comments,category
1972년 설립 순수 콜라겐 펩타이드 히알루론산 비타민C 비오틴 콜라겐 펩타이드 1형 보충제 Holistically Balanced  글루텐 무함유 뼈 및 관절 건강 증진 건강한 피부  모발  손발톱 간편하게 저어서 쉽게 혼합 지구 친화적인 유리병 제품 좋은 것들만 담음 대서양 노르웨이 대구,bone-joint-cartilage
S lumeve  코코아가 함유된 가수분해 해양 콜라겐 펩타이드 모발  피부 및 손발톱 강화  유기농 코코아로 만든 달콤한 초콜릿 맛 글루텐  유전자 변형 성분 및 대두 무함유 인공색소 및 향료 무함유 cGMP 시설에서 생산한 보충제,bone-joint-cartilage
관절 건강 및 가동성 캡슐당 720mg 허브 보충제 피부 건강  관절 건강  운동성 및 신체 기능 개선 항산화 효과 제공 1969년부터 과학에 기반한 고품질 상품 제공,bone-joint-cartilage
관절 건강 및 운동성 캡슐 1정당 300mg 허브 보충제 관절 건강  가동성 및 신체 기능 강화 활성산소를 중화하는 항산화제 공급 근골격계 건강 강화 1969년부터 과학에 기반한 고품질 상품 제공,bone-joint-cartilage
히알루론산과 비타민C 함유 빛나는 피부  셀룰라이트 감소  모발 강화 글루텐 무함유 보충제 나만의 아름다움을 믿으십시오  저희는 믿습니다 ,bone-joint-cartilage
보충제 제약 등급 유전자 변형 성분 무함유 AVA 비건 인증 Star K 코셔 인증 GRAS Generally Recognized As Safe  취득,bone-joint-cartilage
보충제 비타민D3 함유 아미노산 킬레이트,bone-joint-cartilage
1947년 설립 뼈 건강 증진 신경 및 근육 기능 지원 유전자 변형 성분 무함유 글루텐 무함유 인증 밀 및 유제품 무함유 비건에게 적합 할랄 인증 코셔 파르브 인증 보충제,bone-joint-cartilage
보충제 건강 증진 비건 젤라틴 무함유 천연 향료  색소 글루텐 무함유,bone-joint-cartilage
California Gold Nutrition MEM Food  60팩 노루궁뎅이버섯  l 세린  블루베리  아세틸 l 카르니틴  강황  트랜스 레스베라트롤  소나무껍질추출물  PQQ가 함유된 MEM 혼합물 기억력 및 인지력 증진  채식주의자와 비건에게 적합 글루텐  유전자 변형 성분  대두 무함유 cGMP 인증 시설에서 생산 100  골드 개런티 Gold Guarantee ,bone-joint-cartilage
더 많이  더 좋게  더 빠르게  185배 더 뛰어난 생체이용률  오래 가는 효과 유전자 변형 성분 무함유 글루텐  밀   유제품 무함유 보충제,bone-joint-cartilage
튼튼한 뼈 건강 지원 칼슘 흡수를 돕는 비타민 D 건강 보조 식품 합성 색소 없음   천연 원료에서 추출한 색소 인공 향료 없음 보존제 없음 글루텐 없음,bone-joint-cartilage
보충제 프랑스 해안송 껍질 추출물 건강한 노화 채식주의자 비건에게 적합 순도 및 효능 보장,bone-joint-cartilage
1정당 활성 S 아데노실 메티오닌 200mg GMP를 준수하여 제조 보충제 NutraLife SAMe  장용 코팅 정제는 다음 코셔 인증을 받았습니다  Star Kosher,bone-joint-cartilage
뛰어난 칼슘 포뮬라 유전자 변형 성분 무함유 LE 인증 보충제,bone-joint-cartilage
건강한 염증 반응   우수한 커큐민 흡수력 임상적으로 연구된 투르메론 Turmerones 을 함유한 커큐민 심황보다 최대 500 배 강한 효능  당신의 건강을 위한 제품 건강 보조 식품 유전자 변형 성분 없음 강력하고 증명된 효능 ,bone-joint-cartilage
아름다움의 비결 피부   모발   손발톱 빛나는 피부  건강한 모발  모든 것이 여기서 시작됩니다  가수분해콜라겐 1   3형 모든 음료에 적합한 무맛 제품 과립형으로 높은 생체이용률 필수 아미노산 케토 인증 제품 Paleo 인증 목초 사육 유전자 변형 성분 무함유 글루텐 무함유 보충제 Beauty is Elemental   케토 인증,bone-joint-cartilage
1969년 설립 뼈 건강 및 근육 기능 보충제 글루텐 무함유,bone-joint-cartilage
칼슘  마그네슘  비타민D의 훌륭한 공급원 뼈와 치아를 건강하고 튼튼하게 관리 칼슘 흡수 및 활용 촉진 채식주의자에게 적합 글루텐 무함유 보충제,bone-joint-cartilage
보충제  메틸설포닐메테인 ,bone-joint-cartilage
생체이용률이 높은 칼슘 우수한 칼슘 공급원 유전자 변형 성분 무함유 미네랄 1968년에 설립된 가족 기업 미국에서 포장 및 품질 검사 완료 우수 제조 및 품질 관리 기준 GMP  품질 보증,bone-joint-cartilage
관절 움직임 편안한 관절을 위한 트리플 액션 지원 관절의 유연성  윤활력 및 움직임 촉진 밸류 사이즈 Value Size  건강 보조 식품,bone-joint-cartilage
PhytO2X  System 1947년 설립 표준화 완전한 효능 보스웰리아 허브 보충제 비건에게 적합 글루텐  밀   유제품 무함유 유전자 변형 성분 무함유 글루텐 무함유 인증 코셔 파르브,bone-joint-cartilage
슈퍼 푸드 고대 허브 슈퍼 푸드 비건 상품 글루텐 무함유 코셔 인증 USDA 유기농 인증 유전자 변형 성분 무함유 프로젝트 인증 CCOF 유기농 인증,bone-joint-cartilage
관절 건강 및 가동성 개선 뉴질랜드에서 공급 보충제,bone-joint-cartilage
신경계 건강 지원 정서 건강 지원 관절 건강 지원 장용 코팅 신제품 타원형 정제 장용 코팅 보충제 채식주의자 비건 제품 코셔 아미노산 1968년에 설립된 가족 기업 우수 제조 및 품질 관리 기준 GMP  품질 보증,bone-joint-cartilage
글루텐 무함유 유전자 변형 성분 무함유 LE 인증 골밀도에 임상적 효능이 있는 K2 함유 보충제,bone-joint-cartilage
아연  구리  망간 함유 칼슘 보충제 구연산 칼슘 및 필수 미량 영양소 아연  구리  망간으로 뼈 건강 지원 Bayer 1일 복용량당 칼슘 하루 영양소 기준치 100  이상 음식과 함께 또는 음식 없이 복용 가능 의사 및 약사  추천 1위 칼슘 브랜드,bone-joint-cartilage
1971년 설립 Target Mins  1000mg   500mg   10mcg 400I U   비타민D  글루텐 무함유 인증 칼슘 흡수를 극대화하도록 구성 보충제 NSF 유전자 변형 성분 무함유 인증 B  corp  인증 코셔,bone-joint-cartilage
1971년 설립 더 얇아진 정제 1 000mg  500mg 글루텐 무함유 칼슘 활용을 극대화하도록 조제 하루 단 2정 보충제 코셔,bone-joint-cartilage
향기로운 포도 향료 강화된 미용 기능성 상품 아미노산 단백질 비오틴 함유 내면에서 시작되는 자연스러운 아름다움 보충제,bone-joint-cartilage
트리플 스트렝스 포뮬라 과학적인 제조 보충제 우수 제조 및 품질 관리 기준 cGMP  인증 시설에서 제조 Vplab   최고만을 추구,bone-joint-cartilage
글루텐 무함유 칼슘콜라겐킬레이트 유전자 변형 성분 무함유 LE 인증 보충제,bone-joint-cartilage
10칼로리 비건 상품 무가당 글루텐 무함유 NO 동물실험 HACCP MFDS 상큼한 과일 맛과 쫄깃한 식감 아름다움으로 이어지는 웰빙 콜라겐 부스터 1 000mg   비타민C 400mg 관절 및 근육 모발 및 손발톱 피부 탄력 강력한 항산화제 면역 건강 건강한 피부,bone-joint-cartilage
비타민D3 및 비타민K2 함유 뼈 강도 건강한 치아 보충제 품질 검사 완료 1973년부터 시작된 부단한 노력,bone-joint-cartilage
드디어 코셔 인증 코셔 파르브 영양 보충제 글루텐 불포함,bone-joint-cartilage
유전자 변형 성분 무함유 인증 지속 가능한 방식으로 생산 자연산 I  III형 천연 콜라겐 보충제 피부 탄력 부드러운 피부 모발 성장 위장 건강 관절 이완 깨끗한 성분  깔끔한 맛 친환경 제품 글루텐 무함유 우수 제조 및 품질 관리 기준 GMP    독립 인증 깨끗함  순수함  최적화,bone-joint-cartilage
관절 건강 관절 운동성 관절 윤활 최고급 관절 케어 포뮬라 흡수율 강화를 위한 Bioperine  운동성   유연성 향상 관절 조직 보호 연골 지원 30회 제공량 보충제,bone-joint-cartilage
보충제 채식주의자에게 적합,bone-joint-cartilage
더블 스트렝스 Science Based Nutrition  정서 및 신경 기능에 도움 편안한 관절 운동에 도움 간 건강 및 해독에 도움 Vegetarian  보충제 유전자 변형 성분 무함유   글루텐 무함유   대두 무함유 디설페이트 토실레이트 함유,bone-joint-cartilage
1972년 설립 관절 기능 건강 증진 표준화된 허브 추출물 보스웰리아 65  보스웰리아산으로 표준화 Holistically Balanced  Discover Nature s Answer and Trust the Difference     유전자 변형 성분 무함유 프로젝트 인증 비건 제품 글루텐 무함유 보충제 크루얼티프리 No 동물 실험,bone-joint-cartilage
목초 사육 및 방목 보충제 순수 및 무가공 Greatness by Nature  The Optimal Collagen 뼈 건강 피부 세포 건강 모발   손발톱 강화 관절 운동성 필수 아미노산 공급원 장 건강 지원 목초 사육   방목 콜라겐 1형 및 3형 글루텐 무함유 품질 검사 완료 호르몬 무함유,bone-joint-cartilage
커큐민 파이토솜 보충제 관절 강화 간 해독 소화기관 지원 대두 성분 무함유 글루텐 무함유 서방형 Thorne 독점 제품,bone-joint-cartilage
Science Based Nutrition  피부 및 손발톱 건강 증진 관절 운동성 지원 사실상 무맛  무향 보충제 유전자 변형 성분 무함유   글루텐 무함유   대두 무함유,bone-joint-cartilage
최상의 효능 강화된 미용 기능성 제품 비오틴 5 000mcg 풍성하고 볼륨감 있는 모발 젊어 보이는 피부 튼튼하고 건강한 손발톱 필수 비타민 및 미네랄 보충제,bone-joint-cartilage
강황 추출물 100mg 함유 커큐미노이드 95 로 표준화 항산화 건강 지원 허브 건강 허브 보충제 품질 보증 품질 검사 완료 나트륨 무함유,bone-joint-cartilage
1932년 설립 단백질 및 콜라겐의 우수한 공급원 상쾌함   건강 하루 2회 보충제,bone-joint-cartilage
건강 보조 식품 제약 등급 비 GMO 비건 식품 코셔  유대 율법 적합    Star K GRAS  일반적으로 안전한 물질,bone-joint-cartilage
목초 사육 콜라겐 20g 설탕 0g   피부  모발  손발톱  관절에 도움 천연 코코아로 제조 기타 천연 향료 첨가 보충제 우피 콜라겐 펩타이드로 제조 유제품 무함유 글루텐 무함유,bone-joint-cartilage
California Gold Nutrition 슈퍼 푸드 콜라겐 코코넛 크리머 가수분해콜라겐 펩타이드를 함유한 유기농 코코넛 밀크 분말 음료에 크리미한 코코넛 향을 더하는 상품 1회 제공량당 콜라겐 10g 및 단백질 10g 모발  피부  손발톱  관절  뼈 건강 증진  향료 또는 감미료 무함유 유제품 및 유당 무함유 글루텐  유전자 변형 성분 및 대두 무함유 cGMP 인증 시설에서 생산 100  골드 개런티 Gold Guarantee ,bone-joint-cartilage
1971년 설립 글루텐 무함유 인증 소화 효소 지원 천연 파파야로 제조 보충제 B  corp  인증 코셔,bone-joint-cartilage
건강한 pH 균형 뼈 건강에 중요 칼슘 350mg 유전자 변형 성분 무함유 보충제 코셔 미네랄 1968년 설립된 가족 기업 우수 제조 및 품질 관리 기준 GMP  품질 보증,bone-joint-cartilage
100  품질 만족 보장 1 200mg 5 000IU 비타민 글루텐 무함유 유전자 변형 성분 무함유 보충제 골다공증 위험 감소 가능 ,bone-joint-cartilage
하루 한 알 500mg   Bioperine  비건 인증 글루텐 무함유 인증 보충제 신뢰를 바탕으로 정성을 다해 만드는 상품 GMP 인증 시설에서 제조 유전자 변형 성분 무함유 제조 제3 기관 검사 완료 미국 식품의약국 등록 시설에서 제조,bone-joint-cartilage
골밀도 증진 포뮬라 천연 식품 식물성 칼슘 외 비타민D3  K2   최적의 칼슘 흡수를 위한 마그네슘 천연 식품 보충제 B  corp  인증,bone-joint-cartilage
뼈 건강 증진 골다공증의 위험을 줄일 수 있습니다   미네랄 보충제 품질 보증 검사 완료,bone-joint-cartilage
목초 사육 및 방목 콜라겐 공급원 빛나는 피부 모발  손발톱 위장 건강 뼈 및 관절 설탕 무함유 소 젤라틴 건강 보조 식품 건강한 음식  활력 넘치는 일상 정성을 담은 제품 유전자 변형 성분 무함유 rBGH 무함유 Kosher Certified 코셔 인증  케토  팔레오,bone-joint-cartilage
MSM OptiMSM NSF 유전자 변형 성분 무함유 인증 보충제 채식주의자 비건에게 적합,bone-joint-cartilage
비 GMO 건강 증진 1968년 설립된 가족 경영 시스템 GMP 품질 보장,bone-joint-cartilage
1969년 설립 탄산염   말산염 뼈 및 근육 기능 제공량당 500mg 보충제,bone-joint-cartilage
피부  모발  손발톱 위장 건강  관절 강화 목초 방목 사육 28회 제공량 1회 제공량당 콜라겐 8 000mg 무설탕  건강 보조 식품 건강한 음식  활력 넘치는 일상 4가지 강력한 성분이 전부입니다  건강 증진 팔레오 및 케토 NSF 우수 제조 및 품질 관리 기준 cGMP  시설에서 제조 Kosher 유형 1 및 3 호르몬 및 항생제 무함유 유제품 무함유,bone-joint-cartilage
보충제 관절의 편안함 및 유연성 순도   효능 보장,bone-joint-cartilage
뼈 건강 지원 비타민 D3가 함유된 구연산 분말 1 1 미네랄 비율 더 잘 섞입니다 영양 보충제 GMP 품질 확인,bone-joint-cartilage
보충제 가장 잘 흡수되는 형태의 커큐민  건강한 염증 반응 채식주의자 비건에게 적합 순도 및 효능 보장,bone-joint-cartilage
니코틴아마이드 리보사이드가 함유된 패션 베리 맛 콜라겐 보충제 건강한 노화 피부 모발 T 독점판매 상품 글루텐 무함유,bone-joint-cartilage
강하고 건강한 뼈 비타민D 250IU 추가 보충제 칼슘 흡수 개선을 위해 비타민D로 강화 튼튼한 뼈 형성 및 개선 근육 건강 증진 1969년부터 과학에 기반한 고품질 상품 제공,bone-joint-cartilage
보충제 임상 증빙  탈모 감소  튼튼한 모발 유지 콜라겐 보충 Made for All of You,bone-joint-cartilage
가수분해콜라겐 보충제 분말 친환경 원료 우수 제조 및 품질 관리 기준 cGMP  인증 유전자 변형 성분 무함유,bone-joint-cartilage
1  3형 콜라겐 1회 제공량당 콜라겐 10g 함유 용기당 제공 횟수  16회 피부  모발  손발톱  관절 건강에 도움 기타 천연 향료 함유 분말 보충제 케토 인증 글루텐 무함유 목초 사육 100  PCR 용기  케토 인증 Igen  유전자 변형 성분 무함유 검사 완료 본 상품에는 유전자 변형 성분 또는 단백질이 함유되지 않았습니다 ,bone-joint-cartilage
1 200mg 오메가3   400mg 최적화된 커큐민 건강한 염증 반응을 위한 l 글루타치온 함유 세포 보호 해독 작용 우수한 생체이용률 우수한 중성지방 제형 IGEN 유전자 변형 성분 무함유 검사 완료 순도   제3 기관 검사 완료 보충제 분자 증류 순도 보장,bone-joint-cartilage
관절 운동성 및 지원 허브 보충제 USDA 유기농 인증 유전자 변형 성분 무함유 프로젝트 인증 B  corp  인증 코셔 할랄 Aditi Organic Certifications Pvt  Ltd  인증 유기농 비건 식물성 글루텐 무함유,bone-joint-cartilage
피부 회복 100  비건   유전자 변경 성분 무함유   친환경 윤리   크루얼티프리 글루텐 무함유 대두 무함유,bone-joint-cartilage
비교 대상  OS CAL  칼슘 D3 칼슘   비타민D3 보충제 글루텐 무함유 뼈 건강 보조 칼슘 500mg 비타민D3 5mcg 200IU  품질 보증 품질 검사 완료,bone-joint-cartilage
건강  자연  생활 미네랄 함유 실리카 보조제 뼈  모발  손발톱에 영양 공급 실리카 20mg 함유 건강 보조 식품 식물성 보조제,bone-joint-cartilage
관절 건강 및 가동성 캡슐당 720mg 허브 보충제 피부 건강  관절 건강  운동성 및 신체 기능 개선 항산화 효과 제공 Full Spectrum  천연 허브 뿌리줄기 포뮬라 1969년부터 과학에 기반한 고품질 상품 제공,bone-joint-cartilage
아름다움의 비결 안티에이징 포뮬라 I  II  III  V  X형 히알루론산 비오틴 비타민C DigeSEB 으로 흡수율 향상 피부  모발  손발톱  관절을 위한 상품 보충제 목초 사육 방목 사육 유전자 변형 성분 무함유 호르몬   항생제 무함유,bone-joint-cartilage
보충제 임상적으로 효과가 증명됨  피부 수분량 증가 천연 성분으로 피부 재생 콜라겐 보충 모두를 위한 제품,bone-joint-cartilage
건강한 피부와 모발 뼈   관절 건강 증진 혼합하거나 흔들어 섞어 드십시오 천연향 보충제 Igen   유전자 변형 성분 무함유 검사 완료   Igen  Program 유전자 변형 성분 무함유 검증 글루텐 무함유 케토 친화적 제품 팔레오 친화적 제품 인증 목초 사육 및 방목 우수 제조 관리 기준   GMP 인증   GMP 시설에서 제조,bone-joint-cartilage
관절 건강 및 가동성 개선 HiActives  타트체리 함유 허브 보충제 VitaCherry  관절 건강  운동성 및 신체 기능 강화 활성산소를 중화하는 항산화제 공급 근골격계 건강 증진 1969년부터 과학에 기반한 고품질 상품 제공,bone-joint-cartilage
피부  모발  손발톱 장   관절 강화 자연산 28회 제공량 1회 제공량당 콜라겐 펩타이드 6 600mg 설탕 무함유  양질의 섭취로 건강 증진 Further Your Wellness 팔레오   케토 우수 제조 및 품질 관리 기준 cGMP  시설에서 포장 코셔 인증 할랄 인증 항생제 호르몬 무함유 유제품 무함유 1  2  3형,bone-joint-cartilage
엑스트라 스트렝스  기초 건강 지원 허브 보충제 B  corp  인증,bone-joint-cartilage
히알루론산 | 비타민C | 비오틴 | 레드오렌지 복합체 | 천연 향료 지속 가능   자연산 보충제 IGEN   유전자 변형 성분 무함유 검사 완료 해산물 채식주의자에게 적합 케토 인증 제품 글루텐 무함유 우수 제조 및 품질 관리 기준 GMP  준수   해당 시설에서 제조 BPA 무함유,bone-joint-cartilage
식이보조제 우유 없음 코셔 파르브 글루텐 없음,bone-joint-cartilage
아유르베다 허브 액상 추출물 유기농 강황 뿌리 유전자 변형 성분 무함유 프로젝트 인증 보충제 채식주의자 및 비건에 적합 USDA 유기농 인증 GMP 품질 보증 1968년 설립된 가족 기업 식물 허브 QAI 유기농 인증,bone-joint-cartilage
콜라겐의 진정한 과학 하이알루론산  비타민 C 세포의 보습  피부와 관절 윤활 효과 건강 보조 식품 글루텐 무함유 Igen   유전자 변형 성분 무함유 테스트 완료,bone-joint-cartilage
USP 등급 바이카보네이트 알레르기 유발 성분 무함유 생물학적 호환 포뮬러 나트륨 무함유 건강 보조 식품,bone-joint-cartilage
면역체계 지원 무코다당류 풍부 콘드로이틴의 천연 소스 식이보충제 GMP 품질 인증,bone-joint-cartilage
비교대상  Citracal   D3 프티트  글루텐 무함유 칼슘 및 비타민D3 보충제 빠른 흡수를 통한 뼈 건강 보조 삼키기 쉬운 정제 품질 보증   연구소 검사 완료,bone-joint-cartilage
브로드 스펙트럼 츄어블 효소 천연 베리맛 성인 및 어린이에게 적합 BioCore  보충제 채식주의자 비건에 적합 소화제 1968년 설립된 가족 기업 GMP 품질 보증,bone-joint-cartilage
보충제 위장관 GI  지원 관절 강화 호흡기 지원 글루텐 무함유,bone-joint-cartilage
1971년 설립 얇은 정제 1 000mg  500mg  10mcg 400I U  D3   글루텐 무함유 인증 칼슘 흡수를 극대화하는 포뮬라 하루 단 2정 보충제 B corp  인증 코셔,bone-joint-cartilage
눈 및 시력 건강 플라보노이드의 허브 공급원 보충제 건강하고 튼튼한 망막 및 황반 촉진 건강한 시력 증진 눈의 피로 및 긴장 완화 1969년부터 과학에 기반한 고품질 상품 제공,bone-joint-cartilage
목초 사육 지속 가능한 어업 방목 닭 계란껍질막 기타 천연 향료 함유 천연 콜라겐 I  II  III  IV  V  X형 보충제 유전자 변형 성분 무함유 인증 친환경 상품 글루텐 무함유 GMP 인증 시설 부드러운 피부 손발톱 강화 모발 성장 장 건강 강화 관절 이완 깨끗함  순수함  최적화 깨끗한 성분  깔끔한 맛,bone-joint-cartilage
Take Care  식물성 칼슘 발효를 통한 흡수 USDA 인증 유기농 유전자 변형 성분 무함유 프로젝트 인증 NSF 글루텐 무함유 인증 코셔 보충제 ICS 유기농 인증 100  식물성 인공 향료 또는 색소 무함유 버몬트에서 전하는 감사의 마음,bone-joint-cartilage
OS CAL  Calcium  D3와 비교해 보십시오  칼슘   비타민D3 보충제 뼈 건강 증진 칼슘 500mg 5mcg 200IU  비타민D3 글루텐 없음 품질 보증 실험실 검사 완료,bone-joint-cartilage
활성산소 제거제 바이오플라보노이드 300mg 함유 건강한 혈관 기능 균형 잡힌 면역 반응 증진 Pycnogenol   Horphag Research 보충제 코셔 채식주의자 비건에게 적합 유전자 변형 성분 무함유 전반적인 건강 증진 1968년 설립된 가족 기업 우수 제조 및 품질 관리 기준 GMP  품질 보장,bone-joint-cartilage
비 GMO식품 효소 전문가 가장 진보된 제품 치료효과 판매 1위 효소 브랜드 건강 보조식품 비건   코셔파브 필러 무첨가,bone-joint-cartilage
I 및 III형 생기 넘치는 피부 1정당 1 000mg 함유 보충제 젊어 보이는 피부 촉진 피부  모발  관절 등을 건강하게 하는 콜라겐 단백질 콜라겐 합성을 위한 비타민C 보충 1969년부터 과학에 기반한 고품질 상품 제공,bone-joint-cartilage
보충제 7 10일 만에 관절을 편안하게 편리하게 하루에 1정씩 복용하는 포뮬라 채식주의자에게 적합 순도 및 효능 보장,bone-joint-cartilage
보충제 에스테르화 오일을 함유한 당사 고유의 혼합물 건강한 관절 기능 Celadrin    관절 유연성 및 통증 완화,bone-joint-cartilage
임상 시험 용량 2 5g 피부  모발  손발톱 건강 개선 기타 천연 향료 첨가 보충제 잔주름 및 깊은 주름 완화  합성색소 무함유 목초 사육 및 방목 인공색소 무함유 글루텐 무함유 우피 콜라겐펩타이드로 제조 Verisol 이 선사하는 안에서부터 차오르는 아름다움,bone-joint-cartilage
하루에 캡슐 2정 관절 건강 강화 보충제 글루텐 무함유 품질 보장   품질 검사 완료,bone-joint-cartilage
조개 및 갑각류 무함유 보충제,bone-joint-cartilage
보충제 건강한 관절과 결합 조직을 지원합니다 ,bone-joint-cartilage
식물성 성분 100  비건 상품 수분 공급으로 노화 방지 효과 장 건강을 위한 프로바이오틱 1회 제공량당 20억CFU 히알루론산   비오틴 보충제 대두 무함유 첨가당 0g 케토 친화 상품 글루텐 무함유 유제품 무함유 유전자 변형 성분 무함유 동물성 성분 말굽  가죽  뿔  무함유 채소 1회 제공량에 해당하는 양 코셔 인증,bone-joint-cartilage
Minerals Promotes Bone  Nerve   Muscle Health Dietary Supplement Gluten Free Non GMO No Artificial Colors Sugar Free Gluten Free,bone-joint-cartilage
소화 건강 2 In 1 포뮬라 허브 보충제 건강하고 편안한 위장에 도움 활성산소를 중화하는 항산화 작용 1969년부터 과학에 기반한 고품질 상품 제공,bone-joint-cartilage
훌륭한 칼슘 공급원이 함유된 고효능 비타민D 뼈 건강 향상 및 유지에 도움 마그네슘 무함유 채식주의자에게 적합 글루텐 무함유 보충제,bone-joint-cartilage
관절 운동 지원 유연성 및 연골 건강 과학적 근거에 기반 프리미엄 품질 포뮬러 매일 한 번 관절 건강 건강 보조 식품,bone-joint-cartilage
보충제 의약품 등급 유전자 변형 성분 무함유 미국채식협회 AVA  식물성 인증 코셔   Star K GRAS   Generally Recognized As Safe 획득,bone-joint-cartilage
비교 대상  Osteo Bi Flex  어드밴스드 3X 보충제 하루 2정 품질 보증   품질 검사 완료,bone-joint-cartilage
건강 보조제 우유 없음 코셔 파르브 글루텐 없음,bone-joint-cartilage
보충제 세포 해독제 D 글루카레이트,bone-joint-cartilage
뼈 건강 개선에 도움 보충제 Mason 보증 품질 검사 완료 우수 제조 및 품질 관리 기준 cGMP  인증   Five Star Certified 글루텐 무함유 대두 무함유,bone-joint-cartilage
임상 연구를 마친 포뮬라 건강한 관절  운동성 및 유연성 유지에 도움 관절의 편안함과 정상적인 범위의 움직임에 도움 운동 후 빠른 회복 보충제 글루텐 무함유 유제품 무함유,bone-joint-cartilage
비건 제품 아연  비타민D  비타민K  붕소 등 뼈 신진대사 동물성 성분 무함유 다양한 원료 보충제,bone-joint-cartilage
뼈 건강 및 신경 기능 강화 보충제 코셔 유전자 변형 성분 무함유 천연 색소 및 향료 땅콩 및 견과류 무함유,bone-joint-cartilage
아름다움   뼈   관절 잔주름과 주름 감소 머리카락을 굵고 튼튼하게 튼튼한 손톱 뼈의 강함과 유연성 증진 관절 건강 증진 원조 ch OSA 포뮬러 임상 실험   미국 특허  5 922 360와 다른 특허들 대기중 건강 보조 식품 베지테리언,bone-joint-cartilage
