comments,category
California Gold Nutrition CollagenUP  206g 7 26oz  바다에서 얻은 콜라겐 펩타이드   히알루론산   비타민C 무맛  우피에서 추출하지 않은 가수분해 피쉬 콜라겐 비동물성 공급원 히알루론산 및 비타민C 건강한 모발  피부  손발톱  관절  뼈 건강 증진  효소를 통해 생체 이용 가능한 펩타이드로 분해된 가수분해콜라겐 글루텐  유전자 변형 성분  대두 무함유 cGMP 인증 시설에서 생산 100  골드 개런티 Gold Guarantee  보관이 더 쉬운 밀폐형 파우치로 제공,bone-joint-cartilage
California Gold Nutrition CollagenUP  464g 16 37oz  바다에서 얻은 콜라겐 펩타이드   히알루론산   비타민C 무맛  우피에서 추출하지 않은 가수분해 피쉬 콜라겐 비동물성 공급원 히알루론산 및 비타민C 건강한 모발  피부  손발톱  관절  뼈 건강 증진  효소를 통해 생체 이용 가능한 펩타이드로 분해된 가수분해콜라겐 글루텐  유전자 변형 성분  대두 무함유 cGMP 인증 시설에서 생산 100  골드 개런티 Gold Guarantee  보관이 더 쉬운 밀폐형 파우치로 제공,bone-joint-cartilage
뼈 건강을 지원하는 미네랄의 중요 트리오   비타민D3 미네랄 보충제 글루텐 무함유 품질 보증  품질 검사 완료,bone-joint-cartilage
Science Based Nutrition  관절 건강 및 생기 있는 모발  피부  손발톱에 도움 보충제 유전자 변형 성분 무함유   글루텐 무함유   비건,bone-joint-cartilage
1회 제공량당 콜라겐 20g 피부  모발  손발톱  관절에 도움 목초사육   방목사육 보충제 코셔 Whole 30 인증 유제품 무함유 글루텐 무함유 9가지 필수 아미노산 중 8가지 함유 젊어 보이는 외모 건강한 관절   뼈 단일 성분 피부 보습 따뜻하거나 차가운 음료와 혼합 Paleo 인증 피부 탄력 모발   손발톱 지원,bone-joint-cartilage
Science Based Nutrition  보충제 관절 건강 강화 유전자 변형 성분 무함유   글루텐 무함유   대두 무함유,bone-joint-cartilage
골다공증 위험 억제 미네랄 보충제,bone-joint-cartilage
피부  모발  손발톱 포뮬라 6 000mg 비타민C로 강화 보충제 유제품 무함유 대두 무함유 글루텐 성분 무함유 결합제 및 충전제 무함유 1회 제공량당 콜라겐 6 000mg 미용 단백질 보충 피부 노화 방지 피부  모발   손발톱 재생,bone-joint-cartilage
Science Based Nutrition  보충제 관절 건강 강화 유전자 변형 성분 무함유   글루텐 무함유   대두 무함유,bone-joint-cartilage
콜라겐 유형 1 및 3 | 비타민C | 비오틴 1회 제공량당 콜라겐 3g 함유 피부  모발  손발톱  관절 건강에 도움 보충제 케토 인증 글루텐 무함유 목초 사육 Igen  유전자 변형 성분 무함유 검사 완료,bone-joint-cartilage
플러스 유기농 생강   BioPerine  유기농 강황 커큐민 2 250mg 95 로 표준화된 커큐미노이드 500mg이 심장 건강을 증진하고 관절을 강화 보충제 비건 상품 유전자 변형 성분 무함유 글루텐 무함유 대두 무함유,bone-joint-cartilage
California Gold Nutrition 글루코사민  콘드로이틴  MSM 플러스 히알루론산 GreenGrown  식물성 글루코사민 및 OptiMSM  메틸설포닐메테인 함유 관절 건강에 도움  우피에서 추출한 콘드로이틴 및 비동물성 원료에서 추출한 히알루론산 글루텐  유전자 변형 성분  대두 무함유 cGMP 인증 시설에서 생산 100  골드 개런티 Gold Guarantee ,bone-joint-cartilage
콜라겐 유형 1 및 3 | 비타민C | 비오틴 1회 제공량당 콜라겐 3g 함유 피부  모발  손발톱  관절 건강에 도움 보충제 케토 인증 글루텐 무함유 목초 사육 Igen  유전자 변형 성분 무함유 검사 완료,bone-joint-cartilage
Science Based Nutrition  보충제 모발  피부  손발톱  힘줄  인대 및 뼈의 필수 구조 유전자 변형 성분 무함유 글루텐 무함유 대두 무함유,bone-joint-cartilage
California Gold Nutrition 하이드롤라이즈드 해양 콜라겐 펩타이드 효소를 통해 생체 이용 가능한 펩타이드로 분해된 가수분해콜라겐 무맛   자연산   높은 생체이용률 모발  피부  손발톱  관절  뼈 건강 증진  글루텐  유전자 변형 성분  대두 무함유 cGMP 인증 시설에서 생산 100  골드 개런티 Gold Guarantee ,bone-joint-cartilage
California Gold Nutrition 가수분해콜라겐   비타민C I형 및 III형 가수분해콜라겐 펩타이드 함유 비타민C 아스코르브산칼슘  함유 모발  피부  손발톱  관절  뼈 건강 증진  글루텐  유전자 변형 성분  대두 무함유 cGMP 인증 시설에서 생산 100  골드 개런티 Gold Guarantee ,bone-joint-cartilage
글루텐 무함유 유전자 변형 성분 무함유 LE 인증 뛰어난 칼슘 포뮬라 보충제,bone-joint-cartilage
보충제 기초 건강 근육 힘줄 뼈 건강 증진 글루텐 무함유,bone-joint-cartilage
Science Based Nutrition  강황 뿌리에서 추출 Curcumin Complex   및 BioPerine   함유 활성산소를 중화하여 관절 건강에 도움 보충제 유전자 변형 성분 무함유   글루텐 무함유   대두 무함유,bone-joint-cartilage
California Gold Nutrition 토탈 베지 조인트 서포트 포뮬라 글루코사민  콘드로이틴  MSM  히알루론산 함유 동물성 성분 무함유 관절 건강에 도움  채식주의자와 비건에게 적합 글루텐  유전자 변형 성분  대두 무함유 cGMP 인증 시설에서 생산 100  골드 개런티 Gold Guarantee ,bone-joint-cartilage
1회 제공량당 콜라겐 20g 피부  모발  손발톱   관절에 도움 목초사육   방목사육 보충제 코셔 Whole30 Approved 유제품 무함유 글루텐 무함유 BPA 무함유,bone-joint-cartilage
건강한 관절 움직임 및 기능 촉진 UC II  Aquamin 보충제 유전자 변형 성분 무함유 코셔 전반적인 건강 증진 1968년 설립된 가족 기업 우수 제조 및 품질 관리 기준 GMP    품질 보증,bone-joint-cartilage
California Gold Nutrition CurcuminUP  블랙 커민 씨오일  보스웰리아  생강 함유 오메가3 커큐민 복합체 Longvida  최적화된 커큐민 함유 관절 가동성 및 편안함 지원  글루텐  유전자 변형 성분  대두 무함유 cGMP 인증 시설에서 생산 100  골드 개런티 Gold Guarantee ,bone-joint-cartilage
기타 천연 향료 함유 비건 상품 글루텐 무함유 뼈 건강 증진 에너지 증진 뇌 기능 강화,bone-joint-cartilage
강화된 미용 기능성 제품 아름다운 모발  피부  손발톱과 관절 건강 증진 보충제 내면에서 시작되는 자연스러운 아름다움,bone-joint-cartilage
노화 증상 완화 건강한 피부 보습력 지원 가수분해콜라겐 타입 1 및 3 Appliednutrition 열대 딸기 및 키위 맛 농축 드링크 믹스  보충제 액상 튜브 10개,bone-joint-cartilage
Science Based Nutrition  OptiMSM  및 BioCell Collagen  함유 관절  모발  피부  손발톱 건강 증진 보충제 유전자 변형 성분  글루텐 및 대두 무함유,bone-joint-cartilage
항산화제 활성 지원 허브 보충제 글루텐 무함유 100  식물성,bone-joint-cartilage
보충제 튼튼한 뼈 Ca   순수 요소 함유 채식주의자 비건에게 적합 순도 및 효능 보장,bone-joint-cartilage
천연 완전 영양소 1회 제공량당 콜라겐 12g 함유 피부  모발  손발톱   관절 지원 자연산   유전자 변형 성분 무함유 보충제 Whole 30 인증 유제품 무함유 글루텐 무함유 BPA 무함유,bone-joint-cartilage
Science Based Nutrition  관절 및 피부 건강 증진 보충제 유전자 변형 성분 무함유 글루텐 무함유 대두 무함유 Vegan ,bone-joint-cartilage
피부  모발 및 손발톱 포뮬러 6 000mg  건강 보조 식품 모두를 위한 제품 1회 제공량당 콜라겐 6 000mg 미용 단백질 보충 피부 노화 방지 피부  모발   손발톱 재생,bone-joint-cartilage
플러스 D3  20mcg 800IU  하루 1회 칼슘 뼈 건강 증진 칼슘 흡수를 돕는 비타민D3 함유 칼슘 및 비타민D3 보충제 글루텐 무함유 품질 보증   품질 검사 완료,bone-joint-cartilage
1  3형 콜라겐 1회 제공량당 콜라겐 10g 함유 용기당 제공 횟수  20회 피부  모발  손발톱  관절 건강 지원 분말 보충제 케토 인증   글루텐 무함유   목초 사육 Igen  유전자 변형 성분 무함유 검사 완료 Paleo 인증,bone-joint-cartilage
허브 보충제 표준화된 추출물 커큐미노이드 95  유전자 변형 성분 무함유 보충제 채식주의자 비건에 적합 코셔 식물성 허브 1968년 설립된 가족 기업 할랄 우수 제조 및 품질 관리 기준 GMP  품질 보증,bone-joint-cartilage
비교 대상  Citracal  D3 맥시멈 칼슘 및 비타민D3 보충제 빠른 흡수를 통한 뼈 건강 보조 품질 보증 품질 검사 완료 글루텐 무함유,bone-joint-cartilage
가수 분해 I형 및 III형 콜라겐 커피 및 셰이크에 적합 1회 제공량당 콜라겐 펩타이드 11g 따뜻한 음료 및 차가운 음료에 혼합 가능 보충제 IGEN 유전자 변형 성분 무함유 검사 완료 Informed Choice 인증 획득 글루텐 무함유 케토 인증 팔레오 친화 제품 우수 제조 및 품질 관리 기준 cGMP  시설에서 제조 저분자량 콜라겐 펩타이드 3 000 5 000달튼 ,bone-joint-cartilage
Science Based Nutrition  보충제 모발  피부  손발톱  힘줄  인대 및 뼈의 필수 구조 지원 유전자 변형 성분 무함유   글루텐 무함유   대두 무함유 BSE 무함유 가수분해콜라겐 1형 및 3형,bone-joint-cartilage
관절 강화 중요한 관절 윤활제 L 프롤린  알파리포산  포도씨추출물 함유 유전자 변형 성분 무함유 보충제 채식주의자 비건에 적합 전반적인 건강 1968년 설립된 가족 기업 우수 제조 및 품질 관리 기준 GMP  품질 보증,bone-joint-cartilage
허브 보충제 표준화된 추출물 커큐미노이드 95  유전자 변형 성분 무함유 보충제 채식주의자 비건에게 적합 코셔 식물성 허브 1968년 설립된 가족 기업 할랄 우수 제조 및 품질 관리 기준 GMP  품질 보증,bone-joint-cartilage
전문 등급 베스트셀링 브랜드 건강한 염증 반응 지원 제3 기관 인증 검사 완료 천연 및 비건 제품 알레르기 유발 성분 무함유 및 글루텐 무함유 전문가 제조 자랑스러운 미국산 제품 고객 선호 제품 별 5개 보장 품질 검사 완료   제3 기관 순도 및 효능 인증 유전자 변형 성분 무함유 프로젝트 인증 30일분 천연 보충제 자연이 지켜온 최고의 비밀  강황 커큐민 GMP   우수 제조 및 품질 관리 기준 안전 지식 품질   진실한 약속 더 높은 기준 천연 제품 전문가 제조,bone-joint-cartilage
1947년 설립 내부에서부터 피부에 영양 공급 유전자 변형 성분 무함유 밀 및 유제품 무함유 글루텐 무함유 인증 보충제,bone-joint-cartilage
California Gold Nutrition 보스웰리아 추출물 Boswellin  보스웰리아 추출물과 강황 추출물 함유 보스웰산 및 커큐미노이드 함유 균형 잡힌 면역 반응 증진  채식주의자와 비건에게 적합 글루텐  유전자 변형 성분  대두 무함유 cGMP 인증 시설에서 생산 100  골드 개런티 Gold Guarantee ,bone-joint-cartilage
California Gold Nutrition Curcumin C3 Complex   강황 뿌리추출물 흡수율을 높이는 후추 추출물 함유 면역계 건강 및 황산화에 도움  심장 및 관절 건강 증진  채식주의자와 비건에게 적합 글루텐  유전자 변형 성분  대두 무함유 cGMP 인증 시설에서 생산 100  골드 개런티 Gold Guarantee ,bone-joint-cartilage
최대 45 5배 더 높은 생체이용률 보충제 유전자 변형 성분 무함유 LE 인증,bone-joint-cartilage
Healthy Renewal Formula  모발  피부  손발톱  뼈   관절 건강 1회 제공량당 콜라겐 6 000mg 보충제 글루텐 무함유 품질 보증 실험실 검사 완료,bone-joint-cartilage
이온성 미네랄 미네랄 보충제 복용 자체보다는 흡수가 더 중요함 눈으로 보며 맛과 느낌으로 순도를 확인할 수 있습니다  위에 부담을 주지 않음 글루텐 무함유 비건 제품 유전자 변형 성분 무함유 100  생체이용성,bone-joint-cartilage
1973년 설립 흡수력 강화 뼈 강화 건강한 치아 보충제 품질 검사 완료 비건 건강한 삶 지원,bone-joint-cartilage
1947년 설립 흡수력이 높은 구연산 칼슘 제형 뼈 건강 증진 신경 지원   근육 기능 유전자 변형 성분 무함유 글루텐  밀   유제품 무함유 글루텐 무함유 인증 코셔 파르브 건강 보충제,bone-joint-cartilage
California Gold Nutrition 글루코사민  콘드로이틴  MSM 플러스 히알루론산 GreenGrown  식물성 글루코사민 및 OptiMSM  메틸설포닐메테인 함유 관절 건강에 도움  우피에서 추출한 콘드로이틴 및 비동물성 원료에서 추출한 히알루론산 글루텐  유전자 변형 성분  대두 무함유 cGMP 인증 시설에서 생산 100  골드 개런티 Gold Guarantee ,bone-joint-cartilage
1947년 설립 맛 좋고 잘 흡수되는 포뮬라 골다공증 위험 감소 가능  유전자 변형 성분 무함유 프로젝트 인증 글루텐  밀  유제품 무함유 코셔 파르브 보충제,bone-joint-cartilage
1947년 설립 초강력 조개 및 갑각류 무함유 건강한 관절 촉진 편안한 움직임 지원 유전자 변형 성분 무함유 글루텐  밀   유제품 무함유 글루텐 무함유 인증 보충제 Regenasure 글루코사민 함유 성분  BioCell Collagen OptiMSM,bone-joint-cartilage
Healthy Renewal Formula  모발  피부   손발톱 건강 지원 보충제 글루텐 없음 품질 보증 실험실 검사 완료,bone-joint-cartilage
Science Based Nutrition  뼈 건강을 위한 다양한 영양소 MCHCal  미결정하이드록시아파타이트칼슘 MK7 형태의 VitaMK7  천연 비타민K2 보충제 유전자 변형 성분 무함유 글루텐 무함유,bone-joint-cartilage
모발   피부   손발톱 잔주름 및 주름살 완화 모발을 굵게 만들고 강화 손톱 강화 뼈와 관절 건강 증진 오리지널 ch OSA 포뮬라 임상으로 증명됨   미국 특허  7 968 528 및 8 771 757 보충제 비건   식물성,bone-joint-cartilage
1947년 설립 맛 좋고 잘 흡수되는 포뮬라 골다공증 위험 감소 가능  글루텐  밀  유제품 무함유 코셔 파르브 보충제,bone-joint-cartilage
건강 보조 식품 관절 건강 증진 관절 운동 능력 증진 결합 조직 보조 글루텐 없음,bone-joint-cartilage
활성산소 제거제 건강한 혈관 기능 균형 잡힌 면역 반응 암라 함유 코셔 Pycnogenol Horphag Research 보충제 채식주의자 및 비건에 적합 유전자 변형 성분 무함유 1968년 설립된 가족 기업 우수 제조 및 품질 관리 기준 GMP  품질 보증,bone-joint-cartilage
Mason 보증   품질 검사 완료 우수 제조 및 품질 관리 기준 cGMP  인증   5 Star Certified 효능  뼈 건강 증진 보충제,bone-joint-cartilage
1973년 설립 흡수력 향상 뼈 강화 건강한 치아 보충제 품질 검사 완료 비건 상품 건강한 삶 지원,bone-joint-cartilage
유기농 강황 커큐민으로 제조 유기농 생강   BioPerine  함유 유기농 강황 커큐민 2 250mg 보충제 비건에게 적합 유전자 변형 성분 무함유 글루텐 무함유 대두 무함유 BioPerine ,bone-joint-cartilage
보충제 가장 잘 흡수되는 형태의 커큐민  건강한 염증 반응 채식주의자 비건에 적합 순도   효능 보장,bone-joint-cartilage
Science Based Nutrition  보충제 관절 건강 및 기능 증진 피부 건강 증진 유전자 변형 성분 무함유   글루텐 무함유   대두 무함유,bone-joint-cartilage
건강한 관절 편안함 및 기능 촉진 아쿠아민 TG UC II  보충제 유전자 변형 성분 무함유 코셔 전반적인 건강 증진 1968년 설립된 가족 기업 GMP 인증,bone-joint-cartilage
1932년 설립 이래 신뢰할 수 있는 KAL  품질 유지 보충제 하루 3정 글루텐 무함유 뼈 강화,bone-joint-cartilage
글루텐 무함유 유전자 변형 성분 무함유 LE 인증 해독 지원 보충제,bone-joint-cartilage
California Gold Nutrition  MEM Food 노루궁뎅이버섯  l 세린  블루베리  아세틸 l 카르니틴  강황  트랜스 레스베라트롤  소나무껍질추출물  PQQ가 함유된 MEM 혼합물 기억력 및 인지력 증진  채식주의자와 비건에게 적합 글루텐  유전자 변형 성분  대두 무함유 cGMP 인증 시설에서 생산 100  골드 개런티 Gold Guarantee ,bone-joint-cartilage
Science Based Nutrition  강황 뿌리에서 추출 Curcumin C3 Complex  및 BioPerine  함유 활성산소를 중화하여 관절 건강에 도움 보충제 Vegan  유전자 변형 성분  글루텐 및 대두 무함유,bone-joint-cartilage
초지 방목 지속 가능한 포획 방목 닭 계란막 천연 콜라겐 타입   I  II  III  IV  V  X 보충제 부드러운 피부 손발톱 강화 모발 성장 위 건강 관절 완화 깨끗한 성분  깔끔한 맛 유전자 변형 성분 무함유 인증 환경에 책임을 집니다  글루텐 무함유 GMP   독립 인증 깨끗함  순수함  최적화 비 가수분해콜라겐으로 만족하지 마세요 ,bone-joint-cartilage
Lake Avenue Nutrition SAMe S 아데노실 L 메티오닌  S 아데노실 L 메티오닌다이설페이트토실레이트에서 추출한 SAMe 함유 채식주의자에게 적합 장용성 정제 관절  정서  간 건강 증진  유전자 변형 성분  글루텐  대두 무함유 우수 제조 및 품질 관리 기준 GMP  인증 시설에서 생산,bone-joint-cartilage
관절 강화 주요 관절 윤활제 MSM 함유 유전자 변형 성분 무함유 보충제 채식주의자 비건에 적합 코셔 전반적인 건강 증진 1968년 설립된 가족 기업 우수 제조 및 품질 관리 기준 GMP  품질 보증,bone-joint-cartilage
피부  모발  손발톱 포뮬라 6 000mg  보충제 모두를 위한 상품 미용 단백질 보충 피부 노화 방지 피부  모발  손발톱 재생,bone-joint-cartilage
관절 구성 관절 윤활 관절 강화 글루코사민 콘드로이틴 특허받은 CMO MSM 히알루론산 아마 보충제 EAC,bone-joint-cartilage
관절 건강 관절 결합 조직을 위한 황 성분 건강한 연골 지원 유전자 변형 성분 무함유 보충제 채식주의자 비건 제품 코셔 일반 건강 1968년에 설립된 가족 기업 우수 제조 및 품질 관리 기준 GMP  품질 보증,bone-joint-cartilage
Longvida Optimized Curcumin 혈뇌장벽 이동 우수한 생체이용률을 가진 자유 형태의 커큐민 보충제 채식주의자 및 비건에 적합 유전자 변형 성분 무함유 코셔 식물성 허브 1968년 설립된 가족 기업 우수 제조 및 품질 관리 기준 GMP  품질 보증,bone-joint-cartilage
1  3형 콜라겐 히알루론산 비오틴 빛나고 건강한 모발과 손발톱 1회 제공량당 콜라겐 3g 함유 보충제 목초 사육 글루텐 무함유 Igen 유전자 변형 성분 무함유 검사 완료 케토 인증 제품,bone-joint-cartilage
모발  피부  손발톱 보충제 1위 브랜드  보충제 Beauty Starts on the Inside ,bone-joint-cartilage
히알루론산 200mg 관절 건강 증진 피부 건강 및 보습에 도움 비건 및 유전자 변형 성분 무함유 상품 보충제,bone-joint-cartilage
뼈 건강 지원 생체이용 가능 칼슘 혼합 강화 유전자 변형 성분 없음 건강 보조 식품 채식주의자 비건 미네랄 1968 년 설립된 가족 기업 GMP 품질 보증,bone-joint-cartilage
보충제 가장 잘 흡수되는 형태의 커큐민  건강한 염증 반응 채식주의자 비건에 적합 순도 및 효능 보장,bone-joint-cartilage
Science Based Nutrition  보충제 건강한 관절 및 관절 기능 지원 유전자 변형 성분 무함유   글루텐 무함유   대두 무함유,bone-joint-cartilage
유전자 변형 성분 무함유 성분으로 제조 아미노산 킬레이트 보충제 Albion 미네랄 비건 코셔 파르브 인증 글루텐 무함유,bone-joint-cartilage
Science Based Nutrition  관절 및 피부 건강 증진 BioCell Collagen  함유 보충제 유전자 변형 성분 무함유   글루텐 무함유   대두 무함유,bone-joint-cartilage
관절 지원 중요한 관절 윤활제 유전자 변형 성분 무함유 보충제 채식주의자 및 비건에 적합 코셔 일반 건강 1968년에 설립된 가족 기업 우수 제조 및 품질 관리 기준 GMP  품질 보증,bone-joint-cartilage
뉴질랜드에서 공급 보충제 관절의 편안함과 가동성을 지원 황산콘드로이틴  미네랄 및 관절 건강을 위한 기타 영양소로 이루어진 천연 식품 1969년부터 과학에 기반한 고품질 상품 제공,bone-joint-cartilage
California Gold Nutrition 가수분해 마린 콜라겐 펩타이드 효소를 통해 생체 이용 가능한 펩타이드로 분해된 가수분해콜라겐 무맛   자연산   높은 생체이용률 모발  피부  손발톱  관절  뼈 건강 증진  글루텐  유전자 변형 성분  대두 무함유 cGMP 인증 시설에서 생산 100  골드 개런티 Gold Guarantee ,bone-joint-cartilage
비교 대상  Osteo Bi Flex  트리플 스트렝스 보충제 하루 2정 품질 보증   품질 검사 완료,bone-joint-cartilage
Science Based Nutrition  보충제 관절 건강 및 생기 있는 모발  피부  손발톱에 도움 비건 유전자 변형 성분 무함유 글루텐 무함유,bone-joint-cartilage
True Science of Collagen 1  3형 콜라겐 비타민C 피부  모발  손발톱  관절 건강에 좋음 콜라겐 4g 보충제 목초 사육   방목 사육   글루텐 무함유 Igen    유전자 변형 성분 무함유 검사 완료,bone-joint-cartilage
순도 보장 CO2 초임계 추출물 관절 강화 보충제,bone-joint-cartilage
뷰티   뼈   관절 잔주름 및 주름살 완화 모발을 굵게 만들고 강화 손톱 강화 건강하고 유연한 뼈 건강 증진 건강한 관절 촉진 오리지널 ch OSA  포뮬라 임상 검증된 제품 보충제 비건 채식주의자에게 적합,bone-joint-cartilage
95  커큐미노이드로 표준화 BioPerine 으로 제조 코코넛오일과 함께 제조 보충제 유전자 변형 없는 성분으로 제조 글루텐 무함유 우수 제조 및 품질 관리 기준 GMP  준수 제3기관 품질 검사 완료 Igen  유전자 변형 성분 무함유 검사 완료 특허받은 C3 Complex ,bone-joint-cartilage
Lake Avenue Nutrition 가수분해콜라겐 I 및 III형 가수분해 우피 콜라겐 펩타이드 함유 모발  피부  손발톱  관절  뼈 건강 강화  채식주의자에게 적합 글루텐  유전자 변형 성분  대두 무함유 GMP 시설에서 생산,bone-joint-cartilage
모발  피부 및 손발톱 건강 증진 70  이산화규소로 표준화 보충제 채식주의자 비건 유전자 변형 성분 무함유,bone-joint-cartilage
관절 및 뼈 건강 건강한 피부 촉진 임상 시험 완료 유전자 변형 성분 무함유 보충제 일반 건강 1968년 설립된 가족 기업 우수 제조 및 품질 관리 기준 GMP  품질 보증,bone-joint-cartilage
뼈 건강 증진 골다공증 위험 감소 가능성   비타민 D3의 100  DV 이상 함유 건강 보조 식품 품질 보증 시험기관 테스트 완료,bone-joint-cartilage
일일 콜라겐 6g 피부  모발  손발톱   관절에 도움 목초사육   방목사육 보충제 코셔 Whole30 Approved 유제품 무함유 글루텐 무함유  Stayvital,bone-joint-cartilage
피부  모발 및 손발톱 포뮬러 잔주름 및 주름살 완화 건강 보조 식품 흔든 후 섭취하시면 활력이 회복됩니다  뛰어난 맛  바로 음용 가능 피부  모발  손발톱 지원 1회 제공량당 콜라겐 5 000mg 간단하고 편리한 휴대용 제품입니다  단백질 5g 아미노산 18종 천연 향료 물이 필요 없음 미용 단백질 보충 잔주름 및 주름살 완화,bone-joint-cartilage
콜라겐 부스터   비타민C 공급 10칼로리 NO 동물실험 비건 상품 설탕 무함유 글루텐 무함유 상큼한 과일 맛과 쫄깃한 식감 HACCP,bone-joint-cartilage
25년 이상 지켜 온 프리미엄 품질 액티브 홀 스펙트럼 4 1 추출물 비건 유전자 변형 없는 성분으로 제조 글루텐 무함유 건강 보조 식품 우수 제조 및 품질 관리 기준 GMP  품질 보증   FDA 등록 Enhancing Nature s Miracles Since 1994,bone-joint-cartilage
임상적으로 테스트된 관절 건강 성분 조인트 | 연골 | 뼈 콜라겐   붕소 UC II  울트라 하루에 작은 알약 1정 보충제 건강   위생   가정,bone-joint-cartilage
글루텐 무함유 유전자 변형 성분 무함유 LE 인증 최대 45 5배 더 높은 생체이용률 보충제,bone-joint-cartilage
1947년 설립 더 많이  더 좋게  더 빠르게  185배 우수한 생체이용률  오래 가는 효과 유전자 변형 성분 무함유 글루텐  밀 및 유제품 무함유 보충제,bone-joint-cartilage
1936년 설립 어드밴스드 플러스 MSM 및 비타민D3 글루코사민   콘드로이틴 함유 보충제 하루 2정 건강 위생 가정,bone-joint-cartilage
항산화제   관절 지원 Bioperine  함유 강황 커큐민 흡수율 향상을 위한 Bioperine  30회 제공량 보충제,bone-joint-cartilage
