comments,category
아름다움의 비결 순수 콜라겐 펩타이드 분말 보충제 인체에 콜라겐 보충 피부 및 모발 건강 지원 유전자 변형 성분 무함유 글루텐 무함유 지속 가능한 제품 케토 인증 Paleo 인증 상품 Bio Checked   글루텐 무함유 인증,bone-joint-cartilage
보충제,bone-joint-cartilage
이온성 미네랄 미네랄 보충제 건강한 뼈를 위한 필수 아미노산의 광범위 블랜드 삼키기 쉬움 위에 부담을 주지 않음 눈으로 볼 수 있는 순수함과 맛 그리고 느낌,bone-joint-cartilage
1982년 설립 식물성 칼슘 발효를 통한 흡수 USDA 유기농 인증 유전자 변형 성분 무함유 프로젝트 인증 NSF 글루텐 무함유 인증 코셔 보충제 ICS 유기농 인증 100  식물성 인공 향미료 색소 무함유 버몬트에서 전하는 감사의 마음,bone-joint-cartilage
뼈 건강 시스템 골밀도 향상에 도움 골격 영양 제공 뼈에 자극을 주는 단백질을 함유한 StimuCal  비타민K2 MK 7  및 칼슘 MCHA 의 천연 공급원 보충제 글루텐 무함유,bone-joint-cartilage
1회 제공량당 450mg   비타민C Liposomal Delivery Technology  글루텐 무함유 유전자 변형 성분 무함유 설탕 무함유 보충제 복용컵 포함,bone-joint-cartilage
1회 제공량당 단백질 20g 슈퍼푸드 프로틴 파우더 콜라겐 펩타이드와 보조 인자를 함유한 실제 Bone Broth로 제조 천연 식품 보충제 피부 관절 유전자 변형 성분 무함유 특허받은 포뮬라 에드워드 Axe 포뮬라 현대인을 위한 Ancient Nutrition,bone-joint-cartilage
1971년 설립 1 000mg  1회 제공량당 500mg 글루텐 무함유 인증 칼슘 활용을 극대화하도록 제조 하루 단 2정 보충제 코셔 B  corp  인증,bone-joint-cartilage
영양 보조 식품 우수한 생물성 칼슘 시트레이트 및 말라테,bone-joint-cartilage
혁신적인 영양소 흡수율 높은 순수 칼슘 마그네슘 저자극성 보충제,bone-joint-cartilage
뼈 건강 지원 보충제 비건 제품 글루텐 무함유,bone-joint-cartilage
유기농 인증 천연 식품 비건 D3   MK 7 형태의 비타민K2   마그네슘 USDA 유기농 인증 유전자 변형 성분 무함유 프로젝트 인증 천연 식품 보충제 코셔 Vitashine D3 함유 QCS 유기농 인증 유기농 농가의 천연 식품 마그네슘스테아레이트 식물성윤활제  무함유,bone-joint-cartilage
피부 관절 팔레오 친화적 유전자 변형 성분 무함유 실제 뼈 육수로 제조한 콜라겐 슈퍼푸드 분말 식품 원료 콜라겐 3가지   유형 I  II    III 1회 제공량당 단백질 14g 천연 건강 보조 식품,bone-joint-cartilage
생기 넘치는 피부 임상 연구를 마친 상품 보충제 대두 무함유 글루텐 무함유 유제품 무함유 합성 성분 무함유 탄력 충전 햇볕으로 인한 손상 완화 세포 재생 안티에이징 포뮬라 동물성 성분 말굽  가죽  뿔  무함유 100  비건 상품,bone-joint-cartilage
1973년 설립 뼈 강도 건강한 치아 보충제 품질 검사 완료 비건 제품 더 밝은 길,bone-joint-cartilage
비타민 1회 제공량당 1 600mg 첨단 기술 글루텐 무함유 유전자 변형 성분 무함유 허브 보충제 전통적인 허브 지원,bone-joint-cartilage
1971년 설립 Target Mins  1 000mg  500mg  1회 제공량당 25mg 글루텐 무함유 인증 뼈 및 면역 건강 증진 보충제 B  corp  인증 코셔,bone-joint-cartilage
1967년 설립 칼슘 600mg D3 400IU 10mcg  뼈 건강 개선에 도움 보충제 Mason 보증   품질 검사 완료 우수 제조 및 품질 관리 기준 GMP  인증 글루텐 무함유 대두 무함유,bone-joint-cartilage
튼튼하고 건강한 뼈 보충제 뼈 건강 증진 골밀도 및 치아 건강 증진 최적의 칼슘 흡수를 지원하는 비타민D 함유 1969년부터 과학에 기반한 고품질 상품 제공,bone-joint-cartilage
생체 이용 가능 임상 시험 완료 천연 성분 피부 보습 촉진 보충제 글루텐 무함유 비건 베지 캡슐 Hyabest  채식주의자 비건에게 적합 유전자 변형 성분 무함유   NSF 인증,bone-joint-cartilage
Dietary Supplement  Nutricost  Quality Guaranteed Vegetarian Product GMP Compliant Facility  Non GMO Product  Third Party Tested Gluten Free,bone-joint-cartilage
채식주의자에게 적합 Maor Hakshrut 액상 허브 및 미네랄 보충제 비타민D 및 아연 함유 쉬운 흡수 글루텐 무함유 인공 보존제  색소  향료 무함유,bone-joint-cartilage
1969년 설립 건강하고 생기 있는 피부 지원 BioCell Collagen 보충제,bone-joint-cartilage
노화 방지 포뮬라 주름 개선 비타민A 및 항산화 성분 혼합물 유전자 변형 성분 무함유 크루얼티 프리 100  비건 상품 글루텐 무함유 대두 무함유,bone-joint-cartilage
보충제 가장 잘 흡수되는 형태의 커큐민  건강한 염증 반응 순도 및 효능 보장 채식주의자 비건에게 적합,bone-joint-cartilage
활성산소 제거제 바이오플라보노이드 300mg 함유 건강한 혈관 기능 균형 잡힌 면역 반응 증진 코셔 인증 Pycnogenol Horphag Research 보충제 채식주의자 비건에게 적합 유전자 변형 성분 무함유 전반적인 건강 증진 1968년 설립된 가족 기업 우수 제조 및 품질 관리 기준 GMP  품질 보증,bone-joint-cartilage
NSF 유전자 변형 성분 무함유 인증 보충제 비건   코셔 증량제 무함유 근육  조직 및 관절 기능 증진 근육 통증과 관절 불편함 완화를 위한 최적의 지원 기타 기능 증진을 위한 세라펩타아제 함유,bone-joint-cartilage
뼈 강화 건강한 치아 보충제 품질 검사 완료 1973년부터 건강한 삶 지원,bone-joint-cartilage
유전자 조작 원료 무첨가 고효율 칼슘 구연산염 식이보조제 글루텐 없음 코셔 파르브,bone-joint-cartilage
건강한 뼈   면역   세포 건강 맛이 좋습니다  보충제 채식주의 인증 글루텐 무함유 cGMP 인증 미국 1위 미량 미네랄 브랜드  확실한 차이를 느껴보십시오 ,bone-joint-cartilage
관절 건강 및 가동성 캡슐당 750mg 내산성 캡슐 허브 보충제 식물성 EMBO Caps  정신  신체  가정을 위한 전반적인 웰니스 증진 최고의 순도 및 효능 1969년부터 과학에 기반한 고품질 상품 제공,bone-joint-cartilage
유전자 변형 성분 없음 글루텐 불포함 1930 년 설립 관절 지원을 위한 제품 허브 보조제 베지 캡슐 85 년 이상 가족 소유 기업 cGMP 비건 친화적 제품 소맥 없음 옥수수 불포함 대두 성분 없음 유제품 없음 동물 유래 성분 없음 전면에 있는 허브가 특징입니다  심황  리좀 및 지상부  2 개월 분량,bone-joint-cartilage
메틸설포닐메테인 관절 건강 관절 결합 조직을 위한 황 성분 연골 건강 증진 유전자 변형 성분 무함유 보충제 채식주의자 비건에게 적합 전반적인 건강 증진 1968년 설립된 가족 기업 우수 제조 및 품질 관리 기준 GMP  품질 보증,bone-joint-cartilage
1971년 설립 글루텐 무함유 인증 칼슘 흡수를 극대화하는 포뮬라 칼슘 생체이용률 개선 보충제 Ifanca 할랄 인증 B  corp  인증 코셔 파르브 인증,bone-joint-cartilage
임상 시험을 완료한 추출물이 함유된 관절 건강 혼합물 보충제 유전자 변형 성분 무함유 LE 인증,bone-joint-cartilage
쉽게 혼합 가능 Paleo 인증 케토 친화 상품 글루텐 무함유,bone-joint-cartilage
BioPerine 으로 더욱 강력해진 효과 보충제 품질 검사 완료 GMP   우수 제조 및 품질 관리 기준에 따른 일관된 품질 비건 상품 Greatness by Nature  이열치열 관절 운동을 편안하게 하는 효과 BioPerine  흑후추 추출물로 생체이용률 향상,bone-joint-cartilage
Informed Sport   Trusted by Sport Paleo 인증 단백질 29g 천연 콜라겐 43   미국산 제품 Informed Choice   Trusted by Sport 인증 스테로이드 무함유 유전자 변형 성분 무함유 아스파탐 무함유 수크랄로오스 무함유 인공 감미료 무함유 아세설팜 K 무함유 우수 제조 및 품질 관리 기준 GMP  품질 보장,bone-joint-cartilage
우수한 생체이용률 건강 보조제 관절 기능 연결 조직 강화 건강한 피부 OptiMSM 글루텐 없음 인공 보존제 없음 효능 및 품질 보증,bone-joint-cartilage
보충제 식물성 정신  신체  가정을 위한 전반적인 웰니스 증진 최고의 순도 및 효능 1969년부터 과학에 기반한 고품질 상품 제공,bone-joint-cartilage
The Cooking Collagen  요리   베이킹에 최적 뼈   관절 건강 증진  건강한 피부와 모발  보충제 Sports Research  소 젤라틴 인증 제품 IGEN 유전자 변형 성분 무함유 검사 완료 글루텐 무함유 케토 친화 제품 팔레오 친화적 제품 인증 목초 사육 및 방목 GMP 인증   우수 제조 품질 관리 기준,bone-joint-cartilage
California Gold Nutrition  슈퍼 푸드 콜라겐 코코넛 크리머 팩 유기농 코코넛 밀크 분말 및 가수분해콜라겐 펩타이드 함유 모발  피부  손발톱  관절  뼈 건강 강화  콜라겐 10g  단백질 10g  유제품 및 유당 무함유 향료  설탕  감미료  증점제 무첨가 개별 포장 12봉  각 24g 0 85oz  무함유 성분  글루텐  유전자 변형 성분  대두 cGMP 인증 시설에서 제조 100  골드 개런티 Gold Guarantee ,bone-joint-cartilage
보충제 건강한 관절과 결합 조직을 지원합니다  순도 및 효능 보장,bone-joint-cartilage
피부  모발 및 손발톱 포뮬러 건강 보조 식품 아미노산 18종 콜라겐 보충 노화 증상 완화 피부  모발 및 손발톱 활성화 힘줄 및 인대 지원,bone-joint-cartilage
아미노산 18종 보충제 콜라겐 보충 노화 증상 완화,bone-joint-cartilage
건강한 관절과 튼튼한 뼈를 위한 보충제 연구로 검증된 수준의 NEM   FruiteX B   MBP  함유 보충제 글루텐 무함유 순도 및 라벨 효능 100  보증,bone-joint-cartilage
하루 3정 뼈 건강 증진 골밀도 향상에 도움 골격 영양 제공 뼈를 자극하는 단백질 함유 StimuCal  비타민K2 MK 7  및 칼슘 MCHA 의 천연 공급원 보충제 글루텐 무함유,bone-joint-cartilage
프랑스 해송 껍질추출물 프리미엄 순환 증진 복합체 함유 항산화제 및 면역력 강화 순환 및 관절 건강 개선 보충제 순환계 강화 흡수력을 높이는 흑후추 성분 함유 혈행을 개선하는 Pycnogenol GMP 인증 품질 품질 검사 및 인증 완료 유전자 변형 성분 무함유 비건 상품 정성을 담은 상품,bone-joint-cartilage
1971년 설립 글루텐 무함유 인증 유전자 변형 성분 무함유 소화 효소 지원 천연 파파야 열매 추출물 보충제 B  corp  인증 코셔,bone-joint-cartilage
아름다움의 비결 피부   모발   손발톱 빛나는 피부  건강한 모발  모든 것이 여기서 시작됩니다  케토 인증 제품 Paleo 인증 제품 유전자 변형 성분 무함유 목초 사육 타입 I   III 보충제 Beauty is Elemental ,bone-joint-cartilage
임상 검증된 제품 ch OSA    이노시톨   MK7   B12 오리지널 ch OSA  포뮬라 뼈의 콜라겐 형성 증가 칼슘 결합 부위 증가 뼈의 유연성 촉진 뼈의 미네랄 밀도 BMD  증가  식이 칼슘과 보충제 칼슘의 효과를 증폭 바람직한 조골 세포 균형 유지에 도움 첨단 칼슘 전달 시스템 보충제 채식주의자 비건에 적합,bone-joint-cartilage
관절 건강을 위한 영양 공급 보충제,bone-joint-cartilage
보충제 코셔 파르브 글루텐 무함유,bone-joint-cartilage
콜라겐 캡슐 1위 브랜드 히알루론산 및 레스베라트롤 함유 빛나는 피부와 건강한 관절 지원 글루텐 무함유 케토 및 Paleo 인증 보충제 BioCell Collagen,bone-joint-cartilage
유기농 울금과 아슈와간다로 제조 울금  대추야자  허브의 맛있는 만남 울금 파우더 보조제 비건 제품   유제품 무함유 Oregon Tilth 인증 유기농 유전자 변형 성분 무함유 글루텐 무함유 순도 테스트 완료,bone-joint-cartilage
보충제 임상에서 효과가 증명됨   건강한 관절 촉진 콜라겐 보충 빠른 효과   모두를 위한 제품,bone-joint-cartilage
제3기관 품질 검사 완료 GMP   우수 제조 및 품질 관리 기준 상품 하루 3회 2개월분 보충제,bone-joint-cartilage
피부 관절 유전자 변형 성분 무함유 특허받은 포뮬라 1회 제공량당 단백질 20g 슈퍼 푸드 단백질 분말 콜라겐 펩타이드와 보조 인자를 함유한 실제 뼈 육수로 제조 천연 식품 보충제,bone-joint-cartilage
건강 보조 식품 실험실 검사필 제품,bone-joint-cartilage
콜라겐 펩타이드 드링크 믹스 케토 인증 모발  피부 및 손발톱 건강 지원 1형 콜라겐 및 3형 콜라겐 10g 함유  설탕 무함유   유제품 무함유 Primal  팔레오   케토 친화적 글루텐  곡물  유청 또는 대두 성분 무함유 글루텐 무함유 인증,bone-joint-cartilage
PhytO X 시스템 1947년 설립 표준화  울금  허브 보조제 글루텐  밀 및 유제품 미함유 비건에게 적합 유전자 변형 성분 없음 K 파르브,bone-joint-cartilage
콜라겐에 담긴 진정한 과학 피부 보습에 도움 보충제 글루텐 무함유 IGEN 유전자 변형 성분 무함유 검사 완료,bone-joint-cartilage
보충제 2001년부터 고품질 상품 제공 LivingSilica  콜라겐 재생성에 도움,bone-joint-cartilage
비타민 칼슘 600mg 100  품질 만족 보장 글루텐 무함유 유전자 변형 성분 무함유 보충제 식물성 포뮬라 골다공증 위험 감소 가능 ,bone-joint-cartilage
신경계 건강 지원 안정화된 SAMe  캡슐 제형 장용성 코팅 불필요 관절 건강 지원 유전자 변형 성분 없음 건강 보조 식품 채식주의자 비건에 적합 아미노산 1968 년 설립된 가족 기업 GMP 품질 보증,bone-joint-cartilage
자일리톨로 단맛 가미 관절 지원 1회 제공량당 100mg 중요한 관절 윤활제 관절을 지원하는 기타 비타민과 아미노산도 함유 기분 좋은 베리 맛  보충제 채식주의자 비건에게 적합한 제품 유전자 변형 성분 무함유 코셔 일반 건강 1968년 설립된 가족 소유 기업 GMP 품질 보증,bone-joint-cartilage
관절 건강 및 가동성 연골  힘줄 및 인대 유지에 도움 관절 무결성  움직임 및 유연성에 도움 1969년부터 과학에 기반한 고품질 상품 제공,bone-joint-cartilage
5가지 콜라겐  비타민C 및 히알루론산 첨단 뷰티 영양소 보충제 우수 제조 및 품질 관리 기준   cGMP 인증 유전자 변형 성분 무함유 성분으로 제조 품질 검사 완료,bone-joint-cartilage
관절 건강 및 운동성 BioCell Collagen 으로 제조 보충제 1969년부터 과학적 근거가 있는 품질 제공,bone-joint-cartilage
1947년 설립 관절 건강 증진 편안한 움직임에 도움 유전자 변형 성분 무함유 글루텐  밀  유제품 무함유 글루텐 무함유 인증 보충제,bone-joint-cartilage
목초 사육 및 방목 사육 모발  피부  손발톱 및 관절 건강 증진 콜라겐 펩타이드 10g  Paleo 인증 보충제 Good  Clean Nutrition ,bone-joint-cartilage
글루텐 무함유 뼈 건강 증진 비교 대상  Caltrate  600 품질 보증   품질 검사 완료,bone-joint-cartilage
나이들지 않는 자산 허브 보충제,bone-joint-cartilage
강하고 건강한 뼈 미네랄 보충제 정신  신체  가정을 위한 전반적인 웰니스 증진 최고의 순도 및 효능 1969년부터 과학에 기반한 고품질 상품 제공,bone-joint-cartilage
뼈 건강 시스템 골밀도 건강 지원 골격 영양 제공 뼈에 자극을 주는 단백질을 함유한 StimuCal  비타민K2 MK 7  및 칼슘 MCHA 의 천연 공급원 보충제 글루텐 무함유,bone-joint-cartilage
관절 건강 및 가동성 천연 허브 및 표준화 추출물 허브 보충제 관절 무결성  움직임 및 유연성에 도움 최소 65  이상의 보스웰산으로 표준화 1969년부터 과학에 기반한 고품질 상품 제공,bone-joint-cartilage
피부  모발  손발톱 위장 건강  관절 강화 목초 방목 사육 28회 제공량  1회 제공량당 콜라겐 8 000mg 무설탕  콜라겐 단백질 분말 Eat Better   Go Further  4가지 강력한 성분   그게 전부입니다  1스쿱   콜라겐 펩타이드 8g 건강 증진 팔레오 및 케토 NSF CGMP 시설에서 제조 코셔 타입 1 및 3  호르몬 및 항생제 무함유 유제품 무첨가,bone-joint-cartilage
1971년 설립 트리플 액션 글루텐 무함유 인증 특허받은 FruiteX B와 임상 연구를 거친 MCHA 및 비타민 포함 보충제 B corp  인증,bone-joint-cartilage
뼈 건강 지원 보충제 채식주의자에게 적합 글루텐 무함유,bone-joint-cartilage
Dietary Supplement  Nutricost  Quality Guaranteed Animal Free Product   Vegan  GMP Compliant Facility  Non GMO Product  Third Party Tested  Gluten Free,bone-joint-cartilage
향상된 골밀도 지원 건강보조식품,bone-joint-cartilage
1회 제공량당 비타민D3 1 200mg | Plus 25mcg  1 000IU  뼈 건강 지원 골다공증의 위험을 줄일 수 있습니다    미네랄 보조제 품질 보증 품질 검사 완료,bone-joint-cartilage
보충제 세라타 펩티다아제 단백질 분해 효소 함유 전신 효소 지원 순도 및 효능 보장,bone-joint-cartilage
항산화 효과 3 in 1 허브 보충제 허브 보충제 전반적인 체내 웰니스를 위한 3 in 1 강장제 아율베딕 최고의 위장 및 관절 건강을 위한 생강 및 강황 1969년부터 과학에 기반한 고품질 상품 제공,bone-joint-cartilage
관절 건강 및 가동성 개선 삼키기 쉬운 미니 정제 보충제,bone-joint-cartilage
보충제 관절 건강 증진 관절 운동성 유연성 및 편안함 증진 고강도 운동으로 인한 관절 통증 완화,bone-joint-cartilage
편안한 관절을 위한 트리플 액션 지원 관절 윤활  유연성 및 이동성 지원 조개류 미함유 채식주의자에게 적합 건강보조식품,bone-joint-cartilage
관절 건강 증진 관절 편안함 촉진 가수분해 콜라겐  글루코사민 황산염  MSM 메틸설포닐메테인  함유 유전자 변형 성분 무함유 보충제 전반적인 건강 증진 1968년 설립된 가족 기업 우수 제조 및 품질 관리 기준 GMP  품질 보장,bone-joint-cartilage
건강 자연 삶 정상적인 관절 기능에 임상적으로 효능이 입증된 영양소 보충제,bone-joint-cartilage
노르딕 뷰티 피부 건강을 위한 천연 비타민C 함유 자연산 생체활성 펩타이드 상큼한 딸기 맛 보충제 제3기관 순도 검사 완료 유전자 변형 성분 무함유 인증 흡수력이 뛰어난 상품,bone-joint-cartilage
히알루론산 MSM 비타민C 1회 제공량당 파우더 10g 용기당 제공 횟수  20회 피부 보습 및 건강한 모발  손발톱 및 관절에 도움 보충제 글루텐 무함유 IGEN 유전자 변형 성분 무함유 검사 완료 키토 인증 상품,bone-joint-cartilage
혁신적인 영양소 흡수율 높은 순수 칼슘 저자극성 보충제,bone-joint-cartilage
윤리적인 방식으로 원료를 확보하는 고품질 식품 물  코코넛워터  스무디에 넣어서 섭취 드레싱  수프  볶음요리 및 모든 기타 요리에 활용 전통적인 아율베딕 항염 효과 슈퍼 허브 가장 중요한 천연 항산화제가 풍부하게 함유된 향신료 지속가능한 방식으로 생산 및 재배 영양소가 풍부한 강황 분말을 더해 더욱 든든하게 즐기는 스무디 증량제  향료  첨가제  보존제 무첨가 강력한 식품   좋은 음식   좋은 생활   활기찬 일상 보충제 USDA 유기농 인증 코셔 비건 상품 무가공 유기농 인증 기관  Ecocert ICO,bone-joint-cartilage
소에서 추출 USDA 유기농 인증 유기농 목초 사육 소 보충제 QCS 유기농 인증 뼈 및 관절 건강 증진 동안 효과 건강한 피부,bone-joint-cartilage
1회 제공량당 커큐미노이드 475mg 건강한 염증 반응 지원 BioPerine   비타민C 함유 유전자 변형 성분 무함유 프로젝트 인증 보충제 비건 인증 NSF 글루텐 무함유 인증 유제품 무함유 대두 무함유 125종 이상의 살충제 및 제초제 성분 검사 완료 코셔 글리포세이트 잔여물 무함유 B  corp  인증,bone-joint-cartilage
콜라겐 캡슐 1위 브랜드 Dermaval  및 레스베라트롤 함유 글루텐 무함유 건강한 피부를 위한 프리미엄 콜라겐 서포트 케토 및 Paleo 인증 보충제 BioCell Collagen,bone-joint-cartilage
관절 건강 및 가동성 2 In 1 포뮬라 허브 보충제 관절 건강  운동성 및 신체 기능 개선 활성산소를 중화하는 항산화 작용 1969년부터 과학에 기반한 고품질 상품 제공,bone-joint-cartilage
1회 제공량당 20g 다양한 원료   프로바이오틱 빛나는 피부  모발  손발톱 보충제 B  corp  인증 콜라겐 20g   환한 피부 히알루론산   빛나는 모발 프로바이오틱 10억 CFU   아름다운 손발톱 IGEN   유전자 변형 성분 무함유 검사 완료 케토 인증 상품 Paleo 인증 상품 NSF 글루텐 무함유 인증 호르몬 및 항생제 무함유 유전자 변형 유전자 편집 성분 또는 단백질 무함유 상품,bone-joint-cartilage
재생 농법으로 경작한 강황으로 제조  유전자 변형 성분 무함유 프로젝트 인증 NSF 글루텐 무함유 인증 B  corp  인증 보충제 100  식물성 효능이 우수한 순수 추출물 버몬트에서 감사의 마음을 담아,bone-joint-cartilage
보충제 근육   관절 보조 순도 및 효능 보장,bone-joint-cartilage
1984년부터 제공된 건강 관리 솔루션 Michael s  Naturopathic Programs 자연요법 의사 마이클 슈워츠 N M D  가 개발 근육 운동용 강력한 단백질 분해효소 보충제 시너지 효과로 완벽함 친환경 재료 가족 소유 및 운영 기업,bone-joint-cartilage
1971년 설립 글루텐 무함유 인증 심혈관계 건강 지원 항산화제 OPC 함유 유전자 변형 성분 무함유   NSF 인증 보충제 B  corp  인증 Pycnogenol  자연의 슈퍼 항산화제 코셔 파르브,bone-joint-cartilage
750mg 600mg 매일 2정 섭취 관절 건강 증진 보충제 글루텐 무함유 품질 검사 완료 보증,bone-joint-cartilage
모발  피부  손발톱  관절 건강 증진 Dermaval  함유 보충제 콜라겐 생성 촉진 엘라스틴 분해 감소 모발  피부  손발톱 건강을 위한 필수 미네랄인 실리카 1969년부터 과학에 기반한 고품질 상품 제공 식물성,bone-joint-cartilage
피부  모발  손발톱 장 및 관절 개선 목초 사육 및 방목 1회 제공량당 콜라겐 펩타이드 8 000mg Eat Better  Go Further  Further Your Wellness    여성 소유 기업 케토 및 팔레오 유전자 변형 성분 무함유 코셔 인증 설탕 무함유  1 및 3형 항생제 호르몬 무함유 유제품 무함유 하나의 강력한 성분만 담았습니다 ,bone-joint-cartilage
하루 캡슐 2정을 복용하십시오  관절 건강 강화 보충제 글루텐 무함유 품질 보증   실험실 검사 완료,bone-joint-cartilage
식물성 칼슘 미네랄 복합체 마그네슘  비타민K2  D3  C 및 아연 함유 골밀도 및 건강에 도움 골절 위험 감소 우수한 생체이용률 및 효능 GMP 인증 품질 품질 검사 및 인증 완료 유전자 변형 성분 무함유 비건 상품 정성을 담은 상품,bone-joint-cartilage
1969년 설립 관절 건강 지원 OptiMSM  1회 제공량당 1 000mg 보충제 비건,bone-joint-cartilage
비타민K2 100mcg 함유 보충제 생체 이용 가능한 활성 형태의 D3 글루텐 무함유 고품질 천연 보충제 순도 보장   중금속   독소에 대한 엄격한 정부 안전 기준 충족,bone-joint-cartilage
글루텐 무함유 유전자 변형 성분 무함유 LE 인증 건강한 관절 촉진 보충제,bone-joint-cartilage
글루텐 무함유 하루 1정 유전자 변형 성분 무함유 LE 인증 보충제 폐 기능 강화,bone-joint-cartilage
1969년 설립 프리미엄 블랜드 건강한 순환 기능 증진 보충제 글루텐 무함유 해양 소나무 껍질 연구 비건 우수한 글로벌 원료   미국에서 포장 및 검사 완료,bone-joint-cartilage
약사 추천 1위 브랜드  트리플 스트렝스  7일 이내에 관절의 편안함이 증진되는 효과를 보여줍니다  글루코사민콘드로이틴 및 Joint Shield 보충제 하루 2정,bone-joint-cartilage
BioPerine  함유 프리미엄 포뮬라 상품 GMP   우수 제조 및 관리 기준 보충제,bone-joint-cartilage
완전한 효능 포일 블리스터 팩 포장 천연 pH 민감한 피부용 식품 품질 EnteroGuard  코팅 S 아데노실 메티오닌 800 SAM e 토실레이트 이황산염 추출 SAM e 400mg 순 함유량  액티브 S S 유형의 최고 농축 장용성 코팅 태블릿 순수율  400 Mg SAM e 글루텐 없음 비건 건강 보조 식품,bone-joint-cartilage
임상 시험 완료 성분 Dr  Axe 포뮬라 식품 원료 콜라겐 5가지 I  II  III  V  X형 건강한 에너지 지원 2스쿱당 콜라겐 20g 목초 사육 및 방목 사육 유전자 변형 성분 무함유 천연 식품 보충제 피부 장 손발톱 모발 관절,bone-joint-cartilage
보충제,bone-joint-cartilage
보충제 프랑스 해송 껍질추출물 건강한 노화 채식주의자 비건에게 적합 순도 및 효능 보장,bone-joint-cartilage
