comments,category
MSM OptiMSM  보충제 NSF 유전자 변형 성분 무함유 인증 비건에게 적합 베지 캡슐 채식주의자 비건에게 적합,bone-joint-cartilage
보충제 관절 지지 관절 윤활 관절 강화 히알루론산,bone-joint-cartilage
완전한 효능 포일 블리스터 팩 포장 천연 pH 민감성 식품 등급 EnteroGuard  코팅 S 아데노실 메티오닌 400 SAM e 토실레이트 이황산염에서 유래한 SAM e 200mg 순 수율  최고 농도의 활성 S S 형태 장용 코팅 정제 순 수율   SAM e 200mg 글루텐 무함유 비건 보충제,bone-joint-cartilage
고효능 유제품 및 글루텐 무함유 쉽게 흡수 보충제,bone-joint-cartilage
심혈관계 건강 균형 잡힌 개선 허브 보충제 정신  신체  가정을 위한 전반적인 웰니스 증진 최고의 순도 및 효능 1969년부터 과학에 기반한 고품질 상품 제공,bone-joint-cartilage
유기농 성분으로 제조 심혈관 기능 개선 소화기관 건강 강화 면역계 강화 보충제 유전자 변형 성분 무함유 글루텐 무함유,bone-joint-cartilage
보충제 우피에서 추출한 목초 사육 단백질 보충제 장에 좋은 성분 관절 건강에 도움 콜라겐 16g 단백질 21g 유전자 변형 성분 무함유 목초 사육 소,bone-joint-cartilage
임상적으로 연구된 성분 에드워드 Axe 포뮬라 5가지 유형의 식품 원료 콜라겐 I  II  III  V  X형 비타민C   프로바이오틱 2스쿱당 콜라겐 20g 목초 사육 및 방목 사육 유전자 변형 성분 무함유 천연 식품 보충제 피부 장 손발톱 모발 관절,bone-joint-cartilage
울금  일상 생활에서 가끔 발생하는 염증을 줄입니다  허브 보조제 1987년부터 이어진 정직   순도   효능 비건 글루텐 무함유 대두 성분 무함유 B Corporation 인증 1987년부터 시작된 Connection Plants   People,bone-joint-cartilage
뼈 및 관절 건강 강화 모발 및 손발톱 건강 강화 보충제,bone-joint-cartilage
커큐민즙 복합체 신선한 강황즙으로 만든 제품 용매 무함유 40배 더 높은 생체이용률  유전자 변형 성분 무함유 보충제 채식주의자 비건 식물성 허브 1968년 설립된 가족 기업 우수 제조 및 품질 관리 기준 GMP  품질 보증,bone-joint-cartilage
Sports   More 히알루론산 및 콘드로이틴이 함유된 피부  모발 및 관절 포뮬라 젤라틴 무함유 보충제 1994년부터 자연이 주는 기적을 나누는 회사,bone-joint-cartilage
유전자 변형 없는 성분으로 제조 뼈 건강에 도움 보충제 비건 상품 코셔 파르브 인증 글루텐 무함유,bone-joint-cartilage
보충제 순도 100  건강한 관절 기능 OptiMSM  순도   효능 보장,bone-joint-cartilage
1932년 설립 히알루론산 20mg MSM 700mg 신선함   건강 하루 1회 보충제,bone-joint-cartilage
유전자 변형 성분 없음 관절 건강 관절 이동성 및 유연성에 도움 건강 보조 식품 일반 건강 1968 년 설립된 가족 기업 GMP 품질 보증,bone-joint-cartilage
관절 건강 및 가동성 아유르베다 포뮬라 허브 보충제 관절 건강  운동성 및 신체 기능 강화 활성산소를 중화하는 항산화제 공급 1969년부터 과학에 기반한 고품질 상품 제공,bone-joint-cartilage
상온 보관 가능하며 열 안정성이 우수한 프로바이오틱   1회 제공량당 10억 마리 유익한 프로바이오틱 바실러스 코아귤런스로 강화 프리미엄 슈퍼 푸드 윤리적인 방식으로 원료 확보 따뜻한 물 또는 시원한 물만 넣으면 섭취 가능 간편하고 맛있는 아율베딕 골든 밀크 차나 커피의 훌륭한 대용품 유제품 무함유  코코넛 밀크 함유 강황   코코넛 사프란   생강   계피   프로바이오틱 천연 건조 유기농 강황 뿌리   CO2 초임계 강황의 이중 추출물 함유 EcoCert 인증 USDA 유기농 인증 코셔 LactoSpore EcoCert ICO 유기농 인증,bone-joint-cartilage
보충제 글루코사민 및 콘드로이틴 설페이트 함유 건강한 관절을 위한 영양 보조제 OptiMSM 순도 및 효능 보장,bone-joint-cartilage
1932년 설립 혁신적인 품질 건강 보조 식품 하루 한 번 확실한 품질 천연 칼슘   마그네슘 원료 채식주의자를 위한 제품,bone-joint-cartilage
보충제 삼키기 쉬운 캡슐 관절과 결합 조직의 구조적 온전성을 유지합니다  순도   효능 보장,bone-joint-cartilage
1971년 설립 Target Mins  1 000mg  500mg  10mcg 400I U  비타민D  글루텐 무함유 인증 칼슘 흡수를 극대화하는 포뮬라 유전자 변형 성분 무함유 보충제 코셔 B  corp  인증,bone-joint-cartilage
임상 시험 완료 성분 5가지 유형의 식품 원료 콜라겐 I  II  III  V  X형 비타민C   프로바이오틱 2스쿱당 콜라겐 20g 목초 사육 및 방목 사육 유전자 변형 성분 무함유 천연 식품 보충제 피부 장 손발톱 모발 관절,bone-joint-cartilage
보충제 임상에서 효과가 증명됨  뼈 무기질화 촉진 골밀도 유지에 도움 콜라겐 보충 모두를 위한 상품,bone-joint-cartilage
건강 보조 식품 근육   관절 보조 순도   효능 보장,bone-joint-cartilage
효능 보장 봄철 속새에서 얻은 10 의 식물성 실리카 허브 보충제,bone-joint-cartilage
1969년 설립 뼈 건강 및 근육 기능 1회 제공량당 765mg 보충제,bone-joint-cartilage
허브 보충제 1930년 설립 85년 넘게 이어온 가족 기업 관절 유연성   운동 범위 정상적인 관절액 기능 지원 Happiness Through Wellness 글루텐 무함유 우수 제조 및 품질 관리 기준 cGMP  비건 친화적 밀 무함유 대두 무함유 유제품 무함유 우수 제조 및 품질 관리 기준 cGMP ,bone-joint-cartilage
하루 3정 뼈 건강 시스템 1회 제공량당 캡슐 3정 골밀도 지원 골격 영양 제공 뼈에 자극을 주는 단백질 함유 StimuCal  비타민K2 MK 7  및 칼슘 MCHA  천연 공급원 함유 보충제 글루텐 무함유,bone-joint-cartilage
격렬한 활동으로 인한 관절 피로 완화 관절 건강 증진 글루코사민  콘드로이틴  콜라겐 펩타이드 함유 GAT 정품   만족도 보장 보충제  CompeteHarder 최적의 운동 능력을 달성하도록 도움,bone-joint-cartilage
보충제 가장 잘 흡수되는 형태의 커큐민  건강한 염증 반응 채식주의자 비건에게 적합 순도 및 효능 보장,bone-joint-cartilage
보충제 KION 관절 강화 근육 힘줄 강화 GI 지원 상처 부상 NSF Certified Sport 인증 글루텐 무함유,bone-joint-cartilage
하이드롤라이즈드콜라겐 1형 및 3형 피부  모발  손발톱 건강 지원 건강한 관절과 뼈를 위해 쉽게 섞이는 수용성 보충제,bone-joint-cartilage
임상 검증된 제품 히알루론산 복합체 3  하룻밤 사이 깊은 보습과 눈에 띄는 탄력 피부 완성 피부과 전문의 테스트 완료 향료 무함유 파라벤 무함유 여드름 유발 성분 무함유 피부과 의사 추천 제품 노화 방지 브랜드,bone-joint-cartilage
관절 건강 및 가동성 캡슐당 300mg 보충제 관절 무결성  움직임 및 유연성에 도움 아보카도와 대두에서 추출한 채소 추출물을 함유하여 관절 조직의 무결성 증진 1969년부터 과학에 기반한 고품질 상품 제공,bone-joint-cartilage
관절 건강 관절 가동성 및 편안함 증진 유전자 변형 성분 무함유 보충제 전반적인 건강 증진 1968년 설립된 가족 기업 우수 제조 및 품질 관리 기준 GMP  품질 보장,bone-joint-cartilage
영양 보충제 글루코사민  콘드로이틴  MSM 첨가 바이오셀 콜라겐 옵티MSM,bone-joint-cartilage
프리미엄 포뮬라 우수 제조 및 품질 관리 기준 GMP  제품 제3기관 품질 검사 완료 보충제,bone-joint-cartilage
관절 건강 및 가동성 보충제 관절 무결성  움직임 및 유연성에 도움 연골 보호에 도움 건강한 결합 조직 유지 1969년부터 과학에 기반한 고품질 상품 제공,bone-joint-cartilage
1회 제공량당 단백질 20g 슈퍼 푸드 프로틴 파우더 콜라겐 펩타이드와 보조 인자를 함유한 실제 뼈 국물로 제조 천연 식품 보충제 피부 관절 유전자 변형 성분 무함유 특허 받은 포뮬라 현대인을 위한 Ancient Nutrition,bone-joint-cartilage
임상 시험 완료 성분 Dr  Axe 포뮬라 5가지 유형의 식품 원료 콜라겐 I  II  III  V  X형 비타민C   프로바이오틱 2스쿱당 콜라겐 20g 목초 사육 및 방목 사육 유전자 변형 성분 무함유 천연 식품 보충제 피부 장 손발톱 모발 관절,bone-joint-cartilage
1회 제공량당 콜라겐 10g 함유 피부  모발  손발톱   관절에 도움 코코넛 밀크 분말로 제조 기타 천연 향미료 자연 첨가 보충제 유제품 무함유 코셔 Whole30 Approved 글루텐 무함유 BPA 무함유,bone-joint-cartilage
나이아신아마이드 리보사이드 함유 콜라겐 보충제 건강한 노화 관절 강화 운동 능력 강화 글루텐 무함유,bone-joint-cartilage
보충제 흡수율이 높은 커큐민 흰버드나무   악마의 발톱 포함 건강한 관절 기능 가장 잘 흡수되는 형태의 커큐민 채식주의자 비건에게 적합 순도   효능 보장,bone-joint-cartilage
통증 완화 포뮬라 1위 수상 임상적으로 연구된 커큐민 및 강황 복합체 안전하고 효과적이며 중독성 없이 통증 완화  여러분의 건강을 위하여   Terry 보충제 코셔 인증 할랄 비건 상품 유전자 변형 성분 무함유 순도   품질 검사 완료,bone-joint-cartilage
히알루론산 보충제 종합비타민   콜라겐 지속 가능한 방식으로 조달된 원료 유전자 변형 성분 무함유 우수 제조 및 품질 관리 기준 cGMP  인증,bone-joint-cartilage
임상 연구를 마친 보스웰리아 고급 보스웰리아 건강한 염증 반응  건강에 좋은 제품 보충제 할랄 유전자 변형 성분 무함유 우수 제조 및 품질 관리 기준 cGMP  준수 시설에서 제조,bone-joint-cartilage
관절 건강 관절의 운동성 및 편안함 자연에서 추출한 글루코사민 건강 보조 식품 채식주의   비건 제품 유전자 변형 성분 없음 전반적인 건강에 도움이 되는 제품 1968 년부터 가족 기업 GMP 품질 보증,bone-joint-cartilage
목초 사육 지속 가능한 어업 방목 닭 계란껍질막 부드러운 피부 손발톱 강화 모발 성장 장 건강 강화 관절 이완 천연 콜라겐 I | II | III | IV | V | X형 보충제 유전자 변형 성분 무함유 인증 친환경 상품 글루텐 무함유 GMP 인증 시설 깨끗함   순수함   최적화 비가수분해콜라겐으로 만족하지 마십시오 ,bone-joint-cartilage
USDA 유기농 유전자 변형 성분 미함유 프로젝트 인증 5 배 강도 발효 강황 및 생강 유기농 후추 및 소화를 돕는 프로바이오틱스 허브 보조제 코셔 QCS 인증 유기농 사회적 기업 인증 비건 인증 글루텐 미함유 NSF 인증,bone-joint-cartilage
관절 건강 및 가동성 캡슐당 400mg 허브 보충제 관절 무결성  움직임 및 유연성에 도움 관절 건강에 도움 고대 아유르베다 체계에서 풍부한 역사를 지닌 인도 허브 1969년부터 과학에 기반한 고품질 상품 제공,bone-joint-cartilage
뼈와 근육 건강에 도움 1정당 500mg 함유 미네랄 보충제 뼈 건강 및 심혈관 기능에 필수 근육 기능 강화에도 도움 3가지 다른 형태의 칼슘을 결합하여 효과 극대화 1969년부터 과학에 기반한 고품질 상품 제공,bone-joint-cartilage
신경계 지원 안정화된 SAMe  캡슐 형태 장용제 필요 없음 관절 건강 지원 유전자 변형 성분 없음 건강 보조 식품 채식주의자 비건에게 적합 아미노산 1968년부터 가족 소유 기업 GMP 품질 보증,bone-joint-cartilage
1973년 설립 기업 필수 추출물 커큐민 95  심혈관계 건강 관절 건강 보충제 유전자 변형 성분 무함유 프로젝트 인증 품질 검사 완료 비건 건강한 삶 지원,bone-joint-cartilage
조개 및 갑각류 무함유 관절 건강 및 가동성 캡슐당 500mg 보충제 식물성 원료에서 추출한 유전자 변형 성분 무함유 글루코사민 관절 건강 및 연골 건강 유지 건강한 관절 노화 촉진 1969년부터 과학에 기반한 고품질 상품 제공 식물성 GreenGrown ,bone-joint-cartilage
튼튼하고 건강한 뼈 칼슘 대 마그네슘 비율 2 1 미네랄 보충제 튼튼한 뼈 형성 및 개선 에너지 생성 및 근육 긴장 완화 증진 심혈관계 건강 증진 1969년부터 과학에 기반한 고품질 상품 제공,bone-joint-cartilage
아름다움의 비결 피부   모발   손발톱 빛나는 피부  건강한 모발  모든 것이 여기서 시작됩니다  케토 인증 제품 Paleo 인증 제품 유전자 변형 성분 무함유 목초 사육 보충제,bone-joint-cartilage
1969년 설립 카보네이트   말레이트 뼈 및 근육 기능 제공량당 500mg 보충제,bone-joint-cartilage
약사 추천 1위 브랜드  3배 강도  7일 이내에 효과적으로 관절이 편안해집니다  글루코사민 콘드로이틴 및 JOINT SHIELD  1일 2정 보충제 글루텐 무함유,bone-joint-cartilage
강력한 뼈 건강 증진 시스템 뼈에 자극을 주는 단백질을 함유한 StimuCal  보충제 글루텐 무함유,bone-joint-cartilage
글루텐 무함유 하루 1정 유전자 변형 성분 무함유 LE 인증 건강한 정맥 혈류 촉진 보충제,bone-joint-cartilage
플러스 비타민 D 3 유제품 및 글루텐 없음 쉽게 소화 건강 보조 식품,bone-joint-cartilage
친환경적 건강 보조 식품,bone-joint-cartilage
1969년 설립 뼈 건강 및 근육 기능 1회 제공량당 765mg 보충제,bone-joint-cartilage
삼키기 쉬움  칼슘시트레이트 식사 여부와 관계없이 복용 가능 Bayer 의사 및 약사  추천 1위 칼슘 브랜드,bone-joint-cartilage
1회 제공량당 콜라겐 10g 함유 피부  모발  손발톱   관절에 도움 코코넛 밀크 분말로 제조 보충제 첨가당 없음 Paleo 인증 젊어보이는 외모 피부  모발 및 손발톱 건강에 도움 피부 탄력 관절 및 뼈 건강 따뜻한 음료에 혼합 글루텐 및 유제품 무함유  Stayvital  코셔 Whole30 Approved 우피 콜라겐 펩타이드로 제조,bone-joint-cartilage
강력한 순수 추출물 유전자 변형 성분 무함유 프로젝트 인증 NSF 글루텐 무함유 인증 Certified B Corporation  보충제 버몬트에서 감사의 마음을 담아 100  식물성 인공 향료 또는 색소 무함유,bone-joint-cartilage
뼈 건강 강화 미네랄 보충제 캡슐당 250mg 뼈 건강을 위한 강력한 칼슘 혼합물 쉬운 동화를 위한 시트레이트 및 카보네이트의 효과적인 혼합물 1969년부터 과학에 기반한 고품질 상품 제공,bone-joint-cartilage
목초 사육 콜라겐 20g 설탕 0g   피부  모발  손발톱 및 관절 건강 개선 기타 천연 향료 첨가 코코아   Rainforest Alliance   사람과 자연 보충제 우피 콜라겐펩타이드로 제조 유제품 무함유 글루텐 무함유 BPA 무함유 건강한 관절 및 뼈 Paleo 인증 케토 친화 제품 피부 탄력 개선,bone-joint-cartilage
1932년 설립 혁신적인 품질 보충제 하루 1정 채식주의자에게 적합 서방형 확실한 품질,bone-joint-cartilage
Dr  Axe 포뮬라 임상 시험 완료 성분 피부  모발  관절 건강 및 소화 증진 효과가 임상 검증됨 5가지 유형의 식품 원료 콜라겐 I  II  III  V  X형 비타민C   프로바이오틱 2스쿱당 콜라겐 20g 목초 사육 및 방목 사육 유전자 변형 성분 무함유 천연 식품 보충제,bone-joint-cartilage
유기농 소뼈 육수 파우더 함유 장에 좋은 성분 관절 건강 증진 모발  피부  손발톱 건강 개선 보충제 유전자 변형 성분 무함유 유제품 무함유 글루텐 무함유 인공 성분 무함유 Paleo 인증 CCOF 유기농 인증,bone-joint-cartilage
빠르게 작용하는 리퀴드 소프트 젤 단순한 글루코사민 이상의 제품 비타민 C  D   E 오메가 지방산 글루코사민 콘드로이틴 건강 보조 식품,bone-joint-cartilage
비오틴   실리카   비타민C 타입 I   III   프로바이오틱 모발  피부   손발톱 20회 제공량 보충제 B  corp  인증 BPA 무함유 콜라겐 12g   프로바이오틱스 15억CFU 빛나는 피부 멋진 모발 아름다운 피부 식물성 비오틴  실리카   비타민C IGEN 유전자 변형 성분 무함유 검사 완료 케토 인증을 받은 제품입니다  팔레오 친화적인 제품입니다  NSF 글루텐 미함유 인증 호르몬 및 항생제 무첨가,bone-joint-cartilage
콜라겐 펩타이드 20g 단백질 18g 설탕 0g  콜라겐 I형 및 III형 목초 사육 및 방목 Paleo 인증 케토 인증 유전자 변형 성분 무함유 재조합 소 성장호르몬 무함유 글루텐 무함유 소화가 쉬운 제품 재조합 소 성장 호르몬 무함유 인공 감미료  향미료  색소 무함유 Well Being For All ,bone-joint-cartilage
완전한 천연 영양소 1회 제공량당 콜라겐 10g 함유 피부  모발  손발톱  관절에 도움 자연산   유전자 변형 성분 없음 보충제 유전자 변형 성분 무함유 프로젝트 인증 코셔 Whole 30 인증 유제품 무함유 글루텐 무함유,bone-joint-cartilage
슈퍼 푸드 맛있는 허브 슈퍼 푸드 혼합물 비건 글루텐 무함유 코셔 인증 USDA 인증 유기농 유전자 변형 성분 무함유 프로젝트 인증 CCOF 유기농 인증,bone-joint-cartilage
1930년 설립 글루텐 무함유 Happiness Through Wellness 유전자 변형 성분 무함유 프로젝트 인증 허브 보충제 1개월분 우수 제조 및 품질 관리 기준 cGMP  비건에게 적합 밀 무함유 옥수수 무함유 대두 무함유 유제품 무함유 동물성성분 무함유 85년 넘게 이어온 가족 기업,bone-joint-cartilage
관절   심장 건강   세포 방어 강화 1 500mg 높은 흡수율 제3기관이 인증한 순도 및 효능 USDA 유기농 인증 1회 제공량당 3정 보충제 QAI 유기농 인증 글루텐 무함유 유제품 무함유 유전자 변형 성분 무함유 스페셜 포뮬라 우수 제조 및 품질 관리 기준 GMP  인증 시설에서 제조 A Wealth Of Wellness ,bone-joint-cartilage
유전자 변형 성분 무함유 성분으로 제조 고효능 구연산 칼슘 보충제 글루텐 무함유 코셔 파르브 인증,bone-joint-cartilage
Joint Shield 함유 약사 추천 브랜드 1위  미국 관절 건강 브랜드 1위  트리플 스트렝스    MSM 포뮬라 연골 건강 보조 관절 강화 도움 Joint Shield   글루코사민  MSM 하루 2정 40일분 보충제,bone-joint-cartilage
콜라겐 펩타이드 드링크 믹스 1회 제공량당 카페인 75mg Paleo 인증 케토 인증 상품 모발  피부  손발톱 건강 증진 유제품 성분 무함유 1형 콜라겐 및 3형 콜라겐 10g 함유  당류 1g   글루텐 무함유 인증,bone-joint-cartilage
피부 회복 100  비건 유전자 변형 성분 무함유 크루얼티프리 환경 윤리적 제품 글루텐 무함유 대두 무함유,bone-joint-cartilage
1967년 설립 피부  뼈  관절 건강 지원 가능 글루텐 무함유 코셔 파르브 보충제 글루텐 무함유 대두 무함유 Mason 보증   품질 검사 완료 우수 제조 및 품질 관리 기준 GMP  인증,bone-joint-cartilage
보충제 흡수율이 높은 커큐민 건강한 장 내벽 형성 및 근육 회복 증진 채식주의자 및 비건에 적합,bone-joint-cartilage
확실한 효능 보충제 완전한 관절 지원 스택 관절 구성 관절 윤활 관절 강화 히알루론산,bone-joint-cartilage
최고의 효과 비교 대상  Flex A Min  보충제 글루텐 무함유 검사 완료   품질 보증,bone-joint-cartilage
목초 사육 지속 가능한 어업 방목 닭 계란껍질막 기타 천연 향료 함유 천연 콜라겐   I  II  III  IV  V  X형 보충제 부드러운 피부 손발톱 강화 모발 성장 장 건강 강화 관절 이완 깨끗한 성분  깔끔한 맛 유전자 변형 성분 무함유 인증 친환경 상품 글루텐 무함유 GMP 인증 시설 깨끗함   순수함   최적화 비가수분해콜라겐으로 만족하지 마십시오 ,bone-joint-cartilage
프리미엄 허브 포뮬라 본연의 아름다움을 위한 식물성 실리카 모발  피부  손발톱 강화 글루텐 무함유 비건 제품 보충제,bone-joint-cartilage
식물성 성분 비건 상품 젊음의 아름다움 피부  모발  손발톱 및 관절 건강 개선 단백질 14g 케토 친화 상품 보충제 대두 무함유 설탕 무함유 글루텐 무함유 유제품 무함유 동물성 원료 말굽  무함유 동물성 원료 뿔  무함유 동물성 원료 가죽  무함유 코셔 인증 안에서부터 흘러나오는 광채,bone-joint-cartilage
강황 뿌리추출물 허브 보충제 표준화 추출물 커큐미노이드 95  용해도 향상을 위한 소프트젤 보충제 식물성 허브 1968년에 설립된 가족 기업 GMP 품질 보증,bone-joint-cartilage
뼈 건강 지원 골다공증의 위험을 줄일 수 있습니다    미네랄 보조제 품질 보증 품질 검사 완료,bone-joint-cartilage
천연 식품 식물성 포뮬라 칼슘  마그네슘  비타민D3 및 K2 MK 7 골다공증 위험 감소   뼈의 강도 증진에 도움 유전자 변형 성분 무함유 프로젝트 인증 글루텐 무함유 인증 NSF 코셔 보충제 채식주의자에 적합 B  corp  인증,bone-joint-cartilage
비타민 가수분해 울트라 목초 사육 펩타이드 1회 제공량당 콜라겐 1형 및 3형 3 000mg 함유 아름다운 모발  피부 및 손발톱 글루텐 무함유 유전자 변형 성분 무함유 보충제 스페셜티 뷰티 포뮬라,bone-joint-cartilage
100  비건 제품 유전자 변형 성분 없음 환경윤리적 동물 실험을 하지 않음 글루텐 없음  콩 성분 없음 ,bone-joint-cartilage
건강한 염증 반응  흡수율이 뛰어난 커큐민 임상적으로 연구된 커큐민 및 강황 복합체 강황에 비해 최대 500배 강도  여러분의 건강을 위하여   Terry 건강 보조 식품 할랄 유전자 변형 성분 없음 입증된 강력한 효과,bone-joint-cartilage
250mg | 200mg  하루에 캡슐 2정 관절 건강 강화 보충제 삼키기 쉬운 캡슐 글루텐 무함유 품질 보증   품질 검사 완료,bone-joint-cartilage
1969년 설립 프리미엄 추출물 관절 운동 능력 Tru ID  진품 인증 제공량당 307mg 보충제 비건에게 적합,bone-joint-cartilage
관절 건강 및 가동성 캡슐당 125mg AKBA 30  함유 5 LOXIN  허브 보충제 관절 무결성  움직임 및 유연성에 도움 우수하고 신뢰할 수 있는 결과를 위한 AKBA 30  제공 1969년부터 과학에 기반한 고품질 상품 제공,bone-joint-cartilage
모발  피부  손발톱 건강에 도움 Paleo 인증 Keto 인증 최소 가공 Whole 30 인증 유제품  유청  대두 성분 무함유 1형 및 3형 콜라겐 10g 함유  글루텐 무함유 인증 곡물 성분 무함유 증량제  보존제  인공 성분 무함유,bone-joint-cartilage
보충제 모든 주요 장기의 세포 건강 보호 디톡스를 촉진하여 전반적인 건강 및 웰빙 지원 1969년부터 과학에 기반한 고품질 상품 제공,bone-joint-cartilage
피부 건강 증진 건강한 관절 및 결합 조직 강화 GMP 보충제 유전자 변형 성분 무함유,bone-joint-cartilage
전신 1회 제공량당 커큐미노이드 475mg 건강한 염증 반응 지원 Bioperine    비타민C 함유 유전자 변형 성분 무함유 프로젝트 인증 보충제 비건 인증 NSF 글루텐 무함유 인증 유제품 무함유 대두 무함유 125종 이상의 살충제 및 제초제 성분 검사 완료 코셔 글리포세이트 잔여물 무함유 B  corp  인증,bone-joint-cartilage
글루코사민 750mg   콘드로이틴 600mg 매일 2정 섭취 관절 건강 증진 보충제 글루텐 무함유 품질 보증   실험실 검사 완료,bone-joint-cartilage
천연 완전 영양소 1회 제공량당 콜라겐 15g 함유 피부  모발  손발톱   관절에 도움 히알루론산 120mg 건강 보조 식품 Whole 30 인증 유제품 무함유 글루텐 무함유 BPA 무함유,bone-joint-cartilage
Dietary Supplement,bone-joint-cartilage
보충제 7 10일 만에 관절을 편안하게 편리하게 하루에 1정씩 복용하는 포뮬라 채식주의자에게 적합 순도 및 효능 보장,bone-joint-cartilage
1  3형 콜라겐 히알루론산 비타민C 아름다운 피부  건강한 모발  손발톱 보충제 목초 사육 글루텐 무함유 Igen 유전자 변형 성분 무함유 검사 완료,bone-joint-cartilage
친환경 제품 1회 제공량당 1 000mg 오키나와산 산호 칼슘 균형 잡힌 비율로 칼슘과 마그네슘 공급 72종 이상의 미량 미네랄 칼슘 및 미네랄 보충제 글루텐 무함유 소금  효모 또는 인공 향료 무함유 품질 검사 완료   품질 보증,bone-joint-cartilage
건강한 염증 반응  흡수율이 뛰어난 커큐민 임상적으로 연구된 커큐민 및 강황 복합체 강황에 비해 최대 500배 강도  건강에 좋은 제품 보충제 유전자 변형 성분 무함유 할랄 강력한 효과 입증 ,bone-joint-cartilage
