description,category
 유전자 변형 성분 무함유 인증 지속 가능한 방식으로 생산 자연산 I  III형 천연 콜라겐 보충제 피부 탄력 부드러운 피부 모발 성장 위장 건강 관절 이완 깨끗한 성분  깔끔한 맛 친환경 제품 글루텐 무함유 우수 제조 및 품질 관리 기준 GMP    독립 인증 깨끗함  순수함  최적화 I  III형 콜라겐 풍부 건강한 피부 탄력  수분  전반적인 건강 촉진 탁월한 모발  손발톱  관절 지원 효과 바다의 자연산 생선만 사용 지속 가능하고 탄소 발자국 적음 흡수율과 효능을 극대화하기 위한 가수분해 및 효소 보강 I형   피부 탄력 및 수분  모발 건강 III형   관절  혈관  주요 장기,모발-피부-손톱
 10칼로리 비건 상품 무가당 글루텐 무함유 NO 동물실험 HACCP MFDS 상큼한 과일 맛과 쫄깃한 식감 아름다움으로 이어지는 웰빙 콜라겐 부스터 1 000mg   비타민C 400mg 관절 및 근육 모발 및 손발톱 피부 탄력 강력한 항산화제 면역 건강 건강한 피부,모발-피부-손톱
 목초 사육 및 방목 보충제 순수 및 무가공 Greatness by Nature  The Optimal Collagen 뼈 건강 피부 세포 건강 모발   손발톱 강화 관절 운동성 필수 아미노산 공급원 장 건강 지원 목초 사육   방목 콜라겐 1형 및 3형 글루텐 무함유 품질 검사 완료 호르몬 무함유,모발-피부-손톱
 콜라겐 생성 지원 윤기 있는 모발을 유지 광채 있는 피부 및 건강한 손발톱 과학적 근거에 기반 프리미엄 품질 포뮬러 매일 1 회 바디   뷰티 건강 보조 식품 비건에게 적합,모발-피부-손톱
 니코틴아마이드 리보사이드가 함유된 패션 베리 맛 콜라겐 보충제 건강한 노화 피부 모발 T 독점판매 상품 글루텐 무함유 피부  모발 및 손발톱 건강 향상   이르면 4주 내에 눈에 보이는 효과 콜라겐이 피부의 수분  탄력 및 힘을 증진 주름 및 잔주름을 완화하고 피부 색소를 밝게 해 주고 환하게 밝혀 줌 피부결 개선 및 거친 피부 완화 건조하고  거칠고  각질이 일어나는 피부를 위한 피부 수분 공급에 도움 젊은 사람의 경우 건강해 보이는 피부를 유지하도록 도움 노화가 진행되는 피부의 세포 회복 증진,모발-피부-손톱
 비타민 B7 보충제 Nutricost  품질 보장 동물성 성분 무함유 비건 제품 GMP 인증 시설 유전자 변형 성분 무함유 상품 제3기관 검사 완료 글루텐 무함유,모발-피부-손톱
 목초 사육 및 방목 콜라겐 공급원 빛나는 피부 모발  손발톱 위장 건강 뼈 및 관절 설탕 무함유 소 젤라틴 건강 보조 식품 건강한 음식  활력 넘치는 일상 정성을 담은 제품 유전자 변형 성분 무함유 rBGH 무함유 Kosher Certified 코셔 인증  케토  팔레오 피부 보습 및 탄력 모발  손발톱 위장 건강 뼈 및 관절,모발-피부-손톱
 건강  자연  생활 미네랄 함유 실리카 보조제 뼈  모발  손발톱에 영양 공급 실리카 20mg 함유 건강 보조 식품 식물성 보조제,모발-피부-손톱
 보충제 토양 미생물 500억CFU  피부 프리바이오틱 및 프로바이오틱 아유르베다 허브 함유,모발-피부-손톱
 목초 사육 지속 가능한 어업 방목 닭 계란껍질막 기타 천연 향료 함유 천연 콜라겐 I  II  III  IV  V  X형 보충제 유전자 변형 성분 무함유 인증 친환경 상품 글루텐 무함유 GMP 인증 시설 부드러운 피부 손발톱 강화 모발 성장 장 건강 강화 관절 이완 깨끗함  순수함  최적화 깨끗한 성분  깔끔한 맛 목초 사육 소고기  자연산 대구  동물복지 닭 및 계란껍질막으로 제조되었습니다  깨끗하고 지속 가능한 성분이 최고의 콜라겐 원료입니다  6가지 유형의 주요 콜라겐 I  II  III  IV  V 및 X형 으로 된 강력한 조성물로서 전신 건강에 뛰어난 효능을 제공합니다  I형   피부 탄력 II형   관절 및 면역계 III형   피부  혈관  주요 장기 IV형   세포 건강 및 성장 V형   피부  힘줄  면역계 X형   관절  뼈  근육 및 모발,모발-피부-손톱
 모발  피부  손발톱 건강 1회 제공량당 비오틴 10 000mcg 함유 보충제 우수 제조 및 품질 관리 기준 GMP 를 준수하는 일관된 품질 품질 검사 및 인증 완료 유전자 변형 성분 무함유 비건 상품 정성을 담은 상품 간편하게 씹어 먹기 좋은 크기 길고 건강하고 풍성한 모발,모발-피부-손톱
 향기로운 포도 향료 강화된 미용 기능성 상품 아미노산 단백질 비오틴 함유 내면에서 시작되는 자연스러운 아름다움 보충제 건강한 모발  피부  손발톱을 위한 콜라겐 및 엘라스틴 공급 피부 재생 및 수분 공급 과정 도움 필수 항산화제 공급,모발-피부-손톱
 피부  모발  손발톱 장   관절 강화 자연산 28회 제공량 1회 제공량당 콜라겐 펩타이드 6 600mg 설탕 무함유  양질의 섭취로 건강 증진 Further Your Wellness 팔레오   케토 우수 제조 및 품질 관리 기준 cGMP  시설에서 포장 코셔 인증 할랄 인증 항생제 호르몬 무함유 유제품 무함유 1  2  3형 피부 보습 및 탄력 모발 및 손발톱 장 건강 뼈 및 관절,모발-피부-손톱
 피부  모발  손발톱 위장 건강  관절 강화 목초 방목 사육 28회 제공량 1회 제공량당 콜라겐 8 000mg 무설탕  건강 보조 식품 건강한 음식  활력 넘치는 일상 4가지 강력한 성분이 전부입니다  건강 증진 팔레오 및 케토 NSF 우수 제조 및 품질 관리 기준 cGMP  시설에서 제조 Kosher 유형 1 및 3 호르몬 및 항생제 무함유 유제품 무함유 피부 보습 및 탄력 모발  손발톱 위장 건강 뼈 및 관절,모발-피부-손톱
 1  3형 콜라겐 1회 제공량당 콜라겐 10g 함유 용기당 제공 횟수  16회 피부  모발  손발톱  관절 건강에 도움 기타 천연 향료 함유 분말 보충제 케토 인증 글루텐 무함유 목초 사육 100  PCR 용기  케토 인증 Igen  유전자 변형 성분 무함유 검사 완료 본 상품에는 유전자 변형 성분 또는 단백질이 함유되지 않았습니다 ,모발-피부-손톱
 아름다움의 비결 안티에이징 포뮬라 I  II  III  V  X형 히알루론산 비오틴 비타민C DigeSEB 으로 흡수율 향상 피부  모발  손발톱  관절을 위한 상품 보충제 목초 사육 방목 사육 유전자 변형 성분 무함유 호르몬   항생제 무함유 콜라겐 펩타이드  피부  모발 및 손발톱  관절을 위한 필수 뷰티 단백질 히알루론산  결합 조직을 위한 천연 수분 비오틴  피부와 모발 건강을 위한 기본 비타민 비타민C  콜라겐 합성을 위한 항산화제 DigiSEB   콜라겐 흡수를 향상하기 위한 효소 혼합물,모발-피부-손톱
 관절   피부 지원 보충제 모두를 위한 제품 피부 깊숙이 영양 공급 관절 윤활 및 완충 개선 피부 보습 증진,모발-피부-손톱
 임상 시험 용량 2 5g 피부  모발  손발톱 건강 개선 기타 천연 향료 첨가 보충제 잔주름 및 깊은 주름 완화  합성색소 무함유 목초 사육 및 방목 인공색소 무함유 글루텐 무함유 우피 콜라겐펩타이드로 제조 Verisol 이 선사하는 안에서부터 차오르는 아름다움,모발-피부-손톱
 내면에서 시작되는 아름다움 기타 천연 향료 함유 케라틴  암라  비오틴 및 미네랄 보충제 합성 향료 및 색소 무함유 글루텐 무함유 NSF 인증 B  corp  인증,모발-피부-손톱
 최상의 효능 강화된 미용 기능성 제품 비오틴 5 000mcg 풍성하고 볼륨감 있는 모발 젊어 보이는 피부 튼튼하고 건강한 손발톱 필수 비타민 및 미네랄 보충제 생기 있는 모발  매끄러운 피부  건강한 손발톱으로 관리 필수적인 단백질 구성 요소 공급 모발  피부  손발톱 성장 관련 단백질을 공급해 주는 필수 황 및 아미노산 함유,모발-피부-손톱
 건강 보조 식품 글루텐 무함유 효모 없음 식물성 삼키기 쉬운 미니 정제 미크로젤 서방형 체계,모발-피부-손톱
 글루텐 무함유 유전자 변형 성분 무함유 LE 인증 하루 한 알 관절 지원 보충제 며칠만에 관절의 불편함을 완화함 염증 억제 및 산화에 도움을 주어 관절 건강과 유연성을 지원 민감한 관절의 완충 및 윤활 지원 건강한 관절 조직 성장 촉진,모발-피부-손톱
 모발 건강 Karanat  함유 보충제 1969년부터 과학에 기반한 고품질 상품 제공,모발-피부-손톱
 제3기관이 인증한 순도 및 효능 USDA 유기농 인증 1회 제공량당 2정 보충제 유전자 변형 성분 무함유 글루텐 무함유 유제품 무함유 스페셜 포뮬라 GMP 인증 시설에서 제조 QAI 유기농 인증,모발-피부-손톱
 프리미엄 포뮬라 우수 제조 및 품질 관리 기준 GMP  제품 제3기관 품질 검사 완료 보충제 관절 건강을 강화합니다  생기 넘치는 피부를 선사합니다 ,모발-피부-손톱
 California Gold Nutrition 슈퍼 푸드 콜라겐 코코넛 크리머 가수분해콜라겐 펩타이드를 함유한 유기농 코코넛 밀크 분말 음료에 크리미한 코코넛 향을 더하는 상품 1회 제공량당 콜라겐 10g 및 단백질 10g 모발  피부  손발톱  관절  뼈 건강 증진  향료 또는 감미료 무함유 유제품 및 유당 무함유 글루텐  유전자 변형 성분 및 대두 무함유 cGMP 인증 시설에서 생산 100  골드 개런티 Gold Guarantee ,모발-피부-손톱
 Science Based Nutrition  피부 및 손발톱 건강 증진 관절 운동성 지원 사실상 무맛  무향 보충제 유전자 변형 성분 무함유   글루텐 무함유   대두 무함유 콜라겐은 중요 기관의 연결 조직  관절  인대  힘줄  모발  손발톱  피부 상피층의 중요 기본요소입니다  해양 콜라겐은 피부의 탄력성과 수분 흡수 및 보유 능력을 강화합니다  보다 부드럽고 건강한 피부를 위해 피부 탄력을 증진합니다  관절 건강을 증진합니다  사실상 무맛  무향이며 어떠한 음료하고도 쉽게 섞입니다  내면의 자연스러운 아름다움을 증진합니다  콜라겐은 신체의 가장 중요한 구성물질 중 하나입니다  피부의 85 는 콜라겐으로 구성되어 있습니다  피부와 관절을 1차적으로 지원하는 I형 콜라겐이 함유되어 있습니다 ,모발-피부-손톱
 1947년 설립 피부  손발톱 및 모발 건강 지원 할랄 유전자 변형 성분 무함유 글루텐  밀  유제품 무함유 비건에게 적합 글루텐 무함유 인증 코셔 파르브 보충제,모발-피부-손톱
 건강한 피부와 모발 뼈   관절 건강 증진 혼합하거나 흔들어 섞어 드십시오 천연향 보충제 Igen   유전자 변형 성분 무함유 검사 완료   Igen  Program 유전자 변형 성분 무함유 검증 글루텐 무함유 케토 친화적 제품 팔레오 친화적 제품 인증 목초 사육 및 방목 우수 제조 관리 기준   GMP 인증   GMP 시설에서 제조 뼈 및 관절 건강  뼈와 관절 건강에 도움이 될 수 있습니다  뷰티  피부 탄력 및 눈에 보이는 피부 노화의 징후를 줄이는 데 도움을 줄 수 있습니다  연결 조직  힘줄  인대  연골에 도움이 될 수 있는 18가지 아미노산이 함유되어 있습니다  장 친화적 제품  소화를 편안히 하고 흡수율을 향상하기 위해 가수분해되었습니다 ,모발-피부-손톱
 글루텐 무함유 칼슘콜라겐킬레이트 유전자 변형 성분 무함유 LE 인증 보충제 뼈 건강 증진 건강한 뼈 미네랄 밀도 유지 뼈 강도   유연성 최적화,모발-피부-손톱
 가수분해콜라겐 보충제 분말 친환경 원료 우수 제조 및 품질 관리 기준 cGMP  인증 유전자 변형 성분 무함유,모발-피부-손톱
 목초 사육 콜라겐 20g 설탕 0g   피부  모발  손발톱  관절에 도움 천연 코코아로 제조 기타 천연 향료 첨가 보충제 우피 콜라겐 펩타이드로 제조 유제품 무함유 글루텐 무함유 목초 사육 콜라겐 20g 설탕 0g Paleo 인증 글루텐 무함유 유제품 무함유 케토 친화 제품 관절 및 뼈 건강 모발 및 손발톱 건강 피부 탄력 개선,모발-피부-손톱
 보충제 바이오틴 5 000 mcg 채식주의자에게 적합,모발-피부-손톱
 임상 검증된 상품 우리 몸에서 직접 생성하는 천연 콜라겐 오리지널 ch OSA  포뮬라 아름다운 피부  모발  손발톱 건강한 뼈와 관절 비건 상품 보충제 인공 색소 및 향료 무함유 유전자 변형 성분 무함유 친환경 원료 태양광 에너지 이용 시설에서 제조 MWU 물 사용 최소화  준수 동물 성분  해양생물 성분 무함유 잔주름 및 깊은 주름 완화 피부 탄력 강화 모발을 굵고 튼튼하게 관리 손발톱 강화 뼈 및 관절 건강 증진 콜라겐 형성 촉진 기존 콜라겐 보호에 도움,모발-피부-손톱
 보충제 인공 향료 색소 무함유 글루텐 무함유 유전자 변형 성분 무함유 우수 제조 및 품질 관리 기준 cGMP  인증,모발-피부-손톱
 임상 시험 완료 성분 5가지 유형의 식품 원료 콜라겐 I  II  III  V  X형 비타민C   프로바이오틱 2스쿱당 콜라겐 20g 목초 사육 및 방목 사육 유전자 변형 성분 무함유 천연 식품 보충제 피부 장 손발톱 모발 관절,모발-피부-손톱
 I 및 III형 생기 넘치는 피부 1정당 1 000mg 함유 보충제 젊어 보이는 피부 촉진 피부  모발  관절 등을 건강하게 하는 콜라겐 단백질 콜라겐 합성을 위한 비타민C 보충 1969년부터 과학에 기반한 고품질 상품 제공,모발-피부-손톱
 히알루론산 | 비타민C | 비오틴 | 레드오렌지 복합체 | 천연 향료 지속 가능   자연산 보충제 IGEN   유전자 변형 성분 무함유 검사 완료 해산물 채식주의자에게 적합 케토 인증 제품 글루텐 무함유 우수 제조 및 품질 관리 기준 GMP  준수   해당 시설에서 제조 BPA 무함유 자연산 심해 어류에서 추출한 가수분해 해양콜라겐펩타이드 5g Redorange complex  히알루론산   비타민C   비오틴,모발-피부-손톱
 식물성 성분 100  비건 상품 수분 공급으로 노화 방지 효과 장 건강을 위한 프로바이오틱 1회 제공량당 20억CFU 히알루론산   비오틴 보충제 대두 무함유 첨가당 0g 케토 친화 상품 글루텐 무함유 유제품 무함유 유전자 변형 성분 무함유 동물성 성분 말굽  가죽  뿔  무함유 채소 1회 제공량에 해당하는 양 코셔 인증,모발-피부-손톱
 1967년 설립   케라틴 100mg 피부 및 모발 건강 증진 글루텐 무함유 대두 무함유 Mason 보증   품질 검사 완료 cGMP   우수 제조 및 품질 관리 기준 인증,모발-피부-손톱
 1932년 설립 히알루론산 20mg MSM 700mg 신선함   건강 하루 1회 보충제,모발-피부-손톱
 1회 제공량당 콜라겐 10g 함유 피부  모발  손발톱   관절에 도움 코코넛 밀크 분말로 제조 기타 천연 향미료 자연 첨가 보충제 유제품 무함유 코셔 Whole30 Approved 글루텐 무함유 BPA 무함유 젊어보이는 외모 건강한 관절 및 뼈 설탕 무첨가   따뜻한 음료와 혼합 Paleo 인증 피부 탄력 글루텐 및 유제품 무함유,모발-피부-손톱
 모발  피부 및 손발톱용 1위 브랜드  Optimal Solutions  비오틴 2배 이상 함유  1회 제공량당 6 000mcg 케라틴 함유 식물성 보충제 Beauty Starts On The Inside  비타민A  C 및 E 유전자 변형 성분 무함유 | 식물성 믹스 베리  딸기 및 수박 맛 젤리 빈 나트륨 무함유,모발-피부-손톱
 항산화 효과 7회 제공량 과일 채소 에너지 활력 웰빙 건강한 모발  피부  손발톱 포뮬러   Nature s C  베지 베리 혼합   녹즙 분말   프로바이오틱스 비건 유전자 변형 무함유 성분으로 제조 글루텐 무함유 건강 보조 식품 채식주의자에게 적합 Best of Supplements Award 수상   우수한 영양 알칼리성 녹즙 함유 1994년부터 자연이 주는 기적을 나누는 회사,모발-피부-손톱
 내면에서 시작되는 아름다움 촉촉하고 생기 넘치는 피부 히알루론산  콜라겐  산자나무 보습 보충제 기타 천연 향료 함유 합성 향료 및 색소 무함유 글루텐 무함유 B  corp  인증,모발-피부-손톱
 모발  피부  손발톱 건강 개선  완전한 종합비타민 종합비타민 종합미네랄 보충제 무함유 성분  인공 감미료  액상과당,모발-피부-손톱
 뼈 및 관절 건강 강화 모발 및 손발톱 건강 강화 보충제,모발-피부-손톱
 영양 보충제 글루코사민  콘드로이틴  MSM 첨가 바이오셀 콜라겐 옵티MSM,모발-피부-손톱
 Sports   More 히알루론산 및 콘드로이틴이 함유된 피부  모발 및 관절 포뮬라 젤라틴 무함유 보충제 1994년부터 자연이 주는 기적을 나누는 회사,모발-피부-손톱
 미용 효과 에너지 증진 면역력 강화 두뇌 기능 강화 기타 천연 향료 함유 보충제 식물성 글루텐 무함유 유전자 변형 성분 무함유,모발-피부-손톱
 보충제 임상에서 효과가 증명됨  뼈 무기질화 촉진 골밀도 유지에 도움 콜라겐 보충 모두를 위한 상품,모발-피부-손톱
 하이드롤라이즈드콜라겐 1형 및 3형 피부  모발  손발톱 건강 지원 건강한 관절과 뼈를 위해 쉽게 섞이는 수용성 보충제 1회 제공량당 콜라겐 11g 함유 콜라겐 1형 및 3형 함유 무맛 및 무향 케토 및 팔레오 친화적 쉽게 섞이는 수용성 건강한 피부 및 손발톱 건강한 관절 및 뼈,모발-피부-손톱
 1  3형 콜라겐 히알루론산 비타민C 아름다운 피부  건강한 모발  손발톱 보충제 목초 사육 글루텐 무함유 Igen 유전자 변형 성분 무함유 검사 완료,모발-피부-손톱
 건강하고 아름다운 피부를 지원합니다  피부 갈라짐을 완화합니다  여러분의 훌륭한 건강을 위하여 보충제 비건 유전자 변형 성분 무함유 피부 갈라짐을 완화합니다  피부의 천연 방어를 도와줍니다  아름다운 피부를 지원합니다  깨끗하고 상쾌한 피부로 가꿔줍니다  황과 칼륨은 적절한 박테리아 균형을 지원합니다  레티닐 형태의 비타민 A는 건강하고 깨끗한 피부 구조에 필수적입니다  비타민 C  보스웰리아 및 아연은 면역계를 지원하고 산화 스트레스로부터 몸을 보호합니다  우엉과 크로뮴은 신체의 해독 시스템을 지원합니다  비타민B6와 판토텐산은 스트레스를 완화해 주어 여드름 제거에 도움이 됩니다  ,모발-피부-손톱
 히알루론산 보충제 종합비타민   콜라겐 지속 가능한 방식으로 조달된 원료 유전자 변형 성분 무함유 우수 제조 및 품질 관리 기준 cGMP  인증,모발-피부-손톱
 Since 1947 Supports Healthy Skin  Nails   Hair Non GMO Certified Gluten Free Wheat   Dairy Free Suitable for Vegans Kosher Parve Dietary Supplement,모발-피부-손톱
 임상 검증된 제품 히알루론산 복합체 3  하룻밤 사이 깊은 보습과 눈에 띄는 탄력 피부 완성 피부과 전문의 테스트 완료 향료 무함유 파라벤 무함유 여드름 유발 성분 무함유 피부과 의사 추천 제품 노화 방지 브랜드,모발-피부-손톱
 목초 사육 지속 가능한 어업 방목 닭 계란껍질막 기타 천연 향료 함유 천연 콜라겐   I  II  III  IV  V  X형 보충제 부드러운 피부 손발톱 강화 모발 성장 장 건강 강화 관절 이완 깨끗한 성분  깔끔한 맛 유전자 변형 성분 무함유 인증 친환경 상품 글루텐 무함유 GMP 인증 시설 깨끗함   순수함   최적화 비가수분해콜라겐으로 만족하지 마십시오  목초 사육 소고기  자연산 대구  동물복지 닭 및 계란껍질막으로 제조되었습니다  깨끗하고 지속 가능한 성분이 최고의 콜라겐 원료입니다  6가지 유형의 주요 콜라겐 I  II  III  IV  V 및 X형 으로 된 강력한 조성물로서 전신 건강에 뛰어난 효능을 제공합니다  I형   피부 탄력 II형   관절 및 면역계 III형   피부  혈관  주요 장기 IV형   세포 건강 및 성장 V형   피부  힘줄  면역계 X형   관절  뼈  근육 및 모발,모발-피부-손톱
 비건 친화적 제품 유전자 변형 성분 무함유 보충제 신뢰할 수 있는 브랜드 IGEN  유전자 변형 성분 무함유 검사 완료 글루텐 및 대두 무함유 비건 인증 우수 제조 및 품질 관리 기준 cGMP  준수 매일 구미젤리 1개 베리 혼합물 25mg 비오틴 5 000mcg 비타민C 45mcg,모발-피부-손톱
 목초 사육 지속 가능한 어업 방목 닭 계란껍질막 부드러운 피부 손발톱 강화 모발 성장 장 건강 강화 관절 이완 천연 콜라겐 I | II | III | IV | V | X형 보충제 유전자 변형 성분 무함유 인증 친환경 상품 글루텐 무함유 GMP 인증 시설 깨끗함   순수함   최적화 비가수분해콜라겐으로 만족하지 마십시오  I형   피부 탄력 II형   관절 및 면역계 III형   피부  혈관  주요 장기 IV형   세포 건강 및 성장 V형   피부  힘줄  면역계 X형   관절  뼈  근육 및 모발,모발-피부-손톱
 100  품질 만족 보장 비타민 슈퍼 강도 글루텐 무함유 유전자 변형 성분 무함유 아르간오일 함유 콜라겐 코코넛오일 보충제 모발  피부  손발톱 강화,모발-피부-손톱
 임상적으로 연구된 성분 에드워드 Axe 포뮬라 5가지 유형의 식품 원료 콜라겐 I  II  III  V  X형 비타민C   프로바이오틱 2스쿱당 콜라겐 20g 목초 사육 및 방목 사육 유전자 변형 성분 무함유 천연 식품 보충제 피부 장 손발톱 모발 관절,모발-피부-손톱
 내면에서 시작되는 아름다움 기타 천연 향료 함유 모발  피부  손발톱 건강 비오틴  케라틴  비타민C 및 E 보충제 합성 향료 및 색소 무함유 글루텐 무함유 NSF 인증 B  corp  인증,모발-피부-손톱
 얇은 모발 영양 공급 및 기존 모발 성장 촉진 지원 하루 캡슐 2개 토코트리에놀 복합체 함유 건강 보조 식품 천연 공급원 유제품 무함유 글루텐 무함유 유전자 변형 성분 무함유 비건,모발-피부-손톱
 미국 판매 1위 구미젤리 비타민 브랜드 1회 제공량당 5 000mcg 모발  피부 및 손톱에 도움 미국 Culinary ChefsBest   2018 Chefs Best Award 최우수상 수상 고효능 바이오틴 인공 향료 또는 감미료 무함유 글루텐 무함유 고과당 옥수수 시럽 무함유 유제품 무함유 합성 염료 무함유,모발-피부-손톱
 종합비타민에 비오틴  항산화제 함유  보충제 수상에 빛나는 맛   American Culinary Chef s Best Chef s Best Award   2019년 최우수상 수상 임상 검증된 흡수율 ,모발-피부-손톱
 1969년 설립 아연 및 비오틴 3mg 헤어  스킨  손발톱 건강 유지 근육 조직 강화 보충제 헤어 및 스킨 건강 비건 제품,모발-피부-손톱
 모발  피부  손발톱 건강에 도움 캡슐당 50mg 보충제,모발-피부-손톱
 1회 제공량당 콜라겐 10g 함유 피부  모발  손발톱   관절에 도움 코코넛 밀크 분말로 제조 보충제 첨가당 없음 Paleo 인증 젊어보이는 외모 피부  모발 및 손발톱 건강에 도움 피부 탄력 관절 및 뼈 건강 따뜻한 음료에 혼합 글루텐 및 유제품 무함유  Stayvital  코셔 Whole30 Approved 우피 콜라겐 펩타이드로 제조 콜라겐 펩타이드 10g 젊어보이는 외모 관절 및 뼈 건강 첨가당 없음 피부  모발 및 손발톱 건강에 도움 따뜻한 음료에 혼합 Paleo 인증 소화 건강 글루텐 및 유제품 무함유,모발-피부-손톱
 콜라겐 펩타이드 20g 단백질 18g 설탕 0g  콜라겐 I형 및 III형 목초 사육 및 방목 Paleo 인증 케토 인증 유전자 변형 성분 무함유 재조합 소 성장호르몬 무함유 글루텐 무함유 소화가 쉬운 제품 재조합 소 성장 호르몬 무함유 인공 감미료  향미료  색소 무함유 Well Being For All ,모발-피부-손톱
 25년 이상 지켜 온 프리미엄 품질 하수오 조제   암라가 함유된 건강한 모발  피부 및 손발톱 포뮬라 비건 유전자 변형 무함유 성분으로 제조 글루텐 무함유 보충제 GMP 품질 보증 및 FDA 등록 Enhancing Nature s Miracles Since 1994,모발-피부-손톱
 생기 넘치는 피부 임상 연구를 마친 상품 보충제 대두 무함유 글루텐 무함유 유제품 무함유 합성 성분 무함유 탄력 충전 햇볕으로 인한 손상 완화 세포 재생 안티에이징 포뮬라 동물성 성분 말굽  가죽  뿔  무함유 100  비건 상품,모발-피부-손톱
 비타민   미네랄   오메가3 식물영양소   프로바이오틱 모든 피부 타입에 적합 보충제 피부 건강 개선 아미노산 B 복합체 프로바이오틱 해조류 구리 l 라이신 HCl 후추 종합비타민 아연 비건 유전자 변형 성분 무함유 대두 무함유 유제품 무함유 글루텐 무함유 cGMP 인증 시설에서 제조,모발-피부-손톱
