effect,category
Oxymetazoline HCl Nasal Solution Nasal Decongestant Relieves Nasal Congestion   Sinus Congestion Pressure  Helps Rehydrate Nasal Passages Unblocks in Seconds Lasts 12 HRS  BAYER Stays Where It s Sprayed No 1 Doctor and Pharmacist Recommended Nasal Spray Brand temporarily relieves nasal congestion due to   common cold  hay fever  upper respiratory allergies  temporarily relieves sinus congestion and pressure  shrinks swollen nasal membranes so you can breathe more freely ,계절성 알레르기
비건 친화적 제품 유전자 변형 성분 무함유 보충제 USDA 유기농 인증 유전자 변형 성분 무함유 프로젝트 인증 비건 인증 글루텐 및 대두 무함유 신뢰할 수 있는 브랜드 QAI 유기농 인증유기농 엘더베리 150mg 비타민C 및 아연 프로바이오틱 10억CFU Lactospore  VitaBerry  유기농 혼합물,계절성 알레르기
눈가 가렵고 눈물   재채기하며 목  콧구멍 가렵 자연적인 방식으로 건강 증진 동종 요법 약품 일 년 내내 알레르기 증상을 완화 졸리지 않음 동종 요법 의약품의 세계적인 리더 인공 감미료  향료  색소 또는 보존제 무함유돼지풀 꽃가루 집 먼지 진드기 반려동물의 털 곰팡이눈이 가렵고 눈물이 나는 경우 콧물 재채기 가려운 목 및 콧구멍 건초열과 관련된 경련성 기침,계절성 알레르기
California Gold Nutrition EpiCor   건조 발효 효모 맥주효모균  면역계 건강 증진  채식주의자와 비건에게 적합 글루텐  유전자 변형 성분  대두 무함유 cGMP 인증 시설에서 생산 100  골드 개런티 Gold Guarantee ,계절성 알레르기
1982년 설립 64배 농축 추출물 USDA 유기농 인증 유전자 변형 성분 무함유 프로젝트 인증 NSF 글루텐 무함유 인증 비건 인증 코셔 보충제 ICS 유기농 인증 인공 향료 및 색소 무함유 B  corp  인증,계절성 알레르기
Searching the World For Better Health  단백질  지방  전분  설탕  유당  글루텐 소화 촉진 보충제 글루텐 무함유,계절성 알레르기
보충제 건강을 증진하는 항산화제 유전자 변형 성분 무함유 GMP 준수 제3 기관 검사 완료 글루텐 무함유 BPA 무함유,계절성 알레르기
보충제 소화를 돕는 프로바이오틱 및 효소 FODMAP 소화 기능 강화 간헐적인 가스 변비 완화 비교적 제한이 크지 않은 식단 지원 섬유소 영양소가 풍부한 음식 섭취 시 도움 미국채식협회 AVA  비건 인증 Star K 코셔 인증 유전자 변형 성분 무함유 검사 완료,계절성 알레르기
효능  면역 기능 뛰어난 맛 1회 제공량당 구미젤리 2개 보충제 제3기관이 인증한 순도 및 효능 USDA 유기농 인증 QAI 유기농 인증 유전자 변형 성분 무함유 글루텐 무함유 유제품 무함유 A Wealth of Wellness  We Make Wellness Possible ,계절성 알레르기
보충제 건강을 증진하는 항산화제 유전자 변형 성분 무함유 GMP 준수 제3 기관 검사 완료 글루텐 무함유 BPA 무함유,계절성 알레르기
500 mg Per Serving  2 400 GDU gram  120 Servings Dietary Supplement NutriCost Quality Guaranteed Vegetarian Product GMP Compliant Quality Non GMO Product Third Party Tested Gluten Free,계절성 알레르기
스퀴즈 용기 1개 및 프리믹스 30개 진정 작용을 하는 순한 비강 세척액 밤낮으로 자녀가 코로 더 쉽게 호흡할 수 있도록 돕습니다 100  천연 성분120mL 4fl oz  부비강 세척 용기 1개 맞춤형 검은색 캡 및 튜브 1개 USP 등급 순도 99  이상  소듐클로라이드 및 소듐바이카보네이트 혼합물 pH 균형  천연 성분  등장성  보존제  요오드 무함유  프리믹스 팩 30개 사용 방법이 설명된 교육용 책자코막힘 또는 콧물 완화 어린이 전용으로 설계된 순한 비강 식염수 헹굼 시스템 화끈거리지 않고 따갑지 않음 양치나 손 씻기만큼 쉬운 사용법코 알레르기  건조증  알레르기성 비염 코막힘  답답함 독감  감기  부비강염으로 인한 비강 증상 후비루 증후군 및 코막힘 업무 환경 및 집 먼지  매연  동물 털  풀  꽃가루  연기 등에 의한 자극 비강 세척  보습 및 일상적인 비강 위생 유지 부비동 수술 후 또는 낭포성 섬유증 환자의 부비강 증상으로 복용화끈거림이 없고 진정 작용을 하며   식염수 비강 세척  일상 비강 위생 및 수분 보충을 위한 Large 볼륨   Low Pressure  시스템 주문 제작한 단일 조각의 둥근 검은색 뚜껑은 비강에 잘 어울립니다  잡아당길 필요 없이 구성 요소가 있어 쉽게 세척할 수 있습니다  보존제  약물  요오드  BPA  글루텐  라텍스 무함유 USP 등급 소듐클로라이드 및 소듐바이카보네이트 프리믹스 팩 순도 99  이상  비강 약물 분사 전 세척 효과가 우수함 PH Balanced   등장성  2팩 이상의 고장성 짜기 쉬운 용기로 속도가 유연함 고개를 똑바로 든 상태에서 내용물의 95  가까이 사용 임신 중에도 사용할 수 있습니다  우려 사항이 있으면 항상 의사와 상담하십시오  휴대 가능,계절성 알레르기
건전지로 작동 Dr  부비강 완화제 부드럽고 효과적인 흡입력 부드러운 실리콘 팁 건전지 포함 뻑뻑한 코를 위한 빠른 완화,계절성 알레르기
1회 제공당 100mg 비타민 C와 아연 함유 면역 강화 뛰어난 맛 보충제 면역력을 지원해주는 맛있는 제품 유전자 변형 성분 무함유 채식주의자에게 적합 글루텐 무함유 인공 향료  감미료 또는 보존제 무함유 천연 향료의 엘더베리 구미젤리,계절성 알레르기
강력한 30  IGG 면역글로불린 저온 가공 면역력 강화 위장관 건강 지원 유전자 변형 성분 무함유 보충제 GMP 인증 시설에서 제조면역 건강 지원  소의 초유에는 건강한 면역 체계와 위장관을 유지하는 데 중요한 항체인 높은 수준의 IgG  IgM 및 IgA 면역글로불린이 포함되어 있습니다  이러한 주요 면역 보조제와 함께 초유에는 프롤린이 풍부한 폴리펩티드 PRP 가 포함되어 있어 시간이 지남에 따라 신체가 직면하는 다양한 상황에 대해 건강한 면역 반응을 유지하는 역할을 합니다  장 건강 및 세포 성장  당사의 실험실 테스트를 거친 무항생제 락토페린은 장내 좋은 박테리아가 성장하는 데 사용하는 프리바이오틱스 역할을 하며 장에서 건강한 세포 성장을 유지하여 회복을 돕습니다  한편  초유에서 발견되는 성장 인자는 운동 후 근육이 가장 효과적으로 성장할 수 있도록 하며 그렇지 않을 경우 발생할 수 있는 관련 정상적인 근육 손상을 방지합니다  최대 흡수 처리  우리는 저열에서 초유를 처리하여 존재하는 다양한 단백질과 항체가 보호되고 가장 생체 이용 가능한 형태로 몸에 들어갈 수 있도록 합니다  당사의 초유는 GMO가 아니며 인공 BST 호르몬으로 처리되지 않은 건강한 젖소의 첫 착유에서 지속 가능한 방식으로 공급됩니다  1회 제공량에는 이 중요한 우유 슈퍼푸드 1 000mg이 일관되게 포함되어 있습니다  자연 유래  당사 소 소는 100  비 GMO이며 충전제나 첨가물을 포함하지 않습니다  1회 제공량당 단 1 000mg의 널리 인정받는 영양소로 전반적으로 몸을 도울 수 있습니다 ,계절성 알레르기
보충제,계절성 알레르기
건조한 비강 진정 과도한 점액 제거 알레르기 및 부비강 증상을 자연적으로 완화 1972년에 최초 생산비강 및 부비강 건강 증진 콧물 및 코막힘 개선 감기  알레르기  콧물이 뒤로 넘어가는 증상 완화에 도움 건조한 비강에 수분 공급 기타 다양한 효과,계절성 알레르기
면역   신경   에너지   소화   성장   발달 보충제 알려진 알레르기 유발 성분 무함유 글루텐 무함유 미국 1위 미량 미네랄 브랜드 확실히 느껴지는 차이 비건 인증 유전자 변형 성분 무함유 우수 제조 및 품질 관리 기준 cGMP  인증 제3 기관 검사 완료,계절성 알레르기
하루 한 알 보충제단백질  탄수화물  지방 분해 장내 유익한 박테리아,계절성 알레르기
휴스턴 박사가 개발한 Houston의 생화학적 효소 포뮬라 글루텐  카세인  단백질  탄수화물  유당  폴리페놀  지방의 소화 보조 간헐적인 가스 및 복부 팽만 완화 보충제 식물성 성분으로만 제조 효소 분야의 권위자,계절성 알레르기
복부 팽만 완화  소화 효소  민들레  생강 및 회향 보충제 NSF 인증 B  corp  인증 합성 향료 및 색소 무함유 삼키기 쉬움체액 저류를 완화하기 위해 예로부터 사용된 민들레  소화 불량 및 가스 완화  팽만감 없는 위장 지원  위장 장애 완화 ,계절성 알레르기
1회 제공량당 엘더베리 3 4g에 해당하는 양 제공 식물성 글루텐 무함유 과학적으로 검사 완료 면역력 증진 항산화제 풍부 보충제 코셔 검사 완료 매일 복용 시 최대 효과 면역계 강화 바이러스 학자가 개발 과학적으로 검사 완료 뛰어난 맛의 정제 엘더베리의 영양을 함유한 자연스러운 맛과 향,계절성 알레르기
면역 건강 캡슐당 500mg 면역글로불린 40  보충제 면역계 지원 소화기 건강 증진 면역글로불린 40  1969년부터 과학에 기반한 고품질 상품 제공,계절성 알레르기
용기 또는 NasaFlo 를 위생적으로 건조하고 보관하는 방법기본 2개입 수직 마운팅 접시 1개 작은 접시 1개  큰 둥근 접시 2개,계절성 알레르기
1932년 설립 이래 신뢰할 수 있는 품질 유지 하루 1정 소화 및 관절 건강에 도움 비건 유제품 무함유 대두 무함유 보충제,계절성 알레르기
식물성 면역력 강화제 허브 보충제 공인침술사 겸 한의사 OMD  마이클 티에라 승인,계절성 알레르기
1936년 설립 위산에서 생존율이 100배 더 높은 프로바이오틱  보충제 500억 개 이상 생존  설탕 무함유 채식주의자에게 적합 순수성 | 신선도 | 힘 Take The Inside Advantage  당사의 일일 Probiotic PLUS 효소는 시작하기 전에 가스를 멈추는 데 도움이 됩니다  건강   위생   가정,계절성 알레르기
By Dr  Mehta  Contains  30 Disposable FiltersTransparent Design Sterilizable In line design changeable filter  Lifetime warranty  Safe for babies   Toddlers Reduced Contamination Risk Pulls Apart for Easy Cleaning 2 in 1 Design  Made Without BPA  Latex  Or  Phthalates Made Of High Grade Silicone Dishwasher Safe,계절성 알레르기
25년 이상 지켜 온 프리미엄 품질 면역 포뮬라 비건 유전자 변형 성분 무함유 글루텐 무함유 보충제 Enhancing Nature s Miracles Since 1994,계절성 알레르기
1회 제공량 3g당 첨가당 0g 동결 건조 차   스무디에 적합 식물성 슈퍼 푸드 고대의 면역력 강화 100  천연 베리 분말 설탕 또는 증량제 무함유 USDA 유기농 인증 유전자 변형 성분 무함유 B  corp  인증 CCOF 유기농 인증 BPA 무함유 글루텐 무함유 비건 농부   나   지구를 위한 상품,계절성 알레르기
1993년 설립 6시간 순도  신선도  효능 보장,계절성 알레르기
엘더베리 Sambucus nigra  함유 100  천연 엘더베리열매 말토덱스트린 및 증량제 무함유 보존제 무함유 파타고니아에서 재배 USDA 유기농 인증 유전자 변형 성분 무함유 비건 상품 글루텐 무함유 무설탕 단순한 식물성 성분 영양소가 풍부한 슈퍼 푸드 요리에 생기 넘치는 색감 추가 Organic Certifiers 유기농 인증,계절성 알레르기
삼중 면역 복합체 면역계 건강 유지 항산화 보호 글루텐 및 대두 무함유 보충제 품질 검사 완료 유전자 변형 성분 무함유,계절성 알레르기
보충제 식물성 포뮬라 소화 건강 순도 및 효능 보장 채식주의자 비건에게 적합,계절성 알레르기
옥시메타졸린 HCI 비강 솔루션 비강 충혈 완화제 빠른 힘줄임계 완화 감기 알레르기 최대 12시간의 완화 효과 최고의 효과 의사 및 약사 추천 1위 비강 브랜드일반 감기  건초열  상부 호흡기 알레르기로 인한 코막힘 증상을 일시적으로 완화 코막힘 및 압박감의 일시적인 완화 부은 비강막을 수축시켜 호흡이 더 편안함,계절성 알레르기
비타민 맛있는 제품  글루텐 무함유 유전자 변형 성분 무함유 보충제 베지 포뮬라,계절성 알레르기
BioProtect 포장 시스템 천연 보충제 다양한 식품의 완벽한 소화를 위한 강력한 지원  21가지 효소 빠른 방출 식물성   글루텐 무함유   유제품 무함유글루텐  유제품 락토오스 및 카제인   페놀  식물성 섬유소가 함유된 음식을 소화하도록 광범위하고 특별하게 지원합니다  소화기관 전체를 지원하기 위해 pH를 최적화한 효소 지원 전반적인 소화 기능 지원,계절성 알레르기
1972년 설립 건강한 면역계 증진 7배 엘더베리 농축물과 경쟁사 제품 비교 개별 포장 Mega Gummie 1개당 신선한 블랙 엘더베리 40g으로 제조 유전자 변형 성분 무함유 프로젝트 인증 글루텐 무함유 알코올 무함유 보충제 인공 보존제 또는 인공 향료 무함유 Mega Gummies 7X 1상자당 신선한 엘더베리 8컵 이상 첨가 Holistically Balanced 크루얼티프리   NO 동물 실험,계절성 알레르기
식사와 함께 섭취하여 소화 및 영양 흡수율 개선 간헐적 가스  복부 팽만 및 소화 불량 완화 효소 보충제유통기한 내 품질  순도  효능 보증 울트라 스트렝스 포뮬라 천연 식물성 효소 혼합물 함유 베지 캡슐로 제공,계절성 알레르기
7가지 식물성 효소 혼합물 적절한 소화 지원   유당 불내증 완화 보충제 식물 공급원,계절성 알레르기
보충제 면역력 강화 표준화된 추출물 유럽산 원료 수작업으로 수확,계절성 알레르기
IGEN 유전자 변형 성분 무함유 검사 완료 보충제 면역력 강화 항산화제 최적의 웰니스 글루텐 무함유 식물성 효능 및 품질 미국 식품의약국 등록 시설에서 제조,계절성 알레르기
USDA 유기농 인증 유전자 변형 성분 무함유 프로젝트 인증 설탕 무함유 코셔 보충제 QCS 유기농 인증 글루텐 무함유 인증 B  corp  인증유기농 블랙 엘더베리와 아로니아 베리 유기농 아세로라 체리의 비타민C 채식주의자에게 적합,계절성 알레르기
1회 제공량당 100mg 비타민C와 아연으로 면역력 증진 천연 색소 및 향료 보충제 글루텐 무함유 효모 무함유 100  식물성  글루텐 무함유 품질 보장  품질 검사 완료,계절성 알레르기
돼지풀 Ambrosia artemisiaefolia  30C 용해 펠릿 동종 요법 약품 이동 중에도 사용하는 알레르기 완화제 혀 아래에서 녹여 복용 졸리지 않음 자연적인 방식으로 건강 증진 동종 요법 의약품의 세계적 선두주자 인공 색소  향료  감미료 및 보존제 무함유 간편한 복용목구멍 및 콧구멍 가려움 재채기 콧물 눈 자극,계절성 알레르기
Soothing Gentle Saline Nasal Rinse All Natural  Drug Free No Burning Natural Sinus   Allergy ReliefIsotonic  Hypertonic  with 2 or more sachets Relief from stuffy or runny nose  Gentle nasal saline rinse system designed just for kids  Non sedating  non burning  non stinging  As easy to do as brushing teeth or washing hands120 Premixed Sachets of USP Grade  Purity level 99  or higher  Sodium Chloride and Sodium Bicarbonate Mixture  pH Balanced  Natural Ingredients  Isotonic  Preservative   lodine Free   Educational Brochure with directions for use,계절성 알레르기
옥시메타졸린 HCI 비강 솔루션 비강 충혈 완화제 알레르기로 인한 빠르고 강력한 코막힘 완화 최대 12시간의 완화 효과 하루 종일 또는 밤새 지속되는 완화 효과 비강의 부기 완화 의사 및 약사 추천 1위 비강 스프레이 브랜드일반 감기  건초열  상부 호흡기 알레르기로 인한 코막힘 증상을 일시적으로 완화 코막힘 및 압박감의 일시적인 완화 부은 비강막을 수축시켜 호흡이 더 편안함,계절성 알레르기
면역 건강 보충제 엘더베리  비타민C 및 아연의 트리플 액션 면역력 혼합물 맛있는 구미젤리 형태 1969년부터 과학에 기반한 고품질 상품 제공,계절성 알레르기
옥시메타졸린 HCI 비강 솔루션 비강 충혈 완화제 코막힘 및 부비강 답답함 압박 완화 멘톨 함유 몇 초 만에 차단 해제  12시간 지속 의사 및 약사 추천 1위  추천 비강 스프레이 브랜드일반 감기 건초열 상부 호흡기 알레르기 코막힘 및 압박감의 일시적인 완화 부은 비강막을 수축시켜 호흡이 더 편안함,계절성 알레르기
USDA 유기농 인증 면역력 강화 면역 건강을 위해 전통적으로 섭취해 온 상품 온 가족이 매일 즐길 수 있는 맛있는 강장제 베스트셀링 포뮬라 허브 보충제 비건 글루텐 무함유 B  corp  인증 무결점   순도   효능 1987년부터 시작된 Connecting Plants   People  Oregon Tilth 유기농 인증,계절성 알레르기
1972년 설립 전반적인 건강 및 웰빙 증진 풀 스펙트럼 허브 Holistically Balanced  순도 검사 완료 품질 검사 및 인증 완료 Discover Nature s Answer and Trust the Difference   비건에게 적합 글루텐 무함유 보충제,계절성 알레르기
임상 검증된 남아프리카 제라늄 함유 엘더베리   남아프리카 제라늄 신속한 통증 완화   안전하고 효과가 좋은 상품 면역력 강화 보충제 글루텐 무함유 식물성당사만의 노하우로 개발된 블랙 엘더베리 추출물로 만들었습니다  비타민C와 아연이 함유되어 면역 기능 강화에도 좋습니다  임상 검증된 남아프리카 제라늄 뿌리추출물 함유   남아프리카 제라늄 뿌리추출물은 쉰 목  건조한 목  자극으로 인한 기침과 관련한 경미한 코  목  흉부 자극 및 간헐적인 기침의 지속 기간과 고통을 완화합니다  어린이에게 건강한 면역력과 활기찬 일상을 선물하십시오  어린이를 위해 특별히 고안된 베리 맛 포뮬라,계절성 알레르기
Medical Grade Drug Free Naturally Safe and Effective  Backed by Peer Reviewed  Published  Medical Research  Research Based Gently Clean Sinuses   Nasal Passages  No Artificial Preservatives No Artificial Dyes Non GMO  Contains no Genetically Modified Organisms Nose Sneeze Trees Flowers Cats House ,계절성 알레르기
Amazing Formulas  보충제 단백질 분해 효소   단백질 소화 촉진 항염증 성분으로 관절 건강 증진 영양소 흡수 촉진 우수 제조 및 품질 관리 기준 GMP 을 준수하는 고품질 상품,계절성 알레르기
California Gold Nutrition EpiCor   건조 발효 효모 맥주효모균  면역계 건강 증진  채식주의자와 비건에게 적합 글루텐  유전자 변형 성분  대두 무함유 cGMP 인증 시설에서 생산 100  골드 개런티 Gold Guarantee ,계절성 알레르기
면역력 강화 건강 보조 식품,계절성 알레르기
면역글로불린이 풍부한 귀한 첫 우유 생체 이용 가능 보충제 소 초유 목초 사육 목초 사육 동결 건조 호르몬 성분 무함유 살충제 무함유 글루텐 무함유 유전자 변형 성분 무함유 cGMP 인증 시설에서 제조 BPA 무함유,계절성 알레르기
인증된 마누카 꿀 함유 EpiCor   비타민C 및 아연 함유 이중 작용 보충제 2시간 동안 빠르게 작용하는 면역력 강화 목구멍에 코팅되는 꿀 함유 여행용 및 휴대용으로 적합 2022년 1월 Neilsen 및 Spinscan 데이터 기준 판매 1위비타민C EpiCor  순수 마누카 꿀 아연,계절성 알레르기
Dinosaurs  1932년 설립 이후 혁신적인 품질 유지 면역계 강화 보충제 비건 상품 유당 무함유 대두 무함유 땅콩 무함유 인공 향료 색소 무함유 QAI 유기농 인증삼부커스 150mg 아연 5mg 비타민C 45mg,계절성 알레르기
보충제 심혈관계 건강 증진 면역 기능 및 건강한 노화에 도움 염증 반응 개선에 도움 우수 제조 및 품질 관리 기준 GMP ,계절성 알레르기
천연 성분 비타민C  비타민D  아연  천연 엘더베리 함유 천연 베리 향 보충제 중독성 약물 또는 알코올 무함유 인공 감미료 무함유 인공 향료 무함유 인공 보존제 무함유 글루텐 무함유 젤라틴 무함유 알레르기 유발 성분 무함유Zarbee s Naturals는 온 가족의 건강을 책임진다는 각오로 가급적 천연 재료를 고집합니다  이뮨 서포트 구미젤리는 천연 엘더베리추출물  비타민C  아연을 함유하고 있어 면역계 증진을 돕습니다  가장 필요할 때 누리는 엘더베리 효과 천연 원료로 착색,계절성 알레르기
예민한 위장을 위한 소화 기능 증진 효과 1969년 설립 보충제 비건 상품,계절성 알레르기
면역 건강 강화를 위해 매일 유지 관리합니다  임상 테스트에서 면역 기능을 증진한다고 밝혀진 EpiCor로 제조 면역 강화 비타민 C 및 D3  셀레늄  아연 함유 건강 보조 식품EpiCor 슈퍼 푸드 효모 복합체 1 일 500mg,계절성 알레르기
면역체계 반응을 지원합니다 영양 보충제,계절성 알레르기
새로운 포장  동일한 포뮬라 면역력 강화 전통적으로 전반적인 건강 관리 지원 황기 뿌리 및 오미자 베리 함유 허브 보충제 무결점   순도   효능 1987년 설립 비건 글루텐 무함유 대두 무함유 B  corp  인증,계절성 알레르기
소화기 건강 및 편안함 개선 10가지 이상의 종합 효소 소화 혼합물 보충제 장 건강 보호 최적의 소화 효과를 위한 10가지 이상의 효소 자세한 소개 GMP 인증 품질 품질 검사 및 인증 완료 유전자 변형 성분 무함유 비건 상품 정성을 담은 상품 글루텐  대두  계란  유제품  견과류  동물성 성분 무함유,계절성 알레르기
Extract Equal to 5 000 mg of Elderberries Sugar Free Liquid Sambucus Immune Support 30 Servings Liquid Dietary Supplement Easy   Convenient Non GMO Vegan Tested Lab Verified GMP Certified Facility Zero Gluten  Soy  Eggs  Dairy  Nuts  Gelatin or Animal Products,계절성 알레르기
면역 건강 3 In 1 체력 강화 포뮬라 허브 보충제 전반적인 체력을 강화하고 건강을 증진하는 전통 허브 면역 건강  에너지 및 항산화 효과를 증진하고 간 및 뇌 기능 강화 1969년부터 과학에 기반한 고품질 상품 제공,계절성 알레르기
유전자 변형 성분 무함유 자연적인 소화기 건강   웰니스 보충제 효소로 보강된 100  천연 식품 영양소 효능이 보장되는 프로바이오틱 및 유기농 인증 슈퍼 푸드 함유 유기농 인증 글루텐 무함유 보존제 무함유 증량제 무함유 유제품 무함유 대두 무함유,계절성 알레르기
옥시메타졸린HCI 0 05  비강 충혈 완화제 12시간 지속되는 효과 감기   알레르기 빠르고 강력한 코막힘 완화다음과 같은 코막힘을 일시적으로 완화  일반 감기 알레르기성 비염 증상 완화 상기도 알레르기 코막힘과 부비강 압박감 일시적 완화 비강 세척에 도움 부은 막 수축,계절성 알레르기
자연스러운 소화기 건강 및 웰니스 유전자 변형 성분 무함유 보충제 효소로 전달하는 100  천연 식품 영양소 효능이 보장되는 프로바이오틱 및 유기농 인증 슈퍼푸드 함유 유기농 인증 글루텐 무함유 보존제 무함유 충전제 무함유 유제품 무함유 대두 무함유,계절성 알레르기
저열량 식품이 아닙니다  유기농 엘더베리 맛있습니다  글루텐 없음 코셔 인증 건강 보조 식품 인공 방부제 무함유 좋은 맛 복용컵 포함글루텐 없음 코셔 인증 비건,계절성 알레르기
보충제 비타민D 25mcg 1 000IU  코셔 유전자 변형 성분 무함유 천연 색소 및 향료 젤라틴 무함유 및 식물성 땅콩 및 견과류 무함유,계절성 알레르기
신뢰할 수 있는 품질 1932년 설립 하루 1회 서방형 전반적인 웰빙 지원 대두 무함유 보충제,계절성 알레르기
순수 비건 상품 글루텐 무함유 유전자 변형 성분 무함유 크루얼티프리 소화 기능 촉진 보충제위 건강 및 장내 세균 증진 장 건강 및 영양소 흡수 촉진 장 누수증후군에 도움 면역계 강화,계절성 알레르기
1971년 설립 비건 컴플리트 멀티 효소 복합체 소화기 건강 지원 식물성 효소 포뮬라 보충제진정성 청결도 신선도 일관성 정확성,계절성 알레르기
엘더베리 450mg  기타 천연 향료 함유 면역계 건강 증진을 위한 보충제 엘더베리  비타민C D  아연 혼합물 보충제 합성 향료 및 색소 무함유 글루텐 무함유 NSF 인증 B  corp  인증,계절성 알레르기
