effect,category
BioProtect 포장 시스템 다양한 식품의 완벽한 소화를 위한 강력한 지원 21가지 효소 빠른 방출 채식주의자에게 적합   글루텐   유제품 무함유 천연 보충제글루텐  유제품 락토오스 및 카제인   페놀  식물성 섬유소가 함유된 음식을 소화하도록 광범위하고 특별하게 지원합니다  전체 소화기관을 위한 pH 최적화 효소 지원  전반적인 소화 기능을 지원합니다 ,계절성 알레르기
유전자 변형 성분 무함유 효소 전문가 치료용 효소 판매 1위 브랜드 환절기나 간헐적 코막힘이 있는 경우 편안한 호흡 촉진 100  천연 성분 졸음을 유발하지 않는 포뮬라 보충제 비건 및 코셔 파르브 충전제 무함유,계절성 알레르기
향신료 포뮬라 P73  야생 오레가노  월계수 잎  세이지 및 정향 오일을 샘물에 녹인 바다 소금 베이스에 유화한 제품 무중독성 제품,계절성 알레르기
프리미엄 약물 성분 무함유 Allercleanse 부비강 점액질 제거 비강 내 점액질 제거 스프레이 140회분 인공 보존제 무함유 인공 색소 무함유 유전자 변형 성분 무함유 알코올 무함유 패키지 구성  1병 수분을 공급하여 건조한 공기로 인한 증상 완화 부비강 점액질 제거 ,계절성 알레르기
대두 성분 무함유 결합제 및 충전제 없음 글루텐 무함유 유전자 변형 성분 없음  유제품 무함유 식물성 제품 향산된 흡수력 AstraZyme 으로 소화 및 흡수 촉진 식물성 건강 보조 식품,계절성 알레르기
베지 캡슐 면역계 반응 지원 보충제,계절성 알레르기
자연스러운 소화 건강 및 웰니스 완벽한 면역계 지원 면역력  호흡기  부비강 건강 지원 많거나 진한 콧물을 녹이는 효과 기도를 깨끗하게 개선하는 효과 NSF 유전자 변형 성분 무함유 인증 보충제 비건 및 코셔 증량제 무함유 코셔 파르브,계절성 알레르기
신생아에게 안전한 상품 Everything They Need  Nothing They Don t   소아과 전문의 추천 1위 상품 호흡을 편안하게 가래를 부드럽게 씻어냄 중독성 약물 무함유 인공 향료 무함유 인공 염료 무함유 파라벤 무함유,계절성 알레르기
100  품질 만족 보장 비타민 1회 제공량당 2 000mg   강력한 농축 추출물 글루텐 무함유 유전자 변형 성분 무함유 허브 보충제 전통 허브 순도 및 효능 품질 검사 완료 유전자 변형 성분 무사용 서약,계절성 알레르기
매일 면역 강화 건강 보조 식품 글루텐 무함유 맛이 좋습니다   인공 색소 및 인공 향료 무첨가,계절성 알레르기
엘더베리 허브 보조제 방사선 없음 코셔,계절성 알레르기
알로에베라 Ketan C  Mehta  M D  제조 창립자 겸 개발자 새지 않는 스프레이 소듐하이알루로네이트 비강 건조증용실내 열 건조한 날씨 비행 높은 고도 산소 사용 CPAP ,계절성 알레르기
유전자 변형 성분 무함유 효소 전문가 소화제 판매 1위의 효소 브랜드 보충제 비건   코셔 증량제 무함유영양소 흡수 개선 간헐적 소화 불량 완화,계절성 알레르기
다른 브랜드보다 더 효과적 약 성분 없음 자일리톨 함유로 3배 더 강력 코막힘 원인을 완화 빠른 증상 완화 알레르기  감기  독감 증상에 사용 BPA 무함유 의사가 추천하는 제품 특허 받은 세척제Xlear 부비강 세척제 6팩 자일리톨 함유  고무를 입힌 부드러운 분사구를 갖춘 인체 공학적인 부비강 세척제 병 약 300 ml 용량 감기  독감 알레르기 코 건조 부비강 감염 부비강 압박 코 자극,계절성 알레르기
유전자 변형 성분 무함유 효소 전문가 완전한 포뮬라 소화제 효소 판매 1위 브랜드 완전한 유제품 소화 포뮬라 유당 불내증 지원 강화 유당 및 유제품 단백질 분해 보충제 비건 코셔 파르브 증량제 무함유,계절성 알레르기
최고의 비강 스프레이  신제품 100  천연 제품 카옌  화란 국화  페퍼민트  그리고 카페인으로 만든 제품 빠르고 강력합니다 두통 완화 긴장성 두통 클러스터 편두통 자연 요법 제품 100  천연 화학 물질 없음 졸음을 유발하지 않음 약물 간의 상호작용은 알려지지 않음 비 습관성 제품일반적인 두통과 편두통 증상 ,계절성 알레르기
가장 향상된 포뮬러 유전자 변형 성분 무함유 효소 전문가 소화제 판매 1위 효소 브랜드 건강 보조 식품 비건   Kosher Parve 코셔 파르브 인증  충전제 무첨가글루텐과 카제인이 포함된 식품의 소화 최적화 글루텐 카제인 배제 식단에 도움이 되는 효소 제공,계절성 알레르기
소화 건강 보충제 일상적인 음식으로 인한 가벼운 가스 및 복부 팽만 완화 편안한 소화 촉진 1969년부터 과학에 기반한 고품질 상품 제공,계절성 알레르기
자연적인 건강 보호 및 증진 PWE 프로폴리스 함유 100  천연 비강 케어 휴대용  가정용  학교용  직장용으로 적합 비강 오염물질과 자극물질 세척 및 제거 사용이 간편함 고효능 빠른 완화 비의료용 만 2세 이상 어린이에게 안전함 덴마크의 기술력 cGMP Certified 시설 프리미엄 브라질 프로폴리스,계절성 알레르기
자연스러운 소화기 건강 및 웰니스 유전자 변형 성분 무함유 NSF  인증 보충제 채식주의자 충전제 무함유향상된 소화 지원 하루 섭취량당 12억 마리 활성 배양균 ,계절성 알레르기
1969년 설립 보충제 글루텐 무함유 코셔 인증 비건,계절성 알레르기
보충제 의약품 등급 유전자 변형 성분 무함유 미국채식협회 AVA  채식주의 인증 GRAS   일반적으로 안전한 것으로 간주됨일일 프로바이오틱 보충 건강한 균 수치 유지 장 소화 기관 정화 최적의 영양소 흡수 건강한 면역 기능 안정적인 장 기능,계절성 알레르기
USDA 유기농 인증 글루텐 무함유 Great Taste 코셔 보충제 QAI 유기농 인증,계절성 알레르기
1972년 설립 면역력 강화 1회 제공량당 2 000mg 유전자 변형 성분 무함유 프로젝트 인증 Discover Nature s Answer  글루텐 무함유 허브 보충제 코셔 파르브 Bio Chelated  저온 추출 공법,계절성 알레르기
활성산소 제거제 10 1 농축물 1티스푼당 500mg 유전자 변형 성분 무함유 보충제 채식주의자 비건에게 적합 코셔 식물성 허브 1968년에 설립된 가족 소유 기업 GMP 품질 보증,계절성 알레르기
동종 요법에 사용되는 엘더베리 함유 고통을 동반한 기침 쉰 목 코막힘 동종 요법 의약품 성인 및 어린이 졸음을 유발하지 않음 자연적인 방식으로 건강 증진 동종 요법 의약품의 세계적인 리더 펠릿 총 240정 인공 색소  향료  감미료 및 보존제 무함유다음과 같은 감기 증상을 일시적으로 완화합니다  고통을 동반한 기침 코막힘 쉰 목 실성증,계절성 알레르기
전통적인 면역 포뮬라 허브 보충제,계절성 알레르기
100  천연 성분,계절성 알레르기
프리미엄 포뮬라 GMP   우수 제조 및 품질 관리 기준 상품 제3기관 품질 검사 완료 보충제,계절성 알레르기
새로운 포뮬라 빠른 두통 완화 114회 분사 의사 추천 제품 습관성 복용을 야기하지 않음 무중독성 제품 Sinol M 은 동종 요법 제품입니다부비강 편두통 긴장감 군발성 두통 월경두통 및 편두통 부비강 군발성 긴장감 월경전 및 월경 두통,계절성 알레르기
1967년 설립 건강한 소화 기능 증진에 도움이 될 수 있음 보충제 글루텐 무함유 대두 무함유 Mason 보증   품질 검사 완료 우수 제조 및 품질 관리 기준 GMP  인증,계절성 알레르기
자연적 소화 건강 및 웰빙 3배 더 많은 효소  일반 시장 브랜드 대비  냉압착 공정으로 제작 배변 활동 규칙성 개선 및 소화 기능 지원 간헐적 변비 해소에 도움 가스 및 복부 팽만감 완화에 도움 병마다 키위 15개 이상에 해당하는 양 함유 임상 연구를 거친 Actazin 키위 열매로 만듦 유전자 변형 성분 무함유 식물성 보충제 ACTAZIN ,계절성 알레르기
면역력 강화 USDA 유기농 인증 면역 건강을 위해 전통적으로 섭취해 온 제품 온 가족이 매일 즐길 수 있는 맛있는 강장제 베스트셀링 포뮬라 허브 보충제 Oregon Tilth 유기농 인증 무결점   순도   효능 1987년 설립 비건 글루텐 무함유 유기농 인증 B  corp  인증,계절성 알레르기
유전자 변형 성분 없음 효소 전문가 소화제 효소 판매 1위 브랜드 최첨단 효소 포뮬러 최적화된 소화 기능 지원 미국 판매 1위 소화 효소  K 파르브,계절성 알레르기
엘더베리 1 7 g에 해당하는 양 함유 과학적으로 검사 완료 면역력 증진 항산화제 풍부 건강 보조 식품 식물성 글루텐 없음 코셔 검사면역 체계 보조 바이러스학자 개발 과학적으로 검사 완료 맛있는 정 우수한 엘더베리 천연향 첨가,계절성 알레르기
1972년 설립 Advanced Botanical Fingerprint Technology 면역 강화 엘더 Sambucus Nigra  알코올 무함유 벤조산염 무함유 인공 보존제 무함유 블랙 엘더베리 12 000mg으로 제조 유전자 변형 성분 무함유 프로젝트 인증 비건 글루텐 무함유 보충제 Holistically Balanced 크루얼티 프리   NO 동물 실험 코셔 파르브 Discover Nature s Answer and Trust the Difference,계절성 알레르기
Good for you Lozenges  천연 향료 현미 시럽으로만 단맛 첨가 아연 5mg 엘더베리 추출물 글루텐 및 유전자 변형 성분 무함유 보충제,계절성 알레르기
생강 300mg   비타민D3 5 000IU 엘더베리 1 000mg 비타민C 400mg 아연 10mg 강력한 항산화 포뮬라  특허 출원 중인 포뮬라 1회 제공량당 캡슐 2정 보충제 유전자 변형 성분 무함유 글루텐 무함유 유제품 무함유 A Wealth of Wellness  We Make Wellness Possible  스페셜 포뮬라 제3기관이 인증한 순도 및 효능,계절성 알레르기
1969년 설립 글루텐 및 카제인 소화 효소 밀 및 유제품 소화를 도움  보충제 표적화된 소화 효소 비건,계절성 알레르기
면역 강화 뛰어난 맛  무설탕  저칼로리 계절별로 건강 챙기기 아연 및 황기 함유 유전자 변형 성분 무함유 보충제 채식주의자 비건에 적합 식물성 허브 1968년 설립된 가족 기업 우수 제조 및 품질 관리 기준 GMP  품질 보증,계절성 알레르기
글루텐 무함유 매일 1정 유전자 변형 성분 무함유 LE 인증 1년 내내 듀얼 액션 보호 작용 보충제신체의 건강한 면역 반응을 증진합니다  신체의 면역 방어에서 핵심적인 역할을 하는 면역글로불린A IgA 의 생성을 촉진합니다  건강한 코 호흡을 지원하고 꽃가루 등 환경 요인에 대한 반응을 지원합니다 ,계절성 알레르기
비타민 삼부커스 Tru ID 진품 인증 DNA 검사 완료 식물 성분 보충제 글루텐 무함유 유전자 변형 성분 무함유 식물성 포뮬라 면역계 강화,계절성 알레르기
프로테아제  아밀라아제 및 리파아제가 함유된 소화 보조제  34 보충제 소화 기능 강화 영양소 흡수율 최적의 웰니스 250회 제공량 글루텐 무함유 인공 보존제 무함유 효능 및 품질 보증,계절성 알레르기
1973년 설립 소화 기능 증진 보충제 품질 검사 완료,계절성 알레르기
혁신적인 영양 영양이 보강된 초유 보충제,계절성 알레르기
15종 효소 프로바이오틱 및 생강 소화 개선 비건 글루텐 무함유 보충제 유전자 변형 성분 무함유 프로젝트 인증 제3기관 검사 완료 cGMP 준수,계절성 알레르기
유전자조작하지 않음 가장 고급한 효소 전문가 소화  1 판매 효소 브랜드 프로바이오틱스와 함께 가장 고급한 효소 최적의 소화 지원 일일 복용량 당 15 억개의 활성 배양균   건강보조식품 채식주의자 필러 추가되지 않음,계절성 알레르기
25년 이상 지켜 온 프리미엄 품질 액티브 홀 스펙트럼 12 1 추출물 보충제 Enhancing Nature s Miracles Since 1994 비건 유전자 변형 무함유 성분으로 제조 글루텐 무함유,계절성 알레르기
효소 및 베타인 HCI로 제조 영양소 생체이용률 최적화 보충제,계절성 알레르기
깨끗하게 제조된 실제 치료법 동종요법 졸음을 유발하지 않음 재채기 및 콧물 눈이 가렵고 눈물 남 코막힘 콧구멍 및 목구멍 가려움 알레르기 유발 성분  염료 또는 파라벤 무함유 유전자 변형 성분 무함유 프로젝트 인증 B  corp  인증 글루텐 무함유 인증 비건 인증 USDA 유기농 인증 SCS Global Services 유기농 인증유기농 동종 요법 혼합물 유기농 아사이베리 항료 유기농 카나우바왁스 유기농 말토덱스트린 유기농 쌀겨 추출물 유기농 타피오카 덱스트로오스눈 자극 콧물 부비강 압박 코막힘 재채기 콧구멍 및 목구멍 가려움,계절성 알레르기
Real Remedies Made Clean 동종 요법 재채기 및 콧물 눈이 가렵고 눈물 남 코막힘 콧구멍 및 목구멍 가려움 유기농 알레르기 및 코막힘 완화제 졸음을 유발하지 않음 알레르기 유발 성분  염료 또는 파라벤 무함유 유전자 변형 성분 무함유 프로젝트 인증 B  corp  인증 글루텐 무함유 인증 비건 인증 USDA 유기농 인증 SCS Global Services 유기농 인증눈 자극 콧물 부비강 압박감 재채기 코막힘 콧구멍 및 목구멍 가려움유기농 동종 요법 혼합물 유기농 아사이베리 향료 유기농 카나우바왁스 유기농 말토덱스트린 유기농 쌀겨 추출물 유기농 타피오카 덱스트로오스 그 외 다른 성분은 없습니다 ,계절성 알레르기
패밀리 사이즈 1972년 설립 면역계 건강 증진 삼부커스 알코올 무함유 벤조산염 무함유 인공 보존제 무함유 블랙 엘더베리 12 000mg으로 제조 Discover s Nature s Answer and Trust the Difference  유전자 변형 성분 무함유 프로젝트 인증 비건 글루텐 무함유 보충제 Holistically Balanced 크루얼티 프리 NO 동물실험 코셔 파르브상품 그대로 복용 뜨거운 물에 타서 복용 우려서 복용,계절성 알레르기
소화 건강 캡슐당 500mg 보충제 식물성 파인애플에서 추출한 소화 효소 음식을 더욱 효율적인 분해 지원 소화 및 흡수 촉진 1969년부터 과학에 기반한 고품질 상품 제공,계절성 알레르기
글루텐 무함유 소화 효소 보충제 글루텐 및 유제품 섭취 보조 탄수화물 소화 효소 7종 BioCore DPP IV  함유,계절성 알레르기
프리미엄 포뮬라 GMP   우수 제조 및 품질 관리 기준 상품 제3기관 품질 검사 완료 보충제,계절성 알레르기
부비강 전체 지원 건강한 부비강 통로 유지 균형 잡힌 수분 유지 면역 기능 강화 허브 및 영양 보조제 다용도   혁신적   효과적 자연스럽게 결과를 보장합니다 ,계절성 알레르기
1969년 설립 프리미엄 추출물 눈 건강 증진 TRU ID  진품 인증 유전자 변형 성분 무함유 프로젝트 인증 25  안토시아닌 보충제 비건,계절성 알레르기
뛰어난 비강 세척기  알레르기  감기  독감  축농증   비염과 관련된 증상을 관리하고 완화하십시오  The Most Comfortable Nose Wash in The World   장애를 가진 성인이 조립 BPA 무함유 플라스틱 만족 보장 빠른 배송 코막힘   부비동 압박감   비강 건조증   후비루 증후군   콧물   재채기   기침 소아과 전문의가 어머니의 지혜를 사용해 개발 의학박사 Dr  Hana r  Solmon BeWellHealth 의사 어머니의 추천 제품 멸균 효과 없음 ISO 13485 인증 보존제  악물    요오드 무함유 완충형 소금 비강 세척 혼합물 진정 작용  작열감 없음  pH 균형 ,계절성 알레르기
유전자 변형 성분 무함유 효소 전문가 가장 향상된 포뮬라 소화 촉진 효소 판매 1위 브랜드 유당 및 카제인 불내증 지원 최적화 모든 음식물 분해 보충제 비건   코셔 코셔 파르브 증량제 무함유,계절성 알레르기
T Relief 제조사 제품 종합적인 증상 완화 24 7  오래 가는 지속력 모든 부위에 적합 보장합니다  동종 요법,계절성 알레르기
1973년 설립  소화 기능 증진 보충제 품질 검사 완료 더 밝은 방법,계절성 알레르기
소아과 의사 개발 감기 및 알레르기 완화,계절성 알레르기
유전자 변형 성분 무함유 효소 전문가 완전한 포뮬라 소화제 판매 1위의 효소 브랜드 완벽한 글루텐 및 카제인 포뮬라 글루텐과 카제인이 포함된 식품의 소화를 돕습니다  글루텐 무함유 카제인 무함유 식단을 위한 효소 지원 보충제 비건   코셔 코셔 파르브,계절성 알레르기
순수 시너지 효과 유전자 변형 성분 없음 건강 보조 식품 코셔 인증,계절성 알레르기
엘더베리 및 엘더꽃 블렌드 허브 보충제 신체 방어를 강화하는 허브 면역계 강장제 항산화 작용 강화 면역계 건강 유지 1969년부터 과학에 기반한 고품질 상품 제공,계절성 알레르기
40년 이상 업력의 안전한 완화제 동종 요법콧물 완화 건초열로 인한 눈물 가벼운 피부 발진   두드러기,계절성 알레르기
USDA 유기농 인증 유전자 변형 성분 무함유 비건 상품 엘더베리 150mg 유전자 변형 성분 무함유 비건 천연 향료 보충제 Americert International 유기농 인증 면역력 강화 엘더베리 Sambucus nigra L   전반적인 건강 증진 케토제닉  셀리악  비만 치료 친화적,계절성 알레르기
면역 건강 증진 보충제 미국에서 제조 우수 제조 및 품질 관리 기준 GMP  인증 면역 기능 건강 증진 탁월한 맛  천연 향미료,계절성 알레르기
보충제최적의 심장 건강과 몸 전체의 혈류  신체 활동 중 및 휴식 시 느끼는 최대의 편안함  충분한 휴식을 취하더라도 매일 활기차고  재충전 된 느낌  미네랄 결핍 없는 건강한 영양 조성 ,계절성 알레르기
Breath Better Now   Clean Nose  Healthy Life   Nature s Decongestant   100  천연 성분  중독성 약물 무함유  건강한 비강 위생 관리의 새로운 기준을 만들어 드립니다 ,계절성 알레르기
25년 이상 지켜 온 프리미엄 품질 관절   소화 보조 포뮬라 강황   생강   홀리 바질 함유 비건 유전자 변형 없는 성분으로 제조 글루텐 무함유 보충제 Enhancing Nature s Miracles Since 1994 우수 제조 및 품질 관리 기준 GMP  품질 보증 및 FDA 등록,계절성 알레르기
뛰어난 맛 글루텐 무함유 Tru ID 진품 인증 보충제 복용컵 포함 비건 제품,계절성 알레르기
전체적인 소화 건강 L 글루타민   효소   프로바이오틱스   천연 푸드   에센셜 공통인자 비건 제품 건강 보조 식품 글루텐 불포함자극 완화 쉽고 편안한 소화 증진 건강한 체중 과 다이어트 지원 기분 전환과 스트레스 감소 점막 조직 안정 음식으로부터 더욱 건강한 영양소 흡수 스테미나 강화와 면역 방어 전신의 활력 해제,계절성 알레르기
전통적인 면역 포뮬러 허브 보조제,계절성 알레르기
1 000mg 최대 강도  보충제,계절성 알레르기
구성품  튜브 1개 비강 건조증용 알로에베라코피 불편함 두통 재감염,계절성 알레르기
USDA 유기농 인증 1976년 설립된 협동 기업 6가지 보조 허브와 혼합된 엘더베리 75  함유 코셔 로즈힙 쇠뜨기 허브 및 녹색 귀리짚 봉오리와 혼합된 엘더베리 신체 반응을 강화하는 허브 QAI 유기농 인증,계절성 알레르기
채식주의자에게 적합 Bio Align  효소 보충제 베지 캡슐 소화 보조제 채식주의자에게 적합,계절성 알레르기
황기 Astragalus membranaceus  원산지  중국 미국 캘리포니아에서 가공  포장  품질 검사 완료 KCS 코셔 인증 QAI 유기농 인증 USDA 유기농 인증,계절성 알레르기
보충제 코셔 GMP   우수 제조 및 품질 관리 기준 글루텐 무함유 유전자 변형 성분 무함유 비건 100  식물성 유제품 무함유 설탕 무함유,계절성 알레르기
여러분은 최고의 제품을 사용할 자격이 있습니다  품질 보증 에너지 보조 식품 소화 효소 보조 식품 The Ultimate Digestive Aid 저자극성 글루텐 미함유,계절성 알레르기
여러분은 최고의 제품을 사용할 자격이 있습니다  품질 보증 에너지 보조 식품 소화 효소 보조 식품 The Ultimate Digestive Aid 저자극성 글루텐 미함유,계절성 알레르기
보충제 코셔 GMP   우수 제조 및 품질 관리 기준 글루텐 무함유 유전자 변형 성분 무함유 비건 100  식물성 유제품 무함유 설탕 무함유,계절성 알레르기
1972년 설립 Advanced Botanical Fingerprint Technology  면역계 건강 지원 삼부커스 sambucus nigra  블랙 엘더베리 12 000mg으로 제조 Discover Nature s Answer   and Trust the Difference     The True Nature of Our Standards Goes Way Beyond the Herb     보충제 비건 제품 글루텐 무함유 유전자 변형 성분 무함유 프로젝트 인증 코셔 파르브 인증,계절성 알레르기
웰니스를 증진하는 허브 1976년 설립된 협동 기업 코셔,계절성 알레르기
인증된 마누카 꿀 함유 EpiCor   비타민C 및 아연 함유 이중 작용 목을 감싸는 꿀 보충제 2시간 동안 빠르게 작용하는 면역력 강화 여행용 및 휴대용으로 적합 2022년 1월 Neilson 및 Spinscan 데이터 기준 판매 1위비타민C EpiCor  순수 마누카 꿀 아연,계절성 알레르기
비타민 더 맛있는 구미젤리  글루텐 무함유 유전자 변형 성분 무함유 보충제 비건 포뮬라,계절성 알레르기
부비강 건강 자연 증진 임상 연구 완료한 자연 재배 머위 추출물 PA 무함유  천연 식품 보충제 식물성   글루텐 무함유   유제품 자연 재배 머위 추출물 100mg 유효성분 페타신 15  는 면역체계 기능 건강을 증진합니다  전통적인 자연 재배 허브 8종 사카로미세스 보울라디 50억 CFU  는 위장 관련 면역계 기능을 증진합니다  브로멜라인 및 프로테아제 함유 부비강 효소 혼합물 베타 1 3 및 1 6 D 글루칸 비타민C 250mg 비타민D3 25mcg 1 000IU ,계절성 알레르기
Nutrition For Kids   블랙 엘더베리 100  만 1세 이상 어린이용 엑스트라 스트렝스 무가당 어린이가 인정하는 맛 보충제 유전자 변형 성분 무함유 프로젝트 인증 USDA 유기농 인증 NSF 인증 Gluten Free  소아과 전문의 인증 인공 색소  향료  보존제 무함유 비건 및 알레르기 유발 성분 무함유 1회 제공량 1티스푼 당 엘더베리 1 200mg 유러피안 엘더베리로 제조 코셔 파르브 Oregon Tilth 유기농 인증,계절성 알레르기
보충제 고급 미생물 전달 유전자 변형 성분 무함유 검사 완료 AVA 비건 인증 코셔 유제품 고효능 일일 생균제 건강한 장내 세균 수치 유지 장을 포함한 소화기 청소 건강한 면역 기능,계절성 알레르기
판매 1위 브랜드 NeilMed  프리믹스 리필 팩이 포함된 재사용 가능한 용기프리믹스 식염수가 포함된 Sinuflo  Readyrinse  용기 240ml 8fl oz  1개  Sinus Rinse  코 세척 블랙 캡 및 튜브 1개  Sinus Rinse  리필 팩 2개코 알레르기 및 건조함 부비강 압박 및 코막힘 독감 및 감기로 인한 비강 증상 업무 환경 및 집 먼지  매연  동물 털  풀  꽃가루  연기 등에 의한 비강 자극 후비루 증후군 및 코막힘프리믹스 식염수로 즉시 사용 가능 재사용 가능한 짜서 쓰는 용기로  NeilMed  Sinus Rinse  프리믹스 리필 팩 사용 진정 작용을 하며 화끈거리거나 따끔한 느낌이 들지 않음 콧구멍 크기에 상관없이 사용할 수 있는 맞춤형 단일 캡으로 밀거나 당기는 캡 부품이 없어 세척이 간편 비강 내에 약물을 분사하기 전에 말끔하게 세정 짜기 쉬운 용기를 사용하여 부드럽게 투입 가능 고개를 똑바로 든 상태에서 내용물의 95  가까이 사용 휴대 가능여행 야외 활동 연기  먼지  모래 및 기타 코에 자극을 주는 요인에 노출 캠핑 자전거 타기 소방관 사막 또는 모래에 노출 탄광 건설,계절성 알레르기
Elderberry Gummies With Vitamin C   Zinc 1 750 mg Elderberry Equivalent Per Serving Naturally Flavored With Other Natural Flavors Dietary Supplement Gluten Free No Preservatives No Corn Syrup No Artificial Flavors or Sweeteners Nutricost  Quality Guaranteed Third Party Tested GMP Compliant Facility Non GMO Product,계절성 알레르기
