description,category
 1967년 설립 모발  피부  손발톱 건강 지원 보충제 글루텐 무함유 대두 무함유 Mason 보증   품질 검사 완료 우수 제조 및 품질 관리 기준 GMP  인증,모발-피부-손톱
 힘줄 및 관절 강화 포뮬라 보충제 최상의 효과를 위한 종합 콜라겐 1형 및 3형 콜라겐 방목형 목초 사육 우피 가수분해콜라겐 펩타이드 생기 넘치는 피부와 건강한 모발 강화 아미노산 및 단백질 함유 무맛에 가까움 원하는 음료에 섞어 먹을 수 있음 설탕 및 탄수화물 무함유,모발-피부-손톱
 총제공량 27g 비건 | 유제품 무함유 | 글루텐 무함유 | 당류 무함유 천연 향 비건 인증 유전자 변형 성분 없음 보충제 새로운 콜라겐 생성   Saberry 암라추출물  아미노산 프롤린  글라이신  식물 단백질의 고유 혼합물 피부와 관절 수분 보충    세라마이드 로 불리는 식물 기반 오일이 수분막을 복구하여 피부와 관절에 수분을 보충해 줍니다  기존 콜라겐 보호   OxyPhyte 화이트티추출물과 히알루론산이 콜라겐 붕괴를 예방합니다  순수한 향미료   맛이 중요합니다  뛰어난 맛과 식감을 위해 당사는 천연 식품 성분을 혼합하는 방법을 개발했습니다  원료 선택   좋은 재료에서 좋은 영양소를 얻을 수 있습니다  당사는 고유한 평가 과정을 통해 전 세계에서 확보한 수 많은 신선한 재료를 검토합니다  순도 보장   제조 공정의 모든 단계를 미국 내 자체 시설에서 관리함으로써 제품의 순도를 보장합니다 ,모발-피부-손톱
 보충제 모발  피부  손발톱 건강 개선 기타 천연 향료 함유 개선된 포뮬라,모발-피부-손톱
 임상적 강도 세라마이드로 강화한 비건 뷰티  화이트헤드 및 블랙헤드 제거와 피지 생성 밸런싱  남성   여성을 위한 건조하지 않은 포뮬라  사용 6주 후 결과  글루텐 무함유 인증 보충제 B  corp  인증 글루텐 무함유 거친 피부 완화 및 피부결 개선  진정성 청결도 신선도 일관성 정확성,모발-피부-손톱
 확실한 선택 당류 0g 35칼로리 비타민C 90mg   하루 영양소 기준치의 100  가수분해 목초 사육 우피 멀티 콜라겐 펩타이드 생기 넘치는 모발  피부 및 손발톱 관리에 도움 1회 제공량당 콜라겐 10g 함유 비오틴 B7 강화 유전자 변형 성분 무함유 성분으로 제조 보충제 우유나 커피에 넣어서 복용 I형  III형 글루텐 무함유 유제품 무함유,모발-피부-손톱
 1회 제공량당 20g   프로바이오틱 피부  모발  손발톱  관절 보충제 B  corp  인증 콜라겐 20g   프로바이오틱 10억 CFU 피부 탄력 튼튼한 손발톱 및 건강한 모발 관절 및 운동 기능 IGEN   유전자 변형 성분 무함유 검사 완료 케토 인증 상품 Paleo 인증 상품 NSF 글루텐 무함유 인증 호르몬 및 항생제 무함유 유전자 변형 유전자 편집 성분 또는 단백질 무함유 상품,모발-피부-손톱
 치아 씨드  아사이  마키  아세로라  석류   블루베리 피부 영양 베리 단 6가지 리얼 푸드 인공 감미료 또는 충전제 없음 USDA 유기농 인증 식물성 원료로 제조 글루텐 무함유 유전자 변형 성분 무함유 프로젝트 인증 B  corp  인증 단 6가지 슈퍼푸드 성분   그게 전부입니다  SCS Global Services 유기농 인증,모발-피부-손톱
 보충제 분말 5가지 유형의 콜라겐 목초 사육   방목 사육 유전자 변형 성분 무함유 cGMP 인증,모발-피부-손톱
 영양 공급 1회 제공량당 콜라겐 20g Go Fat  올리브오일 피부  모발  손발톱  관절 건강 개선 보충제 Paleo 인증 피부 탄력 피부 보습 젊어 보이는 외모 뼈와 관절 강화 따뜻한 음료나 차가운 음료에 타서 복용 유제품 무함유 유전자 변형 성분 무함유 설탕 무함유 글루텐 무함유,모발-피부-손톱
 MSC 지속 가능 수산물 인증 대구  해덕  명태에서 추출한 I형 콜라겐 펩타이드 1회 제공량당 콜라겐 5g 함유 분말 보충제 대두 무함유 유전자 변형 성분 무함유 글루텐 무함유 동안 효과 뼈와 관절을 편안하게 소화 기능 강화 2001년부터 고품질 상품 제공,모발-피부-손톱
 비건 콜라겐 펩타이드 글루텐 무함유 식물성 콜라겐 펩타이드 포뮬라 NO 동물실험   PETA   비건 HACCP MFDS 피부 탄력 및 탄력 관절 및 근육 모발  피부   손발톱 천연 과일 향료 비타민 및 미네랄 항산화제,모발-피부-손톱
 목초 사육   방목 사육 모발  피부  손발톱  관절 건강 증진 비타민C 목초 사육 콜라겐 10g  50가지 이상의 슈퍼 푸드 보충제 Good  Clean Nutrition  I형 및 III형 목초 사육   방목 사육 콜라겐 펩타이드 고대 곡물 새싹 혼합물 베리 및 과일 녹색 채소 및 새싹 채소 및 허브 암라 열매 추출물 유제품 성분 무함유 대두 성분 무함유 유전자 변형 성분 무함유 글루텐 무함유 인공 보존제  향료  색소 무함유 Paleo 인증,모발-피부-손톱
 치아 씨드  아사이  마키  아세로라  석류   블루베리 피부 영양 베리 단 6가지 리얼 푸드 인공 감미료 또는 충전제 없음 USDA 유기농 인증 식물성 원료로 제조 글루텐 무함유 유전자 변형 성분 무함유 프로젝트 인증 B  corp  인증 단 6가지 슈퍼푸드 성분   그게 전부입니다  SCS Global Services 유기농 인증,모발-피부-손톱
 비타민C  비오틴  히알루론산 함유 GMP   우수 제조 및 품질 관리 기준 상품 제3 기관 품질 검사 완료 보충제,모발-피부-손톱
 개선된 포뮬라 강력한 뷰티 지원 비오틴 및 비타민C 함유 I  II  III  V  X형 건강한 모발  피부  손발톱  관절 1회 제공량당 콜라겐 1 300mg 보충제 글루텐 무함유 유제품 무함유 유전자 변형 성분 무함유 대두 무함유 땅콩 무함유 조개 및 갑각류 무함유 보존제 무함유,모발-피부-손톱
 멀티 타입 포뮬라 모발  피부  손발톱  관절 건강 강화 콜라겐 합성 지원 쉽게 용해 | 무향 혼합물 보충제 우수 제조 및 품질 관리 기준 GMP  유전자 변형 성분 무함유 보존제 무함유 유제품 무함유 조개 및 갑각류 무함유 대두 무함유 땅콩 무함유 글루텐 무함유 케토 친화 상품,모발-피부-손톱
 방목하여 목초 사육 모발  피부  손발톱  관절 포뮬라   히알루론산 및 비타민C I  II  III형 보충제 유전자 변형 성분 무함유 우수 제조 및 품질 관리 기준 GMP  준수 품질 검사 완료 유제품  글루텐  계란 및 견과류 무함유 흡수 검사 완료,모발-피부-손톱
 관절 건강 및 가동성 캡슐당 83mg 보충제,모발-피부-손톱
 바오밥 대나무 실리카 비타민C 1회 제공량당 분말 8g 용기당 제공 횟수  30회 건강한 모발  피부  손발톱 관리를 위해 콜라겐 생성을 촉진하는 비건 뷰티 부스팅 혼합물 기타 천연 향료 함유 보충제 글루텐 무함유 IGEN 유전자 변형 성분 무함유 검사 완료 케토 인증 상품,모발-피부-손톱
 해양 콜라겐   아스타잔틴 파워 어려 보이는 피부 결 및 피부 톤 유지 피부 속 수분 공급 자연산 샌선에서 추출한 해양 콜라겐 보충제 유전자 변형 성분 무함유 빛나는 피부 피부 속 수분 공급,모발-피부-손톱
 비건 콜라겐 펩타이드 글루텐 무함유 식물성 콜라겐 펩타이드 포뮬라 NO 동물실험   PETA   비건 HACCP 식품 제조 및 품질 관리 기준 HACCP  피부 탄력 및 탄력 관절 및 근육 모발  피부   손발톱 천연 과일 향료 비타민 및 미네랄 항산화제,모발-피부-손톱
 비변성 콜라겐 II형 함유 관절 건강  가동성 및 유연성 강화 일반적인 관절 스트레스에 대한 균형 잡힌 반응 지원 Aquamin 유전자 변형 성분 무함유 보충제 UC II  할랄,모발-피부-손톱
 콜라겐 생성 지원 건강하고 부드러운 피부 주름 형성을 줄이는데 도움을 줌 콜라겐  석류  토마토  아스타잔틴 및 비타민 C 자연에서 얻은 원천 건강 보조식품,모발-피부-손톱
 1932년 설립 이래 신뢰할 수 있는 품질 유지 하루 1정 모발  피부  손발톱 건강 증진 천연 향료 ActivMelt  Instant Dissolve 보충제 채식주의자,모발-피부-손톱
 자연스럽게 빛나는 피부 증진 신체의 천연 피 정화 시스템에 대한 영양적인 지원 제공 식이보조제 활기찬 피부를 위한 천연 재료  내부로부터의 건강한 피부  천연 클렌징 특징  세포에 영양분 공급 및 독성 제거에 도움 ,모발-피부-손톱
 Concentrated Formula Beauty Formula Gluten Free Non GMO Dietary Supplement,모발-피부-손톱
 No Hormones  Antibiotics or Gluten Non GMO Naturally Honest No Artificial Sweeteners Skin Health Healthy Hair   Nails Joint Health 10 g BioActive Peptides Dietary Supplement Naturally Flavored Never Clumps 5 Collagen Types Paleo Friendly Keto Friendly Pasture Raised   Beauty Within BSE TSE Free Dairy Free BPA Free Hot or Cool Mixes Easily,모발-피부-손톱
 30회 제공량 식물성 및 천연 콜라겐 생성 증진 슈퍼 푸드 보충제 USDA 유기농 인증 유기농 인증   Quality Assurance International If It s Organic  It s Non GMO 인증 글리포세이트 잔여물 무함유 QAI 유기농 인증 식물성 성분 비건 글루텐 무함유 유제품 무함유 대두 무함유 흰목이버섯 암라 로즈힙 알로에베라 대나무 실리카 석류 바오밥 열매 코코넛워터 레몬 라즈베리,모발-피부-손톱
 프리미엄 포뮬라 GMP   우수 제조 및 품질 관리 기준 상품 제3기관 품질 검사 완료 보충제 모발  두피  피부  손발톱을 건강하게 지원합니다  세포 에너지 생성 지원 아미노산 대사 지원  면역계 건강을 강화합니다  탄수화물  단백질  지방 대사를 촉진합니다 ,모발-피부-손톱
 속부터 탄탄하게 차오르는 건강하고 아름다운 피부 보충제 제3기관 순도 검사 완료 유전자 변형 성분 무함유 인증 임상적으로 검증된 성분 흡수력이 뛰어난 제품 목초 사육 방목 사육 생체 활성 펩타이드,모발-피부-손톱
 아름다움의 비결 뷰티 드링크 믹스 천연 향료 빛나는 피부  건강한 모발  모든 것이 여기서 시작됩니다  목초 사육 유전자 변형 성분 무함유 글루텐 무함유 설탕 무함유 보충제 탁월한 맛,모발-피부-손톱
 목초 사육 관절 및 뼈 건강 증진 모발  피부  손발톱 건강 개선 조직 강화 보충제 유전자 변형 성분 무함유 목초 사육 가수분해콜라겐 콜라겐 펩타이드 7 000mg 소뼈 육수 7 000mg,모발-피부-손톱
 해양 콜라겐 히알루론산 비타민C 비오틴 레드오렌지 복합체 천연 향료 지속 가능한 방식으로 조달   자연산 보충제 IGEN 유전자 변형 성분 무함유 검사 완료 해산물 채식주의자에게 적합 케토 인증 제품 글루텐 무함유 우수 제조 및 품질 관리 기준 cGMP  준수 자연산 심해 어류에서 추출한 가수분해 해양 콜라겐 펩타이드 5g Redorange Complex  히알루론산 비타민C   비오틴,모발-피부-손톱
 1932년 설립 이래 신뢰할 수 있는 품질 유지 하루 1정 모발  피부  손발톱 건강 지원 유전자 변형 성분 무함유 비건 글루텐 무함유 보충제,모발-피부-손톱
 Verisol  Bioactive Collagen Peptides 보충제 내면과 외면의 자연적인 아름다움을 새롭게 정의 독특한 젤리 형태 뛰어난 맛 깨끗한 성분 Verisol  내면의 아름다움 세계적으로 인정받는 Verisol  콜라겐 성분 사용 임상 검증된 잔주름과 주름살 완화 품질 검사 완료,모발-피부-손톱
 골드 스탠더드 임상 연구를 거친 제품 제1형   제3형 리저브 에이지 뉴트리션  Reserveage Nutrition 의 아름다움 히알루론 산과 비타민 C 함유 제품 바이오 액티브 콜라겐 펩티트로 빛나는 피부 주름 개선에 도움이 되는 제품 건강 보조 식품 Verisol 제품   내면으로부터의 아름다움,모발-피부-손톱
 You Better Way to B  드링크 믹스 솔루션 면역력 강화 보충제 비타민C 2 000mg 보충제 코셔 유전자 변형 성분 무함유 인증 설탕 무함유 비건 상품 글루텐 무함유 GMP   우수 제조 및 품질 관리 기준에 따른 일관된 품질 To Your Health  드링크,모발-피부-손톱
 영양 공급 히알루론산 1회 제공량당 콜라겐 20g GO  Fat 올리브 오일 피부  모발  손발톱  관절 건강 개선 보충제 유제품 무함유 유전자 변형 성분 무함유 설탕 무함유 글루텐 무함유 Paleo 인증 피부 탄력 피부 보습 젊어 보이는 외모 뼈와 관절 강화 따뜻한 음료나 차가운 음료에 타서 복용,모발-피부-손톱
 Hair   Skin Support Vitamins 10 000 mcg Per Serving Biotin Helps Support Healthy Hair   Skin Delicious  Gluten Free Non GMO Dietary Supplement Vegan Formula 100  Quality Satisfaction Guarantee,모발-피부-손톱
 유전자 변형 성분 무함유 성분으로 제조 모발 및 손발톱 건강에 도움 비건 글루텐 무함유 코셔 파르브 보충제,모발-피부-손톱
 모발 건강 개선 건강한 두피를 위한 영양소 히알루론산 비오틴 항산화제 혼합물  보충제 판매 1위 브랜드   영양사가 개발한 포뮬라 대두 무함유 유제품 무함유 조개 및 갑각류 무함유 글루텐 무함유 모낭에 영양을 공급하는 히알루론산 및 필수 영양소 모발 건강에 도움이 되는 핵심 영양소 비오틴  항산화제 베타카로틴 및 비타민C 및 E   활성산소로부터 보호,모발-피부-손톱
 정상적인 포도당 대사 모발  피부  손발톱 건강 유전자 변형 성분 무함유 보충제 채식주의자 비건에게 적합 할랄,모발-피부-손톱
 1회 제공량당 비오틴 5 000mcg 함유 모발  피부  손발톱 건강 강화 맛있는 딸기 맛 채식주의자에게 적합 보충제,모발-피부-손톱
 Clinical Youth Collagen 1932년 설립 I 및 III형 콜라겐 3 750mg 혁신적인 품질 피부  모발  손발톱   관절 건강을 위한 Solusil 혼합물 천연 향료 보충제 40회 제공량 매일 1회 심해 저온 수역에서 포획한 자연산 생선,모발-피부-손톱
 콜라겐 친화 영양분 및 비타민 C를 포함한 전매특허 세라모사이드 Ceramosides  세라모사이드는 2주 만에 눈에 띄는 결과가 나타나도록 수분 공급에 도움을 줍니다  세라모사이드는 더 매끈하고 탄력 있는 피부를 위한 수분 공급을 돕습니다  콜라겐 합성을 지원하는 영양분과 보조 인자를 제공 건강 보조 식품 글루텐 프리 비건 제품,모발-피부-손톱
 유기농 프리바이오틱 섬유소 및 실론 계피 함유 보충제 천연향료 분말 Greatness by Nature  콜라겐 1형 및 3형 말토덱스트린 무함유 품질 검사 완료 목초 사육  방목 사육 글루텐 무함유 유전자 변형 없는 성분으로 제조 깨끗한 에너지   최적의 단백질 호르몬 무함유 콜라겐 맑은 정신 장 건강 증진 빠르고 지속적인 에너지 제공 최상의 효능 관절 운동성 모발 및 손발톱 강화 피부 세포 건강 건강한 수준의 식욕,모발-피부-손톱
 피부  모발  손발톱 회복 보충제 유전자 변형 성분 무함유 대두 무함유 글루텐 무함유 목초 사육 소   방목 사육,모발-피부-손톱
 보충제 품질 검사 완료 사탕 정제 1개당 5 000mcg,모발-피부-손톱
   Promote Radiant Skin  Biotin Silica  Vitamin C  Proline  Zinc Copper  Flaxseed Oil  Gotu Kola  Dietary Supplement Nutrients to Strengthen  Horsetail is a nutritive plant full of important minerals  and is standardized to supply 11 2 mg Silica per serving  Biotin is an essential vitamin that improves the strength and luster of brittle nails  Connective Tissue Support  A special blend of vitamins and minerals provide the ingredients necessary to build and protect connective tissue  Proline and Lysine are two key elements of collagen structure  Free Radical Protection  The best way to maintain healthy skin  hair and nails is to protect them from damage  Bioflavonoids possess antioxidant qualities to protect the cells from free radicals that are created by the sun and environmental pollution ,모발-피부-손톱
 건강보조식품 비변성 콜라겐 편안한 관절,모발-피부-손톱
 TM Ancestral Type I   III 20 g Serving Pasture Raised Grass Fed   Finished Hormone  Pesticide    GMO Free No Fillers or Flow Agents Dietary Supplement America s 1 Trace Mineral Brand  Gluten Free Dairy Free Paleo Friendly Keto cGMP Certified BPA Free No Known Allergens,모발-피부-손톱
 판매 1위 케라틴 보충제 브랜드 모발 및 손발톱 건강 지원 보충제 글루텐 무함유,모발-피부-손톱
 I II III 개선된형 가수분해콜라겐 모발  피부  손발톱    관절 건강 증진 보충제 2스쿱당 콜라겐 22g 파스테르에서 재배한 목초 사육 흡수 검사 완료 유전자 변형 성분 무함유 성분으로 제조 우수 제조 및 품질 관리 기준 GMP  준수 품질 검사 완료 전 세계에서 공급되는 성분 사용   미국에서 제조 근육 회복 관절의 편안함과 가동성 뼈 강화 장 건강 및 소화 기능 피부 세포 재생 건강한 모발  피부  손발톱 설탕 무함유 유제품 무함유 글루텐 무함유 계란 무함유 견과류 무함유 대두 무함유 생선 무함유 호르몬 성분 보존제 또는 첨가제 무함유,모발-피부-손톱
 콜라겐 펩타이드 드링크 믹스 1회 제공량당 콜라겐 11g 함유 Paleo 인증 케토 인증 유제품  유청 또는 대두 성분 무함유 설탕 무함유 GFCO 글루텐 무함유 인증 맛있는 커피  벨벳같이 부드럽고 고소한 맛,모발-피부-손톱
 1928년 설립 재충전  활력 충전  회복 ,모발-피부-손톱
 Dietary Supplement Hair  Skin and Nails Kosher Non GMO Gluten Free Nut Free,모발-피부-손톱
 식물성 글루텐 무함유 유제품 무함유 모발  피부  손발톱 건강 개선 및 천연 콜라겐 생성 촉진 히알루론산 50mg 비오틴 3 000mcg 비타민C  E 10가지 슈퍼 푸드 보충제 기타 천연 향료 첨가 인공 색소 무함유 인공 감미료 무함유 젤라틴 무함유 코셔 유제품,모발-피부-손톱
 보충제의 기준이 되는 상품 히알루론산과 비타민C로 강화된 콜라겐 펩타이드 I  II  III  V  X형 쉽게 용해됨 전문가가 맛을 낸 상품 천연 및 인공 향료 보충제 목초 사육 소고기 BSE 프리 농장 사육 닭고기 자연산 생선 난각막 유전자 변형 성분 무함유 글루텐 무함유 유제품 무함유 인공 색소 무함유 품질 검사 완료,모발-피부-손톱
 1회 제공량당 콜라겐 15g 함유 피부  모발  손발톱 건강에 도움 히알루론산 120mg 보충제 9가지 필수 아미노산 중 8가지 함유 우피 콜라겐펩타이드로 제조 Whole 30 인증 유제품 무함유 글루텐 무함유 BPA 무함유 인공 감미료 무함유 피부 보습 20억CFU 프로바이오틱 어려보이는 외모 피부 탄력 소화기 건강,모발-피부-손톱
 Gluten Free Non GMO 2 500 mcg Biotin Per Serving  Biotin Helps Support Healthy Hair and Skin Dietary Supplement Laboratory Tested   Quality Guarantee Vegan Formula Let Your Health Shine ,모발-피부-손톱
 피부와 손발톱  관절 건강에 도움 Dr  Axe 포뮬라 5가지 유형의 식품 원료 콜라겐 I  II  III  V  X형 천연 식품 보충제,모발-피부-손톱
 피부와 손발톱  관절 건강에 도움 Dr  Axe 포뮬라 5가지 유형의 식품 원료 콜라겐 I  II  III  V  X형 천연 식품 보충제,모발-피부-손톱
 보조 인자 100mg 관절 강화 피부를 구성하는 성분 유전자 변형 성분 무함유 보충제 채식주의자 비건에게 적합,모발-피부-손톱
 MSC 지속 가능한 수산물 인증 MSC 인증 자연산 대서양 대구 목초 사육 소 사골 육수 윤리적인 방식으로 공급받은 닭고기 천연 초콜릿 향료 및 기타 천연 향료 1회 제공량당 콜라겐 5g 함유 분말 보충제 동안 효과 뼈와 관절을 편안하게 소화 기능 강화 2001년부터 고품질 상품 제공 대두 무함유 유전자 변형 성분 무함유 글루텐 무함유  Cod MSC 인증,모발-피부-손톱
 MSC 지속 가능한 수산물 인증 MSC 인증 자연산 대서양 대구 목초 사육 소 사골 육수 윤리적인 방식으로 공급받은 닭고기 1회 제공량당 콜라겐 5g 함유 천연 바닐라 향과 기타 천연 향 분말 보충제 동안 효과 뼈와 관절을 편안하게 소화 기능 강화 2001년부터 고품질 상품 제공 대두 무함유 유전자 변형 성분 무함유 글루텐 무함유  Cod MSC 인증,모발-피부-손톱
 1스쿱당 콜라겐 20g 유전자 변형 성분 무함유 글루텐 무함유 모발  피부  손발톱  관절 건강 증진 보충제 피부 보습 및 탄력 강화 목초 사육 및 방목 사육 소에서 추출 1969년부터 과학에 기반한 고품질 상품 제공,모발-피부-손톱
 보충제의 기준이 되는 상품 신진대사를 촉진하는 카페인 무함유 콜라겐 펩타이드  콜라겐 I  II  III  V  X형 눈에 띄는 셀룰라이트를 완화해 줍니다   보충제 Dimpless  목초 사육 소 BSE 프리 농장 사육 닭고기 자연산 생선 난각막 유전자 변형 성분 무함유 유제품 무함유 글루텐 무함유 인공 색소 무함유 Vitauthority 정품,모발-피부-손톱
 전반적인 웰니스 뷰티  탄탄한 근육  장 개선 콜라겐 펩타이드 10g  단백질 25g  프로바이오틱 10억  Good  Clean Nutrition  우수 표준 제품 유제품 성분 무함유 대두 성분 무함유 글루텐 무함유 인공 보존제 및 향료 무함유 케토 친화 상품 설탕 0g   완두콩 단백질 목초 사육   방목 사육 콜라겐 펩타이드 I형 및 III형,모발-피부-손톱
 보충제 5가지 콜라겐 비오틴 10 000mcg 케라틴 헤어 케어 비타민C   히알루론산 cGMP 인증,모발-피부-손톱
 1973년 설립 관절 건강 보충제 품질 검사 완료 건강한 삶 지원,모발-피부-손톱
 Clinically Proven Ch OSA    Biotin Generates   Protects You Own Collagen Vegan Friendly Supplement Gluten   Allergen Free GMO Free Soy Free Dairy Free Vegan Friendly,모발-피부-손톱
 1928년 설립 재충전  활력 충전  회복  목초 사육 가족 농장 글루텐 무함유 유전자 변형 성분 무함유 호르몬 무함유 화학 성분 무함유 대두 무함유,모발-피부-손톱
 Whole Food Dietary Supplement Types  I  II  III  V  X Anti Aging  Muscle   Joint Support 28 Days to Reduce Deep Wrinkles Beautiful Hair  Skin   Nails Muscle   Joint Comfort   Support Gut Health   Digestion Verisol   Types I   III Bovine Collagen  Collactive   Type I Marine Collagen  NEM   Types  I  V  X collagen  UC II  Type II Collagen  Pasture Raised  Grass Fed Sustainable Wild Caught 10 g Collagen Protein Per Scoop Enjoy At Home or On The Go  Shake It  Blend It  Bake It  Reduces deep wrinkles Helps increase skin elasticity and density while reducing the appearance of fine lines and crow s feet   Promotes healthy hair and strong nails   Helps strengthen your bones and muscles  promotes joint comfort and mobility  and supports gut health,모발-피부-손톱
 모발  피부  손발톱  뼈  관절 건강  체중 감량 할랄식품협회,모발-피부-손톱
 임상 연구 완료 성분 5가지 유형의 식품 원료 콜라겐 I  II  III  V  X형 비타민C   프로바이오틱 2스쿱당 콜라겐 20g 천연 식품 보충제 목초 사육 및 방목 사육 유전자 변형 성분 무함유 임상 시험을 마친 유형 V 및 X 콜라겐의 공급원 4주 후 눈가 주름 개선   임상 시험을 마친 유형 V 및 X 콜라겐의 공급원 7일 후 관절 불편함 완화  ,모발-피부-손톱
 무설탕  일일 프로바이오틱 보충제 프리바이오틱 프로바이오틱 크랜베리 콜라겐 기타 천연 향료 함유,모발-피부-손톱
 캡슐 제제에 담긴 최고의 성분 좀 더 튼튼하고  반짝이고  건강한 모발 촉진 원료의 고유한 조합이 보장하는 제품의 우수성 좀 더 풍성하고 두꺼운 모발이 되도록 모발을 젊게 만드는데 도움 2개월 제공량 식이보충제,모발-피부-손톱
 채식주의자에게 적합 글루텐 무함유 유전자 변형 성분 무함유 모발  피부  손발톱 건강 개선 및 천연 콜라겐 생성 촉진 히알루론산 100mg 비오틴 3 000mcg 비타민C  E 14가지 슈퍼 푸드 천연 향료를 사용한 트로피컬 과일 맛 보충제 휴대 가능한 스틱팩 20개 인공 염료 무함유 인공 감미료 무함유 Dermaval 함유,모발-피부-손톱
 자일리톨로 단맛 가미 관절 지원 1회 제공량당 100mg 중요한 관절 윤활제 관절을 지원하는 기타 비타민과 아미노산도 함유 기분 좋은 베리 맛  보충제 채식주의자 비건에게 적합한 제품 유전자 변형 성분 무함유 코셔 일반 건강 1968년 설립된 가족 소유 기업 GMP 품질 보증,모발-피부-손톱
 보충제 모발  피부  손발톱 건강에 도움 채식주의자에게 적합 젤라틴 무함유 우수 제조 및 품질 관리 기준 GMP ,모발-피부-손톱
