effect,category
1971년 설립 글루텐 무함유 인증 근육 이완에 도움 뼈 건강 지원 보충제 코셔 B  corp  인증 IGEN 유전자 변형 성분 무함유 검사 완료진정성 청결성 신선도 일관성 정확성,불면증
신뢰할 수 있는 품질 1932년 설립 하루 2정 신경계 건강에 도움 비건 보충제,불면증
Sierra Fit 아연  마그네슘 및 비타민 B6 근력 및 회복 지원  0칼로리 설탕 무함유 탄수화물 무함유 유전자 변형 성분 및 글루텐 무함유 베지 캡슐 90정,불면증
글루텐 무함유 유전자 변형 성분 무함유 LE 인증 수면 개선 및 스트레스 감소 보충제혈중 트립토판의 적정 농도를 유지하여 건강한 수면과 기분 조절 스트레스에 대한 건강한 생물학적 반응 지원 건강한 체중 관리를 위한 포만감 촉진 트립토판 활성을 촉진하는 영양소 제공,불면증
시트레이트  말레이트 포도 맛 및 기타 천연 향미료 미네랄 보충제 B  corp  인증 글리포세이트 잔여물 무함유 125종 이상의 살충제 및 제초제 성분 무함유 검사 완료 글루텐 무함유 검사 완료 채식주의자에게 적합 유제품 무함유 대두 성분 무함유,불면증
신경계 건강 증진 에너지 생성 증진 효소 기능에 중요 유전자 변형 성분 무함유 보충제 채식주의자 비건에게 적합 코셔 미네랄 1968년 설립된 가족 기업 할랄 GMP 인증,불면증
근육 및 에너지 생성 보조 글루텐 무함유 보충제 글루텐  설탕  유제품 무함유 Albion Minerals,불면증
100  비건 제품 1972년 설립 홍조류 및 해수 성분 시원하고 청정한 자연 그대로의 아이슬란드 북극 해역 미량 미네랄 72종 1회 제공량당 초고농축물 500mg 함유 Discover Marine Minerals and Trust the Difference     글루텐 무함유 보충제 Aquamin  Holistically Balanced  크루얼티프리 No 동물 실험,불면증
Targeted Support  보충제 Albion Minerals,불면증
이온 미네랄 미네랄 건강보조식품 엄격한 채식 다이어트에 적합함 삼키기 쉬움 위에 편안함 당신은 순수함을 볼수 있고 맛을 느낄수있습니다 ,불면증
보충제 Magtein 어떤 형태의 마그네슘보다도 흡수성이 뛰어납니다  세포 침투성이 높아 혈뇌장벽과 세포막을 통과할 수 있습니다  위장의 불편감을 현저히 감소시킵니다  위장의 불편감과 묽은 변을 유발할 수 있는 다른 형태의 마그네슘과 달리 마그네슘 L 트레오네이트는 완하 작용을 일으키지 않습니다 ,불면증
심혈관계 건강 1정당 100mg 함유 미네랄 보충제 두 가지 필수 영양소인 마그네슘과 타우린을 하나의 포뮬라에 결합 튼튼한 근육 및 뼈  심혈관계 건강 등에 꼭 필요한 영양소 1969년부터 과학에 기반한 고품질 상품 제공,불면증
스트레스 완화 허브 보충제 자연스러운 휴식 및 긴장 완화 신경성 활력의 감소에 도움 Full Spectrum  천연 허브 포뮬라 1969년부터 과학에 기반한 고품질 상품 제공,불면증
학습 능력 및 기억력 증진 보충제 Magtein  Think Clearly,불면증
심장  에너지  정서  근육 지원 보충제 글루텐 무함유 유전자 변형 성분 무함유 프로젝트 인증 미국 1위 미량 미네랄 브랜드 Feel The Difference 보증 코셔 비건 인증 우수 제조 및 품질 관리 기준 cGMP  준수,불면증
혁신적인 영양소 잘 흡수되는 순수 마그네슘 저자극성 보충제,불면증
마그네슘 보충제 기타 천연 향미료 첨가 유전자 변형 성분 무함유 프로젝트 인증 비건 글루텐 무함유,불면증
유전자 변형 성분 무함유 글루텐 무함유 보충제 마그네슘 비스글리시네이트 킬레이트 비건 상품 대두 무함유 우수 제조 및 품질 관리 기준 cGMP  인증,불면증
Science Based Nutrition  Albion 미네랄 100  킬레이트화 리시네이트 글리시네이트 근육 이완 및 건강한 수면 지원 보충제 천연 향미료 글루텐 무함유 비건,불면증
1932년 설립 이래 신뢰할 수 있는 품질 유지 보충제 하루 1정 서방형 뼈  근육  신경계 건강 강화 비건 글루텐 무함유,불면증
스트레스 완화 종합적인 혼합물 허브 보충제 건강한 긴장 완화를 촉진하는 허브 3종 발레리안의 긴장 완화  카모마일의 진정 효과 및 편안함  홉의 스트레스 완화 효과 1969년부터 과학에 기반한 고품질 상품 제공,불면증
기분 및 수면 지원 유전자 변형 성분 무함유 LE 인증 보충제스트레스에 대한 건강한 반응 촉진 편안한 수면에 도움 스트레스에 대한 반응으로 건강한 코르티솔 수치 촉진,불면증
보충제 Nutricost  품질 보장 식물성 상품 GMP 인증 시설 유전자 변형 성분 무함유 상품 제3기관 검사 완료 글루텐 무함유,불면증
마그네슘시트레이트 400mg 뼈 건강 증진 비건 유전자 변형 성분 무함유 상품 근육 건강 증진 순도 검사 완료 우수 제조 및 품질 관리 기준 GMP  시설에서 제조 보충제,불면증
1932년 설립 이래 신뢰할 수 있는 품질 유지 하루 1정 옥사이드  타우레이트  시트레이트  오로테이트 글루텐 무함유 유전자 변형 성분 무함유 보충제 채식주의자에게 적합,불면증
천연 스트레스 완화제 표준화한 3 5  추출물 마음 안정 지원 건강 보조 식품 채식주의   완전 채식 비건 용으로 적합 식물성 허브 가족 기업 1968년부터  GMP 품질 보증,불면증
수면 보조제 캡슐당 475mg 허브 보충제 평온함과 긴장 완화 촉진 휴식 및 회복성 수면 강화 진정 촉진 및 신경성 긴장 완화 1969년부터 과학에 기반한 고품질 상품 제공,불면증
1973년 설립  수면 건강 증진 보충제 유전자 변형 성분 무함유 프로젝트 인증 품질 검사 완료 비건 건강한 삶 지원,불면증
근육 및 뼈 건강 캡슐당 400mg 미네랄 보충제 신경  근육  뼈 건강에 도움 권태 및 피로감 감소에 도움 산화마그네슘  마그네슘시트레이트  마그네슘아스파테이트 함유 1969년부터 과학에 기반한 고품질 상품 제공,불면증
Science Based Nutrition  정상적인 숙면  건강한 기분 및 행동 증진에 도움 건강 보조 식품 유전자 변형 성분 무함유   글루텐 무함유   대두 무함유   식물성정상적인 숙면 증진에 도움 건강한 기분 및 행동 증진에 도움,불면증
유전자 변형 성분 없음 100  비건 제품 건강 보조 식품 동종요법 영양성분을 함유한 발레리안 호프 실험실 검사 필 제품,불면증
밤사이 면역력 강화 멜라토닌 무함유 USDA 유기농 인증 흘리지 않는 주사기 어댑터 보충제 엄마가 설립하고 주도 NSF 유전자 변형 성분 무함유 인증 모든 포장재에 BPA  PVC  프탈레이트 무함유 유기농 인증 기관  QAI따뜻한 물로 목욕하기 부드러운 마사지 배드타임 스토리 읽어보기 자장가 부르기 화이트노이즈,불면증
1969년 설립 전통적인 심신 안정제 Tru ID  진품 인증 유전자 변형 성분 무함유 프로젝트 인증 1회 제공량당 700mg 보충제 비건,불면증
글리신산 말레이트 보충제 Albion  미네랄,불면증
유전자 변형 성분 무함유 비건 설탕 무함유 젤라틴 무함유 한천 성분 2개월분 천연 히비스커스 향료 및 기타 천연 향료 보충제,불면증
1969년 설립 전통적인 수면 보조제 Tru ID  진품 인증 유전자 변형 성분 무함유 프로젝트 인증 보충제 비건 글루텐 무함유,불면증
신경계 건강 지원 최적의 생체이용률을 위한 5가지 유형의 마그네슘 건강한 근육  신경 및 심장 기능 지원 유전자 변형 성분 무함유 보충제 채식주의자 비건에 적합 1968년 설립된 가족 기업 우수 제조 및 품질 관리 기준 GMP  품질 보증,불면증
USDA 유기농 힐링 제품   건강한 비즈니스 NH Dept  of Agr  Mkts     Food 인증 유기농 GFCO Gluten Free Certification Organization  글루텐 없음 인증 Leaping Bunny 인증 동물에게 피해 없이 제조됨 마음의 안정  진정 및 편안함,불면증
1972년 설립 스트레스 완화 촉진  카모마일 Matricaria recutita  1회 제공량당 카모마일꽃추출물 2 400mg 글루텐 무함유 코셔 파르브 인증 허브 보충제 보존제 100  무함유,불면증
Amazing Formulas  보충제 건강 효능을 제공하도록 과학적으로 제조 튼튼한 뼈 및 치아에 도움 신경 및 근육 기능에 도움 GMP를 준수하는 고품질 상품 Vitamin Angels    자랑스러운 서포터,불면증
글루텐 무함유 유전자 변형 성분 무함유 LE 인증 자연적 수면 개선 및 스트레스 감소를 위한 필수 아미노산 보충제건강한 수면 및 긍정적 기분 보조 신체의 자연스러운 스트레스 반응 조절 포만감 증진,불면증
보충제 설탕 무함유 건강한 근육   심장 기능 채식주의자 비건에게 적합 순도   효능 보장,불면증
근육  신경 및 진정 작용을 위한 마그네슘 함유 가향 구미젤리 보충제 코셔 파르브 땅콩 무함유 견과류 무함유 유제품 무함유 글루텐 무함유 대두 무함유 계란 무함유,불면증
뼈 건강 강화 1회 제공량당 400mg 설탕 무함유 미네랄 보충제 Albion Minerals,불면증
수면 보조제 캡슐당 500mg 보충제 건강한 수면 패턴 향상 신체의 24시간 주기 리듬 조절에 도움 건강한 세로토닌 수치 촉진 1969년부터 과학에 기반한 고품질 상품 제공,불면증
허브 보충제 발레리안 Valeriana officinalis  유전자 변형 성분 무함유 보충제 채식주의자 비건에게 적합 식물성 허브 1968년 설립된 가족 기업 우수 제조 및 품질 관리 기준 GMP  품질 보장,불면증
산화 마그네슘  시트레이트   글리시네이트 보충제 Nutricost  품질 보장 제3기관 검사 완료 GMP 인증 시설 유전자 변형 성분 무함유 상품 글루텐 무함유,불면증
세척 건강 증진을 위한 첫걸음 보충제 글루텐 무함유 유전자 변형 성분 무함유 크루얼티프리 비건 인증건강 루틴을 개선합니다  소화가 느리고 잘 안 되는 경우를 개선합니다  소화기관을 더 건강하고 편하게 해줍니다  간헐적인 변비를 해소합니다 ,불면증
10회 분사당 원소 마그네슘 200mg 진정 및 미용 효과  피부 개선 100  천연   농축   유타주 내해 유래 의사 추천 제품 NO 동물실험 100  천연 성분 미국 1위 액상 마그네슘 브랜드  확실히 느껴지는 변화 보장 RCC 코셔 할랄 인증 유전자 변형 성분 무함유 비건 인증 글루텐 무함유 제3 기관 검사 완료 우수 제조 및 품질 관리 기준 cGMP  인증 BPA 무함유,불면증
알코올 무함유 1972년 설립 자연적인 진정 및 안정 효과를 주는 식물 1회 제공량당 2 000mg Discover Nature s Answer  유전자 변형 성분 무함유 프로젝트 인증 허브 보충제 글루텐 무함유 코셔 파르브 Bio Chelated  저온 추출 공법,불면증
마그네슘 보충제 기타 천연 향미료 첨가 유전자 변형 성분 무함유 프로젝트 인증 비건 제품 글루텐 무함유,불면증
1정당 8ppm의 수소 생성  보충제,불면증
서방형 마그네슘 보충제 미국 판매 1위   It s Fun to Feel Good 8시간 서방형 기술 간헐적인 다리 경련 및 근육 긴장 완화 유전자 변형 성분 100  무함유 글루텐 무함유 대두 성분 무함유 비건 제품 의사 인증 특정 기능성 표기 강조 문구 인증 마그네슘 보충제,불면증
펀더멘탈 포뮬라 테스토스테론에 도움 뛰어난 흡수율 핵심 천연 성분 강력한 포뮬라 빠르게 작용 보충제,불면증
숙면으로 아름다움을 찾으세요 건강 보조 식품 유전자 변형 성분 없음최적의 숙면을 회복하는 데 도움 스트레스를 건강하고 자연스럽게 해소하는 데 도움 젊고 건강한 피부에 도움,불면증
근육  신경 및 진정 작용을 위한 마그네슘 함유 가향 구미젤리 보충제 코셔 파르브 땅콩 무함유 견과류 무함유 유제품 무함유 글루텐 무함유 대두 무함유 계란 무함유,불면증
보충제 Nutricost 품질 보증 식물성 상품 GMP 인증 시설 유전자 변형 성분 무함유 상품 제3기관 검사 완료 글루텐 무함유,불면증
1회 제공량당 420mg 60회 제공량 보충제 Nutricost  품질 보장 식물성 상품 GMP 인증 시설 유전자 변형 성분 무함유 상품 제3기관 검사 완료 글루텐 무함유,불면증
1947년 설립 건강한 뼈 미네랄화 촉진 신경 및 근육 기능 지원 유전자 변형 성분 무함유 글루텐 무함유 인증 밀   유제품 무함유 비건에 적절함 K 파르브 보충제,불면증
시트레이트  말레이트  글리신산 근육 이완에 필수적인 미네랄 보충제 125종 이상의 살충제 및 제초제 성분 검사 완료 9가지 식품 알레르기 유발 성분 무함유  글리포세이트 잔여물 무함유 글루텐 무함유 식물성 B  corp  인증,불면증
1932년 설립 신뢰할 수 있는 품질 신경  뼈 및 근육 건강 강화 유전자 변형 성분 무함유 글루텐 무함유 무함유 성분  대두 보충제 ActivGels    액상 소프트젤신경계 건강 뼈 건강에 도움 효소 기능 근육 건강에 도움더 뛰어난 품질  순도 및 효능 검사 완료  개선된 전달 시스템  뛰어난 액상형 소프트젤 건강한 상품  글루텐 무함유 식단에 적합 ,불면증
신경계 건강에 도움 Magtein  함유 미네랄 보충제 1969년부터 과학에 기반한 고품질 상품 제공 Magtein ,불면증
보충제 글루텐 무함유 카제인 무함유,불면증
네 가지 생물학적 성분에서 얻은 최고의 마그네슘 효능 비건 유전자 변형 성분 무함유 글루텐 무함유 건강 보조 식품 GMP 제조 품질 보증 독립 기관 검사,불면증
1회 제공량당 원소 마그네슘 102mg 신경 및 근육 기능 지원 보충제 코셔 유전자 변형 성분 무함유 천연 색소   천연 향 젤라틴 무함유   식물성 땅콩   견과류 무함유,불면증
비타민 글루텐 무함유 유전자 변형 성분 무함유 허브 보충제 100  품질 만족 보장 DNA 검사 완료 식물 성분 긴장 완화 및 진정 효능이 있는 전통적인 성분 Tru ID 진품 인증,불면증
보충제 기분 전환  긴장 완화  숙면에 도움,불면증
일상적인 통증  근육 및 뼈 ATA Mg  | 글리신산 | 말레이트 생체이용성 높은 3가지 형태의 마그네슘 비건에게 적합 보충제,불면증
신경계 건강 증진 에너지 생성 증진 효소 기능에 중요 유전자 변형 성분 무함유 프로젝트 인증 보충제 채식주의자   비건에게 적합한 제품 미네랄 1968년 설립된 가족 기업 우수 제조 및 품질 관리 기준 GMP  품질 보증,불면증
보충제 건강 효능을 제공하도록 과학적으로 제조 튼튼한 뼈 및 치아에 도움 신경 및 근육 기능에 도움 GMP를 준수하는 고품질 상품,불면증
글루텐 무함유 유전자 변형 성분 무함유 LE 인증 긴장 완화를 위한 상품 보충제,불면증
허브 보충제 유전자 변형 성분 무함유 프로젝트 인증 1972년 설립 진정 및 긴장 완화 효과 1회 제공량당 1 000mg Discover Nature s Answer  글루텐 무함유 K 파르브 Bio Chelated  저온 추출 공법,불면증
Targeted Support  보충제인기 있는 마그네슘 형태의 조합 제공 건강한 에너지 생성에 도움이 될 수 있음 칼슘 및 기타 미네랄이 풍부한 건강한 식습관과 병행할 경우 뼈 및 근육 건강에 도움이 될 수 있음 신경계 건강에 도움이 될 수 있음,불면증
에너지 보조 식품 건강 보조 식품 아미노산 킬레이트 채식주의자 글루텐 미함유 품질 자연 보조 식품,불면증
보충제 뛰어난 흡수율 무가당 글루텐 및 대두 무함유 회복  균형  이완 효과 채식주의자 비건에게 적합,불면증
From Farm to Tablet  B  corp  인증 유전자 변형 성분 무함유 프로젝트 인증 글리포세이트 잔여물 무함유 125종 이상의 살충제 및 제초제 성분 검사 완료 글루텐 무함유 검사 완료 비건 인증 코셔 인증 유제품 및 대두 성분 무함유 근육 이완에 필수적인 미네랄 보충제,불면증
America s Integrative Cardiologist  심장 및 뼈 건강을 위한 네 가지 형태의 마그네슘 함유 보충제,불면증
Advanced Nutrition by Zahler  강력한 마그네슘 보충제 전반적인 건강 증진 보충제 코셔 파르브 유전자 변형 성분 무함유 글루텐 무함유 유제품 무함유 대두 성분 무함유 식물성 Feel Better  Everyday,불면증
건강보조식품 뼈 및 심장 건강 지원,불면증
임상 시험 완료    마그네슘 보충제 서방형 마그네슘 보충제 미국 판매 1위   8시간 서방형 It s Fun to Feel Good 간헐적인 다리 경련 및 근육 긴장 완화 CL 승인   CL 승인을 받았는지 확인하십시오 유전자 변형 성분 100  무함유 비건 상품 대두 무함유 글루텐 무함유,불면증
보충제 순한 비산성 비타민C 채식주의자에게 적합,불면증
항산화 작용 보충제 채식주의자 비건에게 적합 유전자 변형 성분 무함유 코셔 1968년 설립된 가족 기업 우수 제조 및 품질 관리 기준 GMP  품질 보증,불면증
1971년 설립 Target Mins 다른 Target Mins 킬레이트와 함께 사용하십시오  글루텐 무함유 인증 심혈관계 건강에 도움 근육 이완에 도움 뼈 건강 지원 보충제 B corp  인증 코셔진정성 청결도 신선도 일관성 정확성,불면증
근육 및 뼈 건강 캡슐당 200mg 미네랄 보충제 1969년부터 과학에 기반한 고품질 상품 제공,불면증
제약 등급 비교 대상  Mag Ox 400  무기물 보충제 글루텐 무함유 품질 보증 연구소 검사 완료,불면증
1969년 설립 전통적인 수면 보조제 TRU ID  진품 인증 유전자 변형 성분 무함유 프로젝트 인증 보충제 비건 상품 글루텐 무함유,불면증
스트레스 예방   진정   균형 유전자 변형 성분 무함유 프로젝트 인증 홀푸드 보충제 코셔 B  corp  인증 NSF   글루텐 무함유 인증 비건 인증 무설탕,불면증
밸류팩 보충제 자극제 무함유 복통을 유발하지 않음 삼키기 쉬움,불면증
근육통 완화  기타 천연 향료 함유 근육 휴식 및 회복  멜라토닌  타트체리 및 비타민D 보충제 인공 향료  색소 무함유 글루텐 무함유 B  corp  인증,불면증
1971년 설립 근육 이완에 도움 건강한 면역계 지원 적절한 칼슘 활용을 위한 필수품 보충제 B corp  인증진정성 청결도 신선도 일관성 정확성,불면증
Magtein 으로 제작 1회 제공량당 Magtein  2 000mg 보충제 비건 인증 글루텐 무함유 우수 제조 및 품질 관리 기준 GMP  준수 제3 기관 검사 완료 유전자 변형 성분 무함유 프로젝트 인증 품질에 중점을 둔 제품 젤라틴 무함유,불면증
스트레스 예방   진정   균형 유전자 변형 성분 미함유 인증 홀푸드 건강 보조 식품 코셔 사회적 기업 인증 글루텐 미함유 NSF 인증 비건 인증 무설탕,불면증
근육  신경 및 심장 건강 증진 캡슐당 420mg 50년 동안 신뢰받은 상품 보충제 우수한 포뮬라,불면증
Homeopathic Alcohol Free  Non Habit FormingNatural active ingredients Free of alcohol  gluten   sugar  Suitable for the whole family  VeganFor relief of occasional sleeplessness caused by stress   repetitive thoughts ,불면증
혁신적인 영양 공급 잘 흡수되는 순수 마그네슘 저자극성 보충제,불면증
뼈   근육 건강 지원 쉽게 삼킬 수 있도록 코팅되었습니다 미네랄 보충제 채식주의자에게 적합한 제품 품질 보증 시험기관 테스트 완료,불면증
저자극성 | 글루텐 무함유 보충제 Ultra Tested 우수 제조 및 품질 관리 기준 cGMP ,불면증
California Gold Nutrition 굿나잇 슬립 순하고 편안한 수면 유도 포뮬라 세인트존스워트  골무꽃  시계꽃 등 엄선한 식물 성분 함유 진정 및 건강한 수면 습관 유지에 도움  채식주의자와 비건에게 적합 글루텐  유전자 변형 성분  대두 무함유 cGMP 인증 시설에서 생산 100  골드 개런티 Gold Guarantee ,불면증
어린이용 수면 보조제 수면 장애 완화 자연적인 방식으로 건강 증진 빠르게 잠들고 오랫동안 잘 수 있는 비결 낮에 피로감 완화 동종 요법 의학의 세계적 리더 99 99  알코올 무함유 보존제  향료  염료 및 색소  락토오스  설탕 및 인공 감미료 무함유수면 장애 간헐적 각성 흥분 악몽 야경증 쉽게 잠들지 못하는 어린이의 잠 드는 시간 단축,불면증
어린이용 허브 포뮬라 진정 효과 보충제 GMP 진정한 알코올 무함유 상품 설탕 무함유 비건 상품 글루텐 무함유불안감 및 신경 완화 에너지 안정화 긴장 완화 촉진 수면 개선 진정 및 편안함,불면증
포타슘시트레이트   마그네슘시트레이트 1회 제공량당 마그네슘 210mg 1회 제공량당 칼륨 99mg 보충제 Nutricost  품질 보장 제3기관 검사 완료 GMP 인증 시설 유전자 변형 성분 무함유 상품 글루텐 무함유,불면증
1967년 설립 더 안정적이고 편안한 수면 지원 보충제 Mason 보증 품질 검사 완료 우수 제조 및 품질 관리 기준 GMP  인증 대두 무함유 나트륨 무함유,불면증
스트레스 예방   진정   균형 유전자 변형 성분 무함유 프로젝트 인증 홀푸드 보충제 코셔 B  corp  인증 NSF   글루텐 무함유 인증 비건 인증 무설탕,불면증
스트레스 예방   진정   균형 유전자 변형 성분 무함유 프로젝트 인증 홀푸드 보충제 코셔 B  corp  인증 NSF   글루텐 무함유 인증 비건 인증 무설탕,불면증
1971년 설립 글루텐 무함유 인증 근육 이완에 도움 뼈 건강 증진 보충제 코셔 B  corp  인증 IGEN 유전자 변형 성분 무함유 검사 완료진정성 청결도 신선도 일관성 정확성,불면증
스트레스 완화   긴장 완화   심장   근육   세포 건강   면역   뼈   신경 보충제 미국 1위 액상 마그네슘 브랜드  비건 인증 글루텐 무함유 우수 제조 및 품질 관리 기준 GMP  인증 제3 기관 검사 완료 차이를 느껴보십시오,불면증
신경계 건강 지원 3회 제공량당 마그네슘 400mg 이온성 미량 미네랄 코셔 유전자 변형 성분 무함유 프로젝트 인증 보충제 채식주의자 비건에 적합 미네랄 1968년 설립된 가족 소유 기업 우수 제조 및 품질 관리 기준 GMP  품질 보증,불면증
It s Fun to Feel Good 활력을 주는 마그네슘 보충제 100  유전자 변형 성분 무함유 글루텐 무함유 Albion Minerals 대두 무함유 비건,불면증
뛰어난 흡수율 마그네슘 400mg 보충제 심혈관계 건강 근육 기능 뼈 건강 강화 120회 제공량 글루텐 무함유 인공 보존제 무함유 효능 및 품질 보증 미국 식품의약국 FDA  등록 시설에서 제조,불면증
Science Based Nutrition  Magtein  Think Clearly 비건 보충제 기억력 및 인지 기능 건강 증진 유전자 변형 성분 무함유   글루텐 무함유   대두 무함유고유한 방식으로 뇌에 마그네슘 전달 기억력  학습 능력 및 집중력 지원 뇌 연결고리 시냅스 의 안정성 및 적응력 지원,불면증
수면  일상 스트레스   인지력 24  더 빠른 흡수율 ATA mG   두뇌를 위한 높은 생체이용률 마그네슘 비건 보충제,불면증
심장   근육   뼈   신경 강화 마그네슘 12mg 마그네슘 원소 225mg 비건 식물성 D3 함유 보충제 GMP 인증 품질 품질 검사 완료 유전자 변형 성분 무함유 비건 상품 정성을 담은 상품 높은 흡수율 마그네슘 미네랄 복합체 우수한 생체이용률 및 효능,불면증
잘 흡수되는 순수 마그네슘 보충제 저자극성,불면증
From Nature With Love  식물성 천연 식품 혼합물 함유 건강한 뼈  심장과 스트레스 완화를 위한 포뮬라 보충제 유전자 변형 성분 무함유 대두 무함유 글루텐 무함유 비건에게 적합 색소  보존제  향료 무함유 GMP 인증 Vitamin Angels 자랑스러운 서포터 비건 및 채식주의자에게 적합,불면증
보충제 스트레스 완화 코셔 비건 상품 글루텐 무함유 견과류 무함유,불면증
임상 연구를 거친 제품 불안   스트레스 완화 당신의 신경을 안정시키세요  신속한 효능 안전하고 효과적 건강을 위한 제품 건강 보조 식품 유전자변형성분 없음,불면증
저자극성 글루텐 무함유 보충제 Ultra Tested cGMP,불면증
4 000 mg  Equivalent Per Serving  Dietary Supplement  Nutricost  Quality Guaranteed Vegetarian Product  GMP Compliant Facility  Non GMO Product  Third Party Tested  Gluten Free,불면증
