description,category
California Gold Nutrition CurcuminUP  블랙 커민 씨오일  보스웰리아  생강 함유 오메가3 커큐민 복합체 Longvida  최적화된 커큐민 함유 관절 가동성 및 편안함 지원  글루텐  유전자 변형 성분  대두 무함유 cGMP 인증 시설에서 생산 100  골드 개런티 Gold Guarantee  ,통증 완화
California Gold Nutrition 보스웰리아 추출물 Boswellin  보스웰리아 추출물과 강황 추출물 함유 보스웰산 및 커큐미노이드 함유 균형 잡힌 면역 반응 증진  채식주의자와 비건에게 적합 글루텐  유전자 변형 성분  대두 무함유 cGMP 인증 시설에서 생산 100  골드 개런티 Gold Guarantee  ,통증 완화
플러스 유기농 생강   BioPerine  유기농 강황 커큐민 2 250mg 95 로 표준화된 커큐미노이드 500mg이 심장 건강을 증진하고 관절을 강화 보충제 비건 상품 유전자 변형 성분 무함유 글루텐 무함유 대두 무함유 ,통증 완화
Science Based Nutrition  강황 뿌리에서 추출 Curcumin Complex   및 BioPerine   함유 활성산소를 중화하여 관절 건강에 도움 보충제 유전자 변형 성분 무함유   글루텐 무함유   대두 무함유 활성산소를 중화하여 세포 조직에 도움을 줍니다  관절 건강을 증진합니다  BioPerine 은 소화관에서 영양소 흡수를 촉진합니다  ,통증 완화
항산화제 활성 지원 허브 보충제 글루텐 무함유 100  식물성 ,통증 완화
허브 보충제 표준화된 추출물 커큐미노이드 95  유전자 변형 성분 무함유 보충제 채식주의자 비건에 적합 코셔 식물성 허브 1968년 설립된 가족 기업 할랄 우수 제조 및 품질 관리 기준 GMP  품질 보증 ,통증 완화
허브 보충제 표준화된 추출물 커큐미노이드 95  유전자 변형 성분 무함유 보충제 채식주의자 비건에게 적합 코셔 식물성 허브 1968년 설립된 가족 기업 할랄 우수 제조 및 품질 관리 기준 GMP  품질 보증 ,통증 완화
전문 등급 베스트셀링 브랜드 건강한 염증 반응 지원 제3 기관 인증 검사 완료 천연 및 비건 제품 알레르기 유발 성분 무함유 및 글루텐 무함유 전문가 제조 자랑스러운 미국산 제품 고객 선호 제품 별 5개 보장 품질 검사 완료   제3 기관 순도 및 효능 인증 유전자 변형 성분 무함유 프로젝트 인증 30일분 천연 보충제 자연이 지켜온 최고의 비밀  강황 커큐민 GMP   우수 제조 및 품질 관리 기준 안전 지식 품질   진실한 약속 더 높은 기준 천연 제품 전문가 제조 강력한 1 500mg 강황 커큐민   이 강력한 포뮬라에는 1 500mg의 100  순수 강황 커큐민이 함유되어 있습니다  강황 추출물은 1회 제공량당 95  표준화 커큐미노이드를 함유하고 있습니다  BioPerine 을 통한 탁월한 흡수   당사의 제형에는 향상된 흡수율 및 생체이용률을 위해 1회 제공량당 10mg의 BioPerine 흑후추 추출물 이 함유되어 있습니다  전문가 제조   당사의 전문가 등급 보충제는 최고의 효능을 얻을 수 있도록 경험이 풍부한 전문가 팀이 만들었습니다  유전자 변형 성분 무함유 프로젝트 인증   당사는 유전자 변형 성분 무함유 식품 및 제품에 대해 북미에서 가장 신뢰할 수 있는 제3 기관 검증 요구 사항을 준수합니다  ,통증 완화
California Gold Nutrition Curcumin C3 Complex   강황 뿌리추출물 흡수율을 높이는 후추 추출물 함유 면역계 건강 및 황산화에 도움  심장 및 관절 건강 증진  채식주의자와 비건에게 적합 글루텐  유전자 변형 성분  대두 무함유 cGMP 인증 시설에서 생산 100  골드 개런티 Gold Guarantee  ,통증 완화
최대 45 5배 더 높은 생체이용률 보충제 유전자 변형 성분 무함유 LE 인증 ,통증 완화
심혈관계 및 관절 건강 풀 스펙트럼 허브 포뮬라 허브 보충제 관절 건강  운동성 및 신체 기능 개선 활성산소를 중화하는 항산화제 공급 생체이용률 향상 효과가 있는 흑후추 1969년부터 과학에 기반한 고품질 상품 제공 ,통증 완화
케이스 포장 Bayer  저용량 아스피린의 활성 성분 비교  열기 쉬운 뚜껑 진통제 NSAID    아스피린 요법   안전 코팅 믿음   품질   경험 경미한 고통과 통증을 일시적으로 완화하거나 의사의 권고에 따르십시오  이 제품은 서방형이므로 즉각적인 완화가 필요한 두통이나 기타 증상을 빠르게 완화하지는 않습니다  안전하게 코팅된 아스피린 81mg의 기타 용도에 대해서는 의사에게 문의하십시오  ,통증 완화
유기농 강황 커큐민으로 제조 유기농 생강   BioPerine  함유 유기농 강황 커큐민 2 250mg 보충제 비건에게 적합 유전자 변형 성분 무함유 글루텐 무함유 대두 무함유 BioPerine  ,통증 완화
보충제 가장 잘 흡수되는 형태의 커큐민  건강한 염증 반응 채식주의자 비건에 적합 순도   효능 보장 신체의 자연적인 염증 반응 강화 강력한 항산화 작용 관절 건강 및 기능 증진 심장 및 혈관 건강 증진 ,통증 완화
California Gold Nutrition  MEM Food 노루궁뎅이버섯  l 세린  블루베리  아세틸 l 카르니틴  강황  트랜스 레스베라트롤  소나무껍질추출물  PQQ가 함유된 MEM 혼합물 기억력 및 인지력 증진  채식주의자와 비건에게 적합 글루텐  유전자 변형 성분  대두 무함유 cGMP 인증 시설에서 생산 100  골드 개런티 Gold Guarantee  ,통증 완화
Science Based Nutrition  강황 뿌리에서 추출 Curcumin C3 Complex  및 BioPerine  함유 활성산소를 중화하여 관절 건강에 도움 보충제 Vegan  유전자 변형 성분  글루텐 및 대두 무함유 활성산소를 중화하여 세포 및 조직의 기능을 돕습니다  파괴 효소를 억제함으로써 연결 조직 증진에 도움을 줍니다  BioPerine 은 위장관에서 영양소 흡수를 증진시킵니다  ,통증 완화
Longvida Optimized Curcumin 혈뇌장벽 이동 우수한 생체이용률을 가진 자유 형태의 커큐민 보충제 채식주의자 및 비건에 적합 유전자 변형 성분 무함유 코셔 식물성 허브 1968년 설립된 가족 기업 우수 제조 및 품질 관리 기준 GMP  품질 보증 ,통증 완화
보충제 가장 잘 흡수되는 형태의 커큐민  건강한 염증 반응 채식주의자 비건에 적합 순도 및 효능 보장 신체의 자연적인 염증 반응 지원 강력한 항산화 작용 관절 건강 및 기능 증진 심장 및 혈관 건강 증진 ,통증 완화
95  커큐미노이드로 표준화 BioPerine 으로 제조 코코넛오일과 함께 제조 보충제 유전자 변형 없는 성분으로 제조 글루텐 무함유 우수 제조 및 품질 관리 기준 GMP  준수 제3기관 품질 검사 완료 Igen  유전자 변형 성분 무함유 검사 완료 특허받은 C3 Complex  ,통증 완화
관절 통증   근육 결림 부상으로 인한 부기 타박상 졸음을 유발하지 않음 알려진 약물 상호 작용 없음 동종 요법 약물 아르니카 천연 유효 성분  빠르게 녹는 알갱이 동종 요법 약품의 세계적 선두주자 증상이 처음 시작될 때 사용하십시오  경미한 부상  과도한 운동  낙상으로 인한 근육통 및 결림을 일시적으로 완화합니다  타박상으로 인한 통증  부기  멍 완화 ,통증 완화
커큐민 파이토솜 보충제 관절 강화 간 건강 증진 해독 GI 건강 증진 상처 부상 회복 글루텐 무함유 대두 무함유 관절 경직 완화 유연성 증대 경미한 통증과 근육통 완화 운동 스트레스로부터 근육 보호 및 지연발생근육통 DOMS  완화에 도움 트레이닝이나 운동으로 인한 근육 부상 완화 역연령의 영향으로부터 근육 조직 보호 신체 전반에서 균형 잡힌 염증 반응 유지 관절  근육  위장관  간  뇌  눈  신경 포함  건강한 콜레스테롤 대사 촉진 및 간 효소 상향 조절 정상적인 혈당 유지에 도움 시중에서 가장 많이 임상적으로 연구된 커큐민으로 일반 커큐민보다 흡수율이 29배 더 높음 30개 이상의 임상 시험에서 메리바 Thorne이 사용하는 커큐민 추출물 형태  사용 ,통증 완화
California Gold Nutrition 슈퍼 푸드 유기농 강황 분말 유기농 강황 뿌리로 제조 차  스무디  채소  수프에 따뜻하고 고소한 맛을 더하는 상품 건강한 식습관과 활동적인 라이프스타일을 위한 훌륭한 보충제  채식주의자와 비건에게 적합 글루텐  유전자 변형 성분  대두 무함유 cGMP 인증 시설에서 생산 100  골드 개런티 Gold Guarantee  ,통증 완화
글루텐 무함유 유전자 변형 성분 무함유 LE 인증 차세대 보스웰리아추출물 보충제 표준화된 보스웰리아 Boswellia serrata 추출물로 제조 5 LOX 효소활동 저해를 통해 건강한 염증 반응 강화 관절  동맥 건강 및 세포 분화 강화 ,통증 완화
패치형 OTC 국소 진통제 세계 1위 브랜드 가벼운 통증의 일시적 완화 요통 어깨 통증 뻣뻣한 목 관절 통증 8시간 동안 부착 관절염 좌상 경미한 요통 타박상 염좌 ,통증 완화
관절 건강 및 가동성 허브 보충제 관절 무결성  움직임 및 유연성에 도움 관절 건강에 도움 아유르베다 의사들이 수 세기 동안 사용 1969년부터 과학에 기반한 고품질 상품 제공 ,통증 완화
글루텐 무함유 유전자 변형 LE 추출물 무함유 때때로 발생하는 경미한 통증 및 불편함 완화 보충제 ,통증 완화
생강이 함유된 유기농 발효 강황 유기농 후추 및 소화를 돕는 프로바이오틱스 USDA 유기농 유전자 변형 성분 없음 프로젝트 인증 허브 보조제 코셔 QCS 인증 유기농 사회적 기업 인증 NSF 인증   글루텐 무함유 비건 인증 ,통증 완화
균형 잡힌 면역 반응 표준화된 보스웰리아 추출물 및 울금 뿌리 추출물 보충제 채식주의자 및 비건에 적합 코셔 식물성 허브 1968년 설립된 가족 기업 우수 제조 및 품질 관리 기준 GMP  품질 보증 ,통증 완화
글루텐 무함유 유전자 변형 성분 무함유 LE 인증 최대 7배 향상된 흡수력  보충제 거의 모든 기관계 건강에 효과적 일반 커큐민보다 최대 7배 높은 흡수율 관절 및 중요 기관의 염증 인자 억제에 도움 항산화 및 심혈관 건강상 이점 면역계 및 장 기능 강화 ,통증 완화
비타민 100  품질 만족 보장 글루텐 무함유 유전자 변형 성분 무함유 허브 보충제 DNA 검사 완료 식물 성분 TRU ID 진품 인증 전통적인 허브 보충제 ,통증 완화
보충제  팔미토일에탄올아마이드  간헐적 통증 및 불편감 완화 유전자를 변형하지 않은 정제 잇꽃 오일에서 자연적인 방식으로 추출 최고의 순도 채식주의자 비건에게 적합 ,통증 완화
후추   커큐민   생강 보충제 리포소말을 통한 전달 방식 아유르베다에서 영감을 얻은 제품 유전자 변형 성분 무함유 우수 제조 및 품질 관리 기준 cGMP  인증 ,통증 완화
California Gold Nutrition CurcuminUP  관절 운동성 및 편안함 지원  AlaskOmega  농축 오메가3 피쉬 오일 Longvida  강황추출물 Curcuma longa  블랙커민 씨오일  보스웰리아 및 생강 함유 무함유 성분  글루텐  유전자 변형 성분  대두 제3 기관이 검증한 우수 제조 및 품질 관리 기준 cGMP  인증 시설에서 제조 100  골드 개런티 100  Gold Guarantee  ,통증 완화
Science Based Nutrition  500mg 생물학적으로 이용 가능한 커큐민 관절 건강 증진에 도움 유전자 변형 성분 무함유   글루텐 무함유   대두 무함유   비건에게 적합 보충제 안정성이 강화되고 생체이용률이 뛰어난 커큐미노이드를 전달합니다  관절과 눈  전립선과 다른 기관의 기능을 건강하게 유지합니다  항산화 방어 메커니즘을 건강하게 관리합니다  ,통증 완화
신속한 통증 완화 목  등  어깨  다리 및 발 관절 통증   근육 결림 부상으로 인한 부기 타박상 빠른 흡수 파라벤 무함유 자연스러운 체내 작용 아르니카 천연 유효 성분 동종 요법 의약품의 세계적인 리더 경미한 부상  과도한 운동  낙상으로 인한 근육통 및 결림을 일시적으로 완화합니다  타박상으로 인한 통증  부기  멍 완화 ,통증 완화
25년 이상 지켜 온 프리미엄 품질 액티브 홀 스펙트럼 4 1 추출물 비건 유전자 변형 없는 성분으로 제조 글루텐 무함유 건강 보조 식품 우수 제조 및 품질 관리 기준 GMP  품질 보증   FDA 등록 Enhancing Nature s Miracles Since 1994 ,통증 완화
1947년 설립 더 많이  더 좋게  더 빠르게  185배 우수한 생체이용률  오래 가는 효과 유전자 변형 성분 무함유 글루텐  밀 및 유제품 무함유 보충제 ,통증 완화
글루텐 무함유 유전자 변형 성분 무함유 LE 인증 최대 45 5배 더 높은 생체이용률 보충제 유리형 커큐미노이드 복합체를 통한 커큐민의 다양한 효능 제공 표준 커큐민보다 생체이용률이 45배 더 높은 유리형 커큐미노이드 제공 표준 커큐민보다 총 커큐미노이드 흡수율 270배 더 높음 염증 인자를 억제하여 관절 및 장기 건강 증진하도록 도움 산화 스트레스 억제 및 심혈관계 건강 증진 두뇌  면역계  간 건강 지원 ,통증 완화
항산화제   관절 지원 Bioperine  함유 강황 커큐민 흡수율 향상을 위한 Bioperine  30회 제공량 보충제 커큐미노이드 95   1 500mg 천연 항산화제 지원 소염 지원 증량제 알레르기 유발 성분 무함유 흡수율 향상을 위한 Bioperine  비건 글루텐 무함유 유전자 변형 성분 무함유 ,통증 완화
근육통 및 근육 경직 부상으로 인한 부기 타박상 동종 요법 약품 빠른 흡수 끈적임 없음 향료 무함유 동종 요법 아르니카 통증 완화제 1위 신속한 통증 완화 동종 요법 의약품의 세계적 선두주자 신선한 아르니카 몬타나 식물로 제조 엄선된 원료 품질 검사 완료 1932년부터 유지해 온 최고의 품질 경미한 부상 과도한 운동 낙상 통증 부기 멍 ,통증 완화
항산화 효과 보충제 글루텐 무함유 비건 베지 캡슐 NSF  유전자 변형 성분 무함유 인증 ,통증 완화
보충제 관절 강화 간 해독 GI 지원 상처 부상 글루텐 무함유 Thorne 독점판매 제품 대두 성분 무함유 관절 경직 완화 유연성 증대 경미한 통증과 근육통 완화 운동 스트레스로부터 근육 보호 및 지연발생근육통 DOMS  완화에 도움 트레이닝이나 운동으로 인한 근육 부상 완화 역연령의 영향으로부터 근육 조직 보호 신체 전반에서 균형 잡힌 염증 반응 유지 관절  근육  위장관  간  뇌  눈  신경 포함  건강한 콜레스테롤 대사 촉진 및 간 효소 상향 조절 정상적인 혈당 유지에 도움 시중에서 가장 많이 임상적으로 연구된 커큐민으로 일반 커큐민보다 흡수율이 29배 더 높음 30개 이상의 임상 시험에서 메리바 Thorne이 사용하는 커큐민 추출물 형태  사용 ,통증 완화
패치형 OTC 국소 진통제 세계 1위 브랜드 가벼운 통증의 일시적 완화 요통 어깨 통증 뻣뻣한 목 관절 통증 8시간 동안 부착 넓은 부위용 관절염 좌상 경미한 요통 타박상 염좌 ,통증 완화
멘솔 10    메틸살리실레이트 30  즉각적인 효과 경험 근육 및 관절 통증을 강력하게 완화 시원해지면서 완화  따뜻해지면서 편안함 끈적임 없음 경미한 요통 근육 좌상 염좌 타박상 관절염 염좌 경미한 요통 타박상 경련 근육 좌상 ,통증 완화
California Gold Nutrition Superfoods GoldenCeps  카페인이 없는 인스턴트 유기농 강황 음료 유기농 강황  아슈와간다  동충하초  영지버섯 및 향신료 USDA 유기농  ECOCERT 유기농 인증 인공 감미료 무함유  인공 보존제 무함유 글루텐 무함유  유전자 변형 성분 무함유  대두 무함유 cGMP 인증 시설에서 생산 100  골드 개런티 Gold Guarantee  ,통증 완화
Curcumin Complex C3  강황 추출물 항산화 지원 제공 관절 기능 지원 보충제 글루텐 무함유 비건 채식주의자 비건에 적합 베지 캡슐 NSF 유전자 변형 성분 무함유 인증 ,통증 완화
보충제 가장 잘 흡수되는 형태의 커큐민  염증에 정상적으로 대응 채식주의자 비건에게 적합한 제품 순도 및 효능 보장 신체의 자연적인 염증 반응 촉진 강력한 항산화 작용 관절 건강 및 기능 증진 심장 및 혈관 건강 증진 ,통증 완화
비타민 및 보충제 브랜드 약사 추천 1위  표준화 추출물 함유 항산화 효과 허브 보충제 색소 무함유 인공향료 무함유 보존제 무함유 글루텐 무함유 ,통증 완화
1973년 설립 기업 신체에 필요한 영양소를 공급하는 추출물로 제조 보충제 65  보스웰리아 애씨드 관절 건강 품질 검사 완료 건강한 삶 지원 ,통증 완화
글루텐 무함유 높은 생체이용률 조합 유전자 변형 성분 무함유 LE 인증 보충제 ,통증 완화
관절 건강 및 가동성 허브 보충제 750mg 피부 건강  관절 건강  운동성 및 신체 기능 개선 항산화 효과 제공 Full Spectrum  천연 허브 뿌리줄기 포뮬라 1969년부터 과학에 기반한 고품질 상품 제공 ,통증 완화
1973년 설립 관절 건강 USDA 유기농 인증 품질 검사 완료 비건 보충제 건강한 삶 지원 ,통증 완화
Lake Avenue Nutrition 커큐민 95 표준화된 강황 추출물 항산화 지원  심장 건강 및 인지 건강  관절 건강에 도움  글루텐  유전자 변형 성분 및 대두 무함유 우수 제조 및 품질 관리 기준 GMP  인증 시설에서 생산 ,통증 완화
관절 건강 표준화된 강황 추출물 브로멜라인 2400 GDU g 건강 보조 식품 채식주의자   비건 코셔 일반 건강 1968 년 설립된 가족 기업 GMP 품질 보증 ,통증 완화
정신을 차분하게 안정시키는 제품 USDA 유기농 인증 미국 뉴햄프셔 농림산업식품부 유기농 인증 글루텐 무함유 인증 크루얼티프리   Leaping Bunny 인증 B  corp  인증 유기농 인증   100  천연 ,통증 완화
건강한 관절 유지 생체이용률이 높은 강황 추출물 30건이 넘는 임상 연구로 검증된 상품 유전자 변형 성분 무함유 보충제 채식주의자 비건에게 적합 코셔 식물성 허브 1968년 설립된 가족 기업 할랄 우수 제조 및 품질 관리 기준 GMP  품질 보증 ,통증 완화
Science Based Nutrition  Meriva    생물학적으로 이용 가능한 커큐민 관절 건강 증진에 도움 비건에게 적합   유전자 변형 성분 무함유   글루텐 무함유   대두 무함유 보충제 안정성이 강화되고 생체이용률이 뛰어난 커큐미노이드를 전달합니다  관절과 눈  전립선과 다른 기관의 기능을 건강하게 유지합니다  항산화 방어 메커니즘을 건강하게 관리합니다  ,통증 완화
허브 보조제 USDA 유기농 유전자 변형 성분 미함유 프로젝트 인증 B Corporation 인증 코셔 할랄 Aditi Organic Certifications Pvt  Ltd  인증 유기농  비건 식물성 글루텐 무함유 ,통증 완화
플러스 강황 추출물 50 mg  커큐미노이드 95 로 표준화 항산화 건강 지원 허브 건강 허브 건강 보조 식품 품질 보증 시험기관 테스트 완료 ,통증 완화
USDA 유기농 인증 유전자 변형 성분 무함유 프로젝트 인증 유기농 발효 천연 강황   생강 소화를 돕는 유기농 흑후추   프로바이오틱 2개월분 허브 보충제 코셔 QCS 유기농 인증 B  corp  인증 비건 인증 NSF 글루텐 무함유 인증 생산 유통 이력제  검사 완료   믿을 수 있는 성분 제3 기관 감사  유기농 인증   유전자 변형 성분 무함유 인증 전문가가 조제 건강한 염증 기능에 도움  신체 항산화 반응에 도움  소화 기능을 향상하는 프로바이오틱   유기농 흑후추 추출물  ,통증 완화
Meriva  항산화 효과 보충제 비건 제품 NSF 유전자 변형 성분 무함유 인증 ,통증 완화
기타 천연 향료 첨가 보충제 심장 건강 증진 소화 기능 보조 관절 강화 면역력 강화 염증 지원  채식주의자에게 적합 글루텐 무함유 유전자 변형 성분 무함유 ,통증 완화
USDA 유기농 인증 유전자 변형 성분 무함유 프로젝트 인증 유기농 발효 강황 및 생강 진짜 과일로 제조 글루텐 무함유 Real Food 허브 보충제 코셔 NSF   글루텐 무함유 인증 비건 인증 B  corp  인증 QCS 유기농 인증 ,통증 완화
프리미엄 | 식물성 슈퍼푸드 풍부한 필수 영양소 20칼로리   필수 영양소 제공   저온 건조   1회 제공량 5g당 고함량 커큐민 공급원  따뜻하고 편안해지는 맛과 향 주방의 웰빙   필수 아이템 USDA 유기농 유전자 변형 성분 없음 프로젝트 인증 고대의 보물 울금  전통 아유르베다 약재 커큐민  강력한 시스템 밸런서 흑후추  더 효과적인 흡수를 위해 글로벌 사회적 기업 인증 코셔 글루텐 무함유 비건 Control Union Certifications 유기농 인증 BPA 무함유 긍정적인 마음   긍정적인 분위기   긍정적 삶 ,통증 완화
건강한 염증 반응 강화 보충제 With Curcumin C3 Complex  강력한 항산화제 성분 건강한 염증 반응 ,통증 완화
100  품질 만족 보장 글루텐 무함유 유전자 변형 성분 무함유 보충제 탁월한 맛 베지 포뮬라 ,통증 완화
보충제 ,통증 완화
강황 95  추출물 산화 방지제 보조 허브 보충제 글루텐 무함유 품질 보증 검사 완료 100  식물성 ,통증 완화
글루텐 무함유 유전자 변형 성분 무함유 LE 인증 면역계 기능을 증진하는 강황 포뮬라 보충제 신체의 자연스럽고 건강한 염증 반응과 면역 반응 사이의 균형을 유지하는 데 도움 염증 인자 억제를 통해 면역계 기능 및 전신 건강을 강화 Curcumin Elite 는 표준 커큐민 대비 생체이용률이 45배 더 높은 유리 커큐미노이드를 제공하며 총커큐미노이드 흡수율이 270배 더 높음 ,통증 완화
관절 건강 및 가동성 캡슐당 720mg 허브 보충제 피부 건강  관절 건강  운동성 및 신체 기능 개선 항산화 효과 제공 1969년부터 과학에 기반한 고품질 상품 제공 ,통증 완화
관절 건강 및 운동성 캡슐 1정당 300mg 허브 보충제 관절 건강  가동성 및 신체 기능 강화 활성산소를 중화하는 항산화제 공급 근골격계 건강 강화 1969년부터 과학에 기반한 고품질 상품 제공 ,통증 완화
California Gold Nutrition MEM Food  60팩 노루궁뎅이버섯  l 세린  블루베리  아세틸 l 카르니틴  강황  트랜스 레스베라트롤  소나무껍질추출물  PQQ가 함유된 MEM 혼합물 기억력 및 인지력 증진  채식주의자와 비건에게 적합 글루텐  유전자 변형 성분  대두 무함유 cGMP 인증 시설에서 생산 100  골드 개런티 Gold Guarantee  ,통증 완화
보충제 건강 증진 비건 젤라틴 무함유 천연 향료  색소 글루텐 무함유 ,통증 완화
더 많이  더 좋게  더 빠르게  185배 더 뛰어난 생체이용률  오래 가는 효과 유전자 변형 성분 무함유 글루텐  밀   유제품 무함유 보충제 ,통증 완화
동종 요법 두통 허리 통증 근육통 다리 경련 좌골 신경통 ,통증 완화
개선된 접착력  냄새 없음 냄새 없는 패치 브랜드 1위 통증 완화 강력한 통증 완화 빠른 효과 무자극성 통증 완화 연고가 있는 통기성 접착 패드 신경에 표적화되어 작용 플렉시블 패브릭 활동적인 모습으로 빠르게 회복 깔끔한 표적 완화  허리  목  다리  팔 ,통증 완화
패치형 OTC 국소 진통제 세계 1위 브랜드 자극받은 신경을 둔감하게 만듦 8시간 동안 부착 통증 감각 완화 둥근 모서리로 부착력 개선 가운데 절개 필름으로 간편한 부착 전 방향으로 늘어남 낱개 포장 어린이 개봉 방지 포장 허리 목 어깨 무릎 및 팔꿈치 ,통증 완화
통증 부어오름 변색 동종요법 약품 빠르게 흡수되는 젤 번들거리지 않습니다 파라벤 없음 아르니카 천연 성분 동종요법 의약품의 세계적 리더 Boiron 동종요법 아르니카를 함유한 최고의 진통제 ,통증 완화
