effect,category
클로로겐산의 편리한 공급원 유전자 변형 성분 무함유 LE 인증 보충제식사 후 건강한 상태의 포도당 수치 유지에 도움 최적의 포도당 수치를 지원하기 위해 클로로겐산 50 로 표준화 건강한 혈당 대사를 증진하기 위해 효소 활성을 억제 보다 많은 페놀 함량을 위해 그린 커피콩으로 생산,체중 조절
비건 글루텐 무함유 자극제 무함유 지방 연소제 보충제 GMP 등록 시설에서 제조체중 관리 신진대사 식욕 증진 항산화 수치 체성분 에너지 수치,체중 조절
건강한 포도당 대사 활성산소 제거제 이미 정상적인 범위에 있는 혈당 수준을 지원합니다  유전자 변형 성분 무함유 프로젝트 인증 보충제 채식주의자 비건 제품 코셔 식물성 허브 1968년에 설립된 가족 기업 우수 제조 및 품질 관리 기준 GMP  품질 보증,체중 조절
중쇄중성지방 코코넛오일에서 추출 보충제 유전자 변형 없는 성분으로 제조 글루텐 무함유 우수 제조 및 품질 관리 기준 GMP  인증 제3 기관 검사 완료 인증C8 및 C10 지방산 함유 IGEN  유전자 변형 성분 무함유 검사 완료 코코넛오일에서 추출,체중 조절
보충제 500mg 크로뮴 250mcg 함유  소화 및 체중 감량에 도움  초모 로 발효 칼로리 제로 채식주의자 비건에게 적합,체중 조절
America s  1 Selling Weight Loss Supplement Brand   0 Sugar 0 Calories Natural Flavors 2x The Weight Loss  Meta Energy  Key Electrolytes Paraxanthine A Metabolite of Caffeine Dietary Supplement Performance Formula Hair   Skin Support ,체중 조절
1967년 설립 에너지 대사를 지원할 수 있음 보충제 Mason 보증 품질 검사 완료 cGMP 인증   우수 제조 및 품질 관리 기준 인증,체중 조절
1969년 설립 100  효능 증량용 오일 무함유 중쇄중성지방 제공량당 3g  보충제 글루텐 무함유 비스페놀A 무함유100  중쇄중성지방   1회 제공량당 중쇄중성지방 3g  빠르게 소화되어 뇌와 몸을 위한 에너지로 전환  쉽게 포만감을 느낄 수 있음  프리미엄 코코넛 추출물만 사용   팜오일 및 기타 충전제 오일 무함유  무맛  무향  헥산 무함유  편리한 소프트젤 형태의 중쇄중성지방 ,체중 조절
심혈관계 건강 캡슐당 400mg 허브 보충제 심혈관계 건강 증진 Full Spectrum 천연 뿌리 포뮬라 1969년부터 과학에 기반한 고품질 상품 제공,체중 조절
1967년 설립 피콜린산크로뮴  5 HTP  발열 허브 성분 함유 보충제 Mason 보증   품질 검사 완료 우수 제조 및 품질 관리 기준 GMP  인증,체중 조절
액상 포뮬라 신진대사 지구력 및 회복력 항산화 지원 천연 향료 제3기관 검사 완료 총 31회 제공량 품질 보장 보충제,체중 조절
미국 판매 1위 체중 감량 보충제 브랜드   강력한 체중 감량 효과  신진대사 및 에너지 촉진  모발  피부와 손발톱 건강 지원 철분   엽산 함유 과학적으로 연구된 체중 감량 핵심 성분 보충제 여성을 위한 포뮬라  과학   품질   순도,체중 조절
수분 균형을 지원합니다 덜 붇고 부푼 느낌 전해질 및 필수 미네랄을 보충합니다 건강 보조 식품 보존제 무 첨가,체중 조절
수분 균형을 지원합니다 덜 붇고 부푼 느낌 전해질 및 필수 미네랄을 보충합니다 건강 보조 식품 보존제 무 첨가,체중 조절
USDA 유기농 인증 유전자 변형 성분 무함유 프로젝트 인증 신체 및 두뇌에 빠르게 연료를 공급 중쇄중성지방   13g 보충제 MK 파르브 비건 인증 글루텐 무함유 인증 BPA 무함유 B  corp  인증 QCS 유기농 인증1회 제공량당 MCT 13g 카프릴산 및 카프릭산 포함  지속 가능한 방식으로 재배된 유기농코코넛추출물만 사용 팜유 및 기타 충전용 오일 무함유 헥산 무함유 비하이드로제네이티드  트랜스 지방 무함유 팔레오 인증 및 케토 식단 친화적,체중 조절
USDA 유기농 유전자 변형 성분 무함유 프로젝트 인증 무가공 천연 바닐라 건강한 이동식   단백질 20g 쉬운 소화   생 프로바이오틱스   설탕 무함유 코셔 비건 유제품 또는 대두 성분 없이 제조 B corp  인증 QCS 유기농 인증 Informed Choice org Trusted by sport 인증 NSF 글루텐 무함유 인증 에너지 증진   순근육 조성   포만감 유지깨끗한 유기농 식물성 단백질 20g 44종의 슈퍼푸드 첨가 설탕 1g 미만 15억 생 프로바이오틱스   효소 21종의 유기농 식품 비타민   미네랄 유기농 섬유질 7g,체중 조절
세포 기능 지원 매일 1회 보충제 유전자 변형 성분 무함유 LE 인증건강한 세포 신호 전달   기능을 지원 세포 신호 전달에 반드시 필요한 효소를 활성화 심혈관계 건강 증진 건강한 지방 대사 촉진 건강한 피부 세포 분열 촉진,체중 조절
에너지와 신진대사 의약품 등급 보충제 몸과 마음에 활력을 주는 영양 공급 신체 운동 능력 향상에 도움 코코넛오일로만 제조 1969년부터 과학에 기반한 고품질 상품 제공,체중 조절
Left Coast Performance 프리바이오틱 아카시아 섬유소 함유 보충제 유전자 변형 성분 무함유 목초 사육,체중 조절
USDA 유기농 인증 애플 사이다 식초 500mg 보충제 비건 인증 코셔 CCOF 유기농 인증,체중 조절
밸류 사이즈  Super Citrus Lipo Burner 저장된 지방 분해 지원 자몽  스위트오렌지  블러드오렌지 및 Sinetrol  함유 보충제 NSF 성분 인증,체중 조절
혈당 건강 증진 실론 시나몬 함유 허브 보충제 혈당 대사 및 심혈관 건강 지원 신진대사 증진 정상 범위에 있는 혈당 수치 유지에 도움 1969년부터 과학에 기반한 고품질 상품 제공,체중 조절
울트라 클린 에너지 및 인지 기능 향상 Enfinity 의 효능 30일분 보충제 열을 발생시키는 Axivite   탄수화물 및 지방 대사  체중 감량 효과 2배  에너지 집중력에너지 최적화 인지 기능 향상 집중력 지속,체중 조절
아미노산   에너지   체중 감량 언제나 맛있는 에너지  설탕 무함유 케토 승인 지방 감소 촉진 에너지 증진 땅콩 무함유 글루텐 무함유 천연 색소 l 카르니틴  l 타르타르산염 1g   타우린 1g   코코넛워터 250mg   천연 및 인공 색소 보충제 수크랄로오스로 단맛 첨가,체중 조절
보충제 1회 제공량당 500mg Nutricost  품질 보장 제3기관 검사 완료 유전자 변형 성분 무함유 글루텐 무함유 식물성 상품 GMP 인증 시설,체중 조절
카프릴산 및 카프릭산 뇌와 신체의 연료 100  유기농 코코넛 커피 및 셰이크에 혼합 가능 유제품 및 글루텐 무함유 케토 USDA 유기농 인증 유전자 변형 성분 무함유 프로젝트 인증 보충제 비건 인증 QAI 유기농 인증 BPA 무함유 케토 인증 제품 Paleo 인증,체중 조절
기분과 집중력을 향상시킵니다 건강 보조 식품 임상 실험을 마친 성분 사프론은 기분을 좋게 합니다 아쉬와간다는 스트레스 효과를 줄여줍니다 로디올라는 정신 기능을 향상시킵니다,체중 조절
Health   Nature   Life 자극제 무함유 순수 강낭콩 추출물 캡슐당 추출물 500mg 건강 보조 식품,체중 조절
손쉬운 칼로리 연소 능력 증대 빠르게 작용하는 액상 소프트젤 최고의 효과 Triple Fat Burner  보충제백차 홍차 녹차칼로리 연소량 증가 열 발생   지방 연소 촉발 지방 산화   강력한 항산화제 보호 지방 연소   1회 제공량당 300mcg EGCG 에너지 증진  비타민B군 항산화 작용  비타민 C  E,체중 조절
식욕 억제 모든 체중 관리 프로그램에 적합 혈당 지수가 낮아 이미 정상 범위에 있는 혈당 수치를 건강하게 유지 보충제 순도 및 효능 보장 채식주의자 비건에게 적합,체중 조절
체중 관리 허브 보충제 건강한 체중 촉진 건강한 신진 대사 촉진 건강한 세라토닌 및 코티솔 수치 유지 관리 1969년부터 과학에 기반한 고품질 상품 제공,체중 조절
미국 판매 1위 체중 감량 보조제 브랜드   탄수화물  단백질 및 지방 대사  화상 칼로리 3 에너지 증가 4 설탕 무함유 체중감량 과학적 연구 핵심성분 1 각성제 규모   135mg 카페인 보충제 천연 인공 향료,체중 조절
미국 판매 1위 체중 감량 보조제 브랜드   탄수화물  단백질 및 지방 대사  화상 칼로리 3 에너지 증가 4 설탕 무함유 체중감량 과학적 연구 핵심성분 1 각성제 규모   135mg 카페인 보충제 천연 인공 향료,체중 조절
건강한 지방 감소 촉진  기타 천연 향료 함유 무가탕 글루텐 무함유 유전자 변형 성분 무함유 LE 인증 보충제 식물성식단과 운동을 병행할 경우 지방 및 체중 감량 촉진 내장 및 피하 지방 감소에 도움 임상 전 연구에서 복부 지방을 50  가까이 감량하도록 유도,체중 조절
혈당 건강 증진 캡슐당 375mg 허브 보충제 심혈관계 건강 및 혈당 대사에 도움 신진대사 증진 혈당 수치 관리 1969년부터 과학에 기반한 고품질 상품 제공,체중 조절
1994년 설립 허브 보충제 실론 유기농 계피로 제조 유전자 변형 성분 무함유 인증 성분  글루텐 무함유 Oregon Tilth 유기농 인증 OTCO ,체중 조절
향상된 발열 포뮬라 ForsLean  포스콜리 Coleus Forskohlii  함유 건강한 지방 대사 촉진 Carnipure 보충제 채식주의자 비건에게 적합 유전자 변형 성분 무함유 코셔 식물성 허브 1968년 설립된 가족 기업 우수 제조 및 품질 관리 기준 GMP  품질 보증,체중 조절
USDA 유기농 인증 유전자 변형 성분 무함유 프로젝트 인증 건강한 이동식   단백질 20g 쉬운 소화   생 프로바이오틱   첨가당 무함유 코셔 비건 제품 유제품 또는 대두 성분 없이 제조 B  corp  인증 QCS 유기농 인증 Informed Choice org Trusted by sport 인증 획득 NSF 글루텐 무함유 인증 에너지 증진   순근육 조성   포만감 유지깨끗한 유기농 식물성 단백질 20g 44종의 슈퍼 푸드 첨가 설탕 1g 미만 15억 마리의 살아 있는 프로바이오틱   효소 22종의 천연 식품 비타민 및 미네랄 유기농 섬유소 3g,체중 조절
비타민 글루텐 무함유 유전자 변형 성분 무함유 보충제 1회 제공량당 1 200mg 비건에게 적합 DNA 검사 완료 식물 성분 인증된 정품 Tru ID  식물성 포뮬라,체중 조절
체액 균형 허브 보충제 정신  신체  가정을 위한 전반적인 웰니스 증진 최고의 순도 및 효능 1969년부터 과학에 기반한 고품질 상품 제공,체중 조절
단백질 20g 44종의 슈퍼 푸드 첨가 USDA 유기농 인증 유전자 변형 성분 무함유 프로젝트 인증 Informed Choice Org Trusted by Sport 인증 NSF 글루텐 무함유 인증 가벼운 감미   스테비아 무함유 유기농 셰이크 및 대용식 휴대용 건강식 소화가 쉬움 살아 있는 프로바이오틱스 및 효소 코셔 비건 유제품 또는 대두 성분 없이 제조 28회 제공량 QCS 유기농 인증 에너지 강화 탄탄한 근육 생성 포만감깨끗한 유기농 식물성 단백질 20g 44종의 슈퍼 푸드 첨가 스테비아 무함유 살아 있는 프로바이오틱 15억 및 효소 21종의 유기농 식품 비타민 및 미네랄 유기농 섬유소 2g,체중 조절
순도 및 효능 검사 완료 지방 감소에 도움 순근육 증가 지방 산화 개선 보충제 GMP 준수 시설에서 생산,체중 조절
발열 지방 연소 에너지 및 정신 집중 신진대사 증진 식욕 증진 강력한 지방 연소제 글루텐 무함유 보충제 GMP 등록 시설에서 제조체중 관리 식욕 억제 글루텐 무함유 식단 에너지 집중력 신진대사,체중 조절
100  코코넛오일 원료 중쇄중성지방 카프릴산   카프릭산 C8   C10 빠른 연료 두뇌 활동에 필요한 에너지 신진대사에 필요한 연료 케토 친화 제품 보충제 채식주의자 비건에게 적합 코셔두뇌를 위한 빠른 에너지 공급 근육을 위한 빠른 신진대사 연료 공급 저탄수화물 케토 식단 지원무향 100  순수 코코넛오일로 제조,체중 조절
체중 관리 탄수화물 조절에 도움 지방 대사 촉진 흰강낭콩 추출물 채식주의자에게 적합 보충제,체중 조절
신진대사 보충제건강한 신진대사 지원 갑상선 건강 증진 에너지 강화,체중 조절
의사가 승인한 포뮬라 냉장 보관 불필요 전문가 등급 애플 사이다 식초 및 녹차 함유 체중 관리에 도움 100  천연 성분 프리바이오틱 150억CFU 보충제 유전자 변형 성분 무함유 글루텐 무함유 cGMP 우수 제조 및 품질 관리 기준 프로바이오틱이 장에 도달할 때까지 보호해 주는 내산성 캡슐 특허 받은 상온 보관 CSP  용기를 사용해 프로바이오틱 생존률을 향상 품질 검사 완료   제3 기관 인증을 받은 효능 및 순도 엑스트라 스트렝스 프로바이오틱 함유소화  배출 건강에 도움 임상 시험 완료된 Greenselect  함유 자연적인 지방 연소를 촉진하는 Capsimax  디톡스 및 정화를 돕기 위해 제조된 상품,체중 조절
빠른 에너지 베이킹 요리에 적합 크림같이 부드러운 셰이크 말토덱스트린 불포함,체중 조절
체중 관리 키토산 및 흰강낭콩 함유 보충제 식이 탄수화물 및 지방이 미치는 영향 최소화 키토산 및 Phase 2 전분 차단제 함유 1969년부터 과학에 기반한 고품질 상품 제공,체중 조절
25년 이상 지켜 온 프리미엄 품질 사프란 액티브 홀 스펙트럼 추출물 비건 유전자 변형 성분 무함유 글루텐 무함유 보충제 GMP 인증 및 미국 식품의약국 등록 Enhancing Nature s Miracles Since 1994,체중 조절
보충제 심장 혈관 건강 지원 신진대사 촉진 글루텐 무함유,체중 조절
진정한 계피 친환경 포장 USDA 유기농 인증 유전자 변형 성분 무함유 프로젝트 인증 비건 인증 글루텐 무함유 EcoCert SA 유기농 인증,체중 조절
프리바이오틱 슈퍼 푸드와 초모 함유 훌륭한 맛 천연 향료 보충제소화 기능 촉진 체중 관리 활력 면역 건강 혈당인공 색소 무함유 인공 향료 무함유 젤라틴 무함유 인공 감미료 무함유 보존제 무함유,체중 조절
천연 클렌저 소화 기능 촉진 보충제 각성제 없는 체중 관리정상적인 소화 몸 속 정화 체중 조절 글루텐 무함유 비건,체중 조절
가장 신뢰할 수 있는 프로바이오틱 브랜드  카페인   자극제 무함유 장내 Microbiome과 자연적으로 협력하여 안전하게 체중을 관리 지방  탄수화물   단백질 대사 촉진 하루 1회 프로바이오틱 보충제 임상적으로 검증된 균주 2종 젤라틴 무함유 인공 염료 무함유 무설탕  비건 친화적 유전자 변형 성분 무함유 천연 원료 LGG  전 세계 가장 많은 임상 연구를 거친 균주  순도   효능 보장    유제품  글루텐  대두 무함유 The Culturelle  Difference 안전한 체중 관리를 위해 건강한 신진대사 촉진   에너지 생성 지원 건강한 라이프 스타일에 기여,체중 조절
체중 관리 흰강낭콩 추출물 성분 보충제,체중 조절
청정 활성 영양소 필수 아미노산 5g 체중 관리 정신 집중 천연   인공 향료 제로 칼로리 설탕 무함유 제3 기관 검사 완료 보충제 CarnoSyn  카르노신 합성제 InnovaTea ,체중 조절
비타민 100  품질 만족 보장 글루텐 무함유 유전자 변형 성분 무함유 보충제 전통적인 허브 보충제,체중 조절
체중 관리 식물성 보충제 정신  신체  가정을 위한 전반적인 웰니스 증진 최고의 순도 및 효능 1969년부터 과학에 기반한 고품질 상품 제공 식물성,체중 조절
1978년 설립 신진대사 강화 허브 24종 유전자 변형 성분 무함유 제품 글루텐 무함유 채식주의자에게 적합 제3자 테스트 완료 건강 보조 식품 지방 감량 촉진 에너지 증진   식욕 감퇴 녹차 및 가르시니아,체중 조절
,체중 조절
에너지와 신진대사 의약품 등급 보충제 몸과 마음에 활력을 주는 영양 공급 신체 운동 능력 향상에 도움 코코넛오일로만 제조 1969년부터 과학에 기반한 고품질 상품 제공,체중 조절
Left Coast Performance 프리바이오틱 아카시아 섬유소 함유 보충제 유전자 변형 성분 무함유 목초 사육,체중 조절
USDA 유기농 인증 애플 사이다 식초 500mg 보충제 비건 인증 코셔 CCOF 유기농 인증,체중 조절
보충제 비건 친화적 상품,체중 조절
항산화 효과 폴리페놀 60  허브 보충제 정신  신체  가정을 위한 전반적인 웰니스 증진 최고의 순도 및 효능 1969년부터 과학에 기반한 고품질 상품 제공,체중 조절
어드밴스드 포뮬라 천연 이뇨제 수분 배출 및 복부 팽만감 완화 보충제 향상된 천연 이뇨제 포뮬라 당일 수분 배출 효과 복부 팽만감을 완화하고 날씬한 복부 완성 건강한 체액 균형을 위한 주요 전해질 함유 안전하고 강력한 효과 남녀 공용,체중 조절
과학   혁신   품질   효과 공액리놀레산 천연 잇꽃 오일에서 추출 95  활성 공액리놀레산 이성질체 순도 및 효능 검사 완료 품질 보증 보충제 의약품 등급 모든 생산 단위에 대해 품질 검사 완료 우수 제조 및 품질 관리 기준 cGMP  등록 시설 글루텐 무함유 검사 완료,체중 조절
미국 판매 1위 보충제 기업에서 제공  최고 발열 효과의 강력한 에너지 및 집중력 체중 감량 효과 두 배  로부스타 커피콩 C  canephora robusta  200mg Zynamite  100mg 알파 리놀렌산 200mg 그레인즈 오브 파라다이스 20mg 보충제,체중 조절
식물성 원료 99mg 칼륨 파슬리  호스테일  우바우르시 건강 보조 식품 및 다이어트 계획,체중 조절
1947년 설립 공액리놀레산 유전자 변형 성분 무함유 글루텐  밀  유제품 무함유 보충제,체중 조절
1회 제공량당 중쇄중성지방 6g 두뇌에 에너지 공급 활기 충전 일상생활에 에너지 충전 코셔 유제품 보충제 USDA 유기농 인증 유전자 변형 성분 무함유 프로젝트 인증 케토 인증 Whole30 Approved  글루텐 무함유 비건 BPA 무함유 유기농 인증 기관  QAI아침에 뇌를 깨우고 에너지 공급 운동 전 활력 충전 하루를 위한 연료를 공급하고 식욕 억제,체중 조절
식물성 성분 보충제 대두 무함유 글루텐 무함유 유제품 무함유 비건 눈에 띄는 셀룰라이트 완화  매끄러운 피부 체중 관리 부드럽게 코셔 100  비건,체중 조절
2 145mg ACV 혼합물  아세트산 750mg  비교 대상  Bragg  사과 식초 보충제 글루텐 무함유 유전자 변형 성분 무함유 설탕  효모  보존제  인공 향료  색소 무함유 비건에게 적합 품질 보장 품질 검사 완료 30년 이상 지켜 온 신뢰할 수 있는 품질,체중 조절
효과적인 디톡스 및 클렌징으로 체중 감량 촉진 천연 사과 향료 보충제 신진대사 증진 및 체중 감량 효능 유기농 비건 우수 제조 및 품질 관리 기준 GMP  유전자 변형 성분 무함유,체중 조절
혈당 건강 증진 Chromax  피콜린산크로뮴 함유 보충제 심혈관계 건강 및 혈당 대사에 도움 신진대사 증진 정상적인 범위의 혈당 수치 유지에 도움 1969년부터 과학에 기반한 고품질 상품 제공,체중 조절
소화 건강을 증진하는  초모  함유 사과 식초   기타 천연 향료 자연 첨가 보충제 유제품 무함유 글루텐 무함유장 건강에 도움  초모 가 함유된 사과 식초 면역계 건강 증진 소화에 도움 일일 에너지 향상 비타민B12 하루 영양소 기준치 100 ,체중 조절
중쇄중성지방 뇌와 신체의 연료 유기농 코코넛에서 추출 보충제 QAI 인증 유기농 품질 중시 USDA 유기농 인증 유전자 변형 성분 무함유 프로젝트 인증 Certified Vegan 비건 인증  케토 인증을 받은 제품입니다  Paleo 인증,체중 조절
1965년 설립 이후 품질 유지 오메가 3 1 400mg   MCT 9 200mg 9 2g  Igen Non GMO Tested Igen 유전자 변형 성분 무함유 검사 완료  신선도와 효능 순도 보장 건강 보조 식품 에너지 생성 지방 신진대사 두뇌 건강 글루텐 무함유 인공 보존제 무함유,체중 조절
메틸코발라민을 지금 복용하십시오  고단백 에너지 식사  글루텐 무함유 Tri Part Protein 섞기 쉽고 맛도 좋습니다 완전한 광범위 스펙트럼 스피룰리나를 함유한 단백질 복합체 심장에 좋은 음식 코셔 파르브 인증 유전자 변형 성분 무함유 천연 대두 채식주의자에게 적합 효모 미함유 제품우수한 3중 단백질 혼합물  쌀  완두콩  대두 모든 비타민의 하루 영양소 기준치 100  충족 광범위한 필수 미네랄 성분 에너지 영양소  고품질 3중 단백질 다이어트 보조  레시틴  스피룰리나  콜린  이노시톨 효소  브로멜라인 및 파파야 세정  엽록소 섬유소  셀룰로오스 및 사과 펙틴,체중 조절
운동 능력 기술 체중 증가 알약  식욕 자극 호르몬 그렐린 증가 소화 및 영양소 흡수 촉진 음식의 동화 및 에르고제닉 효과 최적화 총 음식 섭취량 및 칼로리 증가 보충제,체중 조절
젤라틴 무함유 천연 향료 해독 소화 장수 초모 함유 보충제 USDA 유기농 인증 비건 상품 품질 검사 완료 글루텐 무함유 Greatness by Nature  소화기 클렌징 및 장 건강을 위한 발열 포뮬라 QAI 유기농 인증 뛰어난 맛,체중 조절
초모 함유  1팩당 1 000mg 탁월한 맛  천연 향료 분말 보충제 글루텐 무함유 비건 인증 cGMP 인증 미국 1위 미량 미네랄 브랜드  제3기관 검사 완료 순도   품질   효능 확실히 느껴지는 변화 보장 신맛이 없는 깔끔한 맛 간편함  뛰어난 맛  좋은 냄새 치아 법랑질에 안전 좋은 맛과 냄새 간편한 섭취 편리한 휴대,체중 조절
건강 보조 식품 아유르베다 허브 25  프레그난 글루코사이드 Green Screened,체중 조절
단백질 35g 이동 중에도 맛있게 즐길 수 있는 셰이크 식이섬유  EFA  비타민  미네랄 함유 인공 향료 또는 색소 무함유 글루텐 무함유 기타 천연향료를 첨가한 자연스러운 맛 비타민   미네랄 22종 건강한 소화 대두 단백질 무함유 Lee Labrada 품질 보증,체중 조절
25년 이상 지켜 온 프리미엄 품질 아유르베다 강장제 액티브 홀 스펙트럼 추출물 비건 유전자 변형 무함유 성분으로 제조 글루텐 무함유 보충제 우수 제조 및 품질 관리 기준 GMP  품질 보증   FDA 등록 Enhancing Nature s Miracles Since 1994,체중 조절
체중 관리 순근육량 증진 근육량을 효과적으로 유지 잇꽃 오일 보충제 Tonalin 순근육량 증진 근육량을 효과적으로 유지 지방 대사 촉진 각성제 무함유,체중 조절
America s  1 Fastest Growing Supplement Brand  Supports A Ketogenic Diet From 100  Coconuts Sustained Energy  Clean Fat For Fuel Blends with Coffees  Teas   Shakes Flavorless Odorless Dietary Supplement This Product is Keto Certified Certified Paleo Non GMO Gluten Free Vegan Friendly,체중 조절
1967년 설립 건강한 체중 관리에 도움 보충제 글루텐 무함유 대두 무함유 Chromax  피콜린산크로뮴  Advantra Z  Mason 보증   품질 검사 완료 우수 제조 및 품질 관리 기준 GMP  인증,체중 조절
소화 건강 디톡스   클렌즈 신진대사 증진 보충제 GMP 준수 시설에서 제조 미국 식품의약국 검사 완료 시설 제3 기관 검사 완료,체중 조절
1972년 설립 식물성 에너지 공급원 녹차 잎 2 000mg으로 제조 글루텐 무함유 유전자 변형 성분 미함유 프로젝트 인증 허브 보조제 Kosher Parve 코셔 파르브 인증  바이오킬레이트화 저온 추출 공법,체중 조절
400mg LipoShield  함유 허브 추출물  지방 친화 및 효소 Phase 2  전분 중화제 함유 글루텐 무함유 채식주의자 섭취 가능 보충제 ChromeMate  ForsLean ,체중 조절
체중 감량 지원 보충제 각성제 무함유 지방 연소 보충제 1회 제공량당 알약 하나로 충분 신진대사 활성 증진 100  카페인 무함유 30일분 Carnipure  Paradoxine  BioPerine ,체중 조절
와  훌륭한 맛  지방 및 칼로리 연소 활력 신진대사 식욕 억제 집중력 지구력 천연 향료 보충제인공 색소 무함유 인공 향료 무함유 젤라틴 무함유 보존제 무함유,체중 조절
적정 체중 유지에 도움  보충제 유전자 변형 성분 무함유 LE 인증 글루텐 무함유건강한 체성분 촉진 건강한 면역계 기능 지원 간에서 일어나는 지방산 산화 촉진 지방 분해 촉진,체중 조절
