effect,category
California Gold Nutrition 마그네슘 비스글리시네이트 TRAACS  고흡수율 Albion Minerals 함유 뼈  심장  신경  근육 건강 지원  신경계 강화 및 근육 긴장 완화에 도움  무함유 성분  글루텐  유전자 변형 성분  대두 cGMP 인증 시설에서 제조 100  골드 개런티 Gold Guarantee ,불면증
California Gold Nutrition  마그네슘 분말 오렌지맛 및 무맛으로 제공 근육 긴장 완화에 도움  무함유 성분  글루텐  유전자 변형 성분  대두 cGMP 인증 시설에서 생산 100  골드 개런티 Gold Guarantee ,불면증
Science Based Nutrition  100  킬레이트화 리시네이트 글리시네이트 근육 이완 및 건강한 수면 지원 Albion Minerals 보충제 비건 상품 유전자 변형 성분 무함유   글루텐 무함유   대두 무함유근육 이완 및 편안한 수면 증진 생화학적 기능을 지원하는 300개의 효소 시스템에 꼭 필요 다른 형태의 마그네슘보다 최대 6배 높은 흡수,불면증
Science Based Nutrition  100  킬레이트화 리시네이트 글리시네이트 Albion Minerals 근육 이완 및 건강한 수면 지원 보충제 비건   유전자 변형 성분 무함유   글루텐 무함유   대두 무함유근육 이완 및 편안한 수면 증진 생화학적 기능을 지원하는 300개의 효소 시스템에 꼭 필요 다른 형태의 마그네슘보다 최대 6배 높은 흡수,불면증
글루텐 무함유 유전자 변형 성분 무함유 LE 인증 심혈관 건강을 위한 필수 미네랄 보충제4가지 유형의 마그네슘 제공 전신 건강에 필수 심장 건강 및 혈관 기능 증진 건강한 골밀도   신경계 기능 지원,불면증
뼈 및 근육 건강 지원 미네랄 보충제 글루텐 무함유 품질 보증  품질 검사 완료,불면증
글루텐 무함유 유전자 변형 성분 무함유 LE 인증 기억력 및 인지 기능 증진 보충제 Magtein ,불면증
신경계 건강 지원 흡수가 잘되는 제형 건강한 근육  신경   심장 기능 지원 유전자 변형 성분 무함유 보충제 채식주의자 비건 제품 미네랄 1968년에 설립된 가족 기업 우수 제조 및 품질 관리 기준 GMP  품질 보증,불면증
신경계 건강 지원 에너지 생성 지원 효소 기능에 중요 유전자 변형 성분 무함유 보충제 채식주의자 비건 제품 코셔 미네랄 1968년에 설립된 가족 기업 우수 제조 및 품질 관리 기준 GMP  품질 보장,불면증
신경계 건강 지원 에너지 생성 지원 효소 기능에 중요 유전자 변형 성분 무함유 보충제 채식주의자 및 비건에 적합 코셔 미네랄 1968년 설립된 가족 기업 우수 제조 및 품질 관리 기준 GMP  품질 보증,불면증
신뢰할 수 있는 품질 1932년 설립 보충제 하루 2정 에너지 증진 유전자 변형 성분 무함유 비건 제품 글루텐 무함유,불면증
1973년 설립 뼈 건강 지원 근육 증강 긴장 완화 보충제 품질 검사 완료 비건 건강한 삶 지원,불면증
1932년 설립 이래 신뢰할 수 있는 KAL 품질 유지 긴장 완화 비건 제품 보충제긴장 완화 뼈 건강에 도움 효소 기능 근육 건강에 도움,불면증
인지 기능 지원 기억력 및 학습력 지원 두뇌 건강 증진 유전자 변형 성분 무함유 보충제 채식주의자 비건에게 적합 코셔 일반 건강 1968년 설립된 가족 기업 우수 제조 및 품질 관리 기준 GMP  품질 보증,불면증
골다공증 위험 억제 미네랄 보충제코팅 정제 품질 보증 품질 검사 완료,불면증
글루텐 무함유 유전자 변형 성분 무함유 LE 인증 생체이용성이 높은 미네랄이 심혈관 건강 지원 보충제정상적인 근육 및 신경 기능 유지에 도움 심혈관 기능 및 면역계 건강 증진 건강하고 튼튼한 뼈 유지,불면증
1973년 설립 뼈 건강 지원 근육 증강 긴장 완화 보충제 품질 검사 완료 비건 건강한 삶 지원,불면증
1932년 설립 이후로 혁신적인 품질 유지 보충제 하루 2정 코엔자임 B 6 함유 마그네슘 400mg Clear Quality  채식주의자 비건에 적합 글루텐  대두  유제품  유전자 변형 성분 무함유  비건 제품,불면증
1947년부터 제조 높은 흡수율 건강한 뼈 촉진 신경 및 근육 기능 지원 Non GMO 글루텐  밀 성분  유제품 불포함 비건용으로 적합 건강 보조 식품 코셔 파르브 Kosher Parve  인증 획득,불면증
California Gold Nutrition 마그네슘 비스글리시네이트 TRAACS 로 제조 뼈  심장  신경 및 근육 건강 강화  채식주의자와 비건에게 적합 글루텐  유전자 변형 성분  대두 무함유 cGMP 인증 시설에서 생산 100  골드 개런티 Gold Guarantee ,불면증
1973년 설립 뼈 강도 근육 강화 보충제 품질 검사 완료 비건 더 밝은 길,불면증
기억력 및 인지 기능 증진 글루텐 무함유 유전자 변형 성분 무함유 LE 인증 보충제 Magtein   Think Clearly 채식주의자에 적합두뇌에서 쉽게 흡수되어 뇌 기능 및 젊은 인지력 향상 뇌 세포 간의 중요한 시냅스 연결을 유지하도록 도움 건강한 두뇌 세포 신호전달 경로를 촉진,불면증
신경계 건강 증진 에너지 생성 증진 효소 기능에 중요 유전자 변형 성분 무함유 보충제 채식주의자 및 비건에 적합 코셔 미네랄 1968년 설립된 가족 기업 우수 제조 및 품질 관리 기준 GMP  품질 보증,불면증
신경계 건강 지원 에너지 생성 지원 효소 기능에 중요 유전자 변형 성분 무함유 보충제 채식주의자 비건 제품 코셔 미네랄 1968년에 설립된 가족 기업 우수 제조 및 품질 관리 기준 GMP  품질 보증,불면증
1932년 설립 이후 혁신적인 품질 유지 하루 2정 보충제 코엔자임 B 6 함유 마그네슘 400mg Clear Quality  글루텐 무함유 유전자 변형 성분 무함유 대두 무함유 유제품 무함유 비건 채식주의자 비건에게 적합,불면증
보충제 고효율 마그네슘 복합체 근육   신경 기능 유지,불면증
유전자 변형 성분 없음 100  식물성 건강 보조 식품 향산된 흡수력 1 회 제공량당 400 mg 실험실 검증 완료,불면증
긴장 완화 지원 긍정적인 기분 증진 편안한 수면을 돕습니다  유전자 변형 성분 무함유 보충제 채식주의자 및 비건에 적합 아미노산 1968년 설립된 가족 기업 우수 제조 및 품질 관리 기준 GMP  품질 보증,불면증
신경계 건강 지원 에너지 생성 지원 효소 기능에 중요 보충제 채식주의자 및 비건에 적합 유전자 변형 성분 무함유 프로젝트 인증 미네랄 1968년에 설립된 가족 기업 우수 제조 및 품질 관리 기준 GMP  품질 보증,불면증
비건에게 적합 코셔 파르브 글루텐 무함유 보충제 유전자 변형 성분 무함유,불면증
유전자 변형 없는 성분으로 제조 킬레이트화 마그네슘 비스글리시네이트 산화마그네슘으로 완충 보충제 Albion 미네랄 비건 제품 코셔 파르브 글루텐 무함유,불면증
Science Based Nutrition  근육 이완 및 건강한 수면에 도움 Albion Minerals 보충제 비건 상품 삼키기 쉬움 유전자 변형 성분  글루텐 및 대두 무함유근육 이완 및 편안한 수면 유도 효과 생화학적 기능을 지원하는 300개의 효소 시스템에 꼭 필요 다른 형태의 마그네슘보다 최대 6배 높은 흡수,불면증
근육 및 뼈 건강 캡슐당 400mg 미네랄 보충제 신경  근육  뼈 건강에 도움 권태 및 피로감 감소에 도움 세 가지 서로 다른 원료의 마그네슘 함유 1969년부터 과학에 기반한 고품질 상품 제공,불면증
긴장 완화 지원 긍정적인 기분 증진 편안한 수면을 돕습니다  유전자 변형 성분 무함유 보충제 채식주의자 및 비건에 적합 코셔 아미노산 1968년 설립된 가족 기업 우수 제조 및 품질 관리 기준 GMP  품질 보증,불면증
보충제 신경계 건강 증진 위에 부담을 주지 않음 채식주의자 비건에게 적합,불면증
유전자 변형 없는 성분으로 제조 스트레스  면역 및 심장 건강에 도움 Albion Minerals 비건 상품 코셔 파르브 글루텐 무함유 보충제스트레스 완화 면역 건강 심장 건강,불면증
신경계 건강 증진 에너지 생성 증진 효소 기능에 중요 유전자 변형 성분 무함유 보충제 채식주의자 비건에게 적합 코셔 미네랄 1968년 설립된 가족 기업 우수 제조 및 품질 관리 기준 GMP  품질 보장,불면증
1973년 설립 흡수력 강화 뼈 강화 건강한 치아 보충제 품질 검사 완료 비건 건강한 삶 지원,불면증
1947년 설립 흡수력이 높은 구연산 칼슘 제형 뼈 건강 증진 신경 지원   근육 기능 유전자 변형 성분 무함유 글루텐  밀   유제품 무함유 글루텐 무함유 인증 코셔 파르브 건강 보충제,불면증
보충제 건강한 근육 및 심장 기능 지원 Mg   순수 요소 함유 순도 및 효능 보증,불면증
유전자 변형 성분 무함유 대두 무함유 글루텐 무함유 비건에게 적합 색소  보존제  향료 무함유 From Nature With Love  식물 기반 전체 식품 혼합 건강한 뼈  심장 및 스트레스 완화를 지원하도록 제조 보충제 비건 및 채식주의자에게 적합 GMP   우수 제조 및 품질 관리 기준   일관된 품질,불면증
근육 및 뼈 건강 증진 미네랄 보충제 신경  근육  뼈 건강에 도움 권태 및 피로감 감소에 도움 세 가지 서로 다른 원료의 마그네슘 함유 1969년부터 과학에 기반한 고품질 상품 제공,불면증
약사 추천 1위 비타민   보충제 브랜드 근육 긴장 완화에 도움 신경  심장   뼈 건강 지원 보충제 합성 색소 무함유   천연 원료에서 추출한 색소 인공향료 무함유 글루텐 무함유,불면증
,불면증
Mason 보증   품질 검사 완료 우수 제조 및 품질 관리 기준 cGMP  인증   5 Star Certified 효능  뼈 건강 증진 보충제,불면증
허브 건강 보조 식품 전통 허브 유전자 변형 성분 없음 건강 보조 식품 채식주의   완전 채식 비건 용으로 적합 식물성 허브 가족 기업 1968년부터  GMP 품질 보증,불면증
보충제 근육 및 에너지 생성 지원 1회 제공량당 3 750mg 유전자 변형 성분 무함유 인증,불면증
Science Based Nutrition  리시네이트 글리신산 100  킬레이트화 근육 이완 및 건강한 수면 지원 Albion Minerals 보충제 유전자 변형 성분 무함유   글루텐 무함유   대두 무함유   비건에게 적합근육 이완 및 편안한 수면 유도 효과 생화학적 기능을 지원하는 300개의 효소 시스템에 꼭 필요 다른 형태의 마그네슘보다 최대 6배 높은 흡수력,불면증
1971년 설립 글루텐 무함유 인증 완전 반응 NSF 유전자 변형 성분 무함유 인증 심장 건강 지원 뼈와 치아 건강 증진 보충제 B  corp  인증 코셔 파르브진정성 청결도 신선도 일관성 정확성,불면증
글루텐 무함유 유전자 변형 성분 무함유 LE 인증 IR 칼륨  6시간 XR 마그네슘 함유 보충제,불면증
1972 년 설립 보충제 뼈  근육 건강에 도움 유전자 변형 성분 무함유 프로젝트 인증 Albion 미네랄,불면증
1932년 설립한 이후로 혁신적인 품질 유지 보충제 매일 4정 마그네슘 200mg 뛰어난 흡수력 깨끗한 품질 채식주의자에게 적합,불면증
1947년 설립 신경 및 근육 기능 지원 뼈 건강 증진 세포 에너지에 필수 유전자 변형 성분 무함유 글루텐 인증 밀 및 유제품 무함유 비건에게 적합한 제품 보충제 코셔 파르브,불면증
건강 보조 식품 근육 및 에너지 생성 보조 제공량당 3 750mg 유전자 변형 성분 무함유 인증,불면증
신경계 건강 지원 우수한 생체이용률 글리시네이트 및 말레이트 함유 유전자 변형 성분 무함유 보충제 코셔 함유 성분  젤라틴 미네랄 1968년 설립된 가족 기업 우수 제조 및 품질 관리 기준 GMP  품질 보증 할랄,불면증
건강 보조 식품 글루텐과 부형제 없음 의약품 제조 품질 관리 기준 GMP  준수 시설에서 생산,불면증
1969년 설립 건강한 근육 기능 1회 제공량당 500mg 보충제,불면증
보충제 신경 및 근육 기능 지원,불면증
근육 및 뼈 건강 캡슐당 133mg 아미노산킬레이트 미네랄 보충제 신경  근육  뼈  심장 건강 강화 최적의 흡수를 촉진하는 특허받은 미네랄 글리시네이트 킬레이트화 형태 1969년부터 과학에 기반한 고품질 상품 제공,불면증
NSF 유전자 변형 성분 무함유 인증 킬레이트화 마그네슘 비스글리시네이트 보충제 Albion Minerals 비건 코셔 파르브 글루텐 무함유,불면증
1973년 설립 허브 보충제 보충제 유전자 변형 성분 무함유 프로젝트 인증 품질 검사 완료 비건 건강한 삶 지원,불면증
유전자 변형 성분 무함유 성분으로 제조 코셔 파르브 비건 글루텐 없음 대두 무함유 우유 무함유 보충제 심장  근육 신경   뼈 지원제,불면증
두뇌 건강 2G Magtein  뇌 건강  기능  기억력에 도움  임상 연구 완료 유전자 변형 성분 무함유 프로젝트 인증 보충제 정신 건강,불면증
보충제 뼈 건강 보조 기초 건강 심장 혈관 건강 지원 근육 힘줄 강화 글루텐 무함유,불면증
허브 보충제 전통 허브 유전자 변형 성분 무함유 보충제 채식주의자 및 비건에 적합 식물성 허브 1968년에 설립된 가족 기업 우수 제조 및 품질 관리 기준 GMP  품질 보증,불면증
심장 건강 건강한 심장  근육 및 신경 기능 지원 타우린 함유 유전자 변형 성분 무함유 건강 보조 식품 채식주의자 및 비건에 적합 코셔 미네랄 1968년 설립된 가족 기업 GMP 품질 보증,불면증
근육  신경 및 진정 작용을 위한 마그네슘 함유 보충제 우수 제조 및 품질 관리 기준 GMP  인증 시설에서 생산 코셔 파르브 인증 땅콩 무함유 견과류 무함유 유제품 무함유 글루텐 무함유 대두 무함유 계란 무함유,불면증
울트라 강도 멜라토닌 10mg 보충제 휴식  긴장 완화  반복 NSF 인증 B  corp  인증 인공 향료 및 색소 무함유 글루텐 무함유 물과 함께 복용건강한 수면 주기 형성 숙면에 도움 몸과 마음의 긴장 완화 빠른 수면 유도 중독성 약물 무함유  습관성 약물 중독을 유발하지 않음,불면증
Response Formulas 자연의 치유력 근육 이완에 필수적인 미네랄 보충제 B  corp  인증 글리포세이트 잔여물 무함유 125종 이상의 살충제 성분 검사 완료 글루텐 무함유 검사 완료 채식주의자 유제품 무함유 대두 무함유 마그네슘스테아레이트 무함유,불면증
1971년 설립 완전 반응 400mg  글루텐 무함유 인증 심장 건강 지원 뼈와 치아 건강 증진 보충제 코셔 파르브 NSF 유전자 변형 성분 무함유 인증 B  corp  인증진정성 청결도 신선도 일관성 정확성,불면증
보충제 코셔 경제적 포뮬라,불면증
보충제 숙면 유도제 순도   효능 보장,불면증
뼈 건강 및 근육 기능 증진 Mg12 보충제 Easy Solv  채식주의자 비건에게 적합,불면증
보충제 건강한 근육   심장 기능 순수 원소 마그네슘 함유 순도   효능 보장,불면증
Pure Vegan 비건 인증 글루텐 무함유 유전자 변형 성분 무함유 크루얼티프리 보충제건강 루틴 개선 소화 기능 저하 개선 장 건강 개선 간헐적인 변비 해소,불면증
진정 효과 긍정적인 기분 증진 편안한 수면에 도움 유전자 변형 성분 무함유 보충제 채식주의자 비건에게 적합 코셔 아미노산 1968년에 설립된 가족 소유 기업 할랄 GMP 인증,불면증
하루 1정 신뢰할 수 있는 품질 1932년 설립 두뇌 기능 강화 유전자 변형 성분 무함유 비건 글루텐 무함유 Magtein  함유 보충제,불면증
보충제 근육 힘줄 뼈 건강 증진 기초 건강 강화 심장 혈관 건강 지원 NSF Sport 인증 글루텐 무함유마그네슘은 심장 및 혈관  뇌  뼈  근육  폐 건강에 필수적이며 건강한 혈당을 유지해 줍니다  기관지 이완을 촉진합니다  심장의 전기 활동에 필요한 필수 미네랄로  건강한 맥박과 리듬 유지에 도움이 됩니다  민무늬근과 골격근의 긴장 완화에 도움을 줍니다  혈관의 팽창 혈관 확장 을 촉진하여 정상적인 혈압을 유지하고 혈류를 개선해 줍니다  건강한 혈당 유지를 위해 인슐린 감수성을 향상합니다  세포 에너지 생성과 관련 있는 효소의 보조인자입니다 마그네슘 비스글리시네이트는 물  주스 또는 다른 파우더 보충제와 혼합할 수 있는 맛있는 파우더입니다  마그네슘 비스글리시네이트 화합물은 마그네슘 글리시네이트라고도 불리지만  두 개의 글라이신 분자가 결합되어 있어 더 정확히는  비스글리시네이트  비스 2개 라고 불립니다  비스글리시네이트 형태는 용해도가 높기 때문에 더 우수한 흡수율을 보입니다  비스글리시네이트 형태는 마그네슘을 완전히 감싸는 순수한 킬레이트 형태이므로 다른 마그네슘 포뮬라에 비해 설사를 적게 유발합니다  글라이신은 이완을 촉진하고 체내 스트레스를 감소시키는 신경전달물질입니다  이 때문에 마그네슘 비스글리시네이트는 편안하게 잘 수 있도록 도와주는 취침 전 보충제로 알맞습니다 ,불면증
비타민 글루텐 무함유 유전자 변형 성분 무함유 보충제 필수 미네랄,불면증
보충제 정신 및 신체 스트레스 완화 GI 친화적 채식주의자 비건에게 적합,불면증
400 mg 구연산 마그네슘 뼈 및 근육 건강 지원 비건   비 GMO 30회 제공량 보충제,불면증
1932년 설립 이래 신뢰할 수 있는 KAL 품질 유지 긴장 완화  뼈 및 근육 건강 증진 비건에게 적합 글루텐 무함유 대두 무함유 보충제 품질 검사 인증,불면증
뛰어난 흡수율 보충제 심혈관계 건강 근육 기능 뼈 건강 보조 글루텐 무함유 인공 보존제 무함유 효능 및 품질 보증 FDA 등록 시설에서 제조,불면증
마그네슘 보충제 유전자 변형 성분 무함유 프로젝트 인증 비건 제품 글루텐 무함유,불면증
스트레스 수면 회복 유전자 변형 성분 무함유 프로젝트 인증 첨가당 무함유   저칼로리 식품 아님 보충제 코셔 B  corp  인증 NSF 글루텐 무함유 인증 비건 인증 대두  글루텐  견과 무함유  스테비아 무함유 스트레스 완화 뼈 건강 증진 심장 건강 증진 근육 강화 수면 보조제 소화 기능 보조,불면증
이온성   심장   에너지   정서 안정   소화   근육 경련 방지 보충제 글루텐 무함유 cGMP 인증 제3기관 검사 완료 확실히 느껴지는 차이 미국 1위 액상 마그네슘 브랜드  OMRI 등재   유기농 상품 유전자 변형 성분 무함유 프로젝트 인증 RCC 코셔 비건 인증 할랄 인증,불면증
Lake Avenue Nutrition 마그네슘 복합체 산화 마그네슘  마그네슘시트레이트  마그네슘카보네이트 함유 근육  심장  신경  뼈 건강 증진  채식주의자에게 적합 글루텐  유전자 변형 성분  대두 무함유 GMP 시설에서 생산,불면증
높은 흡수율 위에 부담을 주지 않음 심장  뼈  근육 건강 지원 비건 제품 글루텐 무함유 보충제 전 재료 유전자 변형 성분 무함유 및 비건에 적합,불면증
1971년 설립 밸류 사이즈 글루텐 무함유 인증 근육 이완에 도움 뼈 건강 증진 보충제 Igen   유전자 변형 성분 무함유 검사 완료 B  corp  인증 코셔진정성 청결도 신선도 일관성 정확성,불면증
멜라토닌 무함유 불면증 완화제 빠른 수면  뒤척이지 않고 오래 지속되는 숙면 지원 신체의 자연 치유력에 도움 동종 요법 약품 식물성 유효 성분 낮에 피로감 완화 알려진 약물 상호 작용 없음 인공 색소  인공 향료  인공 감미료 무함유간헐적 불면증 뒤척이는 수면 간헐적 각성신경과민 걱정,불면증
설탕 무함유 기타 천연 향료 함유 효모 무함유 글루텐 무함유 채식주의자에게 적합,불면증
California Gold Nutrition   EuroHerbs  시계꽃 Phyto Proof  EuroMed 품질 긴장 완화  플라보노이드 3 5 로 표준화 시계꽃 원산지 프랑스 제조국 스페인 엽록소로 만든 녹색 베지 캡슐 무함유 성분  유전자 변형 성분  글루텐  대두 cGMP 인증 시설에서 제조 100  골드 개런티 Gold Guarantee ,불면증
근육 긴장 완화 심장 건강 증진 긍정적인 기분 유전자 변형 성분 무함유 인증 제3 기관 순도 검사 완료 보충제 미국채식협회 AVA  인증 비건에게 적합한 상품근육 긴장 완화 기분 전환 세포 건강 근육 기능두뇌 건강 세포 건강 근육 기능심장 건강 두뇌 건강 기분 전환 세포 건강 근육 기능,불면증
1회 제공량당 420mg 120회 제공량 보충제 Nutricost  품질 보장 비건   동물성 성분 무함유 상품 GMP 인증 시설 유전자 변형 성분 무함유 상품 제3기관 검사 완료 글루텐 무함유,불면증
보충제 뛰어난 흡수율 첨가당 무함유 글루텐   대두 무함유 회복  균형  이완 효과 채식주의자 비건에게 적합한 제품 순도   효능 보장,불면증
Sun Food Energy  마그네슘 200mg 근육 및 신경 보충제 하루 1정 Quality You Can Trust ,불면증
보충제 Magtein ,불면증
25년 이상 지켜 온 프리미엄 품질 진정   스트레스 완화   수면   근육   신경 포뮬라 높은 흡수율 Albion Minerals 비건 유전자 변형 성분 무함유 원료로 제조 글루텐 무함유 보충제 증량제  결합제 또는 일반적인 알레르기 유발 성분 무함유  Enhancing Nature s Miracles Since 1994 ,불면증
뛰어난 흡수율 보충제 심혈관계 건강 근육 기능 뼈 건강 보조 글루텐 무함유 인공 보존제 무함유 효능 및 품질 보증 FDA 등록 시설에서 제조,불면증
NDF   중금속 및 화학 물질을 안전하게 제거 허브 드롭   빠른 작용 중독성 약물 무함유 알코올 무함유 유전자 변형 성분 무함유 비건 글루텐 무함유 대두 성분 무함유 유제품 무함유 1 2개월분 일일 보충제빠른 수면 긴장 완화 심신 안정 밤에 깨지 않는 숙면,불면증
Natural Living 첫 번째 선택 최적의 건강 CCOF 유기농 인증,불면증
보충제 기분 전환  긴장 완화  숙면 유전자 변형 성분 무함유 인증 채식주의자에게 적합,불면증
유전자 변형 없는 성분으로 제조 제공량당 마그네슘 원소 400mg 보충제 비건 상품 코셔 파르브 글루텐 무함유,불면증
캡슐형 천연 수면 보조제 용해성 약물에 대한 습관성을 형성하지 않음 알코올 없음 동종 요법,불면증
1정당 8PPM의 수소 생성  보충제,불면증
식이 보충제,불면증
긴장 완화 및 두뇌 건강 Magtein  Think Clearly 보충제 제3 기관 품질 검사 완료 Certified Open Source    전 성분 표시 미국 우수 제조 및 품질 관리 기준 cGMP  인증 시설에서 생산,불면증
보충제 심혈관계 건강 지원 근육 기능 신경 건강 글루텐 무함유 인공 보존제 무함유 효능 및 품질 보증 미국 식품의약청 FDA  등록 시설에서 제조,불면증
글루텐 무함유 유전자 변형 성분 무함유 LE 인증 6시간 지연 방출 포뮬라 보충제300여 가지 생화학적 반응에 필요한 필수 영양소 공급 마그네슘이 부족한 식단 보충 심혈관 건강  뼈 건강 등 증진 장기 흡수 및 빠른 흡수를 위한 형태의 마그네슘을 함유하여 보다 일관적인 효능 제공,불면증
학습 및 기억력 지원 보충제 Magtein    Think Clearly,불면증
아미노산킬레이트 뼈 강화 근육 강화 보충제 품질 검사 완료 비건 건강한 삶 지원,불면증
1932년 설립 신뢰할 수 있는 품질 신경  뼈 및 근육 건강 강화 유전자 변형 성분 무함유 글루텐 무함유 대두 무함유 보충제 ActivGel   액상 소프트젤신경계 건강 효소 기능 뼈 건강에 도움 근육 건강에 도움순도 및 효능 검사를 완료한 더 뛰어난 품질 개선된 전달 시스템의 뛰어난 액상형 소프트젤 글루텐 무함유 식단에 적합한 더 뛰어난 상품,불면증
1932년 설립 완전 킬레이트화 긴장 완화  뼈 및 근육 건강 증진 비건 상품 글루텐 무함유 무함유 성분  대두 보충제 PCR 용기긴장 완화 효소 기능 뼈 건강에 도움 근육 건강에 도움더 높은 품질 순도 및 효능 실험실 검사 완료 더 효과적인 형태 고흡수 마그네슘 비스글리시네이트 더 좋은 성분 비건 식단에 적합,불면증
뼈   근육 건강 지원 미네랄 보충제 쉽게 삼키기 좋은 정장제 품질 보증 시험기관 테스트 완료,불면증
