effect,category
1930년 설립 유전자 변형 성분 무함유 프로젝트 인증 USDA 유기농 인증 허브 보충제 1개월분 글루텐 무함유 비건에게 적합 우수 제조 및 품질 관리 기준 cGMP  85년 넘게 이어온 가족 기업 Control Union Certifications 유기농 인증,체중 조절
보충제 신진대사 글루텐 무함유,체중 조절
California Gold Nutrition 사과 식초 유기농 사과 식초 분말 소화 및 대사 건강 증진  무함유 성분  글루텐  유전자 변형 성분  대두 cGMP 인증 시설에서 제조 100  골드 개런티 Gold Guarantee ,체중 조절
보충제 식욕 감소 이미 정상 범위에 있는 건강한 혈당 수치 지원 혈당 수치 감소 글루텐 무함유 1회 제공량당 PGX  5g 채식주의자 비건에 적합 순도 및 효능 보장,체중 조절
보충제 순도 및 효능 보장식욕 감소 혈당 균형 촉진 식욕 억제 설탕 및 탄수화물에 대한 욕구 감소 맛과 포만감 EnviroSimplex  기술로 가공풍부한 단백질 낮은 혈당 지수 인공 감미료 및 향료 무함유 글루텐 무함유 설탕 및 탄수화물에 대한 욕구 감소 건강한 체중 감량을 촉진하는 최적의 영양소 혼합물 제공 건강한 식단 및 주기적인 운동과 병행 시 ,체중 조절
백차 녹차 홍차 보충제칼로리 연소 EGCG와 카페인은 실제로 체내에서 지방을  녹이는  것은 아니지만  새로운 연구에 따르면 열발생 증가과 지방 연소 지방 산화 를 촉진하는 것으로 나타났습니다  에너지 증진   비타민B군은 체내에서 에너지 생성을 촉진합니다  추가로 녹차 추출물이 지방 산화를 돕고 에너지 소모를 늘립니다  활성산소 억제   비타민C 및 E와 함께 3종 차 혼합물은 체내 세포를 보호하는 강력한 항산화 특성을 가지고 있습니다 ,체중 조절
지방 감량 식단 포뮬라 보충제 섭취하는 음식에서 지방을 흡수하도록 설계 The Diet Company ,체중 조절
단백질 35g 이동 중에도 맛있게 즐길 수 있는 셰이크 식이섬유  EFA  비타민  미네랄 함유 인공 향료 또는 색소 무함유 글루텐 무함유 기타 천연향료를 첨가한 자연스러운 맛 비타민   미네랄 22종 건강한 소화 대두 단백질 무함유 Lee Labrada 품질 보증,체중 조절
100  천연 향료 보충제 GMP 인증 시설에서 생산 인공 향료 무함유 인공 식품 염료 색소 무함유 아스파탐 아세설팜칼륨 무함유 신체의 잠재력 강화 2012년부터 업계 최고의 자리를 지켜온 상품 전 세계 300만 명이 넘는 사람들이 신뢰하는 상품,체중 조절
1926년 설립 대두 단백질 혼합 포뮬라 1회 제공량당 150칼로리 천연 향료 및 감미료 순도 품질 보증단백질 13g 24가지 비타민 및 미네랄 함유 트랜스 지방 0g 유당 무함유 글루텐 무함유 유전자 변형 대두 무함유살코기 1개 채소 1개 전분 식품 1개,체중 조절
자극제 무함유  가르시니아  지방 감량  칼라루마  식욕 억제 GreenSelect   체중 관리에 도움  보충제 보존제 무함유,체중 조절
글루텐 무함유 유전자 변형 성분 무함유 LE 인증 칼로리 연소 촉진 보충제발열 작용을 촉진하여 건강한 체중 관리 지원 건강한 지방 연소를 통해 에너지 소비 촉진 호로파 섬유소가 함유되어 있어 소화를 도움 저칼로리 다이어트에 적합,체중 조절
카페인 무함유 표준화 허브 보충제,체중 조절
100  유전자 변형 성분 무함유 코코넛 보충제 신속한 청정 에너지원 몸과 마음을 위한 제품 신진대사 증진 정신 능력 강화 장 건강 쉽게 혼합 가능 유전자 변형 성분 무함유 성분으로 제조 첨가제 무함유 비건에게 적합 커피 셰이크 스무디 요리,체중 조절
1972년 설립 폴리페놀  카테킨 및 EGCG로 표준화 1회 제공량당 녹차 100mg Discover Nature s Answer  글루텐 무함유 허브 보충제 코셔 파르브 인증 Bio Chelated  저온 추출 공법 보존제 100  무함유,체중 조절
1회 제공당 100mg 의사가 제조한 포뮬라 보충제,체중 조절
 초모 가 함유된 사과 식초 병마다 사과 12개에 해당하는 양 함유 1회 제공량당 AVC 710mg 소화 및 체중 감량에 도움 보충제 유전자 변형 성분 무함유  글루텐 무함유 계란 무함유 유제품 무함유 대두 무함유 젤라틴 무함유 인공 향료 및 색소 무함유,체중 조절
,체중 조절
식물성 원료 99mg 칼륨 파슬리  호스테일  우바우르시 건강 보조 식품 및 다이어트 계획,체중 조절
,체중 조절
보충제 채식주의자에게 적합,체중 조절
Science Based Nutrition  보충제 비건 정상 범위에 있는 건강한 혈당 수치를 유지하는 데 도움 유전자 변형 성분 무함유   글루텐 무함유   대두 무함유,체중 조절
아프리카 망고 체중 관리 캡슐당 400mg 허브 보충제 고유하고 영양이 풍부한 기적의 식품 체중 관리 목표에 도움 Full Spectrum  천연 씨 포뮬라 1969년부터 과학에 기반한 고품질 상품 제공,체중 조절
천연 허브 당류 대사 증진에 도움 보충제 대두 무함유 Chromax Mason 보증   품질 검사 완료 우수 제조 및 품질 관리 기준 GMP  인증   Five Star Certified,체중 조절
강화된 체중 감량 성분  운동 후 근육 강화 단백질 30g l 카르니틴   l 타르타르산염 500mg  로부스타 커피콩 C  canephora robusta  추출물 200mg  천연 및 인공 향료 보충제 생물공학식품 성분 함유,체중 조절
보충제 포도당 관리 시스템 채식주의자 비건에게 적합한 제품 순도   효능 보장,체중 조절
저탄수화물 식단에 훌륭함 원조 탄수화물 억제제 보충제 Trimplex  전분 억제제 탄수화물 식욕을 줄임 The Diet Company빵 설탕 곡물 전분 감자 파스타 쌀견과류 치즈 플레인 요거트 고도불포화베리 콩 저혈당 과일소고기 돼지고기 닭고기 생선 해산물 전분이 적은 채소 단일포화 지방 달걀,체중 조절
장 건강 증진 소화 기능 개선 지방 연소 및 체중 감량 복부 팽만감 완화 300억 활성 배양균 프로바이오틱 균주 7종 보충제 UNLEASH YOUR POTENTIAL ,체중 조절
열 발생 촉진 녹차 추출물 700mg  EGCG 350mg 에너지 소비 촉진 활성산소 제거제 유전자 변형 성분 무함유 보충제 채식주의자 및 비건 1968년 설립된 가족 기업 우수 제조 및 품질 관리 기준 GMP  품질 보증,체중 조절
,체중 조절
California Gold Nutrition 마그네슘 킬레이트 필수 미네랄 보충제 뼈  심장  신경 및 근육 건강 강화  흡수를 돕기 위한 킬레이트화 채식주의자와 비건에게 적합 글루텐  유전자 변형 성분  대두 무함유 cGMP 인증 시설에서 생산 100  골드 개런티 Gold Guarantee ,체중 조절
NSF 유전자 변형 성분 무함유 인증 스트레스 완화  면역 및 심장 건강 강화 Albion 미네랄 비건 상품 글루텐 무함유 코셔 파르브 보충제,체중 조절
멜라토닌 무함유 글루텐  밀  유제품 무함유 비건에게 적합 유전자 변형 성분 무함유 보충제하루를 상쾌하게 시작할 수 있도록 수면의 질 향상 긴장 완화 및 편안한 마음이 들도록 지원 빠르게 잠들고 숙면을 취하도록 지원 밤에 깨지 않는 휴식을 촉진 간헐적인 불면증 및 스트레스 완화를 위한 제품 멜라토닌 무함유 약물 성분 완전 무함유 습관성 약물 중독을 형성하지 않음,체중 조절
대두 단백질 혼합 포뮬라 1회 제공량당 150칼로리 천연 향료 및 감미료 순도 품질 보증단백질 13g 24가지 비타민 및 미네랄 함유 트랜스 지방 0g 유당 무함유 글루텐 무함유 유전자 변형 대두 무함유살코기 1개 채소 1개 전분 식품 1개,체중 조절
Phase 2 탄수화물 차단제 보충제,체중 조절
천연 식품 B12 유기농 과일 함유 USDA 유기농 인증 유전자 변형 성분 무함유 프로젝트 인증 보충제 코셔 QCS 유기농 인증 B  corp  인증 NSF 글루텐 무함유 인증 비건 인증,체중 조절
건강한 신진대사 캡슐당 450mg 보충제 Slendacor  체중 관리 복합체 함유 단 14일 만에 체중 관리 개선 1969년부터 과학에 기반한 고품질 상품 제공,체중 조절
지방 연소 톤 업 군살 감량 보충제 우수 제조 및 품질 관리 기준 GMP  인증 시설에서 제조,체중 조절
1967년 설립 건강한 체중 관리에 도움 보충제 글루텐 무함유 대두 무함유 Chromax  피콜린산크로뮴  Mason 보증   품질 검사 완료 우수 제조 및 품질 관리 기준 GMP  인증,체중 조절
순수 활성 영양소 BCAA   EAA 5g 수분을 공급해 주는 전해질 운동 후 회복 면역력 지원 천연 향료 비건 당류 무함유 인공색소  향료 무함유 카페인 무함유 보충제,체중 조절
스포츠 영양제 MCT 67   케토 연료 Informed Sport Com   Trusted by Sport 인증 Informed Choice org Trusted by Sport 인증 스테로이드 무함유 유전자 변형 성분 무함유,체중 조절
Naturally Flavored with Other Natural Flavors Dietary Supplement Natural Flavors Non GMO Vegan,체중 조절
폐 보호 폐 세포 강화 호흡기 기능에 도움 면역력 강화 바이오플라보노이드 폴리페놀 EGCG 보충제 천연 성분 건강에 좋은 천연 재료 효능   품질   효과 시너지 효과 2가지 프리미엄 허브 추출물 함유 식물성 성분   100  식물성   채식주의자에게 적합 미국 내 cGMP 인증 시설에서 제조,체중 조절
오메가6 지방산 비자극성 체중 감량 보조제 천연 인공 향료 인공 색소 무함유 보충제 품질 검사 완료 우수 제조 및 품질 관리 기준 cGMP 체지방 감소  순근육 증대 ,체중 조절
유전자 변형 성분 무함유 100  Vegan 100  비건  건강 보조 식품 하이드록시시트릭산 50  효능 보장 실험실 검증 완료,체중 조절
보충제의 기준이 되는 상품 카페인 무함유 신진대사 강화 콜라겐 펩타이드 콜라겐 I  II  III  V  X형 눈에 띄는 셀룰라이트 완화에 도움   천연 및 인공 향료 보충제 목초 사육 소고기 BSE 프리 농장 사육 닭고기 자연산 생선 난각막 유전자 변형 성분 무함유 글루텐 무함유 유제품 무함유 염료 무함유 Vitauthority 정품 Dimpless  Sensoril ,체중 조절
1967년 설립 1회 제공량당 1 000mg 당류 대사에 도움이 될 수 있음 보충제 글루텐 무함유 대두 무함유 Mason 보증   품질 검사 완료 cGMP 인증,체중 조절
강력한 체중 감량 효과 신진대사 강화제 및 탄수화물 대사제 신진대사  기분과 에너지 지원을 향상시키는 완전한 식스 인 원 포뮬라 보충제첫째  열 발생   녹차 및 백차 추출물과 Advantra Z의 조합이 강력한 영양소를 공급하여 열 발생 열 생성 을 향상시키고 칼로리를 태우는 데 도움을 줍니다  둘째  에너지   천연 카페인과 마테  구아라나 및 스피룰리나와 같은 식물이 활력 증진에 도움을 줍니다  셋째  기분   본 포뮬라에 함유된 L 테아닌은 기분 완화에 도움을 줍니다  넷째  신진대사   비타민B군은 섭취한 음식을 에너지로 전환하는 데 도움을 주고 탄수화물  지방  단백질의 분해를 돕습니다  다섯째  탄수화물 지원   크로뮴은 탄수화물이 포도당으로 분해되는 것을 돕고 정상 범위 내 건강한 혈당 수치 유지에 도움을 줍니다  여섯째  항산화제   비타민C와 E 및 항산화 활동을 하는 기타 영양소는 세포 보호 및 몸 속 영양 증진에 도움을 줍니다 ,체중 조절
단백질 20g 설탕 1g 미만 44가지 슈퍼 푸드 함유 USDA 유기농 인증 유전자 변형 성분 무함유 프로젝트 인증 Informed Choice   Trusted by Sport 인증 획득 NSF 글루텐 무함유 인증 유기농 셰이크   대용식 휴대용 건강식 소화가 잘 되는 제품 생 프로바이오틱 첨가당 없음 코셔 비건 유제품 또는 대두 성분 없이 제조 28회 제공량 QCS 유기농 인증 에너지 강화 순 근육 생성 포만감깨끗한 유기농 식물성 단백질 20g 44가지 슈퍼 푸드 함유 설탕 1g 미만 15억 생 프로바이오틱   효소 21가지 천연 식품 비타민   미네랄 유기농 섬유소 2g,체중 조절
신경계 건강   스트레스 완화 긴장 완화   숙면 인지 건강 세포 조절 보충제 의학 박사 이삭 엘리아즈 의사  공인침술사  제조 글루텐 무함유 유전자 변형 성분 무함유 비건 친화적 제품,체중 조절
식물성 성분 보충제 대두 무함유 글루텐 무함유 유제품 무함유 합성 성분 무함유 지방 연소 옷 주름 완화 에너지 증진 코셔 100  비건 지방 연소제,체중 조절
체중 관리 발열 케토 친화 상품 스테로이드 무함유 비건 코셔 보충제 유전자 변형 성분 무함유 프로젝트 인증 GMP 품질 보증,체중 조절
코코넛오일에서 추출 체중 관리 케토 친화적인 제품 발열 에너지 Informed Sport   We Trust You Trust 보충제 스테로이드 미함유 USDA 유기농 인증 비건에게 적합 유전자 변형 성분 무함유 프로젝트 인증 QAI 유기농 인증 헥산 무함유 할랄 우수 제조 및 품질 관리 기준 GMP  품질 보증,체중 조절
DNF 10  포만감 펩타이드 보충제 품질 검사 통과 보증 고도로 전문화된 제품,체중 조절
Formulated To Help Support Fat Loss   Muscle Building Powered By Gluco Vantage  Dietary Supplement,체중 조절
C8 Medium Chain Triglycerides  10 g C8 MCT Oil Powder Per Serving  Dietary Supplement  Nutricost  Quality Guaranteed  Third Party Tested  GMP Compliant Facility  Non GMO Product  Gluten Free,체중 조절
Morosil  400mg 녹차 315mg 브린들베리 250mg 보충제 유전자 변형 성분 무함유 글루텐 무함유 대두 무함유 비건 상품 견과류 무함유 유제품 무함유,체중 조절
100  코코넛오일 원료 중쇄중성지방 카프릴산   카프릭산 C8   C10 빠른 연료 두뇌 에너지 신진대사용 연료 케토 친화 제품 USDA 유기농 인증 보충제 채식주의자 비건에게 적합 비건 QAI 유기농 인증두뇌를 위한 빠른 에너지 공급 근육을 위한 빠른 신진대사 에너지 공급 저탄수화물  케토 식단 지원무향 100  순수 코코넛오일로 제조 유기농 인증,체중 조절
카프릴산 MCT 오일 뇌와 신체의 연료 유기농 코코넛 유래 커피 및 셰이크에 혼합 가능 유제품 및 글루텐 무함유 케토 인증 USDA 인증 유기농 유전자 변형 성분 무함유 프로젝트 인증 비건 인증 보충제 Paleo 인증 Pro Cert 유기농 인증신경과민 없이 에너지를 공급하는 케톤체 생성 증진 케토 및 저탄수 식단에 적합 탄수화물 없이 뇌와 신체에 에너지 공급,체중 조절
체중 관리에 도움 탄수화물 흡수 감소에 도움 화이트 멀베리 잎 1 DNJ 함유 식물성 성분 함유 보충제 유제품 무함유 글루텐 무함유 유전자 변형 성분 무함유 비건,체중 조절
USDA 유기농 Informed Choice org Trusted by sport 인증 유전자 변형 성분 무함유 프로젝트 인증 NSF 글루텐 미함유 인증 무가공 바닐라 향 카이 건강한 이동식   단백질 20g 쉬운 소화   생 프로바이오틱스   설탕 무함유 코셔 비건   글루텐 무함유   유제품 또는 대두 성분 없이 제조 글로벌 사회적 기업 인증 QCS 인증 유기농 에너지 증진   순근육 조성   포만감깨끗한 유기농 식물성 단백질 20g 44개의 수퍼푸드 첨가 설탕 1g 미만 15억 생 프로바이오틱스   효소 21가지 홀푸드 비타민 및 미네랄 유기농 섬유질 7g,체중 조절
오메가6 지방산 효과  체지방 감소  순근육 증대  비자극성 체중 감량 보충제  천연 및 인공 향미료 인공 색소 무함유 보충제 품질 검사 완료 우수 제조 및 품질 관리 기준 GMP  품질 인증,체중 조절
마황 미포함 임상적으로 테스트된 체중 감량 팻 버너  체지방 감소  건강보조식품제품  제품은 천연 허브의 체중 감량 성분들과 녹차 잎 추출물  카페인  코코아 등을 이용하여 만든 고급한 체중 감량 및 체지방 감소 포뮬러입니다  결과  cut  ripped abs  과학  독점적인 특허 출원 중에 있는 체중 감량 성분 등 임상적으로 테스트된 재료들의 결합  그리고 완고한 지방 축적 영역들을 목표로 특별히 제조 되었습니다 ,체중 조절
혁신적인 영양 공급 키토산 올리고당 보충제,체중 조절
단백질 15g 순 탄수화물 4g  설탕 2g 섬유소 14g 총지방 12g 천연 향료 크리미하고 바삭한 맛있는 상품 말티톨 무함유,체중 조절
MCT 중쇄중성지방  지속 가능한 에너지원 빠르게 흡수되는 지방산 함유 USDA 유기농 인증 글루텐 무함유 팔레오 비건 NJDA 유기농 인증,체중 조절
Dietary Supplement  Manufactured by a GMP Facility 10 g Of Medium Chain Triglyceride Powder  As GOMCT   Per Serving Vegan  Non GMO,체중 조절
체중 관리 임상 검증된 효능 보충제 건강한 신진 대사 촉진 60 의 강력한 HCA 하이드록시시트릭산  농도 함유 건강한 세로토닌 수치 관리 1969년부터 과학에 기반한 고품질 상품 제공,체중 조절
보충제 소화 기능 증진 채식주의자에게 적합 젤라틴 무함유 우수 제조 및 품질 관리 기준 GMP ,체중 조절
Nurture Vitality 1회 제공량당 MCT 6g 신체   뇌의 연료 프리바이오틱 소화가 쉬움 섞기 쉬움 USDA 유기농 인증 케토 인증 제품 코셔 보충제 BPA 무함유 유전자 변형 성분 무함유 프로젝트 인증 식물성 글루텐 무함유 유기농 인증  QAI매일 아침 두뇌 능력을 강화 운동 전에 몸에 에너지를 공급 하루를 위한 연료를 공급하고 식욕을 억제,체중 조절
보충제 강력한 천연 항산화제,체중 조절
소화기 건강 면역 강화 USDA 유기농 인증 유전자 변형 성분 무함유 프로젝트 인증 보충제 코셔 QCS 인증 유기농 B  corp  인증 NSF 글루텐 무함유 인증 비건 인증,체중 조절
1회 제공량당 480mg 식물성 건강 보조 식품피트니스 애호가가 선호하는 성분 품질 보증 실험실 검사 완료,체중 조절
걱정 없이 소변 횟수 조절 안전한 제품  중독성 약물 무함유 소변 욕구 조절 및 안전한 체중 관리에 도움 매일 섭취 시 가장 효과적 24시간 지원 안전하게 간헐적 긴박뇨 완화 건강한 신진대사 촉진으로 체중 관리 숙면 지원 매일 섭취 건강 보조 식품 안전하고 독성에 노출되지 않게 방광 기능을 조절하고 유지하는 2가지 방식여성의 건강에 대한 개방적이고 솔직한 대화를 믿습니다  고객 스스로 자신의 건강을 책임지도록 돕겠습니다  고객 스스로 보람 있는 삶을 유지하도록 돕겠습니다  최고의 비뇨기  질  방광 건강 제품을 전달하도록 노력하겠습니다 ,체중 조절
천연 및 인공 향미료 단백질 35g 식이섬유 및 EFA 글루텐 무함유 복합 탄수화물 21가지 비타민 및 미네랄 맛있는 맛 건강한 소화 대두 단백질 무함유 Lee Labrada 품질 보증,체중 조절
더 좋은 몸을 위한 포뮬라 녹차 가르시니아 크로뮴 L 카르니틴 인삼 메가 B 복합체 카페인 예르바 마테 스피룰리나 보충제 보존제 무함유,체중 조절
아미노산   에너지   체중 감량 언제나 맛있고 에너지 넘치는 보충제 설탕 무함유 케토 승인 지방 감소 촉진 에너지 증진 땅콩 무함유 글루텐 무함유 천연 색소 l 카르니틴  l 타르타르산염 1g   타우린 1g   코코넛워터 250mg   천연 및 인공 색소 보충제 수크랄로오스로 단맛 첨가,체중 조절
비건 인공 색소 또는 인공 향료 무함유 자연이 선사하는 최고 수준의 식물성 식품 유전자 변형 성분 무함유 프로젝트 인증 환경 친화적이며 깨끗함 단백질 30g 섬유질 15g 글루텐 무함유 대두 무함유 최고의 맛을 자랑하는 식물성 단백질  씨앗  새싹 및 채소 보충제 천연 향 Plant Head에서 원하는 것  환경적 이점 동물성 단백질보다 지속 가능하고 환경에 미치는 영향이 적습니다  유전자 변형 성분 무함유 식물 생애의 3단계  씨앗  새싹 및 성숙한 식물을 전부 공급 동물 복지 친화적 영양학적 이점 훌륭한 단백질 공급원 1회 제공량당 30g 하루 영양소 기준치의 60   훌륭한 식이섬유 공급원 1회 제공량당 15g 하루 영양소 기준치의 60   지질 및 PUFA 고도불포화 지방산 의 천연 공급원 채소  과일  씨앗  새싹 및 채소의 유기농 인증 혼합물 라이프스타일적인 이점 채식주의자 비건 대두 무함유 유제품 무함유 유전자 변형 성분 무함유 유당 무함유 일반적인 알레르기 유발 성분 무함유 보존제 무함유 맛이 가장 뛰어난 식물성 단백질,체중 조절
체중 관리 순근육량 증진 근육량을 효과적으로 유지 잇꽃 오일 보충제 Tonalin 순근육량 증진 근육량을 효과적으로 유지 지방 대사 촉진 각성제 무함유,체중 조절
운동선수를 위한 순수 성분 금지 성분 검사 완료 설탕 무함유 제로 탄수화물 타우린   공액리놀레산   EAA 천연 유래 카페인 순근육 증대 커피생두추출물 염료 무함유 보충제 글루텐 무함유 검사 완료 Informed Choice 인증   We Test   You Trust 정기적인 금지 성분 검사 완료 깨끗한 성분 생산 단위별 품질 검사 완료 우수 제조 및 품질 관리 기준 cGMP  인증 시설 천연 및 인공 향료 수크랄로오스 및 아세설팜칼륨으로 단맛 첨가,체중 조절
설탕 무함유 전체적인 건강 증진 Apple Cider 식초 함유 건강 보조 식품 식물성 성분 함유 유제품 무함유 유전자 변형 성분 무함유 식물성,체중 조절
빠르게 뱃살과 군살 감소 소화 기능 개선 빠르게 지방 연소 6배 더 강력한 체중 감량 효과 3배 더 강력한 허리 및 엉덩이 사이즈 감소 효과 보충제인공 색소 무함유 인공 향미료 무함유 젤라틴 무함유 설탕 무함유 인공 감미료 무함유 보존제 무함유,체중 조절
보충제열 발생 촉진 체지방 감소 순근육량 증가,체중 조절
4 Hr Hunger Control Makes 14 Shakes Taste You ll Love A Classic For Over 40 years 24 Vitamins   Minerals  Including A  C  D  E   Zinc 10 g Protein  5 g Fiber  Delicious Taste Clinically Proven Lose Weight   Keep It Off Artificially Flavored Gluten Free1  One sensible meal   enjoy your favorite foods 2  Replace two meals a day   with shakes  smoothies or bars 3  Indulge in three snacks   satisfy hunger between meals,체중 조절
각성제 무함유 지방 감량 톤   스컬프트 보충제 cGMP 인증복부 지방 감량  허벅지 부위 지방 감량  건강한 체성분 ,체중 조절
25년 이상 지켜 온 프리미엄 품질 오염되지 않은 산악지대에서 재배 액티브 홀 스펙트럼 20 1 추출물 비건 유전자 변형 무함유 성분으로 제조 글루텐 무함유 보충제 우수 제조 및 품질 관리 기준 GMP  품질 보증 Enhancing Nature s Miracles Since 1994,체중 조절
보충제 순도 및 효능 보장식욕 감소 혈당 균형 촉진 식탐 억제 설탕 및 탄수화물에 대한 욕구 감소 맛있고 만족스러운 EnviroSimplex  가공 제품풍부한 단백질 낮은 혈당 지수 인공 감미료 또는 향료 무함유 글루텐 무함유 설탕 및 탄수화물에 대한 욕구 감소 건강한 체중 감량을 지원하는 최적의 영양소 혼합물 제공 건강한 식단 및 주기적인 운동과 병행 시 ,체중 조절
가벼운 감미   스테비아 무함유 USDA 유기농 인증 유전자 변형 성분 무함유 프로젝트 인증 Informed Choice org Trusted by sport 인증 NSF 글루텐 무함유 인증 건강한 이동식 단백질 20g 소화가 쉬움   생 프로바이오틱   효소 비건   글루텐 무함유   유제품 또는 대두 성분 없이 제조 코셔 B corp  인증 QCS 유기농 인증 에너지 증진 순근육 조성 포만감깨끗한 유기농 식물성 단백질 20g 44종의 슈퍼푸드 첨가 스테비아 무함유 15억 생 프로바이오틱스   효소 21종의 유기농 식품 비타민   미네랄 유기농 섬유질 7g,체중 조절
Made with Organic Ceylon Cinnamon 1 200 mg Per Serving  Certified Organic by CCOF  Dietary Supplement  Nutricost  Quality Guaranteed Vegetarian Product  GMP Compliant Facility  Non GMO Product  Third Party Tested  Gluten FreeLower Blood Pressure  Reduced Inflammation  Reduced Oxidative Stress Reduced Soreness From Exercise Improved Heart Health  Improved Oral Health,체중 조절
