description,category
건강한 염증 반응   우수한 커큐민 흡수력 임상적으로 연구된 투르메론 Turmerones 을 함유한 커큐민 심황보다 최대 500 배 강한 효능  당신의 건강을 위한 제품 건강 보조 식품 유전자 변형 성분 없음 강력하고 증명된 효능  큐라메드는 1소프트젤 당 풀스펙트럼 커큐미노이드 500 mg을 공급합니다  저희 큐라메드 소프트젤은 강황 캡슐 최대 500개에 해당하는 커큐민의 효능을 제공합니다   임상 연구를 거친 이 커큐민은 발표된 획기적인 연구 31건에서 사용되었습니다  투르메론이 함유된 강황 에센셜 오일이 있는 유일하게 특허받은 커큐민입니다  건강한 염증 반응 지원하는데 뛰어난 효능   간  두뇌  심장 및 면역 건강 지원  고 항산화 ORAC 수치  1 500 000    화학 성분을 사용하지 않고 재배한 비 GMO 강황 사용  유해한 용매 성분 없음  ,통증 완화
빠르고 효과적인 야간용 상품 U S News   World Report Pharmacy Times 약사 추천 1위 상품 동종 요법 활동적인 라이프스타일을 가진 사람들을 위한 포뮬라 빠른 효과 무중독성 상품 알려진 약물 상호 작용 없음 다리 경련 완화 물 없이 복용 가능 위장 불편함 없음 ,통증 완화
PhytO2X  System 1947년 설립 표준화 완전한 효능 보스웰리아 허브 보충제 비건에게 적합 글루텐  밀   유제품 무함유 유전자 변형 성분 무함유 글루텐 무함유 인증 코셔 파르브 ,통증 완화
슈퍼 푸드 고대 허브 슈퍼 푸드 비건 상품 글루텐 무함유 코셔 인증 USDA 유기농 인증 유전자 변형 성분 무함유 프로젝트 인증 CCOF 유기농 인증 ,통증 완화
열을 통한 치유 효과 특허받은 히트셀을 통해 지속적이고 효과적으로 통증 완화 최대 8시간 동안 생리통 완화 몸속 깊숙이 통증 완화 진정 효과가 있는 열을 전달하여 생리통 완화 중독성 약물 무함유 냄새 없는 우리 집 세심한 상품 공기 활성식 일회용 상품 ,통증 완화
Formerly Headache II 동종 요법 편두통 완화 태블릿 두통의 고통 메스꺼움을 동반한 두통의 고통 목 근육 긴장 ,통증 완화
1위 리도카인 브랜드  통증 완화 빠른 효과 신경에 표적화되어 작용 끈적이지 않는 가벼운 포뮬라 등  목  어깨 무릎  팔꿈치 손  손목 발  발목  다리 ,통증 완화
1972년 설립 관절 기능 건강 증진 표준화된 허브 추출물 보스웰리아 65  보스웰리아산으로 표준화 Holistically Balanced  Discover Nature s Answer and Trust the Difference     유전자 변형 성분 무함유 프로젝트 인증 비건 제품 글루텐 무함유 보충제 크루얼티프리 No 동물 실험 ,통증 완화
커큐민 파이토솜 보충제 관절 강화 간 해독 소화기관 지원 대두 성분 무함유 글루텐 무함유 서방형 Thorne 독점 제품 ,통증 완화
강황 추출물 100mg 함유 커큐미노이드 95 로 표준화 항산화 건강 지원 허브 건강 허브 보충제 품질 보증 품질 검사 완료 나트륨 무함유 ,통증 완화
관절 운동성 및 지원 허브 보충제 USDA 유기농 인증 유전자 변형 성분 무함유 프로젝트 인증 B  corp  인증 코셔 할랄 Aditi Organic Certifications Pvt  Ltd  인증 유기농 비건 식물성 글루텐 무함유 ,통증 완화
1 200mg 오메가3   400mg 최적화된 커큐민 건강한 염증 반응을 위한 l 글루타치온 함유 세포 보호 해독 작용 우수한 생체이용률 우수한 중성지방 제형 IGEN 유전자 변형 성분 무함유 검사 완료 순도   제3 기관 검사 완료 보충제 분자 증류 순도 보장 ,통증 완화
관절 건강 및 가동성 캡슐당 720mg 허브 보충제 피부 건강  관절 건강  운동성 및 신체 기능 개선 항산화 효과 제공 Full Spectrum  천연 허브 뿌리줄기 포뮬라 1969년부터 과학에 기반한 고품질 상품 제공 ,통증 완화
최고의 비강 스프레이  신제품 100  천연 제품 카옌  화란 국화  페퍼민트  그리고 카페인으로 만든 제품 빠르고 강력합니다 두통 완화 긴장성 두통 클러스터 편두통 자연 요법 제품 100  천연 화학 물질 없음 졸음을 유발하지 않음 약물 간의 상호작용은 알려지지 않음 비 습관성 제품 일반적인 두통과 편두통 증상  ,통증 완화
관절 건강 및 가동성 개선 HiActives  타트체리 함유 허브 보충제 VitaCherry  관절 건강  운동성 및 신체 기능 강화 활성산소를 중화하는 항산화제 공급 근골격계 건강 증진 1969년부터 과학에 기반한 고품질 상품 제공 ,통증 완화
엑스트라 스트렝스  기초 건강 지원 허브 보충제 B  corp  인증 ,통증 완화
아유르베다 허브 액상 추출물 유기농 강황 뿌리 유전자 변형 성분 무함유 프로젝트 인증 보충제 채식주의자 및 비건에 적합 USDA 유기농 인증 GMP 품질 보증 1968년 설립된 가족 기업 식물 허브 QAI 유기농 인증 ,통증 완화
근육통 타박상 및 붓기 활동적인 라이프스타일을 가진 사람들을 위한 포뮬라 빠른 효과 무중독성 상품 알려진 약물 상호 작용 없음 경미한 부상 또는 과도한 운동으로 인한 통증 완화 ,통증 완화
근육통 및 근육 경직 부상으로 인한 부기 타박상 경제적인 용량 아르니카 천연 유효 성분  동종 요법 의약품의 세계적 리더 동종 요법 아르니카 통증 완화제 1위 마사지용으로 적합 무향 진정작용  파라벤 무함유 경미한 부상  과도한 운동  낙상으로 인한 근육통 및 근육 경직을 일시적으로 완화 타박상으로 인한 통증  부기  멍 완화 ,통증 완화
보충제 위장관 GI  지원 관절 강화 호흡기 지원 글루텐 무함유 ,통증 완화
눈 및 시력 건강 플라보노이드의 허브 공급원 보충제 건강하고 튼튼한 망막 및 황반 촉진 건강한 시력 증진 눈의 피로 및 긴장 완화 1969년부터 과학에 기반한 고품질 상품 제공 ,통증 완화
옷 위에 부착 12시간 지속되는 열로 통증 완화 비의료용 상품 무향 일회용 열 패드 4개입 근육통 진정 오래 가는 완화 효과 공기에 노출되어 활성화 떼어내서 붙인 다음 편안하게 휴식 ,통증 완화
Arnica  12 천연 통증 완화제 관절 통증   경직을 지속적으로 완화 MediNatura 동종 요법 관절염 통증 관절 통증 관절 경직 ,통증 완화
글루텐 무함유 머위 생강 리보플라빈 포뮬라로 표준화됨 보충제 염증 억제를 도와 머리의 편안함 지원 건강한 신경계 신호 전달 강화 두개골 혈관 이완 지원 ,통증 완화
소화 건강 2 In 1 포뮬라 허브 보충제 건강하고 편안한 위장에 도움 활성산소를 중화하는 항산화 작용 1969년부터 과학에 기반한 고품질 상품 제공 ,통증 완화
유기농 성분으로 제조 심혈관 기능 개선 소화기관 건강 강화 면역계 강화 보충제 유전자 변형 성분 무함유 글루텐 무함유 심혈관 기능 개선 소화기관 건강 강화 면역계 건강 강화 강력한 소염 작용을 하는 항산화제 메스꺼움 및 멀미 방지 ,통증 완화
심혈관계 건강 균형 잡힌 개선 허브 보충제 정신  신체  가정을 위한 전반적인 웰니스 증진 최고의 순도 및 효능 1969년부터 과학에 기반한 고품질 상품 제공 ,통증 완화
보충제 오리지널 레시피 천연 성분 ,통증 완화
방사통 또는 전격통 추가 튜브 1개 포함 서양고추나물 30C 동종 요법 의약품 휴대하기 편리한 통증 완화제 알려진 약물 상호 작용 없음 자연적인 방식으로 건강 증진 펠릿 총 240정 인공 색소  향료  감미료 및 보존제 무함유 방사통 또는 전격통 다리 및 허리 통증 치통 ,통증 완화
울금  일상 생활에서 가끔 발생하는 염증을 줄입니다  허브 보조제 1987년부터 이어진 정직   순도   효능 비건 글루텐 무함유 대두 성분 무함유 B Corporation 인증 1987년부터 시작된 Connection Plants   People ,통증 완화
관절 건강 및 가동성 아유르베다 포뮬라 허브 보충제 관절 건강  운동성 및 신체 기능 강화 활성산소를 중화하는 항산화제 공급 1969년부터 과학에 기반한 고품질 상품 제공 ,통증 완화
커큐민즙 복합체 신선한 강황즙으로 만든 제품 용매 무함유 40배 더 높은 생체이용률  유전자 변형 성분 무함유 보충제 채식주의자 비건 식물성 허브 1968년 설립된 가족 기업 우수 제조 및 품질 관리 기준 GMP  품질 보증 ,통증 완화
상온 보관 가능하며 열 안정성이 우수한 프로바이오틱   1회 제공량당 10억 마리 유익한 프로바이오틱 바실러스 코아귤런스로 강화 프리미엄 슈퍼 푸드 윤리적인 방식으로 원료 확보 따뜻한 물 또는 시원한 물만 넣으면 섭취 가능 간편하고 맛있는 아율베딕 골든 밀크 차나 커피의 훌륭한 대용품 유제품 무함유  코코넛 밀크 함유 강황   코코넛 사프란   생강   계피   프로바이오틱 천연 건조 유기농 강황 뿌리   CO2 초임계 강황의 이중 추출물 함유 EcoCert 인증 USDA 유기농 인증 코셔 LactoSpore EcoCert ICO 유기농 인증 ,통증 완화
건강 보조 식품 근육   관절 보조 순도   효능 보장 ,통증 완화
허브 보충제 1930년 설립 85년 넘게 이어온 가족 기업 관절 유연성   운동 범위 정상적인 관절액 기능 지원 Happiness Through Wellness 글루텐 무함유 우수 제조 및 품질 관리 기준 cGMP  비건 친화적 밀 무함유 대두 무함유 유제품 무함유 우수 제조 및 품질 관리 기준 cGMP  ,통증 완화
보충제 가장 잘 흡수되는 형태의 커큐민  건강한 염증 반응 채식주의자 비건에게 적합 순도 및 효능 보장 신체의 자연적인 염증 반응 강화 강력한 항산화 작용 관절 건강 및 기능 증진 심장과 혈관 건강 증진 ,통증 완화
보충제 KION 관절 강화 근육 힘줄 강화 GI 지원 상처 부상 NSF Certified Sport 인증 글루텐 무함유 관절 경직 완화 유연성 증대 경미한 통증과 근육통 완화 운동 스트레스로부터 근육 보호 및 지연발생근육통 DOMS  완화에 도움 트레이닝이나 운동으로 인한 근육 부상 완화 역연령의 영향으로부터 근육 조직 보호 신체 전반에서 균형 잡힌 염증 반응 유지 관절  근육  위장관  간  뇌  눈  신경 포함  건강한 콜레스테롤 대사 촉진 및 간 효소 상향 조절 정상적인 혈당 유지에 도움 시중에서 가장 많이 임상적으로 연구된 커큐민으로 일반 커큐민보다 흡수율이 29배 더 높음 30개 이상의 임상 시험에서 메리바 Thorne이 사용하는 커큐민 추출물 형태  사용 ,통증 완화
보충제 흡수율이 높은 커큐민 흰버드나무   악마의 발톱 포함 건강한 관절 기능 가장 잘 흡수되는 형태의 커큐민 채식주의자 비건에게 적합 순도   효능 보장 관절 건강 및 기능 증진 신체의 자연적인 염증 반응 지원 심장 및 혈관 건강 증진 강력한 항산화 작용 ,통증 완화
통증 완화 포뮬라 1위 수상 임상적으로 연구된 커큐민 및 강황 복합체 안전하고 효과적이며 중독성 없이 통증 완화  여러분의 건강을 위하여   Terry 보충제 코셔 인증 할랄 비건 상품 유전자 변형 성분 무함유 순도   품질 검사 완료 ,통증 완화
Real Heat That Heals Patented Heat Cells for Consistent Effective Relief Up to 8 Hours Pain Relief Deep Penetrating Relief Clinically Proven to Relax Tight Muscles and Enhance Flexibility   Mobility Drug Free Odor Free Air Activated  One Time Use Provides heat therapy for temporary relief of minor muscular and joint aches and pains associated with overexertion  strains  sprains  and arthritis  ,통증 완화
임상 연구를 마친 보스웰리아 고급 보스웰리아 건강한 염증 반응  건강에 좋은 제품 보충제 할랄 유전자 변형 성분 무함유 우수 제조 및 품질 관리 기준 cGMP  준수 시설에서 제조 건강한 염증 반응 전체적인 세포 보호 임상 연구 완료  자체 표준화 표준화되지 않은 보스웰리아에 비해 AKBA 성분 최대 10배 함유 안전하며 효과적 ,통증 완화
USDA 유기농 유전자 변형 성분 미함유 프로젝트 인증 5 배 강도 발효 강황 및 생강 유기농 후추 및 소화를 돕는 프로바이오틱스 허브 보조제 코셔 QCS 인증 유기농 사회적 기업 인증 비건 인증 글루텐 미함유 NSF 인증 관절 건강 및 운동성 증진 프로바이오틱스 및 소화 기능을 향상시키는 유기농 후추 추출물 함유 생산 유통 이력제  검증 완료  순수한 성분 제 3 자에 의한 감사  유기농 인증 및 유전자 변형 성분 미함유 인증 전문적 배합 ,통증 완화
관절 건강 및 가동성 캡슐당 400mg 허브 보충제 관절 무결성  움직임 및 유연성에 도움 관절 건강에 도움 고대 아유르베다 체계에서 풍부한 역사를 지닌 인도 허브 1969년부터 과학에 기반한 고품질 상품 제공 ,통증 완화
관절 통증   경직 부상으로 인한 부기 타박상 동종 요법 약물 졸음을 유발하지 않음 약물 상호 작용 없음 자연스럽게 체내에서 작용 아르니카 천연 유효 성분 동종 요법 의약품의 세계적인 리더 경미한 부상  과도한 운동  낙상으로 인한 근육통 및 결림을 일시적으로 완화합니다  타박상으로 인한 통증  부기  멍 완화 ,통증 완화
1973년 설립 기업 필수 추출물 커큐민 95  심혈관계 건강 관절 건강 보충제 유전자 변형 성분 무함유 프로젝트 인증 품질 검사 완료 비건 건강한 삶 지원 ,통증 완화
슈퍼 푸드 맛있는 허브 슈퍼 푸드 혼합물 비건 글루텐 무함유 코셔 인증 USDA 인증 유기농 유전자 변형 성분 무함유 프로젝트 인증 CCOF 유기농 인증 강황 마카 구기자 계피 생강 보스웰리아 카르다몸 흑후추 ,통증 완화
관절   심장 건강   세포 방어 강화 1 500mg 높은 흡수율 제3기관이 인증한 순도 및 효능 USDA 유기농 인증 1회 제공량당 3정 보충제 QAI 유기농 인증 글루텐 무함유 유제품 무함유 유전자 변형 성분 무함유 스페셜 포뮬라 우수 제조 및 품질 관리 기준 GMP  인증 시설에서 제조 A Wealth Of Wellness  ,통증 완화
1930년 설립 글루텐 무함유 Happiness Through Wellness 유전자 변형 성분 무함유 프로젝트 인증 허브 보충제 1개월분 우수 제조 및 품질 관리 기준 cGMP  비건에게 적합 밀 무함유 옥수수 무함유 대두 무함유 유제품 무함유 동물성성분 무함유 85년 넘게 이어온 가족 기업 ,통증 완화
보충제 흡수율이 높은 커큐민 건강한 장 내벽 형성 및 근육 회복 증진 채식주의자 및 비건에 적합 소화기 및 면역 건강 증진 건강하고 튼튼한 장 내벽 형성 도움 건강한 염증 반응 강화 운동 후 근육 세포 회복 증진 ,통증 완화
강황 뿌리추출물 허브 보충제 표준화 추출물 커큐미노이드 95  용해도 향상을 위한 소프트젤 보충제 식물성 허브 1968년에 설립된 가족 기업 GMP 품질 보증 ,통증 완화
관절 건강 및 가동성 캡슐당 125mg AKBA 30  함유 5 LOXIN  허브 보충제 관절 무결성  움직임 및 유연성에 도움 우수하고 신뢰할 수 있는 결과를 위한 AKBA 30  제공 1969년부터 과학에 기반한 고품질 상품 제공 ,통증 완화
1969년 설립 프리미엄 추출물 관절 운동 능력 Tru ID  진품 인증 제공량당 307mg 보충제 비건에게 적합 ,통증 완화
건강한 염증 반응  흡수율이 뛰어난 커큐민 임상적으로 연구된 커큐민 및 강황 복합체 강황에 비해 최대 500배 강도  여러분의 건강을 위하여   Terry 건강 보조 식품 할랄 유전자 변형 성분 없음 입증된 강력한 효과 CuraMed 1정당 풀 스펙트럼 커큐미노이드 250mg이 함유되어 있습니다  CuraMed 소프트젤 1정은 강황 캡슐 500개에 해당하는 커큐민 효능을 제공합니다   임상 연구를 완료한 커큐민은 31건의 혁신적인 연구에 사용되었습니다  강황 복합체 함유 강황 에센셜 오일이 포함된 유일한 특허 커큐민 제품 건강한 염증 반응을 위한 우수한 지원  간  두뇌  심장  면역 건강 지원 산화 스트레스와 활성산소로부터 세포 보호 항산화제 ORAC 수치 1 500 000   화학 물질 없이 재배한 유전자 변형 성분 미포함 울금 유해한 용매 없음 ,통증 완화
전신 1회 제공량당 커큐미노이드 475mg 건강한 염증 반응 지원 Bioperine    비타민C 함유 유전자 변형 성분 무함유 프로젝트 인증 보충제 비건 인증 NSF 글루텐 무함유 인증 유제품 무함유 대두 무함유 125종 이상의 살충제 및 제초제 성분 검사 완료 코셔 글리포세이트 잔여물 무함유 B  corp  인증 ,통증 완화
생리증후군 완화 불편함  통증  복부팽만  과민성 동종 요법 의약품 졸음을 유발하지 않음 알려진 약물 상호 작용 없음 신체의 자연 치유력에 도움 동종 요법 의약품의 세계적인 리더 불편함 경미한 통증 복부 팽만 과민반응 ,통증 완화
리도카인 4    멘톨 1  처방전 없이 구현한 최대 강도의 리도카인  침투하여 목표 부위를 빠르게 완화 편안한 원단 제자리에 고정됨 각 10cm x 14cm 3 15 16  x 5 1 2   신경까지 침투 빠른 효과 붙이고 떼기 쉬움 통기성 있는 부착 패드의 통증 완화 연고 허리 목  어깨 무릎  팔꿈치 발목  다리 ,통증 완화
Soil Association 유기농 인증 식품 보충제 GB ORG 05 EU 비EU 농업 GMP 표준을 준수하여 영국에서 제조 ,통증 완화
Amazing Formulas  보충제 강력한 항산화제 및 항염증 효과 심장  소화기  관절 건강 강화 영양소 흡수를 촉진하는 BioPerine  1회 제공량당 1 500mg 우수 제조 및 품질 관리 기준 GMP 을 준수하는 고품질 상품 미국 식품의약국 FDA  등록 시설에서 제조 ,통증 완화
관절 통증   경직  날씨로 인한 통증 추가 튜브 1개 포함 러스 톡스 30C 동종 요법 의약품 휴대하기 편리한 통증 완화제 알려진 약물 상호 작용 없음 자연적인 방식으로 건강 증진 펠릿 총 240정 인공 색소  향료  감미료 및 보존제 무함유 관절 부어오름 활동 시 심해지는 통증 근육 통증 경직 춥거나 습도가 높은 날씨에 심해지는 통증 ,통증 완화
비타민 1회 제공량당 1 600mg 첨단 기술 글루텐 무함유 유전자 변형 성분 무함유 허브 보충제 전통적인 허브 지원 ,통증 완화
보충제 가장 잘 흡수되는 형태의 커큐민  건강한 염증 반응 순도 및 효능 보장 채식주의자 비건에게 적합 신체의 자연적인 염증 반응 강화 강력한 항산화 작용 관절 건강 및 기능 증진 심혈관 건강 강화 ,통증 완화
유전자 변형 성분 없음 글루텐 불포함 1930 년 설립 관절 지원을 위한 제품 허브 보조제 베지 캡슐 85 년 이상 가족 소유 기업 cGMP 비건 친화적 제품 소맥 없음 옥수수 불포함 대두 성분 없음 유제품 없음 동물 유래 성분 없음 전면에 있는 허브가 특징입니다  심황  리좀 및 지상부  2 개월 분량 ,통증 완화
아르니카 몬타나 전체 꽃 USDA 유기농 인증 Organic Certifiers 유기농 인증 ,통증 완화
임상 시험을 완료한 추출물이 함유된 관절 건강 혼합물 보충제 유전자 변형 성분 무함유 LE 인증 건강하고 편안한 관절 증진 염증을 억제하여 관절 건강 지원 편안한 관절 기능 증진 임상적으로 연구된 식물 추출물 함유 ,통증 완화
관절 건강 및 가동성 캡슐당 750mg 내산성 캡슐 허브 보충제 식물성 EMBO Caps  정신  신체  가정을 위한 전반적인 웰니스 증진 최고의 순도 및 효능 1969년부터 과학에 기반한 고품질 상품 제공 ,통증 완화
BioPerine 으로 더욱 강력해진 효과 보충제 품질 검사 완료 GMP   우수 제조 및 품질 관리 기준에 따른 일관된 품질 비건 상품 Greatness by Nature  이열치열 관절 운동을 편안하게 하는 효과 BioPerine  흑후추 추출물로 생체이용률 향상 ,통증 완화
보충제 식물성 정신  신체  가정을 위한 전반적인 웰니스 증진 최고의 순도 및 효능 1969년부터 과학에 기반한 고품질 상품 제공 ,통증 완화
멘톨 3  메틸살리실레이트 10  국소 진통제 8 12시간 동안 부착 처방전 없이 살 수 있는 미국 식품의약국 승인 통증 완화 패치 임상 시험에서 효과 확인 민트 향 요통 근육통 염좌 타박상 좌상 염좌 경미한 요통 관절염 타박상 ,통증 완화
유기농 울금과 아슈와간다로 제조 울금  대추야자  허브의 맛있는 만남 울금 파우더 보조제 비건 제품   유제품 무함유 Oregon Tilth 인증 유기농 유전자 변형 성분 무함유 글루텐 무함유 순도 테스트 완료 ,통증 완화
보충제 임상에서 효과가 증명됨   건강한 관절 촉진 콜라겐 보충 빠른 효과   모두를 위한 제품 ,통증 완화
PhytO X 시스템 1947년 설립 표준화  울금  허브 보조제 글루텐  밀 및 유제품 미함유 비건에게 적합 유전자 변형 성분 없음 K 파르브 ,통증 완화
관절 건강 및 가동성 Meriva  함유 허브 보충제 관절 건강  운동성 및 신체 기능 강화 활성산소를 중화하는 항산화제 공급 위장관 건강 증진 1969년부터 과학에 기반한 고품질 상품 제공 ,통증 완화
동종요법 다리 경련 근육 통증 및 경련 수면 중 경련 및 통증 근육 통증 및 경련 종아리 및 발 경련 수면 중 경련 및 통증 ,통증 완화
나이들지 않는 자산 허브 보충제 ,통증 완화
브로드 스펙트럼 움직임을 위한 가동성 강화 Apresflex  보스웰리아  글루코사민 및 콘드로이틴 가동성 및 관절 건강 보조 관절 유연성 촉진 히알루론산 및 MSM 함유 보충제 글루텐 무함유 대두 무함유 GMP   우수 제조 및 품질 관리 기준 땅콩 무함유 유제품 무함유 ,통증 완화
브로드 스펙트럼 움직임을 위한 가동성 강화 Apresflex  보스웰리아  글루코사민 및 콘드로이틴 가동성 및 관절 건강 보조 관절 유연성 촉진 히알루론산 및 MSM 함유 보충제 글루텐 무함유 대두 무함유 GMP   우수 제조 및 품질 관리 기준 땅콩 무함유 유제품 무함유 ,통증 완화
동종요법 No  1 아르니카 통증 완화제 근육통 및 근육 결림 부상으로 인한 붓기 타박상 부스러기가 떨어지지 않음 손이 더러워지지 않음 천연 유효성분 Boiron   동종 요법 의약품의 세계적 리더 마사지가 가능한 롤러 볼 빠른 흡수 무향 끈적임 없음 빠른 피부 흡수 무향 쿨링 효과 경미한 부상  과도한 운동  낙상으로 인한 근육통 및 결림을 일시적으로 완화합니다  타박상으로 인한 통증  붓기  멍 완화 ,통증 완화
커큐민   흑후추   생강 염증 반응 증진 및 항산화 작용 커큐미노이드 추출물 95  보충제 맛있는 강황 뛰어난 맛과 강력한 효과 어린이와 성인을 위한 달콤한 솔루션 GMP 인증 품질 품질 검사 완료 유전자 변형 성분 무함유 비건 상품 정성을 담은 상품 ,통증 완화
대사성 염증 억제 보충제 ,통증 완화
표준화 1회 제공량당 2 000mg   TRU ID 진품 인증 글루텐 무함유 유전자 변형 성분 무함유 허브 보충제 전통적인 허브 보충제 DNA 검사 완료 식물 성분 ,통증 완화
서방정 포뮬라 강황 추출물 일반 커큐민보다 3배 더 강력한 커큐민  생체 활성 강황 추출물 보충제 ,통증 완화
표준화된 추출물 커큐미노이드 95  유전자 변형 성분 무함유 채식주의자 비건에게 적합 코셔 보충제 할랄 ,통증 완화
강황 Curcuma longa  신체 회복 USDA 유기농 인증 허브 보충제 강황 액상 추출물 Organic Certifiers 유기농 인증 건조 허브 용제 비율  1 4 ,통증 완화
심장 건강 증진 3 in 1 포뮬라 허브 보충제 정신  신체  가정을 위한 전반적인 웰니스 증진 최고의 순도 및 효능 1969년부터 과학에 기반한 고품질 상품 제공 ,통증 완화
 329  뛰어난 흡수력 보충제 Unleash Your Potential 염증 반응 감소 관절 건강 증진 세포 에너지 활성 면역 기능 강화 인공 색소 무함유 인공 향료 무함유 젤라틴 무함유 인공 감미료 무함유 보존제 무함유 ,통증 완화
25년 이상 지켜온 프리미엄 품질 액티브 홀 스펙트럼 4 1 추출물 비건 유전자 변형 성분 무함유 글루텐 무함유 보충제 GMP 인증 및 미국 식품의약국 등록 Enhancing Nature s Miracles Since 1994  ,통증 완화
