description,category
 목초 사육   방목 사육 MCT 중쇄중성지방  오일 분말 5g 목초 사육 콜라겐 10g  설탕 0g   대두 성분 무함유 글루텐 무함유 유전자 변형 성분 무함유 Good  Clean Nutrition  목초 사육   방목 사육 콜라겐 펩타이드 단백질 대 지방 비율 2 1 유제품 성분 무함유 대두 성분 무함유 유전자 변형 성분 무함유 글루텐 무함유 인공 보존제  향미료 또는 색소 무함유 무가당 ,모발-피부-손톱
 건강 보조 식품 콜라겐   식물 칼슘   마그네슘   비타민 D 3   K 2 실험실 검증 완료 유전자 변형 성분 무함유 미네랄 50  콜라겐 25  물 25 ,모발-피부-손톱
 임상 시험 완료 성분 Dr  Axe 포뮬라 식품 원료 콜라겐 5가지 I  II  III  V  X형 건강한 에너지 지원 2스쿱당 콜라겐 20g 목초 사육 및 방목 사육 유전자 변형 성분 무함유 천연 식품 보충제 피부 장 손발톱 모발 관절 임상 시험을 마친 유형 V 및 X 콜라겐의 공급원 4주 후 눈가 주름 개선   임상 시험을 마친 유형 V 및 X 콜라겐의 공급원 7일 후 관절 불편함 완화  ,모발-피부-손톱
 혁신적인 영양제 높은 비오틴 함량 저자극성 보충제 글루텐 무함유,모발-피부-손톱
 가수분해케라틴 함유 모발  피부  손발톱 건강 증진 GMP 보충제 유전자 변형 성분 무함유,모발-피부-손톱
 1  3형 콜라겐 1회 제공량당 콜라겐 12g 함유 용기당 제공 횟수  30회 피부 보습   건강한 피부  모발 및 손발톱 지원 분말 보충제 케토 인증   글루텐 무함유 Igen   유전자 변형 성분 무함유 검사 완료,모발-피부-손톱
 소에서 추출 USDA 유기농 인증 유기농 목초 사육 소 보충제 QCS 유기농 인증 뼈 및 관절 건강 증진 동안 효과 건강한 피부 건강한 피부  모발 및 손발톱을 지원하는 동시에 뼈  관절  근육 및 장을 강화하는 영양소를 제공합니다  쉽게 흡수되고 미네랄이 풍부한 콜라겐이 농축되어 있는 뼈  관절 및 연결 조직으로 만들어집니다  유기농으로 사육한 동물 원료에서 조달합니다  따라서 유전자 변형 성분을 배제하고 지속 가능한 농업을 지지하는 것에 대해 확신을 느낄 수 있습니다  맛을 감추기 위해 뼈 육수 상품에 첨가되기도 하는 설탕 및 향료를 사용하지 않습니다  준비하는 어려움 없이 뼈 육수의 모든 효능을 얻을 수 있으므로 건강 루틴을 간소화해 줍니다 ,모발-피부-손톱
 I형 및 III형 비타민C 퀘르세틴 파이토솜 보충제 퀘르세틴 파이토솜 비타민C 목초사육   방목사육 우수 제조 및 품질 관리 기준 cGMP  인증 유전자 변형 성분 무함유,모발-피부-손톱
 보충제의 기준이 되는 상품 히알루론산과 비타민C로 강화된 콜라겐 펩타이드 I  II  III  V  X형 쉽게 용해됨 40회 제공량 보충제 목초 사육 소고기 BSE 프리 농장 사육 닭고기 자연산 생선 난각막 유전자 변형 성분 무함유 글루텐 무함유 유제품 무함유 첨가물 무함유 품질 검사 완료 젊고 생기 넘치는 피부 순근육량 증가 잔주름 및 깊은 주름 완화 건강한 모발 및 손발톱 개선 관절 및 뼈 강화 건강한 장 관리,모발-피부-손톱
 임상적으로 연구된 성분 에드워드 Axe 포뮬라 2스쿱당 콜라겐 20g 피부 모발 식품 원료 콜라겐 5가지 I  II  III  V  X형 천연 식품 보충제 비타민C   프로바이오틱 목초 사육 및 방목 사육 손발톱 관절 모발 굵기와 성장을 증진하고 모발 끊어짐이 완화됩니다  4주 후 눈가 주름이 개선되고 8주 후에는 피부톤이 개선됩니다 ,모발-피부-손톱
 프리미엄 허브 포뮬라 본연의 아름다움을 위한 식물성 실리카 모발  피부  손발톱 강화 글루텐 무함유 비건 제품 보충제 튼튼하고 유연한 손발톱  윤기 있는 모발에 도움 피부의 탄력 유지에 도움 피부  결합 조직  관절 및 뼈 건강 강화,모발-피부-손톱
 특허받은 복합체 건강하고 생기 있는 피부 BioCell Collagen  젤라틴 무함유 보충제,모발-피부-손톱
 1973년 설립 서방형 모발  피부   손발톱 보충제 품질 검사 완료 비건 건강한 삶 지원,모발-피부-손톱
 생체 활성  생체 이용 가능한 단백질 및 아미노산의 고유한 공급원 영양소가 풍부한 슈퍼 푸드 1979년 설립 천연  활력 보충  영양 공급 목초 사육  방목 사육 우피에서 추출한 1   3형 콜라겐 무맛  찬물에도 잘 녹는 제품 뷰티   활력   젊음   재생 Paleo 인증 유제품 무함유 유전자 변형 성분 무함유 글루텐 무함유 대두 무함유 글리포세이트 무함유 검사 완료 생체이용성  소화 가능  차갑거나 뜨거운 음료에 용해 가능 신체의 자연적인 치유 과정 보조 뼈  관절  힘줄  인대 건강 증진 근육 회복에 도움 운동 기능 향상 피부  모발  손발톱을 자연스럽게 개선 노화 징후 억제 잔주름 및 주름살 최소화 건강한 소화   전반적인 장 건강 증진,모발-피부-손톱
 식이보충제,모발-피부-손톱
 목초 사육 지속 가능한 어업 동물복지 닭 계란껍질막 기타 천연 향료 함유 천연 콜라겐   I  II  III  IV  V  X형 보충제 부드러운 피부 손발톱 강화 모발 성장 장 건강 강화 관절 이완 깨끗한 성분  깔끔한 맛 유전자 변형 성분 무함유 인증 친환경 상품 글루텐 무함유 GMP 인증 시설 깨끗함   순수함   최적화 비가수분해콜라겐으로 만족하지 마십시오  목초 사육 소고기  자연산 대구  동물복지 닭 및 계란껍질막으로 제조되었습니다  깨끗하고 지속 가능한 성분이 최고의 콜라겐 원료입니다  6가지 유형의 주요 콜라겐 I  II  III  IV  V 및 X형 으로 된 강력한 조성물로서 전신 건강에 뛰어난 효능을 제공합니다  I형   피부 탄력 II형   관절 및 면역계 III형   피부  혈관  주요 장기 IV형   세포 건강 및 성장 V형   피부  힘줄  면역계 X형   관절  뼈  근육 및 모발,모발-피부-손톱
 피부  모발  손발톱 위장 건강  관절 강화 목초 방목 사육 28회 제공량  1회 제공량당 콜라겐 8 000mg 무설탕  콜라겐 단백질 분말 Eat Better   Go Further  4가지 강력한 성분   그게 전부입니다  1스쿱   콜라겐 펩타이드 8g 건강 증진 팔레오 및 케토 NSF CGMP 시설에서 제조 코셔 타입 1 및 3  호르몬 및 항생제 무함유 유제품 무첨가 피부 보습 및 탄력 모발  손발톱 위장 건강 뼈 및 관절,모발-피부-손톱
 케라틴 보충제 판매 1위 브랜드  비오틴 및 레스베라트롤 함유 모발 손발톱 강화 및 영양 공급 글루텐 무함유 보충제,모발-피부-손톱
 유전자 변형 성분 무함유 글루텐 무함유 구미젤리 3개당 비타민C 90mg 펙틴 기반 구미젤리 3개당 비타민A 900mcg 구미젤리 3개당 l 라이신 150mg 설탕 무함유 유전자 변형 성분 무함유 비건 천연 향료 보충제,모발-피부-손톱
 Dr  Axe 포뮬라 임상 연구 완료 성분 식품 원료 콜라겐 5가지   I  II  III  V  X형 비타민C   프로바이오틱 2스쿱당 콜라겐 20g 목초 사육 및 방목 사육 유전자 변형 성분 무함유 천연 식품 보충제 임상 연구된 V 및 X형 콜라겐의 공급원 4주 후 눈가 주름 개선   임상 연구된 V 및 X형 콜라겐의 공급원 7일 후 관절 불편감 감소  ,모발-피부-손톱
 히알루론산 100mg  l 글루타민  비오틴 노화 방지  피부 보습  근육  관절 강화 28일의 깊은 주름 완화 목초 사육 및 방목 사육 I 및 III형 호르몬 및 항생제 무함유 2스쿱당 콜라겐 단백질   20g 아름다운 모발  피부 및 손발톱을 위한 상품 근육 및 관절 건강에 도움 장 건강 및 소화 기능 팔레오   케토 친화적 유전자 변형 성분 무함유   글루텐 무함유 깊은 주름 완화 피부 탄력과 밀도를 높이는 동시에 잔주름과 눈가 주름을 완화하는 데 도움을 줍니다  건강한 모발과 튼튼한 손발톱을 강화합니다  뼈와 근육을 강화하고  관절의 편안함과 운동성을 증진하며  장 건강을 증진합니다 ,모발-피부-손톱
 총제공량 25g 비건 | 유제품 무함유 | 글루텐 무함유 | 설탕 무함유 천연 향료 사용 비건 인증 유전자 변형 성분 무함유 보충제 새로운 콜라겐 생성   Saberry 암라추출물  아미노산 프롤린  글라이신  식물 단백질의 고유 혼합물 피부와 관절에 수분 보충    세라마이드 라는 식물성 오일이 수분 장벽을 복구하여 피부와 관절에 수분을 충분히 공급 기존 콜라겐 보호   OxyPhyte  백차 추출물과 히알루론산이 콜라겐 분해를 방지 Flavor Pure   맛이 중요합니다  뛰어난 맛과 식감을 위해 당사는 천연 식품 성분을 혼합하는 방법을 개발했습니다  Select Source   좋은 재료에서 좋은 영양소를 얻을 수 있습니다  당사는 고유한 평가 과정을 통해 전 세계에서 확보한 수많은 신선한 재료를 검토합니다  Purity Promise   제조 공정의 모든 단계를 미국 내 자체 시설에서 관리함으로써 상품의 순도를 보장합니다 ,모발-피부-손톱
 보충제 관절 및 피부 건강 증진 BioCell Collagen ,모발-피부-손톱
 손톱  머리카락  피부  결합 조직을 위한 미네랄 식품 보충제,모발-피부-손톱
 보충제 피부 및 관절 건강 채식주의자 비건에게 적합,모발-피부-손톱
 건강보조식품 관절 로직 전반적인 관절 및 피부 건강을 위한 노화 억제 제형 채식주의 Friendly 관절 건강을 위한 특허출원 경구용 히알루론산 모발 모낭들 파부 눈 잇몸 관절 건강한 관절 및 정상적인 이동성 건강한 피부 및 입술 투명하고 건강한 눈 건강한 모발 및 두피 사용하기 쉬운 액상 형태 피부 및 관절을 위한 고분자량 간편합니다   하루 한 번 비동물성 산출 그리고 채식주의 친화적,모발-피부-손톱
 보충제 모발 건강 개선 손발톱 강화 에너지 생산 글루텐 무함유 인공 보존제 무함유 효능 및 품질 보증 미국 식품의약국 등록 시설에서 제조,모발-피부-손톱
 1947년 설립 강력한 효능 피부  손발톱  모발 건강 지원 밀 및 유제품 무함유 글루텐 무함유 인증 비건에게 적합 유전자 변형 성분 무함유 코셔 파르브 보충제,모발-피부-손톱
 I  II  III  V  X형 5가지 히알루론산   비타민C   프로바이오틱스 보충제 무맛 분말 목초사육   방목사육 cGMP 인증 유전자 변형 성분 무함유,모발-피부-손톱
 America s Favorite 아름다움을 위한 종합 비타민 건강 보조 식품 100  만족 보장,모발-피부-손톱
 무설탕 의학적 입증 액상 단백질 뛰어난 흡수 건강 보조 식품 코셔 더욱 탄력있는 몸매 모발  피부 및 손톱 관절 및 뼈 장 및 상처 회복 케토 및 팔레오 승인 1 fl oz 당 단백질 함량 높음 유전자 변형 성분 없는 초지에서 방목하여 얻은 콜라겐 섞을 필요 없음  흘릴 염려 없음 ,모발-피부-손톱
 모발 손발톱 강화 및 영양 공급 모발 끊어짐 감소 및 모발 성장 주기에 도움 특허받은 성분 글루텐 무함유 검사 완료 임상 연구 완료 성분 보충제 베스트셀러 케라틴 브랜드 ,모발-피부-손톱
 관절 건강 및 가동성 캡슐 1정당 40mg 보충제,모발-피부-손톱
 콜라겐 타입 1   3 히알루론산 비타민C 아름다운 피부  건강한 모발 및 손발톱 1회 제공량당 콜라겐 12g 함유 용기당 제공 횟수  15회 크랜베리 향과 기타 천연 향 보충제 목초 사육 글루텐 무함유 Igen 유전자 변형 성분 무함유 테스트 완료 100  PCR 용기 ,모발-피부-손톱
 콜라겐 I  II  III  V  X형 히알루론산 비오틴 비타민C 보충제 유전자 변형 성분 무함유 피부  모발  손발톱 성장 촉진,모발-피부-손톱
 MSC 지속 가능한 수산물 인증 MSC 인증 자연산 대서양 대구 목초 사육 소 사골 육수 윤리적인 방식으로 공급받은 닭고기 보충제 동안 효과 뼈 및 관절 건강 증진 소화 기능 강화,모발-피부-손톱
 치료제 등급 비타민 100  품질 만족 보장 생기 있는 피부 노화 증상 완화에 도움 글루텐 무함유 유전자 변형 성분 무함유 보충제 보습 포뮬라 보충제 스킨 활력 강화 포뮬라,모발-피부-손톱
 모발  피부  손발톱 강화 콜라겐 부스터 임상 검증된 성분 리포소말 Support  보충제 복용컵 포함,모발-피부-손톱
 첨가물을 넣지 않는 기업 의사가 제조한 제품 임상적으로 입증된 비변성 콜라겐 메리바커큐미노이드 건강 보조 식품 임상적 효능 미국산 제품 마그네슘스테아레이트 무함유 글루텐 무함유,모발-피부-손톱
 1932년 설립 혁신적인 품질 I형 및 III형 콜라겐 600mg 가수분해 해양 콜라겐 피부  모발  손발톱   관절 건강을 위한 Solusil  혼합물 보충제 하루 2정 자연산 냉수성 심해 어류,모발-피부-손톱
 보충제 피부 및 손발톱 건강 증진 채식주의자 비건에게 적합,모발-피부-손톱
 콜라겐 10g   MCT   프로바이오틱스 코코넛 밀크로 제조 에너지  뷰티  관절 건강 증진 유제품 무함유 12회 제공량 건강 보조 식품 Certified B Corporation 글로벌 사회적 기업 인증  BPA 무함유 Igen   유전자 변형 성분 무함유 검사 완료 Keto Certified 케토 인증  Certified Paleo 팔레오 인증  Certified Gluten Free   NSF NSF 글루텐 무함유 인증  관절 및 운동 기능 아름다운 모발 및 손발톱 윤기나는 피부 에너지,모발-피부-손톱
 중독성 약물 무함유 가는 모발에 영양 공급 및 기존 모발 성장 촉진 임상 시험 완료 보충제 과학적인 배합 AminoMar  마린 복합체,모발-피부-손톱
 히알루론산 탄력 수분,모발-피부-손톱
 히알루론산 100mg  l 글루타민  비오틴 노화 방지  피부 보습  근육  관절 강화 28일의 깊은 주름 완화 목초 사육 및 호르몬제에서 방목 사육 I 및 III형 호르몬 및 항생제 무함유 2스쿱당 콜라겐 단백질 20g 팔레오   케토 친화적 유전자 변형 성분 무함유 글루텐 무함유 아름다운 모발  피부 및 손발톱을 위한 상품 근육 및 관절 건강에 도움 장 건강 및 소화 기능 특징 Verisol 생체 활성 콜라겐 펩타이드 집에서나 이동 중에도 즐길 수 있습니다  흔들기 | 블렌딩 | 굽기 보충제 깊은 주름 완화 피부 탄력과 밀도를 높이는 동시에 잔주름과 눈가 주름을 완화하는 데 도움 건강한 모발과 튼튼한 손발톱을 강화합니다  뼈와 근육을 강화하고  관절의 편안함과 가동성을 촉진하며  장 건강을 증진합니다 ,모발-피부-손톱
 관절 건강 및 가동성 연골  힘줄 및 인대 유지에 도움 관절 무결성  움직임 및 유연성에 도움 1969년부터 과학에 기반한 고품질 상품 제공,모발-피부-손톱
 식물성 성분 수분 공급으로 노화 방지 효과 장 건강 프로바이오틱   1회 제공량당 20억CFU 히알루론산 및 비오틴 보충제 무가당 코셔 인증 동물성 원료 말굽  무함유 동물성 원료 뿔  무함유 동물성 원료 가죽  무함유 채소 1회 제공량에 해당하는 양 대두 무함유 첨가당 0g 케토 친화 상품 글루텐 무함유 유제품 무함유 유전자 변형 성분 무함유 100  비건 상품,모발-피부-손톱
 뷰티 필수 요소 100  순수 젤라틴 분말 보충제 피부 건강 증진 관절 및 모발 건강 지원 젤 제형으로 요리에 넣으면 농도가 높아짐 목초 사육 및 유전자 변형 성분 무함유 팔레오 친화 제품 케토 인증 제품 코셔 인증 Ko BioChecked 유전자 변형 성분 무함유 인증 100  목초 사육 인증 글루텐 무함유 인증,모발-피부-손톱
 5가지 유형의 식품 원료 콜라겐 I  II  III  V  X형 천연 식품 보충제 수면 지원 피부 건강 손발톱 강화 관절 강화,모발-피부-손톱
 피부  모발  손발톱 포뮬라 보충제 남녀노소 모두에게 적합 아미노산 18종 콜라겐 보충 노화 증상 완화 피부  모발  손발톱 재생 힘줄 및 인대 강화,모발-피부-손톱
 비오틴  케라틴  히알루론산 자연산 유전자 변형 성분 무함유 보충제 케라틴 모발 건강 cGMP 인증 시설에서 제조 콜라겐 10g 비오틴 10 000mcg,모발-피부-손톱
 Allmax 천연 성분 목초 사육   방목 사육 관절 및 뼈 건강을 증진하는 콜라겐 10g 함유 피부  모발 및 손발톱을 튼튼하게 하는 비오틴 10 000mcg 함유 항산화제 공급원 비타민C 90mg 함유 보충제 모든 생산 단위에 대해 품질 검사 완료 우수 제조 및 품질 관리 기준 cGMP  인증 시설 글루텐 무함유 케토 팔레오 모발   피부   손발톱   관절,모발-피부-손톱
 모발 건강 개선 임상 검증된 포뮬라 판매 1위 브랜드 가는 모발에 영양 공급  탈모 완화  모발 굵기 개선  중독성 약물 무함유 보충제 콜라겐 복합체,모발-피부-손톱
 임상 연구 완료 성분 Dr  Axe 포뮬라 5가지 유형의 식품 원료 콜라겐 I  II  III  V  X형 비타민C   프로바이오틱 2스쿱당 콜라겐 20g 목초 사육 및 방목 사육 유전자 변형 성분 무함유 천연 식품 보충제 임상 연구된 유형 V 및 X 콜라겐의 공급원 4주 후 눈가 주름 개선   임상 연구된 유형V 및 X 콜라겐의 공급원 7일 후 관절 불편감 감소  ,모발-피부-손톱
 1994년 설립 BioCell Collagen  히알루론산 OptiMSM   Nature s C  함유 모발  피부  손발톱 건강 보충제 Enhancing Nature s Miracles GMP 인증 및 미국 식품의약국 등록,모발-피부-손톱
 피부  모발  손발톱 포뮬라 보충제 아미노산 18종 콜라겐 보충 노화 방지 피부  모발  손발톱 재생 All of You 를 위한 상품,모발-피부-손톱
 보충제의 기준이 되는 상품 카페인 무함유 신진대사 강화 콜라겐 펩타이드 콜라겐 I  II  III  V  X형 눈에 띄는 셀룰라이트 완화에 도움   천연 및 인공 향료 보충제 목초 사육 소고기 BSE 프리 농장 사육 닭고기 자연산 생선 난각막 유전자 변형 성분 무함유 글루텐 무함유 유제품 무함유 염료 무함유 Vitauthority 정품 Dimpless  Sensoril ,모발-피부-손톱
 일일 콜라겐 10g 피부  모발  손발톱   관절 건강에 도움 자연산   유전자 변형 성분 무함유 보충제 Whole30 Approved 유제품 무함유 글루텐 무함유 건강한 피부 건강한 관절 및 뼈 단일 성분 섭취하기 편한 캡슐 Paleo 인증 모발 및 손발톱 건강에 도움  Stayvital,모발-피부-손톱
 피부  모발  손발톱  관절 건강 증진 보충제 콜라겐 I   III형 아미노산 18종 목초 사육 방목 사육 소화 효소 히알루론산 유전자 변형 성분 무함유 대두 무함유 유제품 무함유 글루텐 무함유 우수 제조 및 품질 관리 기준 cGMP  인증,모발-피부-손톱
 피부  모발  손발톱 건강에 도움 기타 천연 향료 자연 첨가 보충제 유제품 무함유 글루텐 무함유 비오틴 2 500mcg 동안 피부로 가꿔주는 효과 합성색소 무함유 튼튼한 모발 및 손발톱 증진 피부 개선 수분 보충 인공색소 무함유,모발-피부-손톱
 히알루론산과 비타민C로 강화된 콜라겐 펩타이드 I  II  III  V  X형 편리한 캡슐 보충제 목초 사육 BSE 프리 농장 사육 닭고기 자연산 생선 난각막 유전자 변형 성분 무함유 유제품 무함유 글루텐 무함유 인공색소 무함유 Vitauthority 정품 비타민C  히알루론산 첨가 피부 요철 잔주름 및 주름살 쓰리고 갈라진 관절 부위 처지는 주름,모발-피부-손톱
 피부 탄력 증진 및 노화 방지 임상적으로 연구된 성분 콜라겐 10g   멜론 추출물   아스타잔틴 20회 제공량 건강 보조 식품 Certified B Corporation 글로벌 사회적 기업 인증  BPA 무함유 Igen   유전자 변형 성분 무함유 검사 완료 Keto Certified 케토 인증  제품 Certified Paleo 팔레오 인증  Certified NSF Gluten Free NSF 글루텐 무함유 인증  호르몬 및 항생제 무함유 임상 시험 완료 노화 방지   젊어 보이는 피부 아름다운 모발 및 손발톱,모발-피부-손톱
 코코넛오일에서 추출 글루텐 무함유 유제품 무함유 목초 사육 소 1회 제공량당 단백질 10g 1회 제공량당 총지방 4g 보충제,모발-피부-손톱
 프리미엄 기능성 성분으로 보강 Plant Life to Thrive USDA 유기농 인증 식물성 단백질 15g 수지 무함유     향료  무함유    첨가제 무함유 신선한 원료로 제조 및 미국 내 제3 기관 검사 완료 진정한 성분이 선사하는 진정한 맛 완벽한 아미노산 조성 다시 살아나는 아름다움 모발  손발톱  피부 지원 유기농 인증   유기농은 모두 유전자 변형 성분 무함유 곡물 무함유 대두 무함유 뛰어난 운동선수들이 신뢰하는 모두를 위한 제품 QAI 유기농 인증 Kosher Check 코셔 인증 Vegan Action 비건 인증 자연적으로 글루텐이 없으나 인증받지는 않음 제3 기관 검사 완료  모든 성분  모든 생산 단위,모발-피부-손톱
 피부 건강에 도움 소프트젤 1정당 70mg 히알루론산 함유 보충제 히알루론산 HA 의 고유한 물질을 통해 더 간편하게 세포 내 체액 균형 유지 피부의 수분 유지 지원 1969년부터 과학에 기반한 고품질 상품 제공 Injuv ,모발-피부-손톱
 보충제 쏘팔메토 및 비오틴 함유 더 강하고 건강한 모발 흡수율 높은 성분 모발 성장 주기 지원 특허받은 성분 글루텐 무함유 검사 완료 임상 검증된 성분 베스트셀러 케라틴 브랜드 ,모발-피부-손톱
 1930년 설립 유전자 변형 성분 무함유 프로젝트 인증 글루텐 없음 건강을 통한 행복 부드럽고 광채 나는 피부 피부 회복 및 복구 증진 인도 멀구슬나무   울금 함유 허브 보조제 1개월 분 cGMP 식물성 친화 제품 밀 없음 옥수수 없음 대두 없음 유제품 없음 동물성 성분 없음 85년 이상 이어온 전통 가족 소유 기업,모발-피부-손톱
 농장 직송 1975년 설립 콜라겐 펩타이드 1형 및 3형 콜라겐 4g 글루텐 무함유 당류 무함유 유전자 변형 성분 무함유 보충제 알칼리화   원기 보충   활력 제공,모발-피부-손톱
 Dr  Axe 포뮬라 하루 만에 결과를 얻기 위해 임상적으로 연구된 성분 모발 성장에 도움 까마귀 발 모양 개선 관절 불편감 완화 천연 식품 보충제 1회 제공량당 10g 콜라겐   프리바이오틱 섬유소 IGEN   유전자 변형 성분 무함유 검사 완료 모발 피부 건강 관절 내장,모발-피부-손톱
 히알루론산 100mg  l 글루타민  비오틴 노화 방지  피부 보습  근육  관절 강화 28일의 깊은 주름 완화 목초 사육 및 방목 사육 I 및 III형 호르몬 및 항생제 무함유 2스쿱당 콜라겐 단백질   20g Natural Factors 아름다운 모발  피부 및 손발톱을 위한 상품 근육 및 관절 건강에 도움 장 건강 및 소화 기능 팔레오   케토 친화적 유전자 변형 성분 무함유   글루텐 무함유 깊은 주름 완화 피부 탄력과 밀도를 높이는 동시에 잔주름과 눈가 주름을 완화하는 데 도움을 줍니다  건강한 모발과 튼튼한 손발톱을 강화합니다  뼈와 근육을 강화하고  관절의 편안함과 운동성을 증진하며  장 건강을 증진합니다 ,모발-피부-손톱
 설탕 없음 의학적 입증 액상 단백질 뛰어난 흡수 건강 보조 식품 코셔 더욱 탄력있는 몸매 모발  피부 및 손톱 관절 및 뼈 장 및 상처 회복 케토 및 팔레오 승인 1fl oz당 단백질 함량 높음 유전자 변형 성분 없는 초지에서 방목하여 얻은 콜라겐 섞을 필요 없음  흘릴 염려 없음,모발-피부-손톱
 모발   피부   손발톱 필수 비타민B 액상 드롭형 보충제,모발-피부-손톱
 특허받은 성분 건강한 모발과 정상적인 모발 성장 지원 하루 단 1정 Biopectin  사과 추출물 모발과 두피에 영양을 공급하는 영양소 함유 보충제 유제품 무함유 유전자 변형 성분 무함유 글루텐 무함유,모발-피부-손톱
 피부  모발   손발톱 장 및 관절 건강 목초 사육   방목 사육 1회 제공량당 콜라겐 펩타이드 8 000mg 케토 및 팔레오 유전자 변형 성분 무함유 코셔 인증 설탕 무함유  1형   3형 항생제 호르몬 무함유 우수 제조 및 품질 관리 기준 cGMP  시설에서 포장 유제품 무함유 Future Your Wellness  Eat Better  더 멀리  여성 소유 기업 강력한 하나의 성분   이것이 전부 피부 보습  탄력 모발 및 손발톱 장 건강 강화 뼈   관절,모발-피부-손톱
 SystemiCare 피부 피트니스 지원 영양 보충제 바이오셀 콜라겐,모발-피부-손톱
 식품 보충제 ,모발-피부-손톱
