description,category
 S lumeve Pearl Tomato  화이트 토마토 추출물 Solanum lycopersicum  함유 건강한 피부 수분  질감 및 톤 지원  피부를 밝게 하고 과색소침착을 지원합니다  채식주의자와 비건에게 적합 무함유 성분  글루텐  유전자 변형 성분  대두 우수 제조 및 품질 관리 기준 cGMP  인증 시설에서 생산한 보충제,모발-피부-손톱
 S lumeve 가수분해콜라겐 펩타이드 무맛 분말 가수분해 우피 콜라겐 펩타이드 건강한 피부  모발 및 손발톱 건강에 도움  인공 색소 및 향료 무함유 감미료 무함유 유전자 변형 성분 무함유   글루텐 무함유 우수 제조 및 품질 관리 기준 cGMP  시설에서 생산한 보충제,모발-피부-손톱
 California Gold Nutrition CollagenUP  206g 7 26oz  바다에서 얻은 콜라겐 펩타이드   히알루론산   비타민C 무맛  우피에서 추출하지 않은 가수분해 피쉬 콜라겐 비동물성 공급원 히알루론산 및 비타민C 건강한 모발  피부  손발톱  관절  뼈 건강 증진  효소를 통해 생체 이용 가능한 펩타이드로 분해된 가수분해콜라겐 글루텐  유전자 변형 성분  대두 무함유 cGMP 인증 시설에서 생산 100  골드 개런티 Gold Guarantee  보관이 더 쉬운 밀폐형 파우치로 제공 I형  이 유형은 체내 전체 콜라겐의 80 90 를 차지합니다  I형 콜라겐은 체내에 가장 풍부하게 존재하며 피부  뼈  힘줄  인대의 구조를 형성합니다  II형  무릎  어깨 등 탄력 연골에 존재하는 이 유형은 관절 건강에 도움이 됩니다  III형  이 유형은 일반적으로 콜라겐 I형과 함께 발견되며 근육  동맥  장기에 존재합니다  IV형  피부층에 존재하는 IV형 콜라겐은 다양한 피부 기능을 유지하는 데 도움이 됩니다  V형  이 유형은 눈 각막  뼈  일부 피부층  모발  태반 조직에 존재합니다 ,모발-피부-손톱
 California Gold Nutrition CollagenUP  464g 16 37oz  바다에서 얻은 콜라겐 펩타이드   히알루론산   비타민C 무맛  우피에서 추출하지 않은 가수분해 피쉬 콜라겐 비동물성 공급원 히알루론산 및 비타민C 건강한 모발  피부  손발톱  관절  뼈 건강 증진  효소를 통해 생체 이용 가능한 펩타이드로 분해된 가수분해콜라겐 글루텐  유전자 변형 성분  대두 무함유 cGMP 인증 시설에서 생산 100  골드 개런티 Gold Guarantee  보관이 더 쉬운 밀폐형 파우치로 제공 I형  이 유형은 체내 전체 콜라겐의 80 90 를 차지합니다  I형 콜라겐은 체내에 가장 풍부하게 존재하며 피부  뼈  힘줄  인대의 구조를 형성합니다  II형  무릎  어깨 등 탄력 연골에 존재하는 이 유형은 관절 건강에 도움이 됩니다  III형  이 유형은 일반적으로 콜라겐 I형과 함께 발견되며 근육  동맥  장기에 존재합니다  IV형  피부층에 존재하는 IV형 콜라겐은 다양한 피부 기능을 유지하는 데 도움이 됩니다  V형  이 콜라겐 유형은 눈 각막  뼈  일부 피부층  모발  태반 조직에 존재합니다 ,모발-피부-손톱
 에너지 생성 아미노산 대사에 도움 정상적인 면역 기능 촉진 유전자 변형 성분 무함유 보충제 채식주의자 및 비건에 적합 코셔 1968년 설립된 가족 기업 우수 제조 및 품질 관리 기준 GMP  품질 보증,모발-피부-손톱
 모발  피부 및 손발톱 건강 지원 비타민 보충제 글루텐 무함유 품질 보증  품질 검사 완료,모발-피부-손톱
 뷰티 비오틴이 부족한 사람의 모발  피부  손발톱을 건강하게 관리 음식을 에너지로 전환하는 과정 촉진 채식주의자에게 적합 보충제 비오틴이 부족한 사람들을 위한 건강한 모발  빛나는 피부  튼튼한 손발톱 관리 에너지 대사를 증진하고 음식을 에너지로 전환하는 과정 촉진,모발-피부-손톱
 종합비타민과 함께 섭취 Orchard Fruits  및 Garden Veggies  가루 혼합물 1회 제공량당 50mg 로 제조  아름다움을 가꾸는 데 도움이 됨 1회 제공량당 콜라겐 100mg 및 비오틴 2 500mcg 함유 종합비타민 보충제 모발  피부 및 손발톱 건강을 위한 고급 뷰티 포뮬라 젤라틴이 아닌 펙틴으로 제조 맛있는 딸기 맛,모발-피부-손톱
 1회 제공량당 콜라겐 20g 피부  모발  손발톱  관절에 도움 목초사육   방목사육 보충제 코셔 Whole 30 인증 유제품 무함유 글루텐 무함유 9가지 필수 아미노산 중 8가지 함유 젊어 보이는 외모 건강한 관절   뼈 단일 성분 피부 보습 따뜻하거나 차가운 음료와 혼합 Paleo 인증 피부 탄력 모발   손발톱 지원,모발-피부-손톱
 글루텐 무함유 하루 1정 유전자 변형 성분 무함유 LE 인증 잔주름과 주름 완화 및 보습 보충제 잔주름과 주름을 완화하여 피부 개선 건강한 피부 보습 및 편안함 증진 노화가 진행되는 피부에서 건강한 세라마이드 수치 촉진 임상적으로 연구된 밀 세라마이드 농축물 함유,모발-피부-손톱
 피부  모발  손발톱 포뮬라 6 000mg 비타민C로 강화 보충제 유제품 무함유 대두 무함유 글루텐 성분 무함유 결합제 및 충전제 무함유 1회 제공량당 콜라겐 6 000mg 미용 단백질 보충 피부 노화 방지 피부  모발   손발톱 재생,모발-피부-손톱
 California Gold Nutrition 글루코사민  콘드로이틴  MSM 플러스 히알루론산 GreenGrown  식물성 글루코사민 및 OptiMSM  메틸설포닐메테인 함유 관절 건강에 도움  우피에서 추출한 콘드로이틴 및 비동물성 원료에서 추출한 히알루론산 글루텐  유전자 변형 성분  대두 무함유 cGMP 인증 시설에서 생산 100  골드 개런티 Gold Guarantee ,모발-피부-손톱
 Science Based Nutrition  보충제 모발  피부  손발톱  힘줄  인대 및 뼈의 필수 구조 유전자 변형 성분 무함유 글루텐 무함유 대두 무함유 건강한 모발  피부  손발톱에 도움 뼈의 강도과 유연성  관절  힘줄 및 인대에 도움 저분자 펩타이드 성분으로 생체이용률 향상,모발-피부-손톱
 콜라겐 유형 1 및 3 | 비타민C | 비오틴 1회 제공량당 콜라겐 3g 함유 피부  모발  손발톱  관절 건강에 도움 보충제 케토 인증 글루텐 무함유 목초 사육 Igen  유전자 변형 성분 무함유 검사 완료,모발-피부-손톱
 콜라겐 유형 1 및 3 | 비타민C | 비오틴 1회 제공량당 콜라겐 3g 함유 피부  모발  손발톱  관절 건강에 도움 보충제 케토 인증 글루텐 무함유 목초 사육 Igen  유전자 변형 성분 무함유 검사 완료,모발-피부-손톱
 California Gold Nutrition 하이드롤라이즈드 해양 콜라겐 펩타이드 효소를 통해 생체 이용 가능한 펩타이드로 분해된 가수분해콜라겐 무맛   자연산   높은 생체이용률 모발  피부  손발톱  관절  뼈 건강 증진  글루텐  유전자 변형 성분  대두 무함유 cGMP 인증 시설에서 생산 100  골드 개런티 Gold Guarantee ,모발-피부-손톱
 1947년 설립 유전자 변형 성분 무함유 글루텐  밀  유제품 무함유 비건에 적합 M 할랄 코셔 파르브 보충제 OptiMSM,모발-피부-손톱
 California Gold Nutrition 가수분해콜라겐   비타민C I형 및 III형 가수분해콜라겐 펩타이드 함유 비타민C 아스코르브산칼슘  함유 모발  피부  손발톱  관절  뼈 건강 증진  글루텐  유전자 변형 성분  대두 무함유 cGMP 인증 시설에서 생산 100  골드 개런티 Gold Guarantee ,모발-피부-손톱
 모발  피부   손발톱 건강 지원 비타민 보충제 글루텐 없음 품질 보증 실험실 검사 완료,모발-피부-손톱
 1회 제공량당 콜라겐 20g 피부  모발  손발톱   관절에 도움 목초사육   방목사육 보충제 코셔 Whole30 Approved 유제품 무함유 글루텐 무함유 BPA 무함유 단일 성분 Paleo 인증 젊어보이는 외모 피부 보습 피부 탄력 건강한 관절 및 뼈 따뜻한 음료 또는 차가운 음료와 혼합 모발 및 손발톱에 도움,모발-피부-손톱
 Healthy Renewal Formula  항산화제 비타민A  C  E  B복합체  미네랄 함유 1회 제공량당 비오틴 5 000mcg 함유 보충제 글루텐 무함유 유전자 변형 성분 무함유 30년 이상 지켜 온 신뢰할 수 있는 품질 품질 보장 품질 검사 완료 피부의 정상 수분 수치 유지 풍성한 모발 유지 손발톱 강화 및 건강,모발-피부-손톱
 건강한 관절 움직임 및 기능 촉진 UC II  Aquamin 보충제 유전자 변형 성분 무함유 코셔 전반적인 건강 증진 1968년 설립된 가족 기업 우수 제조 및 품질 관리 기준 GMP    품질 보증,모발-피부-손톱
 California Gold Nutrition 토탈 베지 조인트 서포트 포뮬라 글루코사민  콘드로이틴  MSM  히알루론산 함유 동물성 성분 무함유 관절 건강에 도움  채식주의자와 비건에게 적합 글루텐  유전자 변형 성분  대두 무함유 cGMP 인증 시설에서 생산 100  골드 개런티 Gold Guarantee ,모발-피부-손톱
 노화 증상 완화 건강한 피부 보습력 지원 가수분해콜라겐 타입 1 및 3 Appliednutrition 열대 딸기 및 키위 맛 농축 드링크 믹스  보충제 액상 튜브 10개 콜라겐 4 000mg  비오틴 2 000mcg  실리카 6 000mcg  1회 제공량당 단 25칼로리,모발-피부-손톱
 강화된 미용 기능성 제품 아름다운 모발  피부  손발톱과 관절 건강 증진 보충제 내면에서 시작되는 자연스러운 아름다움 건강한 모발  피부  손발톱을 위한 콜라겐 공급 관절 강화,모발-피부-손톱
 엑스트라 스트렝스 에너지 생성 아미노산 대사에 도움 정상적인 면역 기능 촉진 유전자 변형 성분 무함유 보충제 채식주의자 비건에게 적합 코셔 비타민 1968년 설립된 가족 기업 GMP 품질 보증,모발-피부-손톱
 1947년 설립 유전자 변형 성분 무함유 글루텐  밀  유제품 무함유 비건에게 적합 할랄 코셔 파르브 글루텐 무함유 인증 보충제 OptiMSM ,모발-피부-손톱
 1947년 설립 내부에서부터 피부에 영양 공급 유전자 변형 성분 무함유 밀 및 유제품 무함유 글루텐 무함유 인증 보충제 얼굴 잔주름과 주름 완화 두드러진 피부 탄력 개선 12주 후 피부 콜라겐 강화 건강한 콜라겐 생성 촉진 임상적으로 연구된 성분인 BioCell Collagen II 를 함유하며  콜라겐 2형 펩타이드  황산콘드로이틴 및 히알루론산으로 구성됩니다  또한 콜라겐 형성에 관여하고 관절 건강에 유익한 비타민C를 함유합니다  호르몬 및 항생제를 함유하지 않은 콜라겐 공급원입니다 ,모발-피부-손톱
 글루텐 무함유 유전자 변형 성분 무함유 LE 인증 내면에서 오는 아름다움을 촉진합니다  보충제 모발  피부  손발톱의 건강을 증진 콜라겐 및 케라틴 건강 촉진을 임상적으로 입증 케라틴 형성을 위한 건강한 영양소 지원 피부의 부드러움 및 탄력 지원,모발-피부-손톱
 모발  피부  손톱 건강 증진 음식을 에너지로 전환하도록 지원 채식주의자에게 적합 보충제 건강한 모발  빛나는 피부  튼튼한 손톱을 가꾸도록 해줍니다  에너지 대사를 지원하고 음식을 에너지로 전환하는 과정을 돕습니다 ,모발-피부-손톱
 피부  모발 및 손발톱 포뮬러 6 000mg  건강 보조 식품 모두를 위한 제품 1회 제공량당 콜라겐 6 000mg 미용 단백질 보충 피부 노화 방지 피부  모발   손발톱 재생,모발-피부-손톱
 Science Based Nutrition  보충제 모발  피부  손발톱  힘줄  인대 및 뼈의 필수 구조 지원 유전자 변형 성분 무함유   글루텐 무함유   대두 무함유 BSE 무함유 가수분해콜라겐 1형 및 3형 건강한 모발  피부  손발톱 지원 뼈의 힘과 관절  힘줄  인대의 유연성에 도움 저분자 펩타이드 성분으로 생체이용률 향상,모발-피부-손톱
 천연 완전 영양소 1회 제공량당 콜라겐 12g 함유 피부  모발  손발톱   관절 지원 자연산   유전자 변형 성분 무함유 보충제 Whole 30 인증 유제품 무함유 글루텐 무함유 BPA 무함유 콜라겐 펩타이드 12g 건강한 피부 건강한 관절 및 뼈 단일 성분 따뜻한 음료 또는 차가운 음료와 혼합 유전자 변형 성분 무함유 Paleo 인증 강하지 않은 향 모발 및 손발톱에 도움,모발-피부-손톱
 1  3형 콜라겐 1회 제공량당 콜라겐 10g 함유 용기당 제공 횟수  20회 피부  모발  손발톱  관절 건강 지원 분말 보충제 케토 인증   글루텐 무함유   목초 사육 Igen  유전자 변형 성분 무함유 검사 완료 Paleo 인증,모발-피부-손톱
 빠른 용해 뷰티 건강한 모발  피부 및 손톱을 가꾸어 줍니다  천연 항료 식물성 건강 보조 식품 건강한 모발  빛나는 피부  튼튼한 손톱을 가꾸어 줍니다  에너지 대사를 지원하고 음식을 에너지로 전환하는 과정을 돕습니다  빠르게 용해되는 제형   언제 어디서나 물 없이 복용 가능합니다 ,모발-피부-손톱
 관절 강화 중요한 관절 윤활제 L 프롤린  알파리포산  포도씨추출물 함유 유전자 변형 성분 무함유 보충제 채식주의자 비건에 적합 전반적인 건강 1968년 설립된 가족 기업 우수 제조 및 품질 관리 기준 GMP  품질 보증,모발-피부-손톱
 가수 분해 I형 및 III형 콜라겐 커피 및 셰이크에 적합 1회 제공량당 콜라겐 펩타이드 11g 따뜻한 음료 및 차가운 음료에 혼합 가능 보충제 IGEN 유전자 변형 성분 무함유 검사 완료 Informed Choice 인증 획득 글루텐 무함유 케토 인증 팔레오 친화 제품 우수 제조 및 품질 관리 기준 cGMP  시설에서 제조 저분자량 콜라겐 펩타이드 3 000 5 000달튼 ,모발-피부-손톱
 콜라겐에 담긴 진정한 과학 콜라겐 타입 1 및 3 히알루론산 광채가 나고 어려 보이는 피부 콜라겐 2g 건강 보조 식품 팔레오 친화적   글루텐 무함유 Igen 유전자 변형 성분 무함유 테스트 완료 팔레오 친화 인증,모발-피부-손톱
 에너지 생성 아미노산 대사에 도움 정상적인 면역 기능 촉진 유전자 변형 성분 무함유 보충제 채식주의자 비건에 적합 코셔 비타민 1968년 설립된 가족 기업 우수 제조 및 품질 관리 기준 GMP  품질 보증,모발-피부-손톱
 모발  피부 및 손톱 부문 1위 브랜드  Optimal Solutions  1회 제공량당 2 500mcg 보충제 산화 방지제 비타민 C   E 천연 색소 및 향료 품질 보장 품질 검사 완료,모발-피부-손톱
 Healthy Renewal Formula  모발  피부  손발톱  뼈   관절 건강 1회 제공량당 콜라겐 6 000mg 보충제 글루텐 무함유 품질 보증 실험실 검사 완료,모발-피부-손톱
 모발  피부와 손발톱 건강 지원 비타민 보충제 글루텐 무함유 품질 보증 실험실 검사 완료,모발-피부-손톱
 이온성 미네랄 미네랄 보충제 복용 자체보다는 흡수가 더 중요함 눈으로 보며 맛과 느낌으로 순도를 확인할 수 있습니다  위에 부담을 주지 않음 글루텐 무함유 비건 제품 유전자 변형 성분 무함유 100  생체이용성,모발-피부-손톱
 건강한 재생 포뮬러 허브  비타민  미네랄 모발  피부  손발톱 지원 건강 보조 식품 글루텐 없음 품질 보증   시험 기관 테스트 완료,모발-피부-손톱
 건강한 관절 편안함 및 기능 촉진 아쿠아민 TG UC II  보충제 유전자 변형 성분 무함유 코셔 전반적인 건강 증진 1968년 설립된 가족 기업 GMP 인증,모발-피부-손톱
 모발  피부  손발톱 보충제 1위 브랜드  보충제 Beauty Starts on the Inside  1회 제공량당 콜라겐 100mg 함유 천연 색소 및 향료 품질 보장 품질 검사 완료,모발-피부-손톱
 Science Based Nutrition 보충제 비건에게 적합 유전자 변형 성분 무함유   글루텐 무함유   대두 무함유 건강한 모발  피부  손발톱 지원에 도움 유전자 조절 및 DNA 온전성 지원 필수 효소 기능 지원,모발-피부-손톱
 Science Based Nutrition  보충제 관절 건강 및 기능 증진 피부 건강 증진 유전자 변형 성분 무함유   글루텐 무함유   대두 무함유,모발-피부-손톱
 초지 방목 지속 가능한 포획 방목 닭 계란막 천연 콜라겐 타입   I  II  III  IV  V  X 보충제 부드러운 피부 손발톱 강화 모발 성장 위 건강 관절 완화 깨끗한 성분  깔끔한 맛 유전자 변형 성분 무함유 인증 환경에 책임을 집니다  글루텐 무함유 GMP   독립 인증 깨끗함  순수함  최적화 비 가수분해콜라겐으로 만족하지 마세요  목초 사육  자연산 대구  방목 닭 및 계란막으로 만듭니다  깨끗하고 지속 가능한 성분이 최고의 콜라겐 원료입니다  6가지 유형의 주요 콜라겐 I  II  III  IV  V   X 이 완전하고 강력한 프로필을 제공하여 몸 전체에 뛰어난 효과를 전달할 수 있습니다  타입 I   피부 탄력 타입 II   관절 및 면연 체계 타입 III   피부  혈관  주요 장기 타입 IV   세포 건강 및 성장 타입 V   피부  힘줄  면역계 타입 X   관절  뼈  근육  모발,모발-피부-손톱
 피부  모발  손발톱 포뮬라 6 000mg  보충제 모두를 위한 상품 미용 단백질 보충 피부 노화 방지 피부  모발  손발톱 재생,모발-피부-손톱
 Science Based Nutrition  관절 및 피부 건강 증진 BioCell Collagen  함유 보충제 유전자 변형 성분 무함유   글루텐 무함유   대두 무함유 관절 건강 및 기능 증진  피부 건강 증진 ,모발-피부-손톱
 관절 강화 주요 관절 윤활제 MSM 함유 유전자 변형 성분 무함유 보충제 채식주의자 비건에 적합 코셔 전반적인 건강 증진 1968년 설립된 가족 기업 우수 제조 및 품질 관리 기준 GMP  품질 보증,모발-피부-손톱
 글루텐 무함유 유전자 변형 성분 무함유 LE 인증 건강한 모발과 손발톱을 위한 필수 영양소 보충제 모발  피부 및 손발톱 건강 지원 세포 에너지 생산에 필수 건강한 유전자 발현 촉진,모발-피부-손톱
 관절 지원 중요한 관절 윤활제 유전자 변형 성분 무함유 보충제 채식주의자 및 비건에 적합 코셔 일반 건강 1968년에 설립된 가족 기업 우수 제조 및 품질 관리 기준 GMP  품질 보증,모발-피부-손톱
 히알루론산 200mg 관절 건강 증진 피부 건강 및 보습에 도움 비건 및 유전자 변형 성분 무함유 상품 보충제,모발-피부-손톱
 California Gold Nutrition 가수분해 마린 콜라겐 펩타이드 효소를 통해 생체 이용 가능한 펩타이드로 분해된 가수분해콜라겐 무맛   자연산   높은 생체이용률 모발  피부  손발톱  관절  뼈 건강 증진  글루텐  유전자 변형 성분  대두 무함유 cGMP 인증 시설에서 생산 100  골드 개런티 Gold Guarantee ,모발-피부-손톱
 Ceramosides  함유 피부의 정상 수분 수치 유지  어려 보이는 피부 톤 및 피부 결 유지 보충제 채식주의자 비건 유전자 변형 성분 무함유,모발-피부-손톱
 뷰티   뼈   관절 잔주름 및 주름살 완화 모발을 굵게 만들고 강화 손톱 강화 건강하고 유연한 뼈 건강 증진 건강한 관절 촉진 오리지널 ch OSA  포뮬라 임상 검증된 제품 보충제 비건 채식주의자에게 적합,모발-피부-손톱
 Lake Avenue Nutrition 가수분해콜라겐 I 및 III형 가수분해 우피 콜라겐 펩타이드 함유 모발  피부  손발톱  관절  뼈 건강 강화  채식주의자에게 적합 글루텐  유전자 변형 성분  대두 무함유 GMP 시설에서 생산,모발-피부-손톱
 1  3형 콜라겐 히알루론산 비오틴 빛나고 건강한 모발과 손발톱 1회 제공량당 콜라겐 3g 함유 보충제 목초 사육 글루텐 무함유 Igen 유전자 변형 성분 무함유 검사 완료 케토 인증 제품,모발-피부-손톱
 True Science of Collagen 1  3형 콜라겐 비타민C 피부  모발  손발톱  관절 건강에 좋음 콜라겐 4g 보충제 목초 사육   방목 사육   글루텐 무함유 Igen    유전자 변형 성분 무함유 검사 완료,모발-피부-손톱
 뷰티 비오틴이 부족한 사람의 모발과 손발톱을 건강하게 관리 음식을 에너지로 전환하는 과정 촉진 채식주의자에게 적합 보충제 비오틴이 부족한 사람들을 위한 건강한 모발과 튼튼한 손발톱 관리 에너지 대사를 증진하고 음식을 에너지로 전환하는 과정 촉진,모발-피부-손톱
 California Gold Nutrition 콜린 실리카 복합체  30ml 1fl oz  콜린과 l 카르니틴이 포함된 생물학적으로 이용 가능하고 안정화된 규소 OSA  사용하기 쉬운 액상 드롭형 모발  피부  손발톱 강화  결합 조직 및 뼈 건강 증진  채식주의자와 비건에게 적합 글루텐  유전자 변형 성분  대두 무함유 cGMP 인증 시설에서 생산 100  골드 개런티 Gold Guarantee ,모발-피부-손톱
 비오틴 2 000mcg  글루텐 무함유 인증 보충제 Igen   유전자 변형 성분 무함유 검사 완료 B  corp  인증 진정성 청결도 신선도 일관성 정확성 대부분의 혼합물과 식물성 성분 및 아미노산 비타민B군 제공 정,모발-피부-손톱
 1947년 설립 건강한 피부  손발톱 및 모발 지원 Halal 유전자 변형 성분 없음 글루텐  밀 및 유제품 무함유 비건에게 적합 Certified Gluten Free Kosher Parve 건강 보조 식품,모발-피부-손톱
 모발  피부 및 손발톱 건강 지원 아름다움을 가꾸는 데 도움이 됨 보충제 채식주의자에게 적합 글루텐 무함유 마이크로젤 서방형 시스템,모발-피부-손톱
 진정한 콜라겐 과학 콜라겐 2형 히알루론산 관절 전용 콜라겐 2 4 콜라겐 보충제 글루텐 무함유 IGEN 유전자 변형 성분 무함유 검사 완료 Paleo 친화적 제품 인증,모발-피부-손톱
 비타민 100  품질 만족 보장 1회 제공량당 비오틴 2 500mcg 비오틴은 건강한 모발과 피부를 지원합니다 맛있는 제품  천연 과일 향료 글루텐 무함유 유전자 변형 성분 무함유 보충제 비건 포뮬라,모발-피부-손톱
 Science Based Nutrition  보충제 모발  피부  손발톱  힘줄  인대 및 뼈의 필수 구조에 도움 유전자 변형 성분 무함유   글루텐 무함유   대두 무함유 BSE 무함유 가수분해콜라겐 1형 및 3형 건강한 모발  피부  손발톱 증진 뼈의 힘과 관절  힘줄  인대의 유연성 증진 저분자 펩타이드 성분으로 생체이용률 향상,모발-피부-손톱
 콜라겐 형성과 칼슘 관리에 관여하는 실리카 미네랄 보충제 눈과 맛과 느낌으로 순도 확인 BPA 무함유,모발-피부-손톱
 종합비타민과 함께 섭취 아름다움을 가꾸는 데 도움이 됨 1회 제공량당 콜라겐 300mg 및 비오틴 2 500mcg 함유 보충제 모발  피부 및 손발톱 건강을 돕는 프리미엄 뷰티 포뮬라 젤라틴이 아닌 펙틴으로 제조 맛있는 딸기 맛,모발-피부-손톱
 California Gold Nutrition 비오틴 비오틴 10 000mcg 건강한 에너지 생성 및 면역 기능 강화  모발  피부  손발톱 건강 유지 채식주의자와 비건에게 적합 글루텐  유전자 변형 성분  대두 무함유 cGMP 인증 시설에서 생산 100  골드 개런티 Gold Guarantee ,모발-피부-손톱
 Advanced Beauty 임상 시험으로 증명된 주름 개선 효과 피부 탄력 및 톤 개선 4 주 만에 나타나는 효과 건강 보조 식품 Verisol  뷰티는 다음의 성분을 포함합니다  피부 콜라겐 전구체 65  증가 탄력 18  증가 눈가 주름 20  감소 주름 개선 피부 탄력 개선 피부 탄력 및 톤 개선 셀룰라이트 감소 4 주 만에 나타나는 효과,모발-피부-손톱
 관절 건강 비변성 콜라겐 II형 함유 히알루론산  보론  비타민D 3 첨가 Aquamin 보충제 UC II  전반적인 건강 증진 1968년 설립된 가족 기업 우수 제조 및 품질 관리 기준 GMP  품질 보증,모발-피부-손톱
