effect,category
California Gold Nutrition 스포츠 유기농 MCT 오일 USDA 유기농 인증 코코넛오일에서 추출한 MCT QAI 유기농 인증 케토 식단 보조  식물성 두뇌 및 신체 연료  비건 및 채식주의자에게 적합 글루텐 무함유  유전자 변형 성분 무함유  팜오일 무함유  대두 무함유 cGMP 인증 시설에서 제조 100  골드 개런티 Gold Guarantee ,체중 조절
California Gold Nutrition 스포츠유기농 MCT 오일 USDA 유기농 인증 코코넛오일에서 추출한 MCT QAI 유기농 인증 케토 식단 보조  식물성 두뇌 및 신체 연료  채식주의자에게 적합 글루텐 무함유  유전자 변형 성분 무함유  대두 무함유  팜오일 무함유 cGMP 인증 시설에서 제조 100  골드 개런티 Gold Guarantee ,체중 조절
신진대사 강화 보충제 글루텐 무함유 품질 보증  품질 검사 완료,체중 조절
매일 1정 글루텐 무함유 유전자 변형 성분 무함유 LE 인증 복부 지방 억제  보충제몸에 저장된 복부 지방을 연소하도록 촉진 생기 넘치는 AMPK 수치 재활성 두 가지 강력한 식물 추출물이 AMPK 활동 유도 건강한 세포 대사 촉진,체중 조절
보충제 삼키기 쉬운 캡슐 소화   순환 순도   효능 보장,체중 조절
최첨단 긴장 완화제   Thermovigilance 임상 시험을 완료한 Verilean  함유 에너지 증진 신진대사 촉진 빠른 체중 감량 강력한 발열 연소제 보충제 믿을 수 있는 성분 인공 색소 무함유 설탕 무함유 인공 향료 무함유 젤라틴 무함유 보존제 무함유 인공 감미료 무함유목표를 달성하도록 계속 동기를 부여하는 신속한 결과 지방 연소에 도움이 되는 임상 시험을 완료한 핵심 성분 다이어트 피로를 극복하도록 돕는 깨끗하고 부드러운 에너지 계속 칼로리를 갈구하지 않도록 하는 식욕 억제 기능 확실한 효과  체중이 줄어들지 않는 것은 절망스러운 일이므로 ,체중 조절
영양 보충제 유전자 변형 성분 무함유 보충제 일반 건강 1968년에 설립된 가족 기업 우수 제조 및 품질 관리 기준 GMP  품질 보증,체중 조절
Super Citrus Lipo Burner  저장된 지방 분해 지원 자몽  스위트 오렌지  블러드 오렌지 및 Sinetrol  함유 보충제,체중 조절
보충제 Natural Factors 소화 및 순환 삼키기 쉬운 캡슐 순도 및 효능 보장,체중 조절
1969년 설립 뇌와 신체의 연료 비건 인증 USDA 유기농 인증 유전자 변형 성분 무함유 프로젝트 인증 Paleo 인증 케토 인증 제품 100  효능   증량제 오일 무함유 중쇄중성지방 1회 제공량당 14g  보충제 글루텐 무함유 BPA 무함유 Pro Cert 유기농 인증 Nature s Way  인증100  중쇄중성지방   1회 제공량당 중쇄중성지방 14g 빠르게 소화되어 뇌와 신체 활동을 위한 에너지로 전환 포만감에 도움 프리미엄 코코넛 추출물만 사용   팜오일 및 기타 증량제 오일 무함유 무맛  무향 헥산 무함유 냉장 보관 시에도 액체 상태 유지,체중 조절
활성산소 제거제 EGCg 200mg   카테킨 80  세포 건강 증진 유전자 변형 성분 무함유 프로젝트 인증 보충제 채식주의자 비건에게 적합 코셔 식물성 허브 1968년 설립된 가족 기업 우수 제조 및 품질 관리 기준 GMP  품질 보증,체중 조절
세계 최초의 애플 사이다 식초 구미젤리 보충제 초모 함유 비건 인증 코셔 파르브 글루텐 무함유 유전자 변형 성분 무함유 비여과,체중 조절
체중 관리 500mg 이상의 크로뮴 강력한 지방 흡수 작용 이미 정상 범위 내에 있는 콜레스테롤 수치 유지에 도움 유전자 변형 성분 무함유 보충제 전반적인 건강 증진 1968년 설립된 가족 기업 GMP 품질 보증,체중 조절
흰강낭콩추출물 체중 관리 유전자 변형 성분 무함유 보충제 채식주의자 비건에게 적합 코셔 식물성 허브 1968년 설립된 가족 기업 우수 제조 및 품질 관리 기준 GMP  품질 보증,체중 조절
건강한 신진대사 표준화된 추출물 HCA 50  유전자 변형 성분 무함유 보충제 채식주의자 및 비건에 적합 코셔 식물성 허브 1968년 설립된 가족 기업 우수 제조 및 품질 관리 기준 GMP  품질 보증,체중 조절
1969년 설립 뇌와 신체의 연료 비건 인증 USDA 유기농 인증 유전자 변형 성분 무함유 프로젝트 인증 Paleo 인증 케토 인증 100   효능 필러오일 없음 중쇄중성지방   1회 제공량당 14g   보충제 Pro Cert 유기농 인증 Nature s Way  인증 글루텐 무함유 BPA 무함유100  MCT     1회 제공량당 MCT 14g  빠르게 소화되어 뇌와 몸을 위한 에너지로 전환됨  포만감에 도움 프리미엄 코코넛추출물만 사용   팜오일 및 기타 충전제 오일 무함유  무맛  무향  헥산 무함유  냉장 보관 시에도 액상으로 유지됨 ,체중 조절
경제적인 용량  탄수화물 중화 소화 향상 신진대사 촉진 보충제전분 효소를 중화합니다  흰강낭콩은 각성제가 없는 100  천연 성분으로서  전분 소화를 담당하는 효소인 아밀라아제를 억제하여 탄수화물의 부정적인 효과를 중화시킵니다  이 강력한 식물 추출물은 인체가 소화시키는 전분 탄수화물 칼로리 수를 줄이는 작용을 합니다  소화 향상  리파아제와 프로테아제는 지방과 단백질 분해를 담당하는 필수 효소입니다  본 포뮬라에는 이 효소들이 포함되어 있어 음식물 소화를 최적화합니다  신진대사 지원  크로뮴 피콜리네이트는 체내에서 건강한 탄수화물 및 지방 대사를 촉진합니다  이 포뮬라는 시나몬 추출물 농축액도 제공합니다 ,체중 조절
영양 보조 식품 유전자 변형 성분 없음 건강 보조 식품 채식주의자 비건 일반 건강 1968년 설립된 가족 기업 GMP 품질 보증,체중 조절
체중 관리 500mg 플러스 크로뮴 강력한 지방 흡수 작용 이미 정상 범위 내에 있는 콜레스테롤 수치 유지에 도움 유전자 변형 성분 무함유 보충제 전반적인 건강 증진 1968년 설립된 가족 기업 우수 제조 및 품질 관리 기준 GMP  품질 보증,체중 조절
천연 및 인공 향료 체중 감량 및 콜레스테롤 감소 측정할 수 있는 결과  15회 제공량 비타민   미네랄 24종 트랜스지방 0g 유당 무함유 글루텐 무함유 유전자 변형 성분 없는 대두1회 제공량 기준 130칼로리에 불과 건강하게 드시고 건강을 느껴 보십시오,체중 조절
탄수화물 중화 소화 향상 신진대사 지원 보충제전분 효소 중화  흰 강낭콩은 전분을 소화하는 효소인 신체의 아밀라아제 일부를 억제함으로써 탄수화물의 부정적인 작용을 중화하는 100  천연 비자극성 성분입니다  이 강력한 식물 추출물은 몸에서 소화하는 전분으로 인한 탄수화물 칼로리를 줄이는 작용을 합니다  소화 향상  리파아제 및 프로테아제는 지방과 단백질을 분해하는 필수 효소입니다  이러한 효소가 이 포뮬라에 포함되어 음식물의 소화를 최적화합니다  신진대사 지원  크로뮴 피콜리네이트는 몸의 탄수화물과 지방의 건강한 대사를 촉진하는 데 도움을 줍니다  이 포뮬라에서는 농축된 계피 추출물도 공급합니다 ,체중 조절
소화 기능 개선 뱃살   군살 감소 지방 연소   체중 감량 필수 영양소 11가지  체중 감량 시기에 필수 보충제,체중 조절
활성산소 제거제 EGCg 200mg   카테킨 80  세포 건강 증진 유전자 변형 성분 무함유 프로젝트 인증 보충제 채식주의자 비건 제품 코셔 식물성 허브 1968년에 설립된 가족 기업 우수 제조 및 품질 관리 기준 GMP  품질 보증,체중 조절
체중 관리 탄수화물 조절에 도움 지방 대사 촉진 흰강낭콩 추출물 채식주의자에게 적합 건강 보조 식품,체중 조절
98  폴리페놀 유전자 변형 성분 무함유 LE 인증 하루 한 알 농축 폴리페놀 추출물 보충제325mg 이상의 강력한 EGCG 제공 세포  심혈관계  인지 건강 지원 정상 범위 내에 있는 콜레스테롤 수준 유지에 도움 건강한 세포 증식 및 대사 기능 촉진,체중 조절
신진대사 강화 보충제 글루텐 무함유 품질 보증   연구소 검사 완료,체중 조절
MCT 중쇄중성지방  MCT 오일 1 000mg 유전자 변형 성분 무함유 보충제 코셔   젤라틴 함유 전반적인 건강 증진 1968년 설립된 가족 기업 우수 제조 및 품질 관리 기준 GMP  품질 보장,체중 조절
CLA 1 000mg 신진대사 체성분 글루텐 무함유 건강한 대사속도 지원 체중 관리 지원 탄탄한 근육 강화 90회 제공량 보충제저장된 체지방을 연료로 활용 고강도 운동 후 회복 지원 순근육 발달 지원 신진대사 속도,체중 조절
CLA 1 000mg 신진 대사 체성분 글루텐 무함유 건강한 대사율 지원 체중 조절 보조 탄탄한 근육 지원 180회 제공량 보충제저장된 체지방을 연료로 활용 고강도 운동 후 회복 지원 군살 없는 근육 발달 지원 신진대사율,체중 조절
글루텐 무함유 유전자 변형 성분 무함유 LE 인증 건강한 식습관 지원   보충제간식 섭취를 줄이는 데 도움이 되는 신경 전달 물질 신호에 영향 불규칙적인 식습관을 줄여 건강한 체중 관리를 지원 카페인 없이 식욕 관리 지원을 제공,체중 조절
식초의 뒷맛이 없음 비타민 맛있는 제품  글루텐 무함유 유전자 변형 성분 무함유 베지 포뮬라 보충제,체중 조절
식욕 억제 소식으로 느끼는 포만감 빠르게 느끼는 포만감 보충제 식단 전문 회사,체중 조절
1926년 설립 천연 및 인공 향료 식사 대용 및 체중 감량 측정할 수 있는 결과  천연 및 인공 향료 1회 제공량당 단 140칼로리 건강하게 드시고 건강을 느껴 보십시오  단백질 13g 24가지 비타민 및 미네랄 함유 트랜스 지방 0g 유당 무함유 글루텐 무함유 유전자 변형 성분 없는 대두 1926년부터 Naturade 품질 및 순도 보장,체중 조절
연구 및 개발 퍼포먼스 시리즈 단백질 30g   L 카르니틴  L 타르타르산염 500mg   공액리놀레산 250mg   로부스타 커피콩 C  canephora robusta  200mg   순근육 증강을 위한 우수한 유청 단백질 펩타이드 과학적으로 검사 완료된 체중 감량 복합체로 강화  천연 인공 향료 보충제 Clarinol 퍼포먼스 단백질 분야 1위 20년 이상 우수성을 유지 우수 제조 및 품질 관리 기준 cGMP  제조   모든 보충제가 준수해야 하는 cGMP 표준에 따라 제조고유 혼합물 무함유 기준량에 미달하는 주요 성분 없음 금지 물질 무함유 증량제 무함유 과장 없는 효과 예외 없음,체중 조절
비타민 글루텐 무함유 유전자 변형 성분 무함유 보충제 100  품질 만족 보장 DNA 검사 완료 식물 성분 변함없는 효과를 제공하며 식초 맛이 남지 않음 Tru ID 진품 인증,체중 조절
새로운 모습 같은 공예 소화 건강 증진 다이어트 및 체중 보충제 펙틴 기반 젤라틴 무함유 채식주의자에게 적합 전 세계적으로 공급되는 성분 GMP   인증된 시설에서 조달 타사 랩 인증,체중 조절
부신 지원 Relora 함유 건강한 부신 반응을 지원 식욕 관리 의학 박사 Hyla Cass의 추천 제품 보충제 채식주의자 및 비건에 적합 코셔 1968년에 설립된 가족 기업 우수 제조 및 품질 관리 기준 GMP  품질 보증,체중 조절
각성제 무함유 임상에서 효과가 증명됨  복부 지방 감소 증진 보충제 체지방 감소에 도움 Sinetrol  감귤류 과일 혼합물 Capsimax  화끈거림 없는 카이엔 유제품 무함유 대두 무함유 글루텐 성분 무함유 베지 캡슐,체중 조절
건강한 체중 관리 생강  카이엔   메이플 수분 균형 지원 건강한 체중 감량 장 건강 증진 최대 강도 포뮬러 건강 보조 식품체중 조절 면역 지원 소화 피부 건강,체중 조절
지금 시작하십시오 Tribe를 만나보십시오  천연 및 인공 향미료 보충제 30회 제공량 우수 제조 및 품질 관리 기준 GMP  준수 시설에서 생산 글루텐 무함유 비건에 적합,체중 조절
건강한 체중 관리 지원 100  순수 브린들베리 각성제 무함유 보충제 비건 유전자 변형 성분 무함유 글루텐 무함유,체중 조절
미국 판매 1위 체중 감량 보충제 브랜드   1억 병 판매 체중 감량  칼로리 소모  탄수화물  단백질 및 지방 대사  천연 에너지 공급원  필수 비타민 체중 감량   주요 성분   과학적 연구 보충제 체중 감량   날씬한 몸매   상쾌한 기분,체중 조절
1회 제공량당 1 000mg 신진대사 강화 보충제 글루텐 무함유 품질 보증   품질 검사 완료 100  식물성,체중 조절
단쇄지방산 마이크로바이옴 지원 소화 기능 개선 원활한 신진대사 보충제 케토  비건  채식주의자에게 적합,체중 조절
자연적 소화기 건강 및 웰니스 필터링되지 않은 무가공 성분으로 제조 진짜 사과로 제조 Clean  라벨 프로젝트   모든 제품 실험실 검사 완료   평가 및 인증 완료 소화와 체중 감량에 도움 1회 복용량은 액체 30ml 1oz 에 해당 병마다 사과 20개에 해당하는 양 함유 NSF 인증 유전자 변형 성분 무함유 식물성 보충제,체중 조절
입증된 Sinetrol  함유 고질적인 지방 저장 세포를 표적화하고 신진대사를 돕는 강력한 투인원 작용 보충제열 발생 촉진  지방 세포에 저장된 트라이글리세라이드의 연소를 촉진하고 전반적인 체내 지방의 감소를 유도합니다  지방 세포의 갈변 효과  지방 세포가 저장형 흰색 에서 대사적으로 활성화된 발열형 갈색 으로 변하도록 표현형 변화를 촉진하여 안정시 대사율을 높여줍니다 ,체중 조절
글루텐 무함유 하루 1정 유전자 변형 성분 무함유 LE 인증 체중 관리 포뮬라  보충제,체중 조절
새로운 포뮬러  퍼포먼스 시리즈 미국 판매 1위 체중감소 브랜드   카페인 무수 250 mg 그린 커피 생두  200 mg L 테아닌 100 mg 100 mg L 카르니틴  L 타타르산 우수한 산열성 Super Thermogenic   체중 감소  극강의 에너지  식이보충제,체중 조절
USDA 유기농 인증 유전자 변형 성분 무함유 프로젝트 인증 휴대용 건강식 단백질 20g 소화가 용이 라이브 프로바이오틱스 및 효소 코셔 비건 상품 글루텐 무함유 유제품 또는 대두 성분 무함유 QCS 유기농 인증 B  corp  인증 에너지 강화 순 근육 생성 포만감깨끗한 유기농 식물성 단백질 20g 44가지 슈퍼 푸드 함유 설탕 1g 미만 15억 생 프로바이오틱   효소 22가지 자연 식품 비타민 및 미네랄 유기농 섬유소 3g,체중 조절
체중 관리 순수한 무맛 발열 효과 케토 친화적 제품 스테로이드 무함유 비건 코셔 Informed Sport   Trusted by Sport 인증 보충제 Informed Choice   Trusted by Sport 인증 유전자 변형 성분 무함유 프로젝트 인증 우수 제조 및 품질 관리 기준 GMP  품질 보장,체중 조절
해독 작용 고효능 보충제 높은 효능의 체내 정화 및 식습관 보조 상품 건강한 체중에 도움 건강한 포도당 신진대사 증진 1969년부터 과학에 기반한 고품질 상품 제공,체중 조절
하루 1정 글루텐 무함유 유전자 변형 성분 무함유 LE 인증 스트레스에 대한 코티솔 반응의 균형 촉진 보충제일상적인 스트레스 요인에 건강한 생물학적 반응 촉진 스트레스 호르몬인 코티솔의 건강 수치 유지 염증 억제를 도와 건강한 스트레스 반응 촉진,체중 조절
유전자 변형 성분 무함유 글루텐 무함유 채식주의자에게 적합 코셔 할랄 Certified Organic by Organic Certifiers  Inc  Organic Certifiers  Inc  유기농 인증  비살균 인공 색소 또는 향료 없음 Where Health   Flavor Meet ,체중 조절
체중 관리 보충제 정신  신체  가정을 위한 전반적인 웰니스 증진 최고의 순도 및 효능 1969년부터 과학에 기반한 고품질 상품 제공,체중 조절
1912년 설립 사과 식초 ACV  혼합물 1 877mg  | 아세트산 750mg  보충제 코셔 유전자 변형 성분 무함유 프로젝트 인증 Bragg  ACV 함유 인공 색소 및 인공 향료 무함유 설탕 무함유 비건 글루텐 무함유건강한 체중 건강한 포도당 수치 건강한 콜레스테롤 수치 면역계 지원,체중 조절
쉬운 반죽 팔레오 비건 상품 완벽한 케토 상품 맛있는 마카다미아  코코넛  아몬드 버터 식물성 지방 무가당  케토 인증 증량제 및 팜오일 무함유 글루텐 무함유 인증 유전자 변형 성분 무함유 프로젝트 인증,체중 조절
신체 및 두뇌에 빠르게 연료를 공급 쉽게 혼합 가능 MCT 6g 프리바이오틱 및 프로바이오틱 보충제 BPA 무함유 B  corp  인증 QCS 유기농 인증지속 가능한 방식으로 생산한 코코넛 팜유 및 기타 충전용 오일 무함유 헥산 무함유비건 인증 케토 인증 Paleo 인증USDA 인증 유기농 유전자 변형 성분 무함유 프로젝트 인증 NSF 글루텐 무함유 인증,체중 조절
체중 관리 허브 보충제 건강한 체중 관리 증진 건강한 신진 대사 촉진 포만감 증가 1969년부터 과학에 기반한 고품질 상품 제공,체중 조절
매일 섭취하는 케톤 보충제 용기당 제공 횟수 10회 1회 제공량당 케톤 10g 보충제 현대 영양소를 통한 건강 관리 BPA 무함유 비건 소금  글루텐 무함유 인공 향료 무함유 인공 감미료 무함유 Avela 함유 최상의 품질로 건강을 위한 상품 Ketone IQ 로 에너지 보충과 기분 전환을 동시에지속적인 에너지 제공 맑은 정신 지구력 및 회복 체중 관리 대사 건강 장수,체중 조절
열량으로 사용할 지방 라우릴 산 전혀 없음 고 효능 MCTs 건강 보조 식품 ,체중 조절
항산화 작용 허브 보충제 활성산소를 중화하는 항산화제 폴리페놀 함유 건강한 에너지  활력 증진 및 두뇌 기능에 도움 1969년부터 과학에 기반한 고품질 상품 제공,체중 조절
,체중 조절
체중 관리 500mg 플러스 크로뮴 강력한 지방 흡수 작용 이미 정상 범위 내에 있는 콜레스테롤 수치 유지에 도움 유전자 변형 성분 무함유 보충제 전반적인 건강 증진 1968년 설립된 가족 기업 우수 제조 및 품질 관리 기준 GMP  품질 보증,체중 조절
천연 및 인공 향료 체중 감량 및 콜레스테롤 감소 측정할 수 있는 결과  15회 제공량 비타민   미네랄 24종 트랜스지방 0g 유당 무함유 글루텐 무함유 유전자 변형 성분 없는 대두1회 제공량 기준 130칼로리에 불과 건강하게 드시고 건강을 느껴 보십시오,체중 조절
,체중 조절
최고의 효능을 담은 3 000mg 기능성 식이섬유 지방 결합력 보충제 및 식단 계획 ,체중 조절
보충제 60  HCA 건강한 체중 조절 채식주의자 비건에게 적합 순도 및 효능 보장,체중 조절
미국 판매 1위 체중 감량 보조제 브랜드   1억 병 판매 체중 감량  99  카페인 무함유 탄수화물  단백질 및 지방 대사  애플 사이다 식초 필수 비타민 체중 감량   주요 성분   과학적 연구 건강 보조 식품 체중 감량   날씬한 몸매   상쾌한 기분,체중 조절
MCT 뇌와 신체의 연료 100  유기농 코코넛 커피 및 셰이크에 혼합 가능 비건 인증 유제품 및 글루텐 무함유 케토 인증 USDA 유기농 인증 유전자 변형 성분 무함유 프로젝트 인증 보충제 QAI 유기농 인증 Informed Choice   Trusted by Sport 인증 획득   We Test You Trust BPA 무함유,체중 조절
 진짜 계피  보충제 정상 혈당 유지 항산화제 인공 보존제 무함유 천연 원료 효능 및 품질 보증 미국 식품의약국 FDA  등록 시설에서 제조,체중 조절
체중 관리 순수   무맛 발열 효과 케토 친화적 보충제 Informed Sport Com   Trusted by Sport 인증 Informed Choice Org   Trusted by Sport 인증 스테로이드 무함유 비건 코셔 유전자 변형 성분 무함유 프로젝트 인증 GMP 품질 보증 헥산 무함유,체중 조절
보충제 채식주의자에게 적합,체중 조절
1926년 설립 식사 대용 및 체중 감량 측정할 수 있는 결과  천연 및 인공 향료 맛있는 대용식 1회 제공량당 단 140칼로리 건강하게 드시고 건강을 느껴 보십시오 15회 제공량 단백질 13g 24가지 비타민 및 미네랄 함유 트랜스 지방 0g 유당 무함유 글루텐 무함유 유전자 변형 성분  대두 무함유 순도 품질 보증,체중 조절
Science Based Nutrition  보충제 비건 정상 범위에 있는 건강한 혈당 수치를 유지하는 데 도움 유전자 변형 성분 무함유   글루텐 무함유   대두 무함유,체중 조절
천연 허브 당류 대사 증진에 도움 보충제 대두 무함유 Chromax Mason 보증   품질 검사 완료 우수 제조 및 품질 관리 기준 GMP  인증   Five Star Certified,체중 조절
아프리카 망고 체중 관리 캡슐당 400mg 허브 보충제 고유하고 영양이 풍부한 기적의 식품 체중 관리 목표에 도움 Full Spectrum  천연 씨 포뮬라 1969년부터 과학에 기반한 고품질 상품 제공,체중 조절
보충제 포도당 관리 시스템 채식주의자 비건에게 적합한 제품 순도   효능 보장,체중 조절
저탄수화물 식단에 훌륭함 원조 탄수화물 억제제 보충제 Trimplex  전분 억제제 탄수화물 식욕을 줄임 The Diet Company빵 설탕 곡물 전분 감자 파스타 쌀견과류 치즈 플레인 요거트 고도불포화베리 콩 저혈당 과일소고기 돼지고기 닭고기 생선 해산물 전분이 적은 채소 단일포화 지방 달걀,체중 조절
강화된 체중 감량 성분  운동 후 근육 강화 단백질 30g l 카르니틴   l 타르타르산염 500mg  로부스타 커피콩 C  canephora robusta  추출물 200mg  천연 및 인공 향료 보충제 생물공학식품 성분 함유,체중 조절
장 건강 증진 소화 기능 개선 지방 연소 및 체중 감량 복부 팽만감 완화 300억 활성 배양균 프로바이오틱 균주 7종 보충제 UNLEASH YOUR POTENTIAL ,체중 조절
체중 관리 종합 포뮬라 보충제 건강한 체중 관리 증진 건강한 신진 대사 촉진 포만감 증진 순근육 발달 촉진 1969년부터 과학에 기반한 고품질 상품 제공,체중 조절
물 추출 폴리페놀 50  카테킨 30   항산화 지원 보충제 비건 베지 캡슐 NSF 유전자 변형 성분 무함유 인증 채식주의자 비건에게 적합,체중 조절
열 발생 촉진 녹차 추출물 700mg  EGCG 350mg 에너지 소비 촉진 활성산소 제거제 유전자 변형 성분 무함유 보충제 채식주의자 및 비건 1968년 설립된 가족 기업 우수 제조 및 품질 관리 기준 GMP  품질 보증,체중 조절
California Gold Nutrition CLA  공액리놀레산  1 000mg 잇꽃 오일에서 추출한 Clarinol  공액리놀레산 함유 전반적인 체중 관리 프로그램 지원  채식주의자와 비건에게 적합 글루텐  유전자 변형 성분  대두 무함유 cGMP 인증 시설에서 생산 100  골드 개런티 Gold Guarantee ,체중 조절
USDA 유기농 인증 유전자 변형 성분 무함유 프로젝트 인증 프리바이오틱  초모 가 함유된 유기농 및 무가공 식품 8샷 함유 Vermont Organic Farmers LLC 인증 유기농 상품 글루텐 무함유,체중 조절
폴리페놀 98  유전자 변형 성분 무함유 LE 인증 하루 한 알 농축 폴리페놀 추출물 보충제세포  심혈관   인지 건강을 지원하는 강력한 EGCG를 325mg 넘게 공급 이미 정상 범위 내에 있는 콜레스테롤 수준을 유지하는 데 도움 건강한 세포 증식   대사 기능 촉진,체중 조절
USDA 유기농 인증 유전자 변형 성분 무함유 프로젝트 인증 휴대용 건강식 단백질 20g 소화가 용이 라이브 프로바이오틱스 및 효소 코셔 비건 상품 글루텐 무함유 유제품 또는 대두 성분 무함유 B  corp  인증 QCS 인증 유기농 에너지 강화 순 근육 생성 포만감깨끗한 유기농 식물성 단백질 20g 44가지 슈퍼 푸드 함유 설탕 1g 미만 15억 생 프로바이오틱   효소 21가지 자연 식품 비타민 및 미네랄 유기농 섬유소 2g,체중 조절
USDA 유기농 인증  마더 가 함유된 유기농 및 무가공 프리바이오틱 8샷 함유 유전자 변형 성분 무함유 프로젝트 인증 글루텐 무함유 Vermont Organic Farmers LLC 인증 유기농 상품,체중 조절
글루텐 무함유 유전자 변형 성분 무함유 LE 인증 체중  엉덩이 치수  허리 치수 케어  보충제,체중 조절
