description,category
통증 완화 포뮬라 1위 수상 임상적으로 연구된 커큐민 및 강황 복합체 안전하고 효과적이며 중독성 없이 통증 완화  여러분의 건강을 위하여   Terry 보충제 코셔 비건 제품 유전자 변형 성분 무함유 할랄 순도   품질 검사 완료 ,통증 완화
글루텐 무함유 유전자 변형 성분 무함유 LE 인증 근육 및 관절 통증 완화 보충제 ,통증 완화
USDA 유기농 인증 비 GMO 프로젝트 인증 유기농 발효 통 강황   생강 함유 소화를 위한 유기농 후추   프로바이오틱스 4개월 분량 허브 보충제 코셔 제품 QCS 인증 유기농 제품 사회적 기업 인증 비건 인증 제품 NSF의 글루텐 프리 인증 추적 가능  테스트 완료   진품 제 3 자 감사 완료  유기농 인증 완료   비 GMO 승인 완료 전문적으로 제조 신체의 건강한 항염증 기능 지원  신체의 항산화 반응 지원  소화 증진을 위한 프로바이오틱스   유기농 후추 추출물  ,통증 완화
USDA 유기농 인증 유기농강황 유기농흑후추 유전자 변형 성분 무함유 포뮬라 보충제 유기농 인증 기관  Where Food Comes From Organic ,통증 완화
관절 건강 증진 TRU ID  진품 인증 유전자 변형 성분 무함유 프로젝트 인증 1회 제공량당 500mg 보충제 비건 ,통증 완화
정신적인 피로감 완화 집중력 부족 두통 불면증 동종 요법 의약품 휴대하기 편리한 완화제 자극제 무함유 자연적인 방식으로 건강을 지원 동종 요법 의약품의 세계적인 리더 인공 색소  향료  감미료 또는 보존제 무함유 집중력 부족 두통 간헐적인 불면증 ,통증 완화
C3 Complex  강황 500mg 커큐미노이드 475mg Bioperine  흑후추 추출물 함유 코코넛오일 함유 보충제 IGEN 유전자 변형 성분 무함유 검사 완료 글루텐 무함유 제3기관 검사 완료 cGMP 준수 ,통증 완화
건강 염증 반응  우수한 커큐민 흡수력 임상적으로 연구된 투르메론 Turmerones 을 함유한 커큐민 강황보다 최대 500배 강력한 효능  당신의 건강을 위하여   테리  Terry  건강 보조 식품 할랄 제품 유전자 변형 성분 없음 강력하고 증명된 효능  큐라메드 CuraMed 는 소프트젤 1 정 당 250 mg의 순수한 커큐미노이드 curcuminoids 가 함유되어 있습니다  한 알의 큐라메드 CuraMed  소프트젤은 500 캡슐의 심황에 해당하는 커큐민 혜택을 제공합니다  임상적으로 연구된 이 커큐민은 31건의 획기적인 출판 연구에 사용되었습니다  터머론 turmerone 을 포함한 심황 에센셜 오일을 함유한 특허 받은 유일한 커큐민 건강한 염증 반응에 대한 우수한 지원  간장  뇌  심장  면역 기능 지원 세포를 산화 스트레스와 자유기로부터 보호 높은 항 산화 ORAC 수치  1 500 000   유전자 변형 성분 없고 화학 물질 쓰지 않고 키운 강황 사용 유해 용매 없음 ,통증 완화
비건 생강   후추 보충제 글루텐 무함유 유전자 변형 성분 무함유 GMP 인증 식물성 성분 ,통증 완화
임상 효능이 있는 커큐민 소염 작용 경미한 진통 완화 관절 건강 증진  329  뛰어난 흡수력 하루 500mg Bioperine  함유 보충제 Unleash Your Potential  인공 색소 무함유 인공 향료 무함유 젤라틴 무함유 설탕 무함유 인공 감미료 무함유 보존제 무함유 ,통증 완화
데일리 골든 밀크 분말 혼합물 강황   7가지 슈퍼푸드 흑후추로 흡수력 최대화 설탕 무함유 건강 보조 식품 건강한 음식  활력 넘치는 일상 정성을 담은 제품 유전자 변형 성분 무함유 비건 케토 여성이 소유하고 운영하는 기업 강황 흑후추 카르다몸 시나몬 정향 생강 보스웰리아 오미자 열매 ,통증 완화
기초 건강 지원 허브 보조제 B Corporation 인증 ,통증 완화
정서 안정 및 스트레스 완화 트리플 액션 포뮬라 허브 보충제 정신  신체  가정의 전반적인 웰니스 증진 최고의 순도 및 효능 1969년부터 과학에 기반한 고품질 상품 제공 ,통증 완화
USDA 유기농 인증 커큐민 95  함유 유전자 변형 성분 무함유 상품 보충제 Organic Certifiers 유기농 인증 GMP 등록 시설에서 제조 ,통증 완화
전반적인 웰니스 보충제 비건 마그네슘스테아레이트 무함유 글루텐 무함유 유전자 변형 성분 무함유 ,통증 완화
건강한 염증 반응 포뮬라 111 무향 유기농 재배 GMP 인증 허브 보충제 의사가 개발한 상품 임상 연구를 거친 상품 품질 검사 완료 ,통증 완화
Longvida  최적화된 커큐민 인지 기능 강화 유리 커큐민 순환 유전자 변형 성분 무함유 보충제 채식주의자 비건에 적합 ,통증 완화
1932 이후로 표준화 된 추출 신선한   건강한 매일 한번씩 식이 보충제 ,통증 완화
건강 보조 식품 건강한 면역 반응 위해 Meriva   생체이용가능한 커큐민 ,통증 완화
1회 제공량당 강황뿌리 5g 상당량 1회 제공량당 설탕 단 3g   USDA 유기농 인증 유전자 변형 성분 무함유 프로젝트 인증 보충제 QAI 유기농 인증 B  corp  인증 글리포세이트   잔여물 무함유 125종 이상의 살충제 및 제초제 성분 검사 완료 유제품 무함유 대두 무함유 글루텐 무함유 검사 완료 채식주의자에게 적합 ,통증 완화
전반적인 웰니스 보충제 식물성 마그네슘스테아레이트 무함유 글루텐 무함유 유전자 변형 성분 무함유 ,통증 완화
균형 잡힌 면역 반응 증진 MCT 오일 베이스에 함유된 표준화된 추출물 65  보충제 ,통증 완화
유기농 커큐민 50mg 소화를 돕는 유기농 후추 및 프로바이오틱 USDA 유기농 인증 유전자 변형 성분 무함유 프로젝트 인증 허브 보충제 코셔 인증 QCS 유기농 인증 B  corp  인증 글루텐 무함유 인증 비건 인증 ,통증 완화
Since 1930 Joint Flexibility   Range of Motion Supports Normal Joint Fluid Function 2 Month Supply Herbal Supplement Family Owned for More Than 85 Years Clinical Strength Extract Gluten Free Vegan Friendly cGMP No Wheat No Soy No Dairy No Ingredients of Animal Origin ,통증 완화
혈당 건강 증진 표준화 허브 보충제 건강한 인슐린 기능과 포도당 대사 촉진 대사 건강 증진 흡수율을 높이는 흑후추 추출물 함유 1969년부터 과학에 기반한 고품질 상품 제공 ,통증 완화
보충제 건강한 염증 반응 강화  27배 더 높은 생체이용률 채식주의자에게 적합 ,통증 완화
USDA 유기농 인증 보충제 비건 인증 코셔 CCOF 유기농 인증 ,통증 완화
동종 요법 의약품 ,통증 완화
Enhanced Absorption  Supports Healthy Inflammation Response  Dietary Supplement Manufactured In a cGMP Certified USA Facility ,통증 완화
1972년 부터 Nature s Answer를 발견하고 그 차이를 믿으세요  고급 식물 지문 기술 Salix Alba Tanacetum Parthenium 채식주의 채식주의 건강 보조식품 전체주의적으로 균형잡힌 잔인함과는 무관 동물에 실험을 하지 않았습니다 화이트 버드나무 추출물 15  살리신으로 표준화된 테스트되고 검증된 ,통증 완화
1 500mg BioPerine  함유  비건 유전자 변형 성분 무함유 글루텐 무함유 보충제 관절 건강 2가지 초임계 형태의 강황 결합 고효능 강황 1회 제공량당 1 500mg  1회 제공량당 95  커큐미노이드 150mg 함유 천연 항산화제 및 식물성 영양소 소염 작용 지원 ,통증 완화
신선한 상품   From Farm to Tablet 1회 제공량당 커큐미노이드 300mg B  corp  인증 유전자 변형 성분 무함유 프로젝트 인증 글리포세이트 잔여물 무함유 125종 이상의 살충제 및 제초제 성분 검사 완료 글루텐 무함유 검사 완료 비건 인증 코셔 유제품 및 대두 성분 무함유 건강한 염증 반응 강화 BioPerine  흑후추 및 밀크시슬 함유 45회 제공량 보충제 ,통증 완화
허브 보충제 코셔 파르브 관절 통증 완화 항산화제 글루텐 무함유 천연향료 젤라틴 무함유 및 식물성 땅콩 및 견과류 무함유 어린이 개봉 방지 처리된 뚜껑 ,통증 완화
강황 허브 보충제 건강한 염증 반응 GMP 인증 ,통증 완화
면역 건강 3 In 1 체력 강화 포뮬라 허브 보충제 전반적인 체력을 강화하고 건강을 증진하는 전통 허브 면역 건강  에너지 및 항산화 효과를 증진하고 간 및 뇌 기능 강화 1969년부터 과학에 기반한 고품질 상품 제공 ,통증 완화
Plant Based  Harvest  USDA Organic  Soy Free  0 g Added Sugars  Gluten Free  Dairy Free  Non GMO  100  Vegan Organic Is Non GMO   More  Kosher ,통증 완화
동종 요법 의약품 ,통증 완화
동종 요법 1903년 설립 천연 통증 완화제 강도 높은 운동 후 빠른 회복 근육통  쓰라림 및 부종 완화 아스피린  이부프로펜  아세트아미노펜  나프록센 무함유 파라벤  페트롤라툼  인공 향료 및 색소 무함유 끈적이지 않음 동종 요법 유효 성분 20  쓰라림 경직 부기 타박상 ,통증 완화
허브 보충제 표준화된 추출물 커큐미노이드 95  소프트젤로 용해도 향상 유전자 변형 성분 무함유 보충제 코셔   젤라틴 함유 식물성 허브 1968년 설립된 가족 기업 GMP 인증 ,통증 완화
1982 년부터 로우  날것  신선한 동결 건조 건강보조식품 100  코셔 유전자조작하지 않음 곡물 콩 유제품 없음 미국에서 재배 날것  엄격한 채식주의자 전체 허브 필러 없음 ,통증 완화
건강 보조 식품 건강한 관절  두뇌 기능  이외의 수많은 혜택 강력한 항산화제 스트레스 관리 지원 두뇌 지원 건강한 관절 지원 심혈관 건강과 간 기능 유지를 돕습니다 건강한 염증 반응 기능을 지원합니다 ,통증 완화
1967년 설립 최적의 흡수 보충제 Mason 보증   품질 검사 완료 우수 제조 및 품질 관리 기준 cGMP  인증 대두 무함유 ,통증 완화
동종 요법 약품 빠른 흡수 향료 무함유 식물성 성분으로 제조 통증 완화 동종 요법 의약품의 세계적인 리더 통증 완화 1위 브랜드 모든 관절에 적합 알려진 약물 상호 작용 없음 유해 성분 무함유 화끈거리거나 따끔한 느낌이 들지 않습니다  관절염 경미한 부상 과도한 운동 낙상 반복적인 움직임 ,통증 완화
임상적으로 연구된 커큐민 및 강황 복합체 안전하고 효과가 좋은 첨가제 무함유 진통제  1위 선정   수상 내력에 빛나는 통증 완화 포뮬러 건강에 좋은 제품 건강 보조 식품 코셔 할랄 비건 유전자 변형 성분 무함유 순도   품질 실험실 검사 완료 ,통증 완화
커큐미노이드 95  간을 위한 식물성 지원제 허브 보충제 공인침술사 겸 한의사 OMD  마이클 티에라 승인 ,통증 완화
더욱 우수한 생체이용률  더 많이  더 우수하고  더 빠르게  오래 가는 효과 유전자 변형 성분 무함유 글루텐  밀   유제품 무함유 비건에 적합 보충제 커큐민은 활성산소를 억제하는 항산화제 역할을 합니다  과도한 활성산소로 인한 산화 스트레스는 인지력 저하와 연관된 것으로 알려져 왔습니다  바코파는 단기적 기억력을 지원하고  동양 아유르베다 요법에서 기억력과 집중력  특히 노화에 관련된 가벼운 기억력 및 집중력 문제를 해결하기 위해 전통적으로 사용되었습니다  콜린은 두뇌 세포막을 구성하는 필수 성분이며 두뇌 세포 신경 전달 물질 아세틸콜린의 전구체입니다  몸에서 바로 이용할 수 있는 B12는 건강한 호모시스테인 대사를 지원합니다  일부 연구에 따르면 낮은 호모시스테인 농도는 긍정적인 인지 건강과 상관관계가 있습니다  ,통증 완화
통증 완화 관절 통증   근육 결림 부상으로 인한 부기 타박상 동종 요법 약물 빠른 흡수 끈적임 무함유 무향  파라벤 무함유 자연스러운 체내 작용  동종 요법 약품의 세계적 선두주자 아르니카 천연 유효 성분 통증이 처음 시작될 때 Arnicare를 사용하십시오  동종 요법 1위 아르니카 통증 완화제 빠른 피부 흡수 끈적임 무함유 무향 파라벤 무함유 졸음을 유발하지 않음 약물 상호작용 없음 경미한 부상  과도한 운동 및 낙상으로 인한 근육통 및 결림을 일시적으로 완화합니다  타박상으로 인한 통증  부기  멍을 완화합니다  ,통증 완화
흑후추추출물 5mg 항산화 작용 지원 허브 보충제 글루텐 무함유 유전자 변형 성분 무함유 비건에게 적합한 상품 30년 이상 지켜 온 신뢰할 수 있는 품질 품질 보장  품질 검사 완료 ,통증 완화
보충제 흡수율이 높은 커큐민 오메가3 1 000mg 및 항산화 효과 전신 건강 개선 순도 및 효능 보장 관절 건강  편안함  기능 증진 신체의 염증 반응에 도움 심장 및 혈관 건강 증진 강력한 항산화 작용 ,통증 완화
관절의 편안함과 기동성을 지원  완전한 라벨 투명성  순도 및 효능 보장  제 3 자 검사 완료  cGMP 시설   자체 소량 제조  건강 보조 식품  채식주의자 섭취 가능 | 유전자 변형 성분 없음 | 글루텐 무첨가 | BSE TSE 무첨가  1996년 설립 ,통증 완화
천연 항산화제 효능 건강한 관절 기능 지원 일상 생활과 관련된 경미한 통증과 고통을 완화시킵니다 초고농축 5 000mg 강황 뿌리줄기  식물 기준  비건 제품 글루텐 프리 95  표준화한 커큐미노이드 강황 뿌리줄기 추출 독자 원료 첨단 식물 지문 기술 바이데스메스옥시커큐민 데스메스옥시커큐민 커큐민 ,통증 완화
OTCO   유기농 인증 유전자 변형 성분 무함유 유기농 울금 추출물로 제조 건강 보조 식품 유전자 변형 성분  유제품  글루텐 무함유 SuperPure  Oregon Tilth 유기농 인증 코셔 인증 ,통증 완화
Since 1930 Joint Flexibility   Range of Motion Supports Normal Joint Fluid Function 1 Month Supply Herbal Supplement Family Owned For Over 90 Years Gluten Free Vegan Friendly cGMP No Wheat No Soy No Dairy No Ingredients of Animal Origin ,통증 완화
보충제 ,통증 완화
1982년 설립 보충제 100  코셔 유전자 변형 성분 무함유 곡물 대두 유제품 무함유 유기농 비건에게 적합 천연 허브 증량제 무함유 ,통증 완화
강력한 활성산소 제거제 생체이용률이 높은 강황 추출물 관절 건강 강화 30건이 넘는 임상 연구로 검증된 상품 유전자 변형 성분 무함유 보충제 채식주의자 비건에게 적합 할랄 ,통증 완화
1967년 설립 건강한 염증 반응 및 심장 건강 증진 보충제 Mason 보증 품질 검사 완료 우수 제조 및 품질 관리 기준 cGMP  인증 글루텐 무함유 대두 무함유 채식주의자에게 적합 ,통증 완화
Amazing Formulas  보충제 천연 강황 뿌리로 제조 강력한 항산화 및 항염증 효과 심장  소화기  관절 건강 강화 1회 제공량당 1 500mg 우수 제조 및 품질 관리 기준 GMP 을 준수하는 고품질 상품 FDA 등록 시설에서 제조 ,통증 완화
1969년 설립 관절 건강 증진 TRU ID  진품 인증 유전자 변형 성분 무함유 프로젝트 인증 1회 제공량당 500mg 보충제 비건 상품 글루텐 무함유 ,통증 완화
캡사이신 0 025  통증 완화 크림 아르니카  비타민B6  MSM DMSO2 이 함유된 피부 깊숙이 침투하는 캡사이신 부드러운 따뜻한 느낌 완화   회복   젊어 보이도록 끈적임 | 사라지는 향 목 어깨 뒤로 팔꿈치 손목 손 무릎 발 아르니카 비타민B6 MSM DMSO2  캡사이신 관절염 경미한 요통 근육 좌상 타박상 염좌 경련 ,통증 완화
1932년 설립 이후 품질 혁신 보충제 하루 1정 Clear Quality  커큐민 항산화제 475mg 공급 ,통증 완화
강황 허브 보조제 건강한 염증 반응 GMP 인증 ,통증 완화
허브 보충제 정신  신체  가정을 위한 전반적인 웰니스 증진 최고의 순도 및 효능 1969년부터 과학에 기반한 고품질 상품 제공 ,통증 완화
25년 이상 지켜 온 프리미엄 품질 생물학적으로 이용 가능한 커큐미노이드 액티브 홀 스펙트럼 추출물 비건 유전자 변형 무함유 성분으로 제조 글루텐 무함유 보충제 GMP 품질 보증 및 FDA 등록 Enhancing Nature s Miracles Since 1994 ,통증 완화
Leading Endocannabinoid Nutrition Vegan Non GMO Gluten Free Dietary Supplement GMP Manufacturing Quality Assured Independent Testing ,통증 완화
관절 가동성 정상적이고 건강한 염증 반응 강화 임상 검증된 CurcuWin을 사용하여 커큐민 흡수율 최대 46배 향상 46배 우수한 흡수율 하루 1정 보충제 채식주의자에게 적합 100  식물성 ,통증 완화
B corp  인증 유전자 변형 성분 무함유 프로젝트 인증 글리포세이트 잔여물 무함유 125종 이상의 살충제 및 제초제 및 무함유 검사 완료 글루텐 무함유 검사 완료 비건 인증 코셔 인증 유제품 및 대두 성분 무함유 30회 제공량 강황  타트체리 및 BioPerine  흑후추 함유 보충제 ,통증 완화
Fresh From Farm to Tablet  관절 건강   운동성 유지 강황  악마의 발톱   보스웰리아 함유 30회 제공량 허브 건강 보조 식품 B  corp  인증 유전자 변형 성분 무함유 프로젝트 인증 125종 이상의 살충제   제초제 성분 검사 완료 NSF   글루텐 무함유 인증 비건 인증 코셔 유제품 무함유   대두 무함유 글리포세이트 잔여물 무함유 ,통증 완화
USDA 유기농 인증 보충제 유기농 인증 기관  QCS ,통증 완화
보충제 USDA 유기농 인증 유전자 변형 성분 무함유 글루텐 무함유 QAI 유기농 인증 심혈관 기능 개선 소화기관 건강 강화 면역계 건강 강화 강력한 소염 작용을 하는 항산화제 메스꺼움 및 멀미 방지 ,통증 완화
임상 연구를 거친 BCM 95  커큐민 빠르게 녹는 상품  작고 삼키기 쉬운 액상 젤 건강에 좋은 상품 보충제 유전자 변형 성분 무함유 순도 및 품질 검사 완료 ,통증 완화
무설탕 관절 건강 보충제 식물성 성분 함유 유제품 무함유 유전자 변형 성분 무함유 비건 상품 글루텐 무함유 ,통증 완화
Curcumin C3 Complex  보충제 보존제 무함유 ,통증 완화
1973년 설립 신체에 필요한 영양소를 공급하는 추출물로 제조 커큐민 95  심혈관계 건강 관절 건강 보충제 품질 검사 완료 A Brighter Way ,통증 완화
활기 충전 강황 커큐민 1 000mg 커큐미노이드 95  보충제 ,통증 완화
 1 Doctor Recommended Form  of Turmeric Curcumin  Ultra High Absorption Hydro Soluble Technology Dietary Supplement Non GMO Gluten Free ,통증 완화
1967년 설립 건강한 염증 반응 및 관절 건강 증진 보충제 채식주의자에게 적합 글루텐 무함유 대두 무함유 Mason 보증   품질 검사 완료 우수 제조 및 품질 관리 기준 GMP  인증 ,통증 완화
동종요법 치료 주요 증상  갑작스런 홍조  일사병 및 두통 일반 명칭  니트로글리세린 ,통증 완화
보충제 강황 Curcuma longa  효능 보장 품질 검사 완료 ,통증 완화
관절 및 소화 건강 비건 글루텐 무함유 보충제 소화 및 면역 건강 증진 관절 건강을 증진하는 강황 뿌리의 맛 식물성 ,통증 완화
임상 연구를 거친 BCM 95  커큐민 빠르게 녹는 상품  작고 삼키기 쉬운 액상 젤 건강에 좋은 상품 보충제 작은 크기 결과를 중요하게 여깁니다 우수 제조 및 품질 관리 기준 cGMP 에서 제조 순도 및 품질 검사 완료 유전자 변형 성분 무함유 ,통증 완화
보충제 ,통증 완화
향상된 흡수력 보충제 보존제 무함유 ,통증 완화
보스웰리아 및 퀘르세틴 함유 관절 건강 및 가동성 개선 Boswellin  함유 보충제 정신  신체  가정을 위한 전반적인 웰니스 증진 최고의 순도 및 효능 1969년부터 과학에 기반한 고품질 상품 제공 ,통증 완화
With Peppermint   Eucalyptus Oil ,통증 완화
에클렉틱 허브 식물 영양소 최대 보존 보충제 USDA 유기농 인증 근골격계 강화 천연 허브 무가공 글루텐 무함유 미국에서 재배 비건 제품 대두 성분 무함유 유전자 변형 성분 무함유 100  코셔 Oregon Tilth 유기농 인증 ,통증 완화
1972년 설립 건강한 관절 기능 지원 액상 허브 배합물 커큐미노이드 95 로 표준화된 강황 진저롤 5 로 표준화된 생강 액상 캡슐 Discover Nature s Answer and trust the Difference     비건 제품 글루텐 무함유 보충제 Holistically Balanced  크루얼티프리 No 동물 실험 Quik Sorb  함유 ,통증 완화
항산화 작용 지원 허브 건강 허브 보충제 품질 보증 품질 검사 완료 나트륨 무함유 ,통증 완화
유전자 변형 성분 없음 100  비건 제품 건강 보조 식품 95  커큐민 브로말린   보스웰라 함유 효능 보장 실험실 검사필 제품 ,통증 완화
염증   반응 개선 비건 품질 검사 인증 글루텐 무함유 관절 심장 건강 보충제 ,통증 완화
BioPerine  특허받은 생체이용률 인핸서 보충제  120일분  생체이용률 강화 면역계 강화 관절 건강 개선 항산화 효능 캡슐당 750mg 커큐미노이드 95  GMP 인증 시설에서 제조 ,통증 완화
For Sensitive Skin Removes Gently From Hair  Proprietary Advanced Adhesive  3 In x 4 In  76 mm x 101 mm  Not Made with Natural Rubber Latex The Perfect Balance of Strong Hold and Pain Free Removal Protecting wounds such as cuts  minor burns  and abrasions Wounds that require multiple dressings changes Sensitive skin  infants  children and the elderly Repositionable for optimal placement Removes gently from hair Hypoallergenic  Proprietary silicone adhesive for pain free removal ,통증 완화
정품 천연 성분 관절염 통증 관절 및 근육 통증 기침 인후통 부비강 트러블 타박상 경미한 화상 벌레 물림 건조하거나 갈라진 손  발 ,통증 완화
전반적인 웰니스 보충제 식물성 마그네슘스테아레이트 무함유 글루텐 무함유 유전자 변형 성분 무함유 ,통증 완화
비건   BioPerine  보충제 고유혼합물 유전자 변형 성분 무함유 cGMP 인증 ,통증 완화
25년 이상 지켜 온 프리미엄 품질 생물학적으로 이용 가능한 커큐미노이드 액티브 홀 스펙트럼 추출물 비건 유전자 변형 무함유 성분으로 제조 글루텐 무함유 보충제 우수 제조 및 품질 관리 기준 GMP  품질 보증   FDA 등록 Enhancing Nature s Miracles Since 1994 ,통증 완화
비건 건강한 염증 반응  임상적으로 연구된 커큐민 및 강황 복합체 강황에 비해 최대 500배 강도  건강에 좋은 상품 보충제 코셔 유전자 변형 성분 무함유 순도 및 품질 검사 완료 우수 제조 및 품질 관리 기준 cGMP  인증 시설에서 생산 이 고유한 커큐민은 70건 이상의 발표된 획기적인 연구에 사용되었습니다  ar 터메론을 함유한 강황 에센셜 오일이 함유된 유일한 특허 받은 커큐민 건강한 염증 반응을 위한 뛰어난 지원  간  두뇌  심장  면역 건강 증진 산화 스트레스 및 활성산소로부터 세포 보호 높은 항산화 ORAC 수치  1 500 000   화학물질 없이 재배한 유전자 변형 성분 무함유 강황 유해한 용매 없음 원하는 경우 캡슐을 개봉하여 음식에 섞으십시오  ,통증 완화
천연 보충제 천연 강황 뿌리로 제조 피페린 및 커큐미노이드 95 로 표준화 강력한 항산화 및 항염증 효과 심장 및 두뇌 기능 강화 관절 건강 강화 1회 제공량당 1 500mg 우수 제조 및 품질 관리 기준 GMP 을 준수하는 고품질 상품 100  천연 상품 ,통증 완화
보정된 스포이트 포함으로 복용이 간편함 흑후추추출물 빠른 효과 글루텐 무함유 유전자 변형 성분 무함유 59회 제공량 허브 보충제 섭취가 간편한 액상 허브 보충제 비건 포뮬라 ,통증 완화
1972년 설립 건강한 관절 유지에 도움 흰버드나무 Salix Alba  흰버드나무껍질 2 000mg로 제조 Discover Nature s Answer  글루텐 무함유 허브 보충제 코셔 파르브 Bio Chelated  저온 추출 공법 ,통증 완화
완화용 정제 40년 이상 업력의 안전한 완화제 동종 요법 생리통 복부 팽만 근육 경련 ,통증 완화
염증 반응 강화 흡수율을 극대화하는 흑후추 및 아보카도 오일과 생강 및 보스웰리아 1회 제공량당 커큐미노이드 추출물 95  500mg 보충제 Eat Better   Go Further  유전자 변형 성분 무함유 식물성 성분 제3기관 검사 완료 cGMP 시설에서 생산 웰니스 증진 건강한 염증 기능 정서적 균형 관절 유연성 ,통증 완화
커큐미노이드 95  흡수율 강화를 위한 BioPerine  보충제 심장  면역  두뇌 및 전반적인 건강 증진 GMP 인증 품질 품질 검사 완료 유전자 변형 성분 무함유 비건 상품 정성을 담은 상품 ,통증 완화
Homeopathic Medicine ,통증 완화
