description,category
Turmeric    Ginger Ultra High Absorption  550 mg  Dietary Supplement Rich Tangerine Flavor  Gluten Free Vegan No Artificial Colors ,통증 완화
Ultra High Absorption 500 mg Turmeric Complex Per Serving Dietary Supplement Gluten Free Vegan No Artificial Colors ,통증 완화
2 000 mg Per Serving Herbal With Ginger   Black Pepper Extract Dietary Supplement Antioxidant Kosher Vegan Gluten Free Nut Free ,통증 완화
Utilizes 95  Curcuminoids  2 300 mg Per Serving  Dietary Supplement  Nutricost  Quality Guaranteed Vegetarian Product  GMP Compliant Facility  Non GMO Product  Third Party Tested  Gluten Free BioPerine  ,통증 완화
일반 강황보다 최대 50배 효능  최적의 분산을 위한 섬유소 코팅 CurcuBeads  건강에 좋은 상품 비건 보충제 유전자 변형 성분 무함유 순도 및 품질 검사 완료 불순물 무함유   검증된 강황 추출물 일반 강황보다 최대 50배 더 강력한 강황  섬유소 코팅 CurcuBeads 를 통한 최적의 분산 1회 제공량당 풀 스펙트럼 커큐미노이드 95  함유 화학물질을 사용하지 않고 재배한 유전자 변형 성분 무함유 강황 유해한 용제 무함유 ,통증 완화
신선한 강황즙으로 만든 제품 최대 40배 우수한 생체이용률 표준 커큐민 추출물 유전자 변형 성분 무함유 보충제 채식주의자 비건에게 적합 ,통증 완화
건강한 노화 12시간 지속 방출 더 빠른 흡수 10배 더 뛰어난 생체 이용률 혈류로의 점진적 방출 보충제 글루텐 무함유 유전자 변형 성분 무함유 우수 제조 및 품질 관리 기준 GMP  채식주의자에게 적합 ,통증 완화
USDA 유기농 인증 보충제 눈 및 시력 건강 면역력 강화 피부 강화 QAI 유기농 인증 ,통증 완화
더 많고  더 우수하고  더 빠르게  185배 더 뛰어난 생체이용률 오래 가는 효과 유전자 변형 성분 무함유 글루텐  밀  유제품 무함유 보충제 ,통증 완화
USDA 유기농 인증 방어 CCOF 유기농 인증 비건 상품 글루텐 무함유 설탕 1g 버섯 맛이 아닌 강황 라떼 맛 유제품 무함유 카페인 무함유 아답토젠 ,통증 완화
사회적 기업 인증 유전자 변형 성분 없음 인증 완료 포뮬러 유전자 변형 성분 없음 비 GMO  프로젝트 인증 편안한 밤의 수면을 지원합니다 편안한 밤을 위한 깊고 만족스러운 수면 및 전신 건강 염증 반응 지원 건강 보조 식품 100  채식주의 제품 글루텐 불포함 ,통증 완화
보충제 건강한 염증 반응 증진 ,통증 완화
건강보조식품 건강한 염증반응을 위한 ,통증 완화
관절의 건강한 염증 수준 지원 보충제 글루텐  밀  유제품 무함유 증량제  결합제  인공 성분 무함유 여러분을 위한 식물 성분 종합 혼합물 우수 제조 및 품질 관리 기준 cGMP  인증 ,통증 완화
효과적인 상품 Dr  Axe 포뮬라 염증 반응  관절   가동성  USDA 유기농 인증 천연 식품 보충제 CCOF 유기농 인증 유기농 강황 뿌리추출물 및 발효 강황 뿌리로 제조 관절 압통 완화 및 관절 가동성 개선 운동으로 인한 관절 불편감 완화 5일 만에 관절 불편감 완화 건강한 염증 반응 강화 ,통증 완화
관절 건강 및 가동성 높은 흡수율 허브 보충제 채식주의자에게 적합 ,통증 완화
300 mg   65  보스웰릭산 표준 식물성 보조 식품 최대 효능 보장 처방 등급 글루텐 미함유 저자극성 채식주의자 Vcaps HerbaShield ,통증 완화
허브 보충제 공인침술사 겸 한의사 OMD  마이클 티에라 승인 항산화제 및 건강한 염증 반응 지원 생체이용률을 높이는 Bioperine  함유 유기농 인증 강황 뿌리줄기 ,통증 완화
관절 건강 및 가동성 높은 흡수율 허브 보충제 채식주의자에게 적합 ,통증 완화
아유르베다 허브 함유 소화와 전반적인 건강 및 웰빙 증진 USDA 유기농 인증 보충제 유기농 인증 B  corp  인증 유전자 변형 성분 무함유 유기농 인증 기관  QAI 100  식물성 ,통증 완화
인공 감미료 및 색소 무함유 건강한 염증 반응  임상적으로 연구된 커큐민 및 강황 복합체 강황에 비해 최대 500배 강도  건강에 좋은 상품 감마 ORB  비건 유전자 변형 성분 무함유 순도 및 품질 검사 완료 이 고유한 커큐민은 70건 이상의 발표된 획기적인 연구에 사용되었습니다  ar 터메론이 함유된 강황 에센셜 오일이 함유된 유일한 특허받은 커큐민 건강한 염증 반응을 위한 뛰어난 지원  간  두뇌  심장  면역 건강 증진 산화 스트레스 및 활성산소로부터 세포 보호 높은 항산화 ORAC 수치 1 500 000   화학물질 없이 재배한 유전자 변형 성분 무함유 강황 유해한 용매 없음 캡슐이나 정제를 삼키는 데 어려움이 있는 분들을 위한 상품 ,통증 완화
Vegan Non GMO Gluten Free Advanced  Dietary Supplement  GMP Manufacturing Quality Assured Independent Testing ,통증 완화
1969년 설립 활성산소로부터 보호 Curcumin C3 Complex  함유 구미젤리 2개 제공량당 강황 260mg 보충제 비건 제품 전 세계에서 고품질의 원료 확보 Curcumin C3 Complex 글루텐 무함유 ,통증 완화
영양 보호 식물 성분 무가공 슈퍼 푸드 강황 고대 아유르베다 처방의 황금빛 뿌리줄기 맑고 강렬한 적도의 햇살을 담은 분말 USDA 유기농 인증 유전자 변형 성분 무함유 비건 글루텐 무함유 설탕 또는 소금 무첨가 Organic Certifiers 유기농 인증 식물성 단순 성분 영양소가 풍부한 슈퍼 푸드 요리에 생기 넘치는 색감 생성 ,통증 완화
밸류 사이즈  보충제 NSF 성분 인증 BioPerine  커큐민 C3 복합체 ,통증 완화
일상 면역력 강화 구미젤리 및 식물성 성분 천연 강황   생강 고효능 비타민C 항산화제와 비타민B군 천연 향료를 함유한 천연 향료 보충제 글루텐 무함유 식물성 카페인 무함유 ,통증 완화
NO 동물실험 파라벤 무함유 캡사이신 0 025  통증 완화 크림 활력 충전 마그네슘 바디 버터 통증 완화 NO 동물실험 PETA 비건 관절염 경미한 요통 좌상 염좌 타박상 ,통증 완화
강황이 함유된 임상 연구를 거친 커큐민 긍정적인 기분 정서적 균형 건강에 좋은 상품 비건 보충제 유전자 변형 성분 무함유 순도 및 품질 검사 완료 Saffron EP15 는 임상 연구된 화합물 수준으로 표준화되었으며 정서적 균형과 마음의 평화에 도움이 되는 고유한 경로에 따라 작용합니다  당사의 임상 시험을 마친 커큐민은 커큐미노이드의 전체 스펙트럼에 대해 표준화되었으며  흡수율과 혈액 보유율을 높이기 위해 강황 에센셜 오일과 함께 사용됩니다  건강과 정서를 안정시키는 효과로 잘 알려져 있습니다  긍정적인 마음 상태 스트레스에 대한 건강한 반응  편안한 수면 건강한 세로토닌  코티솔 및 GABA 수치 유지 ,통증 완화
강황 Curcuma longa  순수 천연 유기농 성분으로 제조 USDA 유기농 인증 자연에서 가장 중요한 향신료 글루텐 무함유 유제품 무함유 비건 보존제 무함유 유전자 변형 성분 무함유 인공 향료 무함유 보충제 DNA 검사 완료 식물 성분 식물성 포뮬라 TRU ID 진품 인증 ,통증 완화
관절 건강 및 유연성 유지에 도움 하루 단 1정 강황 생체이용률을 개선하는 긴 후추 함유 10 1 추출물 비율 보충제 식물성 성분 함유 유제품 무함유 유전자 변형 성분 무함유 글루텐 무함유 비건 ,통증 완화
유기농 인증 분말 USDA 유기농 인증 유전자 변형 성분 무함유 프로젝트 인증 항산화 강화 염증 반응 촉진 관절  소화기  심장 건강 증진 코셔 유전자 변형 없는 성분으로 제조 비건 글루텐 무함유 무가공 Natural Food Certifiers 유기농 인증 ,통증 완화
허브 생강 및 흑후추 추출물 함유 보충제 항산화제 코셔 1회 제공량당 2 000mg 비건 글루텐 무함유 견과류 무함유 천연 복숭아 맛 ,통증 완화
관절 건강 및 가동성 캡슐당 300mg 표준화됨 허브 보충제 정신  신체  가정을 위한 전반적인 웰니스 증진 최고의 순도 및 효능 1969년부터 과학에 기반한 고품질 상품 제공 식물성 ,통증 완화
보충제 ,통증 완화
건강한 염증 반응  흡수율이 뛰어난 커큐민 임상적으로 연구된 커큐민 및 강황 복합체 강황에 비해 최대 500배 강도  비건 고객의 건강을 위한 제품 보충제 유전자 변형 성분 무함유 코셔 순도 및 품질 검사 완료 강력하고 검증된 상품 이 고유한 커큐민은 70건 이상의 발표된 획기적인 연구에 사용되었습니다  ar 터메론을 함유한 강황 에센셜 오일이 함유된 유일한 특허 받은 커큐민 건강한 염증 반응을 위한 뛰어난 지원  간  두뇌  심장  면역 건강 증진 산화 스트레스 및 활성산소로부터 세포 보호 높은 항산화 ORAC 수치  1 500 000   화학물질 없이 재배한 유전자 변형 성분 무함유 강황 유해한 용매 없음 원하는 경우 캡슐을 개봉하여 음식에 섞으십시오  ,통증 완화
Healthy Inflammation Response Clinically Studied Curcumin Up to 500 Times Stronger Than Turmeric For Your Good Health Vegan Dietary Supplement Non GMO Mild  Sweet Taste cGMP Compliant Lab Tested for Purity   Quality Perfect for children or anyone who has difficulty swallowing capsules or softgels Delivers clinically studied curcumin Great for daily support Sugar Free The ONLY PATENTED curcumin with turmeric essential oil containing ar turmerone Superior support for a healthy inflammation response Supports liver  brain  heart  and immune health Protects cells from oxidative stress and free radicals High antioxidant ORAC value  1 500 000 From non GMO turmeric grown without chemicals Over 70 groundbreaking  published studies ,통증 완화
항산화제 제공 활동 레벨이 무엇인지에 상관없이 편안한 움직임을 즐기도록 도움 식이보조제 생체 공학 아님 | 알레르겐 없음 신체의 염증 반응과 면역 기능을 중재하는 데 돕습니다  심장 건강과 순환의 지원을 돕습니다  최소한의 두통과 차분한 소화를 쉽게 할 수 있도록 돕습니다  ,통증 완화
리도카인 4  국소진통제 크림 손상된 신경을 둔감하게 만들어 경미한 통증 완화 은은하고 기분 좋은 향 끈적임 없음 ,통증 완화
관절 건강 및 가동성 개선 캡슐당 500mg 허브 보충제 흡수력 개선 커큐미노이드 35 로 표준화 관절 건강 증진 1969년부터 과학에 기반한 고품질 상품 제공 식물성 ,통증 완화
건강한 염증 반응 증진 허브 보충제 미국 침구 및 한의사 OMD   마이클 티에라 승인 ,통증 완화
Curcumin C3 Complex  함유 이중 작용 회복 포뮬라 격렬한 운동으로 인한 일시적 통증과 경직을 완화하는 보스웰리아 보충제 고강도 운동으로 인한 일시적 통증 및 경직 완화 건강한 염증 반응 촉진 ,통증 완화
Est  1973 Bladder Strength Formula With Butterbur   Flowtrol  Urinary Tract Support Dietary Supplement Lab Verified ,통증 완화
Formulated with CoQ10  Magnesium  and Riboflavin Dietary Supplement CoQ10 Magnesium Riboflavin ,통증 완화
가족 농장 1994년 설립 허브 보충제 운동 관련 염증 완화 브로멜라인 및 감귤류 바이오플라보노이드 함유 유전자 변형 성분 무함유 인증  글루텐 무함유 ,통증 완화
1969년 설립 관절 건강 증진 최대 효능  TRU ID  진품 인증 유전자 변형 성분 무함유 프로젝트 인증 1회 제공량당 750mg 보충제 글루텐 무함유 비건 상품 ,통증 완화
프리미엄 보충제 보충제 ,통증 완화
보충제 건강한 염증 반응 증진 ,통증 완화
1969년 설립 통증 완화  Tru ID  진품 인증 유전자 변형 성분 무함유 프로젝트 인증 1회 제공량당 추출물 400mg 글루텐 무함유 비건 보충제 ,통증 완화
Homeopathic Medicine ,통증 완화
USDA 유기농 인증 보충제 유기농 인증 기관  QCS ,통증 완화
1982년 설립 흡수를 돕는 포뮬라 유전자 변형 성분 무함유 프로젝트 인증 NSF 글루텐 무함유 인증 B  corp  인증 보충제 100  식물성 인공향료 또는 색소 무함유 버몬트에서 전하는 감사의 마음 ,통증 완화
1930년 설립 글루텐 무함유 비건 친화적 상품 인공 색소 무함유 관절 강화를 위한 커큐미노이드 95  1회 제공량 츄 2개당 285mg 허브 보충제 관절 강화를 위한 커큐민 함유 ,통증 완화
에너지보충제 400 mg 95  커큐민 표준화된 식물성 보충제 최대 효능 보장 처방의약품 품질 글루텐프리 저자극성 식물성캡슐 허바쉴드 HerbaShield  ,통증 완화
관절 건강 Meriva  커큐민 및 ApresFlex  보스웰리아 함유 관절 편안함 촉진 건강한 관절 기능 지원 단 7일 만에 나타나는 효과 보충제 글루텐 무함유 유전자 변형 성분 무함유 GMP 채식주의자에게 적합한 상품 ,통증 완화
A Dietary Supplement Vegetarian Gluten Free Curcumin C3 Complex  BioPerine  ,통증 완화
NovaSOL  185X More Bioavailable  Dietary Supplement 3rd Party Lab Tested Certified Open Source   Full Label Disclosure cGMP Certified Facility ,통증 완화
A Dietary Supplement Gluten Free Curcumin C3 Complex  ,통증 완화
파라벤 무함유 NO 동물실험 PETA 비건 캡사이신 0 025  상쾌한 마그네슘 오일 관절염 경미한 요통 좌상 염좌 타박상 ,통증 완화
USDA 유기농 인증 1회 제공량당 커큐미노이드 60mg 허브 보충제 유기농 Tilth 인증 ,통증 완화
흡수율이 높은 강황 포뮬라 강황 1 000mg 커큐민 900mg 흡수율을 극대화하는 흑후추 20mg 보충제 개별 스퀴즈 팩 ,통증 완화
Essentials 500 mg Dietary Supplement  Vegetarian  Gluten Free  Superior Absorption to Support Muscles  Joints  Bones   Liver Relief of occasional muscle and joint stiffness soreness associated with overexertion and exercise Vascular health Liver function Bone density ,통증 완화
The Additive Free Company  Doctor Formulated Enhanced Liposomal Absorption 500 mg Per 2 Capsules Plus 12 Hour Retention PureWay C  and Distilled OptiMSM  Dietary Supplement Clinical Potency Made with Non GMO Ingredients No Magnesium Stearate Gluten Free Vegan Formula  ,통증 완화
It s Fun to Feel Good  Supports Brain  Join   Immune System Health Non GMO No Gluten No Soy Vegan Label Claim Verified Nutritional Supplement  ,통증 완화
1982년 설립 심장 및 심혈관계 건강 강화 유전자 변형 성분 무함유 프로젝트 인증 NSF 글루텐 무함유 인증 보충제 100  식물성  인공 향료 및 색소 무함유 고효능 순수 추출물 ,통증 완화
1969년 설립 경미한 통증 완화  1회 제공량당 600mg 보충제 특허받은 기술 뛰어난 흡수율 생체이용률 극대화 효율성 최적화 비건 전 세계에서 고품질의 원료 확보 글루텐 무함유 ,통증 완화
유제품 무함유 글루텐 무함유 보충제 ,통증 완화
쑤시고 아픈 발 접질림으로 인한 부기 관절 통증 동종요법 의약품 보습 향료 무함유 식물성 통증 완화제 동종 요법 1위 아르니카 통증 완화제 통증 완화 동종 요법 의약품의 세계적 선두주자 엄선된 원료 품질 검사 완료 1932년 이래 유지해온 최고의 품질 당사의 살펴 만든 제품이 여러분의 건강을 살핍니다  신선한 아르니카 몬타나 식물로 제조 욱신거리는 발 통증 통증 통증 붓기 타박상으로 인한 멍 ,통증 완화
항산화 건강 지원 허브 보조제 유제품 젖당 없음 인공 향료 무첨가 유전자 변형 성분 없음 비 GMO  글루텐 불 포함 인증 인공 색소 무첨가 보존제 무첨가 95  커규민에 대해 표준화 된 500mg 추출물 함유 ,통증 완화
국소 진통제 근육통 및 근육 경직의 일시적인 완화 1835년 설립 동종 요법 국소 젤 깨끗한 성분 쾌적한 사용감 끈적임 없음 통증 부기 경직 타박상 지나친 운동  염좌  낙상  타격  스포츠로 인한 경미한 부상과 관련된 근육통  경직 및 부기를 일시적으로 완화합니다  타박상으로 인한 통증  부기  멍을 완화합니다  ,통증 완화
For Life Balance  간헐적이고 경미한 통증 및 과도한 운동으로 인한 통증 ApresFlex  함유 고효능 포뮬라 보충제 채식주의자 비건에게 적합 할랄 ,통증 완화
12시간 동안 부착 외용 진통제 근육 요통 염좌 좌상 관절 관절염 타박상 ,통증 완화
1973년 설립 허브 보충제 보충제 품질 검사 완료 비건 상품 ,통증 완화
MEM 푸드  기억력   인지력 강화 California Gold Nutrition MEM Food  개별 포장 노루궁뎅이버섯  L 세린  블루베리  아세틸 L 카르니틴  강황  트랜스 레스베라트롤  소나무껍질추출물  PQQ가 함유된 MEM 혼합물 기억력 및 인지력 증진  채식주의자와 비건에게 적합 글루텐  유전자 변형 성분 및 대두 무함유 cGMP 인증 시설에서 제조 100  골드 개런티 Gold Guarantee  ,통증 완화
에클렉틱 허브 식물 영양소 최대 보존 보충제 USDA 유기농 인증 자연 요법 의사가 제조 증량제 무함유 설탕 무함유 식물성 원료 비건 제품 대두 성분 무함유 유전자 변형 성분 무함유 100  코셔 Oregon Tilth 유기농 인증 ,통증 완화
Superfoods to Nourish Your Life Keto   Paleo Friendly Gluten Free Vegan Non GMO BPA Free   Reusable Container USDA Organic Supports Joint Health 4  Curcumin Certified Organic by  Ecocert SA Kosher Let s Reduce Landfill Waste Natural cleanser Supports joint health ,통증 완화
Dietary Supplement ,통증 완화
Enhanced Absorption 95  Curcuminoids Supports Healthy Inflammation Response  Dietary Supplement Manufactured in a cGMP Certified USA Facility ,통증 완화
Dairy Free Keto   Paleo 2 g MCT Per 9 g Serving Plant Based Superfood Drink Mix Pour  Mix  Sip  Enjoy Hot Only 40 Calories Per Serving Only 3 g Sugar Per Serving Gluten Free USDA Organic Ancient Treasure Nutrient Dense Certified B Corporation Non GMO Kosher Vegan BPA Free Certified Organic by Control Union Certifications Navitas  Live Life Positive  ,통증 완화
Maximum Potency Formula Health   Wellness Solution Anti Inflammatory Support Powerful Antioxidants Supports Joint Health Stimulates Immune System Dietary Supplement GMP Quality   Good Manufacturing Practice Certification Vegan Gluten Free Non GMO Unleash Your Superhero  FDA Inspected Facility ,통증 완화
흡수율이 뛰어난 강황 추출물 관절 건강 및 가동성 캡슐당 300mg 허브 보충제 ,통증 완화
USDA 유기농 인증 엑스트라 스트렝스  구미젤리 1회 제공량당 커큐미노이드 95mg 24배 흡수율   더 높은 생체이용률  허브 보충제 Oregon Tilth 유기농 인증 ,통증 완화
글루텐 무함유 유제품 수수료 유전자 변형 성분 무함유 깨끗한 영양 성분 추출물 50mg 함유 커큐미노이드 95 로 표준화 항산화 작용 지원 허브 보충제 ,통증 완화
Gluten Free Non GMO Traditional Herb 1 Per Day Dietary Supplement Laboratory Tested Quality Guarantee Let Your Health Shine  ,통증 완화
천연 보충제 65  보스웰리아산 함유 근육 및 관절 건강 증진 건강한 결합 조직 유지에 도움 건강한 염증 반응 촉진 우수 제조 및 품질 관리 기준 GMP 을 준수하는 고품질 상품 100  천연 상품 ,통증 완화
LongVida  보충제 ,통증 완화
Feel Younger Daily Naturally Honest  Clean Ingredients 46x Better Absorption Optimized Curcumin Formula Dietary Supplement CurcuWIN  ,통증 완화
Turmeric Curcumin Complex Supports Healthy Inflammation Response  Enhanced Absorption Vegetarian Formula Suitable For Diabetics Dietary Supplement Gluten Free Non GMO ,통증 완화
Gummiology 강황 및 생강 구미젤리 강황 및 생강 추출물을 함유한 성인용 구미젤리 천연 열대 과일 맛 관절 운동성 및 소화기 건강에 도움  채식주의자에게 적합 인공 색소 또는 감미료 무함유 젤라틴  글루텐  유전자 변형 성분  대두 무함유 cGMP 인증 시설에서 생산 ,통증 완화
Lake Avenue Nutrition PQQ 함유 PEA PEA 팔미토일에탄올아마이드  가벼운 불편 완화를 돕는 PEA  PQQ 피롤로퀴놀린 퀴논  미토콘드리아 기능을 강화하도록 돕는 PQQ  무함유 성분  유전자 변형 성분  글루텐 또는 대두 우수 제조 및 품질 관리 기준 GMP  인증 시설에서 생산 ,통증 완화
