effect,category
Zahler 고급 영양제 강력한 마그네슘 보충제 전반적인 건강 증진 1회 제공량당 200mg 보충제 코셔 파르브 우수 제조 및 품질 관리 기준 GMP  인증 시설에서 제조 유전자 변형 성분 무함유 글루텐 무함유 유제품 무함유 대두 무함유 채식주의자에게 적합 Feel Better  Everyday ,불면증
마그네슘 보충제 유전자 변형 성분 무함유 프로젝트 인증 비건 글루텐 무함유,불면증
1994년 설립 허브 보충제 휴식에 도움 유기농 시계꽃으로 제조 유전자 변형 성분 무함유 인증 성분  글루텐 무함유 Oregon Tilth 유기농 인증 OTCO ,불면증
주요 브랜드보다 2 5배 높은 흡수율  유전자 변형 성분 무함유 프로젝트 인증 NSF 글루텐 무함유 인증 코셔 인증 보충제 B  corp  인증 100  비건 상품 인공 향료 색소 무함유 버몬트에서 전하는 감사의 마음,불면증
천연 스트레스 완화제 마그네슘시트레이트 400mg 글루텐 무함유 비건 유전자 변형 성분 무함유 인증 보충제 효모 무함유 독립적으로 GMP 인증 FALCPA  알레르기 유발 성분 무함유건강한 마그네슘 수치 회복 신경 및 근육의 긴장 완화에 도움 최고 품질의 마그네슘 제공,불면증
BioAlign  보충제 다양한 영양소 및 허브 복합체 채식주의자에게 적합,불면증
500 mg Per Serving Dietary Supplement Nutricost  Quality Guaranteed Third Party Tested GMP Compliant Facility Non GMO Product Gluten Free BioPerine ,불면증
보충제 근육 및 에너지 생성 보조 유전자 변형 성분 무함유 인증,불면증
마그네슘 보충제 유전자 변형 성분 무함유 프로젝트 인증 비건 글루텐 무함유,불면증
의사가 설계한 포뮬라 스트레스 | 수면 | 회복 유전자 변형 성분 무함유 프로젝트 인증 무가당 저칼로리 식품 아님 보충제 코셔 비건 인증 NSF 글루텐 무함유 인증 대두  글루텐  견과 무함유  스테비아 무함유 B  corp  인증스트레스 완화 뼈 건강 증진 심장 건강 증진 근육 강화 수면 보조제 소화 기능 보조,불면증
1969년 설립 프리미엄 혼합물 전통적인 수면 포뮬라 Tru ID  진품 인증 유전자 변형 성분 무함유 프로젝트 인증 허브 3종 혼합물 보충제 글루텐 무함유 비건,불면증
아르니카 몬타나 함유 페퍼민트 및 유칼립투스 오일 함유 NO 동물 실험,불면증
건강 증진  자연 보호  삶의 개선 지향 발레리안 및 카모마일 함유 식물 성분 및 미네랄 포뮬라 l 테아닌 함유 보충제,불면증
유전자 변형 없는 성분으로 제조 스트레스  뼈 및 심장 건강 보충제 비건 상품 코셔 파르브 인증 글루텐 무함유스트레스 완화 뼈 건강에 도움 심장 건강,불면증
벨라돈나풀 무함유 치아가 나기 시작하는 아기 생후 3개월 이상  천연 성분 함유 치아가 나는 시기에 잠들지 못하고 뒤척이거나 불안해하는 아기의 진정 및 긴장 완화 효과 보충제,불면증
스트레스 완화   긴장 완화   심장   근육   세포 건강   면역력   뼈   신경   뛰어난 맛 보충제 확실히 느껴지는 변화 보장 글루텐 무함유 비건 인증 cGMP 인증,불면증
마그네슘 보충제 유전자 변형 성분 무함유 프로젝트 인증 글루텐 무함유,불면증
일상적인 통증  근육 및 뼈 ATA Mg  | 글리신산 | 말레이트 생체이용성 높은 3가지 형태의 마그네슘 비건에게 적합 보충제,불면증
휴식 및 회복 Animal 트레이닝 팩 보충제 수면 강화제 진정 효과 허브 회복제 면역 강화 GH 강화제 EAA,불면증
정서적 안정과 진정 효과를 통해 아기를 단잠에 빠지게 하는 아로마테라피 아기를 재울 때 방에 분사 인공향료 무함유 안전하고 효과가 좋은 제품 소아과 전문의 추천 제품 1위  파라벤 무함유 석유 성분 무함유 편안하고 달콤한 숙면 루틴에 도움 아기를 재울 때 방에 분사,불면증
글리신산  말레이트 형태 신경계 건강 지원 우수한 생체이용률 유전자 변형 성분 무함유 보충제,불면증
천연 스트레스 완화제 설탕 무함유   자일리톨로 단맛 첨가 마그네슘 시트레이트 400mg 글루텐 무함유 비건 유전자 변형 성분 무함유 인증 보충제 효모 무함유 독립적으로 GMP 인증 FALCPA  알레르기 유발 성분 무함유건강한 마그네슘 수치 회복 신경 및 근육의 긴장 완화에 도움 최고 품질의 마그네슘 제공,불면증
다른 유명 브랜드에 비해 2 5배 높은 흡수율 100  비건 제품 유전자 변형 성분 무함유 프로젝트 인증 NSF 글루텐 무함유 인증 코셔 보충제 인공향료 또는 색소 무함유,불면증
마그네슘 보충제 기타 천연 향미료 첨가 유전자 변형 성분 무함유 프로젝트 인증 글루텐 무함유,불면증
1967년 설립 보충제 Mason 보증   품질 검사 완료 cGMP 글루텐 무함유 대두 무함유 나트륨 무함유 신경계 및 심장 건강 증진에 도움,불면증
스트레스 완화 허브 보충제 정신  신체  가정을 위한 전반적인 웰니스 증진 최고의 순도 및 효능 1969년부터 과학에 기반한 고품질 상품 제공,불면증
마그네슘 보충제 유전자 변형 성분 무함유 프로젝트 인증 비건 상품 글루텐 무함유 R A W   인증 C L E A N   인증,불면증
1967년 설립 신경계 및 심장 건강 증진에 도움 보충제 대두 무함유 Mason 보증   품질 검사 완료 우수 제조 및 품질 관리 기준 cGMP    Five Star Certified,불면증
식품 재배 피타빌 미네랄로 강화 뼈 건강 증진 보충제,불면증
영양 보충제 기분 향상과 수면,불면증
전문가 등급 보충제 베스트셀링 브랜드 킬레이트 완충형 TRAACS   최적의 건강 지원 삼키기 쉬운 미니 캡슐 소화기 계통에 순하게 작용 100  천연 성분  충전제 또는 결합제 무함유 공인된 제3 기관 검사 완료 Albion Minerals  유전자 변형 성분 무함유 프로젝트 인증 60일치 복용량 보충제 우수한 품질 보증 안전  지식   품질   헌신   무결성   우수한 표준 Nutritional Supplements 의 우수한 표준 글루텐 무함유 성분 GMP   우수 제조 및 품질 관리 기준 품질 검사 완료   제3 기관 인증   순도 및 효능,불면증
30일치   분량 심장   에너지   기분   근육 보충제 유전자 변형 성분 무함유 프로젝트 인증 코셔 비건 인증 글루텐 무함유 cGMP 인증 제3기관 검사 완료 미국 1위 액상 마그네슘 브랜드 확실히 느껴지는 차이,불면증
1972년 설립 편안한 수면을 도움 풀 스펙트럼 허브 발레리안 차분하고 이완된 기분을 촉진 Holistically Balanced  보충제 비건 제품 글루텐 무함유 코셔 파르브 크루얼티프리 Leaping Bunny 인증,불면증
최적의 흡수 미네랄 보충제 수백 가지 생화학 반응에 관여하는 필수 미네랄 잘 흡수되는 공급원 뼈 건강  근육  신경 기능 유지 1969년부터 과학에 기반한 고품질 상품 제공,불면증
보충제 달걀 무함유 글루텐 무함유 견과류 무함유 유제품 무함유 GMP 준수 시설에서 제조,불면증
210 mg Magnesium Per Serving Dietary Supplement Quality Guaranteed   Nutricost   Vegetarian Product GMP Compliant Facility Non GMO Product Third Party Tested Gluten Free,불면증
근육 및 뼈 건강 미네랄 보충제,불면증
유전자 변형 성분 무함유 건강 보조 식품 흡수력 향상 실험실 검증 완료,불면증
멜라토닌 무함유 글루텐  밀  유제품 무함유 비건에게 적합 유전자 변형 성분 무함유 보충제하루를 상쾌하게 시작할 수 있도록 수면의 질 향상 긴장 완화 및 편안한 마음이 들도록 지원 빠르게 잠들고 숙면을 취하도록 지원 밤에 깨지 않는 휴식을 촉진 간헐적인 불면증 및 스트레스 완화를 위한 제품 멜라토닌 무함유 약물 성분 완전 무함유 습관성 약물 중독을 형성하지 않음,불면증
의사가 설계한 포뮬라 스트레스 | 수면 | 회복 유전자 변형 성분 무함유 프로젝트 인증 무가당 저칼로리 식품 아님 보충제 코셔 비건 인증 NSF 글루텐 무함유 인증 대두  글루텐  견과 무함유  스테비아 무함유 B  corp  인증스트레스 완화 뼈 건강 증진 심장 건강 증진 근육 강화 수면 보조제 소화 기능 보조,불면증
건강 보조 식품,불면증
보충제 코셔 파르브 글루텐 무함유,불면증
보충제 규칙적인 배변 촉진 심혈관계 건강 증진 근육 기능 글루텐 무함유 우유 카제인 무함유 인공 보존제 무함유 효능 및 품질 보증 FDA 등록 시설에서 제조,불면증
보충제의 과학 1회 제공량당 아연 30mg 1회 제공량당 마그네슘 450mg 1회 제공량당 비타민B6 10 5mg 미네랄 보충제 회복  근력  면역 기능 증진 보충제 BioPerine ,불면증
1969년 설립 프리미엄 추출물 편안한 숙면 지원 Tru ID  진품 인증 유전자 변형 성분 무함유 프로젝트 인증 쥐오줌풀추출물 1회 제공량당 220mg 보충제 비건 글루텐 무함유,불면증
1969년 설립 세포 에너지 강화 1회 제공량당 345mg 보충제 글루텐 무함유 비건 상품,불면증
식물성 액상 허브 및 미네랄 보충제 근육 긴장 및 스트레스 완화에 도움 쉬운 흡수 글루텐 무함유 인공 보존제  색소  향료 무함유 알코올 무함유,불면증
뼈 건강에 도움 긴장 완화 촉진 근육 강화 진짜 마그네슘으로 만든 보충제 시설에서 공급된 GMP 등록,불면증
내면에서 시작되는 건강 아연  비타민D3에 마그네슘 추가 뼈 및 심장 건강 증진 신경계 건강 증진 면역계 건강 증진 보충제 GMP 보존제 무함유 유제품 무함유 글루텐 무함유 조개 및 갑각류 무함유 대두 무함유,불면증
휴식  긍정적인 마음가짐과 수면위해 비건 제품 식물성 캡슐 건강 보조 식품 트립토퓨어 채식주의자 비건에게 적합,불면증
보충제 달걀 무함유 글루텐 무함유 견과류 무함유 유제품 무함유 GMP 준수 시설에서 제조,불면증
시트레이트  말레이트  글리신산 기타 천연 향료 함유 유전자 변형 성분 무함유 프로젝트 인증 분말형 보충제 채식주의자에게 적합 글루텐 무함유 검사 완료 유제품 무함유 대두 무함유 125종 이상의 살충제 및 제초제 성분 무함유 검사 완료 코셔 인증 글리포세이트 잔여물 무함유 B  corp  인증,불면증
보충제 긍정적인 기분 및 편안한 수면 증진 면역 기능에 도움 순환계 개선 및 스트레스 감소 효과 GMP를 준수하는 고품질 상품,불면증
스트레스에 대한 건강한 반응 지원 마그네슘 보충제 유전자 변형 성분 무함유 프로젝트 인증 비건 상품 글루텐 무함유,불면증
유전자 변형 성분 무함유 비건 글루텐 무함유 젤라틴 무함유 펙틴 기반 설탕 무함유 비건 천연 딸기 향료 보충제,불면증
비타민 100  품질 만족 보장 글루텐 무함유 유전자 변형 성분 무함유 미네랄 보충제 비유전자 변형 성분 서약 필수 미네랄,불면증
보충제 브로멜라인 함유 품질 검사 완료,불면증
신경계 진정 및 휴식 USDA 유기농 인증 허브 보충제 발레리안 글리세라이트 긴장을 풀어 주고 편안한 수면 유도 글루텐 무함유 알코올 무함유 Organic Certifiers 유기농 인증,불면증
수면 보조제 스트레스를 받는 동안 숙면을 취할 수 있도록 지원합니다  Passionflower  Ashwagandha   대추 날짜로 만든 허브 보충제 1987년부터 이어진 무결점  순도  효능 비건 글루텐 무함유 대두 무함유 B  corp  인증 식물과 사람을 연결하다 ,불면증
Amazing Formulas  보충제 건강한 웰빙을 위한 필수 미네랄 에너지 생성 보조 심장  뼈  소화 건강 강화 우수 제조 및 품질 관리 기준 GMP 을 준수하는 고품질 상품 미국 식품의약국 FDA  등록 시설에서 제조,불면증
Dietary Supplement Nutricost  Quality Guaranteed Vegetarian Product GMP Compliant Facility Non GMO Product Third Party Tested  Gluten Free,불면증
근육 및 뼈 건강 미네랄 보충제 튼튼한 근육 및 뼈  심혈관계 건강 등에 꼭 필요한 영양소 규칙적인 배변과 소화 건강에 도움 1969년부터 과학에 기반한 고품질 상품 제공,불면증
보충제 글루텐 무함유 유전자 변형 없는 성분으로 제조 우수 제조 및 품질 관리 기준 GMP  인증 식물성 성분,불면증
이온성 미네랄 미네랄 보충제 36회 제공량 눈과 맛과 느낌으로 순도를 확인할 수 있습니다  어린이 및 반려동물에게 안전한 제품 BPA 무함유 섭취보다는 흡수가 더 중요합니다 ,불면증
1971년 설립 글루텐 무함유 인증 근육 이완에 도움 뼈 건강 증진 하루 단 2정 보충제 NSF 유전자 변형 성분 무함유 인증 코셔 파르브 B  corp  인증 Ifanca 할랄 인증진정성 청결성 신선도 일관성 정확성,불면증
수면  일상 스트레스  인지력 24  더 빠른 흡수율 ATA Mg    두뇌를 위한 높은 생체이용률 마그네슘 비건에게 적합 보충제,불면증
근육 및 뼈 건강 증진 슈퍼 강도 미네랄 보충제 건강한 혈압 및 포도당 수치 유지에 도움 1969년부터 과학에 기반한 고품질 상품 제공,불면증
From Farm to Tablet  근육 이완에 필수적인 미네랄 보충제 60회 제공량 유전자 변형 성분 무함유 프로젝트 인증 비건 인증 125종 이상의 살충제 및 제초제 성분 무함유 9가지 식품 알레르기 유발 성분 무함유 글리포세이트 잔여물 무함유 글루텐 무함유 B  corp  인증 코셔 인증,불면증
수면 사이클 균형 유지 USDA Organic 미국 농무부 유기농 인증  Non GMO Project Verified 유전자 변형 성분 무함유 프로젝트 인증  Certified B Corporation 사회책임기업 인증  허브 보조제 Kosher 비건 채식주의자에게 적합 글루텐 무함유 Aditi Organic Certifications Pvt  Ltd  Certified Organic Aditi Organic Certifications Pvt  Ltd  유기농 인증 ,불면증
1969년 설립 프리미엄 혼합물 허브 수면 보조제 쥐오줌풀 추출물 1회 제공량당 320mg 보충제 글루텐 무함유,불면증
1972 년 부터 네이처스 앤써  Nature s Answer 를 발견하시고 차이를 믿으세요    진보된 식물지문 기술 시계초  학명 Passiflora Incarnata  표준화된 허브 추출물 3 5 4  플라보노이드를 이소비텍신  Isovitexin 으로 표준화한 무글루텐 진짜임이 확인된 채식주의자 엄격한 채식주의자 무글루텐 건강보조식품 전체학적으로 균형잡힌 동물실험을 거치지 않음,불면증
1969년 설립 뼈 건강 및 근육 기능 1회 제공량당 750mg 보충제,불면증
대두 무함유 결합제 또는 충전제 무함유 글루텐 무함유 유제품 무함유 Kosher 비건 근육 및 수면 천연 이온 보충제 Non GMO Project Verified 유전자 변형 성분 무함유 프로젝트 인증  건강 보조 식품 심장 건강 숙면 및 이완 작용 뼈 및 치아 건강 숙면으로 아름다움을 찾으세요,불면증
슈퍼 푸드 MG 마그네슘 24 3050 6  Ne 3s2 국소용 미네랄 스프레이,불면증
유전자 변형 성분 무함유 성분으로 제조 근육 건강을 지원할 수 있습니다 비건 상품 글루텐 무함유 코셔 파르브 보충제,불면증
1976년 설립된 협동 기업 사람과 환경에 대한 책임감 발레리안 Valeriana officinalis  허브 보조제 방사선 노출 없음 코셔,불면증
유전자 변형 성분 무함유 비건 글루텐 무함유 100  순도   효능 보장 2개월분 건강 보조 식품 RAW 인증 Clean 인증건강한 스트레스 반응 보조 신경 안정 및 건강한 수면 패턴 지원 꾸준한 에너지 생산에 도움 심장 건강   뼈 건강   건강한 혈당량 유지 쥐가 난 근육 이완 촉진,불면증
글루텐 불포함  유기농 허브로 만든 제품 건강하고 편안한 수면 촉진 허브 보조제 오리건 틸스 Oregon Tilth  유기농 인증,불면증
보충제 채식주의자에게 적합 글루텐 무함유 대두 성분 무함유 유전자 변형 없는 성분으로 제조부신 호르몬 균형 뼈 건강 심혈관 기능 해독 기능 포도당 대사 정신 건강 신경 기능 치아 법랑질,불면증
설탕 무함유 멜라토닌 무함유 휴식 및 면역계에 도움 USDA 유기농 인증 유전자 변형 성분 무함유 프로젝트 인증 액상 허브 보충제 알코올 무함유 QCS 유기농 인증 비건 인증 글루텐 무함유 인증 전통적인 수면 허브 생산 유통 이력제  검사 완료  믿을 수 있는 성분 제3 기관 검사 완료 전문적 배합,불면증
마그네슘 보충제 기타 천연 향료 함유 유전자 변형 성분 무함유 프로젝트 인증 채식주의자에게 적합 글루텐 무함유 R A W   인증 C L E A N   인증,불면증
구조대 브랜드 Bach  Rescue  제조사 제품 멜라토닌  아슈와간다  라벤더  카모마일  비타민B6 긴장 완화 및 편안하게 숙면을 취하도록 도와줍니다  보충제 기타 천연 향료 함유 6가지 플라워 에센스 비건 무중독성 상품,불면증
BIOMAG  비스글리시네이트 100  킬레이트 보충제 글루텐 무함유 유전자 변형 성분 무함유 대두 무함유 cGMP 인증,불면증
,불면증
건강 보조 식품,불면증
보충제 코셔 파르브 글루텐 무함유,불면증
보충제 규칙적인 배변 촉진 심혈관계 건강 증진 근육 기능 글루텐 무함유 우유 카제인 무함유 인공 보존제 무함유 효능 및 품질 보증 FDA 등록 시설에서 제조,불면증
보충제의 과학 1회 제공량당 아연 30mg 1회 제공량당 마그네슘 450mg 1회 제공량당 비타민B6 10 5mg 미네랄 보충제 회복  근력  면역 기능 증진 보충제 BioPerine ,불면증
프리미엄 포뮬라 우수 제조 및 품질 관리 기준 GMP  제품 순수 분말 제3기관 품질 검사 완료 보충제신경 및 근육 기능을 강화합니다  뼈 건강을 강화합니다 ,불면증
Magtein  마그네슘 l 트레온산 신경계에 마그네슘 공급 건강한 인지 기능 강화 유전자 변형 성분 무함유 보충제 채식주의자 비건에 적합,불면증
Sun Food Energy  Muscle   Nerve Support Non GMO Dietary Supplement Quality You Can Trust ,불면증
고효능 미네랄 보충제 아미노산 킬레이트 복합체 채식주의자에 적합 글루텐 무함유 고품질 천연 보충제,불면증
보충제 기분  휴식  수면에 도움 유전자 변형 성분 무함유 인증 채식주의자에게 적합,불면증
보충제 글루텐 무함유 유전자 변형 성분 무함유 인증 효모 무함유 비건 상품 인공색소  인공보존제 무함유 마그네슘 시트레이트  420mg 주야간 섭취 건강한 마그네슘 수치 회복 신경 및 근육의 긴장 완화에 도움 최고 품질의 마그네슘 제공 친환경 상품 우수 제조 및 품질 관리 기준 GMP  인증 시설에서 제조 식품 알레르기 유발 성분 라벨링 및 소비자 보호법 FALCPA  에 명시된 주요 알레르기 유발 물질 무함유,불면증
Lactium   l 테아닌 및 식물성 혼합물 중독성 약물 무함유 스트레스를 진정시켜 더 건강하고 긴 수면에 도움 건강한 수준의 명료한 정신 및 주의력 유지에 도움 보충제 유전자 변형 성분 무함유 인공 향료 무함유 인공 감미료 무함유 보존제 무함유 합성 염료 무함유 식물성 중독성 약물 무함유 수면 보조제 브랜드 1위 Lactium 은 수면의 질과 수면 시간을 개선하고 간헐적인 스트레스와 불안을 완화하는 것으로 알려진 우유 단백질입니다   l 테아닌은 Lactium 과 함께 작용하여 마음을 진정시켜 보다 편안한 수면을 위해 작용합니다  카모마일  라벤더 및 레몬밤의 식물 혼합물 ,불면증
Health  Nature  Life  발레리안 및 카모마일 함유 식물 성분 및 미네랄 포뮬라 l 테아닌 함유 보충제,불면증
B  corp  인증 글리포세이트 잔여물 무함유 글루텐 무함유 검사 완료 식물성 코셔 유제품   대두 무함유 유전자 변형 성분 무함유 프로젝트 인증 Fresh From Farm toCapsule  의사가 설계한 포뮬라 휴식 및 회복성 수면 촉진 60회 제공량 발레리안  아슈와간다  시계꽃 및 홉 함유 허브 보충제,불면증
Original Flower Essence Natural Sleep Aid For Kids  Homeopathic Free of Alcohol  Gluten   Sugar  Non Narcotic   Non Habit Forming  Vegan,불면증
건강 증진 Albion  TRAACS  마그네슘 비스글리시네이트 킬레이트 및 dl 마그네슘 말레이트 미네랄 보충제 코셔 식물성 식단에 함유된 성분 확인   특허 출원된 혼합물 없이 라벨 전체에 표시 1996년 설립 Albion 미네랄,불면증
NO 동물 실험,불면증
마그네슘 보충제 기타 천연 향료 함유 유전자 변형 성분 무함유 프로젝트 인증 비건 상품 글루텐 무함유 R A W   인증 C L E A N   인증,불면증
심혈관계 건강 증진 생체 이용성이 높은 형태의 마그네슘 유전자 변형 성분 무함유 보충제 채식주의자 비건에게 적합 코셔,불면증
마그네슘 보충제 유전자 변형 성분 무함유 프로젝트 인증 기타 천연 향료 함유 비건 글루텐 무함유 R A W  인증 C L E A N  인증,불면증
안티 스트레스 진정 심장 건강 근육 세포 무결성 면역력 뼈 건강 신경계 뛰어난 맛  보충제 알려진 알레르기 유발 성분 무함유 미국 1위 액상 마그네슘 브랜드 글루텐 무함유 비건 인증 cGMP 인증,불면증
안티 스트레스 구미젤리 오렌지 향과 기타 천연 향료 유전자 변형 성분 무함유 프로젝트 인증 글루텐 무함유 비건 인공 향료 또는 합성 색소 무함유,불면증
산화 마그네슘 및 시트레이트 함유 에너지 생성 보조 뼈   근육 건강 증진 보충제,불면증
마그네슘시트레이트 420mg 주야간 사용 건강한 마그네슘 수치 회복 신경 및 근육의 긴장 완화에 도움 최고 품질의 마그네슘 제공 보충제 글루텐 무함유 유전자 변형 성분 무함유 인증 효모 무함유 비건 우수 제조 및 품질 관리 기준 GMP  인증 시설 FALCPA 주요 알레르기 유발 물질 무함유 ,불면증
1972년 설립 천연 진정 및 안정 효과를 주는 식물 허브 보충제 Discover Nature s Answer  유기농 알코올 최저 12 15   글루텐 무함유 코셔 파르브 인증 Bio Chelated  저온 추출 공법,불면증
보충제 심혈관계 건강 증진 혈압 신경계 건강 효능 및 품질 보증 미국 식품의약국 등록 시설에서 제조 글루텐 무함유 인공 보존제 무함유,불면증
1932년 설립 이래 신뢰할 수 있는 품질 유지 마그네슘타우레이트 비건 유전자 변형 성분 무함유 보충제 무설탕 글루텐 무함유,불면증
미국 1위 액상 마그네슘 브랜드 더 강력한 이온성 미량 미네랄 글루텐 무함유 미국 채식주의자 협회 AVA  비건 인증 보충제 우수 제조 및 품질 관리 기준 cGMP ,불면증
효능이 우수한 순수 추출물 유전자 변형 성분 무함유 프로젝트 인증 포뮬라 NSF 글루텐 무함유 인증 B  corp   인증 보충제 100  식물성 상품 인공 향료 색소 무함유 버몬트에서 전하는 감사의 마음,불면증
편안한 숙면을 위한 식물성 보조제 허브 보조제 마이클 티에라 L Ac  O M D 승인,불면증
기타 천연 향료 함유 건강한 혈압 수치 유지 주의력 강화에 도움 긴장 완화 및 수면의 질 촉진 보충제 무설탕 글루텐 무함유 유전자 변형 성분 무함유 친환경 상품 GMP 인증 비건,불면증
보충제,불면증
1947 년 설립 효과적인 흡수 뼈 건강 증진 신경 및 근육 기능에 도움 유전자 변형 성분 없음 글루텐  밀  유제품 없음 비건에게 적합 건강 보조 식품 코셔 파르브,불면증
근육 및 뼈 건강 증진 캡슐당 200mg 미네랄 보충제 1969년부터 과학에 기반한 고품질 상품 제공,불면증
Nutrition for Kids  설탕 무함유 멜라토닌 무함유 천연 베리 향료 및 기타 천연 향료 100  천연 성분으로 수면 지원 보충제 코셔 파르브 글루텐 무함유   카제인 무함유편안한 수면을 유도 취침 전 긴장 완화에 도움 불안감을 줄여줌 간헐적인 불면증 완화긴장을 완화하여 잠들 수 있도록 함 건강한 야간 수면에 도움레몬밤 Melissa officinalis  허브 시계꽃 Passiflora incarnata  허브 발레리안 Varleriana officinalis  뿌리,불면증
