effect,category
동종 요법 깨끗하게 제조된 실제 치료법 깊고 편안한 수면 상쾌한 기상 긴장 완화   달콤한 꿈 약물 습관성을 형성하지 않음   멜라토닌 무함유 유전자 변형 성분 무함유 프로젝트 인증 알레르기 유발 성분  염료 또는 파라벤 무함유 B  corp  인증 글루텐 무함유 인증 비건 인증 USDA 유기농 인증 SCS Global Services 유기농 인증유기농 동종 요법 혼합물 유기농 카나우바왁스 유기농 적합 바닐라 라벤더 향 유기농 덱스트로오스 유기농 말토덱스트린 유기농 쌀겨추출물,불면증
Pure Vegan 비건 인증 글루텐 무함유 유전자 변형 성분 무함유 크루얼티프리 보충제건강 루틴을 개선합니다  소화가 느리고 잘 안 되는 경우를 개선합니다  소화기관을 더 건강하고 편하게 해줍니다  간헐적인 변비를 해소합니다 ,불면증
높은 흡수율 보충제 근육 긴장 완화 뼈 생성 심혈관계 건강 증진 40회 제공량 식물성 글루텐 무함유 인공 색소 및 인공 향료 무함유 효능 및 품질 보증 미국 식품의약국 등록 시설에서 제조,불면증
1982년 설립 주요 브랜드보다 2 5배 높은 흡수율 유전자 변형 성분 무함유 프로젝트 인증 NSF 글루텐 무함유 인증 코셔 인증 보충제 100  비건 상품 인공 향료 또는 색소 무함유 B  corp  인증 버몬트에서 전하는 감사의 마음,불면증
스트레스 완화 및 정서 안정에 도움 긴장 완화 포뮬라 허브 보충제 정신  신체  가정을 위한 전반적인 웰니스 증진 최고의 순도 및 효능 1969년부터 과학에 기반한 고품질 상품 제공,불면증
210 mg Magnesium Per Serving Dietary Supplement Nutricost  Quality Guaranteed Vegetarian Product GMP Compliant Facility Non GMO Product Third Party Tested Gluten Free,불면증
수면 장애 및 과민함 완화 커피아 크루다 30C 동종 요법 의약품 낮 동안 졸음을 유발하지 않음 알려진 약물 상호 작용 없음 자연적인 방식으로 건강 증진 펠릿 총 240정 동종 요법 의약품의 세계적인 리더 인공 색소  향료  감미료 및 보존제 무함유과잉 정신활동 급속 사고 강박적 사고 걱정 또는 고민 수면 장애 완화 도움,불면증
건강한 수면 지원 식이보충제 Seditol,불면증
긴장 완화 효과 긍정적인 기분 증진 수면의 질 향상 유전자 변형 성분 무함유 보충제 채식주의자 비건에게 적합 아미노산 1968년 설립된 가족 소유 기업 우수 제조 및 품질 관리 기준 GMP  품질 보장,불면증
시계꽃 신경계 건강 증진 진정 및 휴식 USDA 유기농 인증 허브 보충제 시계꽃 액상추출물 글루텐 무함유 Organic Certifiers 유기농 인증,불면증
A Magnesium Supplement With Melatonin   L Theanine For a Good Night s Sleep With Other Natural Flavors Dietary Supplement Gluten Free ,불면증
1971년 설립 Target Mins        1 000mg  500mg  10mcg 400IU  1회 제공량당 비타민D 글루텐 무함유 인증 칼슘 흡수를 극대화하도록 구성 보충제 NSF 유전자 변형 성분 무함유 인증 B  corp  인증 코셔진정성 청결도 신선도 일관성 정확성,불면증
글루텐 무함유 보충제 Ultra Tested cGMP,불면증
,불면증
보충제 규칙적인 배변 촉진 심혈관계 건강 증진 근육 기능 글루텐 무함유 우유 카제인 무함유 인공 보존제 무함유 효능 및 품질 보증 FDA 등록 시설에서 제조,불면증
보충제의 과학 1회 제공량당 아연 30mg 1회 제공량당 마그네슘 450mg 1회 제공량당 비타민B6 10 5mg 미네랄 보충제 회복  근력  면역 기능 증진 보충제 BioPerine ,불면증
튼튼하고 건강한 뼈 캡슐당 200mg Simag  함유 미네랄 보충제 식물성 정신  신체  가정을 위한 전반적인 웰니스 증진 최고의 순도 및 효능 1969년부터 과학에 기반한 고품질 상품 제공,불면증
멜라토닌 무함유 어린이 수면 보조제 자연적인 방식으로 건강 증진 용해 펠릿 동종 요법 약품 자연스러운 수면 패턴 회복 동종 요법 의약품의 세계적 선두 주자뒤척이는 수면 간헐적 각성 짜증 악몽 나이트테러 쉽게 잠들지 못하는 어린이의 잠 드는 시간 단축,불면증
1 500 mg Equivalent Per Serving Dietary Supplement Nutricost  Quality Guaranteed Vegetarian Product GMP Compliant Facility Non GMO Product  Third Party Tested Gluten Free,불면증
Extra Strength  High Absorption  420 mg Promotes Nerve  Bone   Muscle Health Dietary Supplement Gluten Free Sugar Free Promotes a Healthy Nervous System Promotes Healthy Heart Support Vegan  Non GMO No Artificial Colors,불면증
프리미엄 포뮬라 제3기관 품질 검사 완료 상품 GMP   우수 제조 및 관리 기준 보충제신경 및 근육 기능에 도움이 됩니다  뼈 건강을 강화합니다  심혈관 건강을 강화합니다 ,불면증
Supports For Healthy Cardiovascular Function  Mood  and Relaxation Great Taste 300 mg Magnesium per 3 Gummies Certified Vegan Dietary Supplement 1gen  Non GMO Tested,불면증
허브 보충제 자연스러운 수면 지원 유전자 변형 성분 무함유   NSF 인증 여성 기업 글루텐 무함유편안하고 편안한 수면 사이클을 지원합니다  진정 작용을 하지 않으며 아침에 졸음이 오지 않습니다  멜라토닌  카바  발레리안은 전혀 함유하지 않았습니다  취침 전 또는 원치 않게 일어날 때 사용하십시오  글루텐 무함유 및 비건 상품입니다 ,불면증
글루텐 무함유 품질 검사 인증 순한 형태 뛰어난 흡수율 보충제 1회 제공량당 350mg Greatness by Nature  근육 강화 이완 및 뼈 건강 증진을 위한 필수 미네랄 효소 지원 효과,불면증
심장 건강 증진 보충제 식물성 글루텐 무함유,불면증
유전자 변형 성분 무함유 비건 글루텐 무함유 100  순도   효능 보장 2개월분 건강 보조 식품 RAW 인증 Clean 인증건강한 스트레스 반응 보조 신경 안정 및 건강한 수면 패턴 지원 꾸준한 에너지 생산에 도움 심장 건강   뼈 건강   건강한 혈당량 유지 쥐가 난 근육 이완 촉진,불면증
1932년 설립 이래 신뢰할 수 있는 품질 유지 하루 2정 긴장 완화 유전자 변형 성분 무함유 비건 글루텐 무함유 보충제,불면증
저자극성 글루텐 무함유 보충제 Ultra Tested cGMP,불면증
멜라토닌 무함유 수면 완화 자연적인 방식으로 건강 증진 동종 요법 약품 식물성 통증 완화제 용해 펠릿 펠릿 총 160개 동종 요법 의학의 세계적인 리더간헐적인 불면증 뒤척이는 수면 간헐적 각성신경과민 걱정,불면증
스트레스 완화 1회 제공량당 l 테아닌 200mg 함유 비건 상품 글루텐 무함유 유전자 변형 성분 무함유 프로젝트 인증,불면증
식물성 근육 긴장 및 스트레스 완화에 도움 쉬운 흡수 글루텐 무함유 인공 보존제  색소  향료 무함유,불면증
스트레스 완화 1회 제공량당 l 테아닌 200mg 함유 비건 상품 글루텐 무함유 유전자 변형 성분 무함유 프로젝트 인증,불면증
식물성 근육 긴장 및 스트레스 완화에 도움 쉬운 흡수 글루텐 무함유 인공 보존제  색소  향료 무함유,불면증
1987년 미국 서부 시간 기준  식물성 효능으로 수면을 유도 허브 보충제 Oregon Tilth 유기농 인증,불면증
글루텐 무함유 유전자 변형 성분 무함유 GMP 인증 100  최고 품질의 상품 보충제 보존제  대두 무함유  인공 색소  향미료  감미료 무함유라즈베리 맛의 맛있는 천연 마그네슘 구미젤리입니다  뒷맛이 불쾌하고 쉽게 흡수되지 않는 마그네슘 캡슐  정제 또는 알약은 피하십시오  대부분의 생체 이용 가능한 마그네슘 구미젤리   당사의 마그네슘 구미젤리는 근육 경련  신경계  수면 촉진 및 건강한 휴식을 촉진합니다 ,불면증
Alcohol Free Nervous System Calming   Relaxing USDA Organic Herbal Supplement Valerian Glycerite Promotes Relaxation   Restful Sleep Non GMO   Gluten Free Contains No Alcohol Fresh Herb Menstruum Ratio  1  1 25 Certified Organic by Organic Certifiers,불면증
저자극성 글루텐 무함유 보충제 Ultra Tested cGMP,불면증
보충제 각성제 무함유 복통을 유발하지 않음 삼키기 쉬움,불면증
인지 능력 및 두뇌 건강 증진 Magtein  Think Clearly  보충제 Paleo Foundation  Inc 의 Paleo 인증 Certified Open Source  전 성분 표시 미국의 우수 제조 및 품질 관리 기준 cGMP  인증 시설에서 제조,불면증
발효 비타민D 고대의 슈퍼 푸드 자양강장 허브 홍경천 추출물 중국전통법에서 영감받음 천연 식품 보충제 Dr  Axe 포뮬라 효소 활성 발효 허브효과적이고 효과적인 고품질 효소 활성 마그네슘 프로바이오틱 발효 비타민D3 홍경천 및 강황을 포함한 허브 추출물 강장 버섯  소뼈 육수  뉴질랜드 소의 간  자연산 생선 알 등을 포함한 고대의 슈퍼 푸드로 획기적인 마그네슘 보충제를 제공합니다 ,불면증
보충제 Albion  미네랄,불면증
가족 농장 1994년 설립 유기농 허브로 제조 편안한 수면에 도움 밸류 사이즈 유전자 변형 성분 무함유 인증  글루텐 무함유 Oregon Tilth 유기농 인증,불면증
,불면증
마그네슘 보충제 기타 천연 향미료 첨가 유전자 변형 성분 무함유 프로젝트 인증 글루텐 무함유,불면증
1967년 설립 보충제 Mason 보증   품질 검사 완료 cGMP 글루텐 무함유 대두 무함유 나트륨 무함유 신경계 및 심장 건강 증진에 도움,불면증
스트레스 완화 허브 보충제 정신  신체  가정을 위한 전반적인 웰니스 증진 최고의 순도 및 효능 1969년부터 과학에 기반한 고품질 상품 제공,불면증
마그네슘 보충제 유전자 변형 성분 무함유 프로젝트 인증 비건 상품 글루텐 무함유 R A W   인증 C L E A N   인증,불면증
1967년 설립 신경계 및 심장 건강 증진에 도움 보충제 대두 무함유 Mason 보증   품질 검사 완료 우수 제조 및 품질 관리 기준 cGMP    Five Star Certified,불면증
식품 재배 피타빌 미네랄로 강화 뼈 건강 증진 보충제,불면증
영양 보충제 기분 향상과 수면,불면증
전문가 등급 보충제 베스트셀링 브랜드 킬레이트 완충형 TRAACS   최적의 건강 지원 삼키기 쉬운 미니 캡슐 소화기 계통에 순하게 작용 100  천연 성분  충전제 또는 결합제 무함유 공인된 제3 기관 검사 완료 Albion Minerals  유전자 변형 성분 무함유 프로젝트 인증 60일치 복용량 보충제 우수한 품질 보증 안전  지식   품질   헌신   무결성   우수한 표준 Nutritional Supplements 의 우수한 표준 글루텐 무함유 성분 GMP   우수 제조 및 품질 관리 기준 품질 검사 완료   제3 기관 인증   순도 및 효능,불면증
30일치   분량 심장   에너지   기분   근육 보충제 유전자 변형 성분 무함유 프로젝트 인증 코셔 비건 인증 글루텐 무함유 cGMP 인증 제3기관 검사 완료 미국 1위 액상 마그네슘 브랜드 확실히 느껴지는 차이,불면증
1972년 설립 편안한 수면을 도움 풀 스펙트럼 허브 발레리안 차분하고 이완된 기분을 촉진 Holistically Balanced  보충제 비건 제품 글루텐 무함유 코셔 파르브 크루얼티프리 Leaping Bunny 인증,불면증
최적의 흡수 미네랄 보충제 수백 가지 생화학 반응에 관여하는 필수 미네랄 잘 흡수되는 공급원 뼈 건강  근육  신경 기능 유지 1969년부터 과학에 기반한 고품질 상품 제공,불면증
보충제 달걀 무함유 글루텐 무함유 견과류 무함유 유제품 무함유 GMP 준수 시설에서 제조,불면증
210 mg Magnesium Per Serving Dietary Supplement Quality Guaranteed   Nutricost   Vegetarian Product GMP Compliant Facility Non GMO Product Third Party Tested Gluten Free,불면증
근육 및 뼈 건강 미네랄 보충제,불면증
유전자 변형 성분 무함유 건강 보조 식품 흡수력 향상 실험실 검증 완료,불면증
멜라토닌 무함유 글루텐  밀  유제품 무함유 비건에게 적합 유전자 변형 성분 무함유 보충제하루를 상쾌하게 시작할 수 있도록 수면의 질 향상 긴장 완화 및 편안한 마음이 들도록 지원 빠르게 잠들고 숙면을 취하도록 지원 밤에 깨지 않는 휴식을 촉진 간헐적인 불면증 및 스트레스 완화를 위한 제품 멜라토닌 무함유 약물 성분 완전 무함유 습관성 약물 중독을 형성하지 않음,불면증
의사가 설계한 포뮬라 스트레스 | 수면 | 회복 유전자 변형 성분 무함유 프로젝트 인증 무가당 저칼로리 식품 아님 보충제 코셔 비건 인증 NSF 글루텐 무함유 인증 대두  글루텐  견과 무함유  스테비아 무함유 B  corp  인증스트레스 완화 뼈 건강 증진 심장 건강 증진 근육 강화 수면 보조제 소화 기능 보조,불면증
건강 보조 식품,불면증
보충제 코셔 파르브 글루텐 무함유,불면증
수면 보조제 허브 보충제 1969년부터 시작된 종합 웰니스 최고의 순도 및 효능 1969년부터 과학에 기반한 고품질 상품 제공,불면증
1967년 설립 신경계 및 심장 건강에 도움 보충제 글루텐 무함유 대두 무함유 채식주의자에게 적합 품질 검사 완료   Mason 보증 cGMP 인증   우수 제조 및 품질 관리 기준 인증,불면증
유전자 변형 없는 성분으로 제조 스트레스 완화  뼈 및 심장 건강 강화 보충제 비건 상품 글루텐 무함유 코셔 파르브 스트레스 완화  뼈 건강  심장 건강에 도움이 될 수 있음,불면증
허브 수면 보조제 진정 및 긴장 완화 GMP 유전자 변형 성분 무함유 보충제,불면증
룸 미스트 자연에서 영감을 받은 상품 자녀의 취침 일과를 통해 긴장을 완화하고 진정시키는 아로마 아기를 재울 때 방에 분사 인공 향료 무함유 파라벤 무함유 석유 성분 없음 소아과 전문의 추천 1위 면역력 지원 브랜드 제조라벤더와 카모마일로 만든 진정 효과가 있는 아로마는 자녀가 긴장을 풀고 취침 시간을 준비하는 데 도움이 됩니다  건강한 취침 루틴의 일부,불면증
100  천연 마그네슘 클로라이드   잔 당 90g 목욕  족욕 용 진정 및 이완 염로 무함유 동물 실험 하지 않음 향료 무함유 유전자 변형 성분 없음 비건 인증 미국 1위 미량 미네랄 브랜드  차이를 느껴보십시오,불면증
스위트 앤 스무스 유전자 변형 성분 무함유 비건 상품 유제품 무함유 글루텐 무함유 대두 무함유 무가당 MSG 무함유 유기농 아몬드 견과 버터 및 유기농 천연 바닐라 맛으로 제조 보충제 스트레스 감소 뼈 건강 항산화제   흡수,불면증
프리미엄 포뮬라 GMP   우수 제조 및 품질 관리 기준 상품 제3기관 품질 검사 완료 보충제에너지 생성 및 신진대사 증진 필수 신경  근육 및 심장 기능을 강화합니다  건강한 혈액 순환을 촉진합니다 ,불면증
심장   에너지   정서 천연 향료 보충제 미국 1위 미량 미네랄 브랜드  확실히 느껴지는 변화 보장 RCC 코셔 비건 인증 글루텐 무함유 cGMP 인증 제3기관 검사 완료 BPA 무함유,불면증
에클렉틱 허브 식물 영양소 최대 보존 보충제 증량제 무함유 천연 허브 무가공 천연 농축 미국에서 재배 글루텐 무함유 비건 제품 유전자 변형 성분 무함유 100  코셔,불면증
식품 보충제 ,불면증
긍정적인 기분 증진 긴장 완화 및 편안한 수면에 도움 유전자 변형 성분 무함유 보충제 채식주의자 비건에게 적합,불면증
1973년 설립 기업 순수 허브 함유 호흡기 건강 소화 보충제 품질 검사 완료 비건 건강한 삶 지원,불면증
수면 보조제 스트레스를 받을 때 숙면 지원 허브 보충제 B Corp   인증,불면증
마그네슘 보충제 유전자 변형 성분 무함유 프로젝트 인증 식물성 글루텐 무함유 R A W   인증 C L E A N   인증,불면증
보충제  신선한 발레리안 뿌리로 제조  우수 제조 및 품질 관리 기준 GMP  준수 글루텐 무함유 유전자 변형 성분 무함유,불면증
Established 1971 With Other Target Mins  Chelates  Certified Gluten Free May Support Cardiovascular Health Helps Relax Muscles Supports Bone Health Dietary Supplement Certified B Corporation KosherAuthenticity Cleanliness Freshness Consistency Accuracy,불면증
1972년 설립 100  비건 상품 홍조류 및 해수 성분 시원하고 청정한 자연 그대로의 아이슬란드 북극 해역 100  해양 성분 미량 미네랄 72종 지속 가능한 방식으로 채취 1회 제공량당 초고농축물 500mg 함유 Discover Marine Minerals    Trust the Difference     글루텐 무함유 보충제 Holistically Balanced 크루얼티 프리 NO 동물실험,불면증
식이보충제 비건 제품 코셔 파브 인증제품 글루텐 프리,불면증
Sugar Free 350 mg Per Serving Stress Relief Regularity Relax Sleep Heart Energy Mood Naturally Flavored Dietary Supplement  1 America s Liquid Magnesium Brand  Feel The Difference Gluten Free Sugar Free Certified Vegan 3rd Party Tested  cGMP Certified BPA FreeSupports a healthy and restful night s sleep  Promotes a calm mood  healthy metabolism  energy  digestion  and immunity  Supports muscle  heart  bone  cell  nerve  and enzyme function  lonic Trace Minerals help body mineral balance Research shows 68  of American diets are deficient  2nd most plentiful ion in cells  Involved in 600  biochemical reactions  60  is found in the bones   teeth  40  is found in muscles  tissues  and fluids ,불면증
경제적인 크기 100  마그네슘시트레이트 형태   보충제 시트레이트 형태로 흡수력 강화  USP 인증 보충제,불면증
하루 2정 1932년 설립 뼈 건강 증진 유전자 변형 성분 무함유 글루텐 무함유 PCR 용기 보충제,불면증
1회 제공량당 멜라토닌 10mg 함유 레몬밤  식물 성분 및 비타민D 보충제 중독성 약물 무함유 글루텐 무함유 유전자 변형 성분 무함유 젤라틴 무함유 비건,불면증
Muscle Relaxation  Restful Sleep  Nerves  Bones  Heart Powered by Concentrace  Dietary Supplement Gluten Free Certified Vegan cGMP Certified 3rd Party Tested  BPA Free America s 1 Liquid Magnesium Brand  Feel The Difference GuaranteeSupports the cardiovascular system  bones  and nerves Promotes muscle relaxation  a calm mood  and restful sleep Supports a healthy liver and intestinal tract,불면증
1971년 설립 실리카 첨가 글루텐 불포함 근육 이완을 돕습니다 건강한 면역체계를 지원합니다 적절한 칼슘 활용에 필수 영양 보충제 코셔고유성 깨끗함 신선함 일관성 정확성,불면증
1971년 설립 글루텐 무함유 인증 보충제 B  corp  인증일상적인 스트레스를 해소하십시오  마음을 편안하게 하십시오  불면증 완화  피로감 감소 ,불면증
스트레스 완화 기타 천연 향료 함유 1회 제공량당 l 테아닌 200mg 함유 식물성 글루텐 무함유 유전자 변형 성분 무함유 프로젝트 인증,불면증
수면 보조제 허브 포뮬라 허브 보충제 휴식 및 회복성 수면 강화 긍정적인 기분과 건강한 수면 주기 조절에 도움 건강하고 깊은 수면 유도 1969년부터 과학에 기반한 고품질 상품 제공,불면증
시더우드  라벤더  스위트 마조람 및 클라리세이지의 유기농 혼합물 함유 NO 동물실험,불면증
250 mg   플라보노이드 3 5 4  표준화된 식물성 보조제 최대 효능 보장 처방약 품질 글루텐 없음 저자극성 제품,불면증
1973년 설립 아이소비텍신 3 5  허브 보충제 보충제 품질 검사 완료 비건 제품 1973년부터 건강한 삶 지원,불면증
심장 및 뼈 건강을 위한 필수 미네랄 근육 및 신경 기능 강화 높은 흡수율 유전자 변형 성분 무함유 비건 글루텐 무함유 알레르기 유발 성분 무함유 보충제,불면증
Clinically Tested Sustained Release Technology America s  1 Time Released Magnesium Supplement  8 Hours It s Fun to Feel Good  Relief From Occasional Leg Cramps and Muscle Tension Be Sure It s CL Approved   Approved Quality Magnesium   Consumer Lab  Non GMO No Gluten Vegan Physician Approved Label Claim Verified Magnesium Supplement ,불면증
흡수율이 높은 마그네슘 보충제 의사 전용 글루텐 무함유 인증 유전자 변형 성분 무함유 및 채식주의자에게 적합아미노산에서 사용하는 것과 유사한 메커니즘을 사용하고 일반적인 미네랄 이온 흡수와 다른 메커니즘을 통해 흡수됩니다  위의 산성도에 따라 흡수되지 마십시오  마그네슘의 장 내성을 개선합니다 ,불면증
멜라토닌 무함유 포뮬라 신진대사 촉진 및 수면 지원 30회 제공량 보충제 cGMP 인증 운동 능력이 뛰어난 분들을 위한 고효능 상품,불면증
마음과 신체 포뮬라 1회 제공량당 마그네슘 330mg 코셔 유제품 글루텐 무함유 비건 상품 유전자 변형 성분 무함유 유제품  대두 무함유 인공 색소 무함유 인공 감미료 무함유 젤라틴 무함유진정 및 긴장 완화 효과 스트레스 완화 긍정적인 기분 기타 천연 향료 첨가 보충제,불면증
건강한 혈압 수치 유지 심장 건강 증진 순환 천연 향료 보충제 글루텐 무함유 비건 인증 cGMP 인증 제3기관 검사 완료 BPA 무함유 미국 1위 미량 미네랄 브랜드 확실히 느껴지는 변화 보장이미 건강한 범위에 있는 혈압 수치 유지 심혈관 및 순환계 건강 지원 심장에 좋은 마그네슘 제공 미네랄 균형을 위한 미량 미네랄 함유 향긋한 향 ,불면증
1971년 설립 멜라토닌 및 프로바이오틱 무함유 장내 마이크로바이옴 건강 개선 긴장 완화 더 빠른 수면 유도 보충제 임상 연구 완료 성분 EpiCor  글루텐 무함유 인증 B  corp  인증 코셔 파르브진정성 청결도 신선도 일관성 정확성EpiCor  건조효모발효물은 소화 및 면역 건강 유지를 돕습니다   특허받은 생체 활성 펩타이드로서 유럽에서 널리 사용되고 있는 Lactium 은 스트레스를 줄여 더 빨리  더 오래 잘 수 있도록 돕습니다  총 수면 시간을 10  늘립니다  잠이 들 때까지 걸리는 시간을 54  단축합니다  전반적인 수면의 질을 개선합니다 ,불면증
자연에서 영감을 받은 상품 취침 전 자녀의 긴장을 완화하는 효과 중독성 약물 무함유 멜라토닌 무함유 기타 천연 향료 함유 천연 꿀 원료 보충제 알레르기 유발 성분 무함유 약물 무함유 액상과당 무함유 인공 감미료  향료 무함유 젤라틴 무함유,불면증
유전자 변형 성분 무함유 제약 등급 자유 형태 아미노산 보충제 AJIPURE 아미노산 비건 코셔 파르브 글루텐 무함유,불면증
뿌리 및 뿌리줄기 신경계 진정 및 이완 USDA Organic 미국 농무부 유기농 인증  허브 보조제 생 허브   용제 비율  1 1 25 Certified Organic by Organic Certifiers Organic Certifiers 유기농 인증  글루텐 무함유,불면증
시계꽃 유럽산 홀 스펙트럼 추출물 비건 유전자 변형 무함유 성분으로 제조 글루텐 무함유 보충제 우수 제조 및 품질 관리 기준 GMP  품질 보증   FDA 등록 Enhancing Nature s Miracles Since 1994,불면증
임상 검증된 AmlaMax    NSK SD40  심장 건강에 도움 혈압 혈류 염증 반응 지원 보충제 글루텐 무함유,불면증
1932년 설립 이래 신뢰할 수 있는 품질 유지 마그네슘시트레이트   해양 콜라겐 유전자 변형 성분 무함유 보충제 무설탕 글루텐 무함유,불면증
It s Fun to Feel Good Ultra Pure Magnesium Lotion Apply After Exercising Free of Harmful Ingredients No Parabens No Phenoxyethanol,불면증
350 mg Per Serving Stress Relief Regularity Relax Sleep Heart Energy Mood Naturally Flavored Dietary Supplement America s  1 Liquid Magnesium Brand  Feel the Difference Guarantee BPA Free Gluten Free Certified Vegan Non GMO cGMP Certified 3rd Party Tested,불면증
1973년 설립 허브 보충제 보충제 유전자 변형 성분 무함유 프로젝트 인증 품질 검사 완료 비건 건강한 삶 지원,불면증
보충제 면역계 강화,불면증
에너지 증진 미네랄 보충제 세포 에너지 생성을 위한 필수 영양소 체내 수백 가지 효소 과정 지원 1969년부터 과학에 기반한 고품질 상품 제공,불면증
1973년 설립 발레르산 0 8   수면 건강 증진 보충제 품질 검사 완료 비건 건강한 삶 지원,불면증
흡수율이 높은 마그네슘 보충제 의사 전용 식물성 유전자 변형 성분 무함유 글루텐 무함유 인증아미노산에서 사용하는 것과 유사한 메커니즘을 사용하고 일반적인 미네랄 이온 흡수와 다른 메커니즘을 통해 흡수됩니다  위의 산성도에 따라 흡수되지 마십시오  마그네슘에 대한 장 내성을 개선합니다 ,불면증
