effect,category
California Gold Nutrition 초유 USDA A 등급 소에서 채취한 소 초유 농축물 항생제   유전자 재조합 소 성장호르몬  무함유 면역 건강 증진 가능  IgG 20  로 표준화 유전자 변형 성분 무함유 지질 코팅된 베지 캡슐 글루텐  유전자 변형 성분  대두 무함유 cGMP 인증 시설에서 생산 100  골드 개런티 Gold Guarantee ,계절성 알레르기
California Gold Nutrition 단백질 분해 효소 지연 방출 베지 캡슐에 담은 브로드 스펙트럼 효소 혼합물 과일에서 추출한 소화 효소 혼합물 및 판크레아틴 대체 혼합물 함유 점액질 분해 도움  면역계 건강 증진  항염 작용 도움  채식주의자에게 적합 유전자 변형 성분 무함유 우수 제조 및 품질 관리 기준 cGMP  인증 시설에서 생산 100  골드 개런티 Gold Guarantee ,계절성 알레르기
유전자 변형 성분 무함유 효소 전문가 필수 소화 촉진 효소 판매 1위 브랜드 필수 효소 포뮬라 소화를 돕는 기능 삼키기 쉬운 캡슐 보충제 비건 및 코셔 파르브 증량제 무함유,계절성 알레르기
소화 건강 증진 지방  탄수화물 및 단백질 분해 촉진 영양소 가용성 최적화 보충제 프로바이오틱  효소  소화 촉진 1968년 설립된 가족 기업 우수 제조 및 품질 관리 기준 GMP  품질 보증,계절성 알레르기
소화 건강 증진 지방  탄수화물  단백질 분해 촉진 영양소 이용률 최적화 보충제 소화 촉진 1968년 설립된 가족 기업 우수 제조 및 품질 관리 기준 GMP  품질 보증,계절성 알레르기
유전자 변형 성분 무함유 효소 전문 브랜드 필수 소화 촉진 판매 1위의 효소 브랜드 소화를 돕는 기능 삼키기 쉬운 캡슐 보충제 비건 상품 및 코셔 인증 증량제 무함유 코셔 파르브AHA   Autism Home Alliance Vitamin Angels   자랑스러운 서포터 그린 마운틴 에너지,계절성 알레르기
건강 보조 식품 건강한 소화 채식주의자 비건에 적합 순도   효능 보장,계절성 알레르기
면역계 강화 지원 높은 항산화제 함량 뛰어난 맛 설탕 무함유 인공향료 무함유 과학적으로 검사 완료 보충제 채식주의자와 비건에게 적합 4세 이상 어린이에게 적합 글루텐  효모  계란 및 유당 무함유 보존제 무함유,계절성 알레르기
Science Based Nutrition  소화 건강 증진 보충제 유전자 변형 성분 무함유   글루텐 무함유   식물성,계절성 알레르기
소화 기능 보조 보충제 글루텐 무함유 Guaranteed Quality Laboratory Tested 품질 보증 연구소 검사 완료 ,계절성 알레르기
100  천연 부비강 케어 계절성 부비강 문제 해결 중독성 약물 무함유 미국 판매 1위 제품 천연 비강 케어 100  천연 성분 자일리톨로 제조 호흡을 편안하게 세정  진정  보호 작용 BPA 무함유 유전자 변형 성분 무함유부비강 및 비강을 부드럽게 세척하고 보습하며 진정시킵니다  오염물질  자극 요인   부유 중인 오염원을 씻어 내립니다  수분을 공급하여 건조한 공기를 완화합니다 전두동 사골동 접형동 상악동,계절성 알레르기
건강한 면역 기능 천연 원료 면역글로불린 및 락토페린 유전자 변형 성분 무함유 보충제 코셔 유제품 일반 건강 1968년에 설립된 가족 기업 우수 제조 및 품질 관리 기준 GMP  품질 보증,계절성 알레르기
영아에게 안전 자일리톨 함유 천연 식염수 미국 판매 1위 코막힘 방지  코 세정 및 보호 완화를 위해 매일 사용 가능 공기 흐름 35  증가 BPA 무함유 유전자 변형 성분 무함유 프로젝트 인증 코셔코막힘 완화 부드러운 세정  진정 및 보습 효과 오염원 및 자극 물질을 씻어내림,계절성 알레르기
Science Based Nutrition  건강한 소화와 편안한 관절을 지원 보충제 비건 유전자 변형 성분 무함유  글루텐 무함유,계절성 알레르기
부비강 자몽씨 추출물이 함유된 비강 윤활제 빠르고   효과적인 중독성 약물 무함유 비의료용 Measured Dose 건조증 완화에 도움 비강 자극물을 씻어내며 보습작용 무첨가 모든 계절에 도움 무함유 성분  글루텐   GMOs 비건 NO 동물 실험,계절성 알레르기
유전자 변형 성분 무함유 효소 전문가 필수 소화 촉진 효소 판매 1위 브랜드 필수 효소 포뮬라 소화를 돕는 기능 삼키기 쉬운 캡슐 보충제 비건   코셔,계절성 알레르기
1969년 설립 글루텐 무함유 젤라틴 무함유 보충제 펙틴으로 제조 인공색소 무함유 어린이를 위해 특별히 고안된 포뮬라 면역 기능 지원 비타민C와 아연으로 제조되어 건강한 면역 기능 지원 BioActives  플라보노이드 로 표준화된 블랙 엘더베리 추출물   전통적으로 면역 지원에 사용 뛰어난 맛,계절성 알레르기
보충제 만 2세 이상 과학적으로 검사 완료 면역력 강화 풍부한 항산화제 함유 코셔  Beth Din De Paris의 수석 랍비가 감독함 면역계 증진 바이러스 학자가 개발 과학적으로 검사 완료 맛있는 시럽 엘더베리의 영양을 함유한 자연스러운 맛과 향,계절성 알레르기
만 2세   이상 글루텐 무함유 과학적으로 검사 완료 면역력 증진 항산화제 풍부 보충제 면역계 강화 바이러스 학자가 개발 맛있는 시럽 엘더베리의 영양을 함유한 자연스러운 맛과 향 코셔  Beth Din De Paris의 수석 랍비가 감독함,계절성 알레르기
보충제 9 000FCC ALU  유당 불내증이 있는 분을 위한 제품 유제품 소화 보조 순도 및 효능 보장,계절성 알레르기
위장 지원 BioCore DPP IV 글루텐  시리얼 곡물 소화 지원 보충제 채식주의자   비건에게 적합 프로바이오틱 효소 소화제 1968년 설립된 가족 기업 우수 제조 및 품질 관리 기준 GMP  품질 보증,계절성 알레르기
Dr  Mehta  제조 진정용 비강 세척 소금 의사 추천 브랜드 1위  Large Volume   Low Pressure  비강 세척 소금  보습 및 코 청결 등장성 1팩  또는 고장성 2팩 이상  보존제 무함유 100  천연 성분 비강 진정제사용하기 쉽고 편안하며 부드럽게 흐르는 비강 세척 식염수로 이용 타는 듯하고 찌르는 느낌 없이 부드럽게 작용 졸림을 유발하지 않는 제품 비강 스프레이 분사 전 세척에 탁월 부비동 수술 이후나 임신 중 사용하기에 적합하지만 걱정이 될 경우 의사와 상의할 것 pH 균형 및 등장성으로 사용 시 팩 1개 사용  고장성으로 사용 시 팩 2개 사용 USP 등급 소듐클로라이드 및 소듐바이카보네이트 함유 순도 99  이상  중독성 약물 및 보존제 무함유 등장성 또는 고장성 2팩 이상의 경우 USP 등급의 100팩 순도 99  이상  소듐클로라이드 및 소듐바이카보네이트 혼합물 pH 균형  등장성  보존제 무함유  100팩 용량 24 000ml 800fl oz   사용법 및 경고를 포함한 안내용 책자 포함코 알레르기  건조증  알레르기성 비염 부비강 압박감  코막힘 독감 및 감기로 인한 비강 증상 업무 환경 및 집 먼지  매연  동물털  풀  꽃가루  연기 등에 의한 비강 자극 후비루 증후군 및 코막힘,계절성 알레르기
성인 및 어린이용 면역 강화 엘더베리 농축물  아연  비타민 C 함유 무설탕  저칼로리 보충제 채식주의자 비건에게 적합 식물성 허브 1968년 설립한 가족 기업 GMP 품질 보증,계절성 알레르기
자연적인 소화기 건강 및 웰빙 프로바이오틱이 함유된 필수 효소 전반적인 소화기 건강 증진 하루 복용량당 7억 5천만 마리 활성 배양균  NSF 유전자 변형 성분 무함유 인증 보충제 채식주의자에게 적합 증량제 무함유,계절성 알레르기
천연 단백질 분해 효소 2 400GDU g 소화 건강 증진 관절 건강 보충제 채식주의자 비건에 적합 프로바이오틱스 효소 소화 1968년 설립된 가족 기업 우수 제조 및 품질 관리 기준 GMP  품질 보증,계절성 알레르기
글루텐 무함유 유전자 변형 성분 무함유 LE 인증 최적의 소화 촉진 보충제특히 식물성 식단을 섭취하는 사람을 위해 최적의 소화를 촉진합니다  섭취한 음식에서 몸이 영양분을 흡수하도록 도와줍니다  10가지 효소 혼합물은 식물성 식품과 단백질  지방 및 탄수화물을 표적으로 삼습니다  글루텐 무함유  채식 및 유전자 변형 성분 무함유 포뮬라,계절성 알레르기
면역력 강화 1회 제공량당 엘더베리 3 200mg으로 제조 비타민C 아연 보충제 젤라틴 무함유 펙틴으로 제조 인공 색소 무함유 식물성 글루텐 무함유 전 세계에서 고품질의 원료 확보,계절성 알레르기
판매 1 위의 효소 브랜드 씹어서 섭취 가능 천연 가당 슈가 프리 자일리톨 소화와 영양 흡수를 부드럽게 지원 유전자 변형 성분 없음 비건 제품 건강 보조 식품  증량제를 첨가하지 않음,계절성 알레르기
효소 판매 1위 브랜드 츄어블 설탕 무함유 천연 감미료인 자일리톨 첨가 순한 소화 및 영양소 흡수 촉진 효과 유전자 변형 성분 무함유 비건 보충제 인공 충전제 또는 감미료 무함유,계절성 알레르기
California Gold Nutrition 소화 효소 브로드 스펙트럼 소화 효소 ProHydrolase  프로테아제 효소 혼합물  고유 효소 혼합물 및 아밀라아제 혼합물 함유 소화기 건강에 도움  채식주의자에게 적합 유전자 변형 성분 무함유 우수 제조 및 품질 관리 기준 cGMP  인증 시설에서 생산 100  골드 개런티 Gold Guarantee ,계절성 알레르기
자연스러운 소화기 건강   웰니스 빠른 효과 간헐적 속 쓰림   소화 불량 완화 단백질 분해를 위한 순한 비건 효소 함유 소화 불량을 완화하는 선인장 열매와 올리브 잎추출물 유전자 변형 성분 무함유 비건 보충제선인장 열매와 올리브 잎추출물로 제조된 mucosave  혼합물은 위벽을 보호하고 불편함을 진정시키는 보호막을 제공합니다  적절한 양의 단백질 분해 효소가 부드러운 효력을 발휘하여 소화 과정을 신속하게 마무리합니다  위산 수치가 낮은 분들의 위장 산도를 최적화합니다  위산 수치가 낮거나 느린 소화계를 가진 분들의 소화 과정을 가속합니다 식사 후 간헐적인 복부 팽만  트림  가스 간헐적인 속 쓰림  소화 불량  설사 또는 변비,계절성 알레르기
California Gold Nutrition 초유 유전자 변형 성분 무함유 지질 코팅으로 된 농축 소 초유 보충제 천연 유래 IgG 면역글로불린 G1 및 G2  함유 면역 건강 증진 가능  항생제 무함유 품질 검사 확인 USDA A등급 젖소에서 착유 유전자 재조합 소 성장호르몬 무함유  글루텐  유전자 변형 성분 및 대두 무함유 cGMP 인증 시설에서 생산 100  골드 개런티 Gold Guarantee ,계절성 알레르기
Science Based Nutrition  보충제 건강한 심혈관 기능 유지에 도움을 주는 효소 1회 제공량당 룸브로키나제 단위 720 000,계절성 알레르기
맛있습니다  글루텐 무함유 면역력 증진 젤라틴 무함유 식물성 건강 보조 식품 면역 체계 보조 매일 섭취하면 효과가 가장 좋음 누구나 좋아하는 천연 베리 향,계절성 알레르기
채식주의자에 적합 젤라틴 무함유 글루텐 무함유 보충제 자연스럽고 좋은 맛,계절성 알레르기
오리지널 포뮬라 목 캔디   비타민C   아연 따끔거리는 목 진정 과학적으로 검사 완료 면역력 지원 풍부한 항산화제 부드럽고 쫄깃한 식감 보충제 채식주의자에게 적합,계절성 알레르기
EnzymeActive  유제품 소화 지원 보충제,계절성 알레르기
글루텐 무함유 매일 1정 유전자 변형 성분 무함유 LE 인증 건강한 면역계 지원 보충제면역계 건강 강화 프로바이오틱스 박테리아 성장 촉진 눈 건강 지원,계절성 알레르기
유전자 변형 성분 무함유 자연적인 소화기 건강과 웰니스 지원 소화제 가장 향상된 효소 포뮬라 효소 판매 브랜드 1위 최적화된 소화 기능 지원 미국 소화 효소 판매 1위   보충제 비건   코셔 증량제 무함유 코셔 파르브,계절성 알레르기
면역계 강화 다당류 70 로 표준화 건강한 면역 세포 기능 증진 보충제 채식주의자 비건에게 적합 식물 허브 1968년 설립된 가족 기업 GMP 인증,계절성 알레르기
감기 및 독감 징후가 보이는 즉시 복용 동종 요법코막힘 콧물 인후염 기침 재채기 오한 및 열온 가족 사용 가능  알려진 약물 상호 작용 없음 알려진 부작용 없음 졸음을 유발하지 않음 약물에 대한 습관성을 형성하지 않음 빠른 감기 및 독감 증상 완화 천연엘더베리 및 아연 함유 특별한 동종요법 포뮬라 물 없이도 입 안에서 빠르게 녹음 탁월한 맛감기 및 독감 증상을 일시적으로 완화합니다  재채기  콧물  코막힘  경미한 목 통증 및 두통 등 호흡기 증상에 일시적 완화 효과를 제공합니다  독감으로 인한 열과 오한  몸살 증상도 일시적으로 완화합니다 ,계절성 알레르기
면역력 지원에 도움이 되는 아연 및 비타민C 함유 인공색소   인공향미료   젤라틴 무함유 보충제 만 2세 이상 아동용,계절성 알레르기
보충제 유기농 발효 식물 혼합물 유기농 발효 소화 혼합물 유전자 변형 성분 무함유 cGMP 인증,계절성 알레르기
소화 건강 증진 지방  탄수화물   단백질 분해 영양소 이용률 최적화 삼키기 쉬운 정제 보충제 1968년 설립된 가족 기업 우수 제조 및 품질 관리 기준 GMP  품질 보증,계절성 알레르기
보충제 소화 기능 보조 에너지 생성 지연 방출췌장 프로테아제  아밀라아제  리파아제로 만든 고활성 효소 혼합물인 췌장 리파아제가 함유되어 담낭 제거 후 소화기 건강을 지원하고 간헐적인 팽만감  가스  장 불편함을 완화합니다  옥스 바일로 과학적으로 조제하여 담즙과 효소 손실을 보상해 주고 소화기관을 통한 적절한 이동을 자극합니다  가공식품과 조리 식품에 빠져 있는 ATP 즉 아데노신 5  트라이포스페이트가 함유되어 소화 과정을 시작하는 데 도움을 줍니다 ,계절성 알레르기
HistaStop  포함 동종요법 히스타민   퀘르세틴 안전하고   효과적인 포뮬라 다음 증상의 완화  재채기 콧물 코막힘 눈 가려움증   눈물 동종요법,계절성 알레르기
면역계 강화 아답토젠 허브 유전자 변형 성분 무함유 보충제 채식주의자 비건에게 적합 식물성 허브 1968년 설립된 가족 기업 우수 제조 및 품질 관리 기준 GMP  품질 보증,계절성 알레르기
자연적인 소화기 건강 및 웰니스 완벽한 면역계 지원 NSF 유전자 변형 성분 무함유 인증 완벽한 면역계 지원 면역계  호흡계  부비강 건강에 도움 과도하거나 진한 콧물을 완화 기도를 강화하고 깨끗하게 하는 효과 보충제 비건 및 코셔 증량제 무함유,계절성 알레르기
1969년 설립 전통적인 면역 지원 Tru ID  정품 인증 유전자 변형 성분 무함유 프로젝트 인증 1회 제공량당 1 150mg 보충제 비건,계절성 알레르기
최적 흡수를 위한 장용 코팅 보충제 유전자 변형 성분 무함유 LE 인증,계절성 알레르기
2400 GDU g   500 mg 천연 단백질 분해 효소 건강한 소화 지원 관절을 편안하게 건강 보조 식품 채식주의   완전 채식 비건 용으로 적합 프로바이오틱스 효소 소화제 1968년부터 가족 소유 GMP 품질 보증,계절성 알레르기
소화 건강 증진 지방  탄수화물  단백질 분해 촉진 영양소 이용률 최적화 삼키기 쉬운 정제 보충제 프로바이오틱 효소 소화 1968년 설립된 가족 기업 우수 제조 및 품질 관리 기준 GMP  품질 보증,계절성 알레르기
글루텐 무함유 맛있는 시럽 과학적으로 검사 완료 면역력 증진 항산화제 풍부 보충제 면역계 강화 바이러스 학자가 개발 엘더베리의 영양을 함유한 자연스러운 맛과 향 매일 복용 시 최대 효과 코셔 인증  Basel Kosher Commission에서 감독,계절성 알레르기
비타민 C 및 아연 함유 엘더베리 1 7 g에 해당하는 양 함유 면역력 증진 식물성 글루텐 없음 건강 보조 식품 면역 체계 보조 매일 섭취하면 효과가 가장 좋음 누구나 좋아하는 천연 베리 향,계절성 알레르기
소화 건강 증진 락타아제  프로테아제  파파인 및 브로멜라인 첨가 유전자 변형 성분 무함유 보충제 채식주의자 비건에 적합 코셔 소화제 1968년에 설립된 가족 기업 우수 제조 및 품질 관리 기준 GMP  품질 보증,계절성 알레르기
감기 및 독감 징후가 보이는 즉시 복용 동종요법코막힘 콧물 인후통 기침 재채기 오한   열온 가족 사용 가능  알려진 약물 상호 작용 없음 알려진 부작용 없음 졸음을 유발하지 않음 약물에 대한 습관성을 형성하지 않음 빠른 감기   독감 증상 완화 천연 엘더베리   아연 함유 특별한 동종요법 구성 성분 물 없이도 입 안에서 빠르게 녹음 탁월한 맛감기 및 독감 증상을 일시적으로 완화 재채기  콧물  코막힘  가벼운 인후통 및 두통 등 호흡기 증상에 일시적 완화 효과 독감으로 인한 열과 오한  몸살 증상도 일시적으로 완화,계절성 알레르기
자연적인 소화 건강과 웰니스 지원 NSF 유전자 변형 성분 무함유 인증 보충제 비건 및 코셔 빠른 효과 코셔 파르브 가스 유발 음식의 소화에 도움을 주는 제품 간헐적인 복부 팽만감 및 불편감 해소가스 복부 팽만 불편함,계절성 알레르기
글루텐 무함유 유전자 변형 성분 무함유 LE 인증 최적의 소화 및 GI 균형 촉진 보충제최고의 포뮬라가 효소와 프로바이오틱스 균주를 결합합니다  특히 식물성 식단을 섭취하는 사람을 위해 최적의 소화를 촉진합니다  섭취한 음식에서 몸이 영양분을 흡수하도록 도와줍니다  10가지 효소 혼합물은 식물성 식품과 단백질  지방 및 탄수화물을 표적으로 삼습니다  글루텐 무함유  채식 및 유전자 변형 성분 무함유 포뮬라식물 유래 탄수화물 및 전분 알파 갈락토시다아제는 탄수화물 소화를 촉진하며  복부 팽만감과 불편함을 유발하는 것으로 알려진 콩과 식물 콩  및 콜리플라워  브로콜리  양배추 및 기타 십지화과 채소 식품에서 발견되는 올리고당을 분해하여 위장관의 편안함을 지원합니다  식이섬유 헤미셀룰라아제  자일라나아제 및 펙티나아제는 식물 세포 성분을 분해하여 최적의 소화와 영양소 흡수를 촉진합니다  단백질 프로테아제 3 0은 위와 같은 산성 pH에서 단백질을 소화하는 데 도움이 됩니다  이 효소는 소화하기 어려운 단백질을 분해하고 글리아딘 밀에서 발견되는 화합물 의 소화를 촉진합니다  프로테아제 SP는 대부분의 가용성 단백질을 더 작은 분자량의 펩타이드와 자유형 아미노산으로 분해하는 데 도움이 됩니다  지방 리파아제는 지방을 분해하는 데 도움이 되는 효소입니다  유제품 락타아제는 유제품의 젖당을 소화하는 데 필수적입니다 ,계절성 알레르기
Dr  Houston의 생화학적 효소 포뮬라 글루텐  카세인  단백질  탄수화물  유당  폴리페놀  지방의 소화 보조 간헐적인 가스 및 복부 팽만 완화 보충제 효소 전문 생화학자인 데빈 휴스턴 박사가 개발한 TriEnza 순 식물성 효소 분야의 권위자,계절성 알레르기
Nature s First Immune Defense 어린이에게도 적합 IgG 항체 25  건강한 면역 반응 강화 위장관 건강 증진 글루텐 무함유 건강 보조 식품 순도 품질 보증,계절성 알레르기
유전자 변형 성분 무함유 소화 촉진 판매 1위 효소 브랜드 보충제 비건 및 코셔 소화 기능 지원 강화 Digest Basic  대비 효소 효능 두 배 완전한 포뮬라 충전제 무함유 코셔 파르브,계절성 알레르기
California Gold Nutrition 브로멜라인 파인애플 열매 및 줄기 추출물로 제조 1g당 2 400GDU 젤라틴 소화 단위  소화와 관절 건강에 도움  채식주의자와 비건에게 적합 글루텐  유전자 변형 성분  대두 무함유 100  골드 개런티,계절성 알레르기
심장에 안전한 상품 각성제 무함유 유전자 변형 성분 무함유   100  천연 상품 보충제 비강 및 부비강 건강 지원 체내 본연의 면역 기능 증진 글루텐 무함유,계절성 알레르기
Science Based Nutrition  글루텐 단백질의 건강한 소화를 지원 식물성   유전자 변형 성분 무함유   글루텐 무함유 보충제소화기 건강을 증진하는 데 도움이 됩니다  밀  보리 및 호밀 곡물이 함유된 음식의 정상적인 소화를 지원합니다  글루텐 단백질에 대한 적절한 면역 반응을 촉진합니다 ,계절성 알레르기
보충제 파인애플 효소 건강한 소화 순도 및 효능 보장,계절성 알레르기
유전자 변형 성분 무함유 효소 전문가 완전한 포뮬라 소화 촉진 효소 판매 1위 브랜드 소화 기능 지원 강화 Digest Basic  대비 두 배의 효소 효능 보충제 비건   코셔 충전제 무함유,계절성 알레르기
유제품 내성 효소 유당  유제품 단백질 및 지방을 소화합니다  유제품 소화 극대화 보충제 채식주의자 비건에게 적합 코셔 GMP 품질 보증 프로바이오틱스 효소 소화 1968년에 설립된 가족 소유 기업,계절성 알레르기
유전자 변형 성분 무함유 효소 전문가 가장 향상된 효소 포뮬라 최적화된 소화 기능 지원 판매 1위 효소 브랜드  보충제 비건 및 코셔 증량제 무함유,계절성 알레르기
글루텐 무함유 맛있는 시럽 과학적으로 검사 완료 면역력 증진 항산화제 풍부 보충제 면역계 증진 바이러스 학자가 개발 엘더베리의 영양을 함유한 자연스러운 맛과 향 매일 복용 시 최대 효과 코셔 인증  Beth Din De Paris의 수석 랍비가 감독함,계절성 알레르기
자연의 1차 면역 방어선 25  IgG 항체 보장 건강한 면역 반응 강화 위장관 건강 증진 글루텐 무함유 보충제 품질 순도 보증 면역 인자,계절성 알레르기
보충제 프로바이오틱 혼합물 함유 미생물 성분 효소로 소화 건강 증진단백질  지방  유제품 및 탄수화물의 소화에 도움 속쓰림  복부 팽만 및 가스 완화에 도움 노화와 관련된 효소 손실을 보충하는 데 도움,계절성 알레르기
보충제 파인애플 효소,계절성 알레르기
1969년 설립 전통의 힘 TRU ID  진품 인증 유전자 변형 성분 무함유 프로젝트 인증 1회 제공량당 1 410mg 보충제 비건,계절성 알레르기
면역력 강화 비타민E 천연 공급원 색소 향료 무함유 인공 감미료 무함유 단 5가지 성분만 함유 보충제 경구용 액제 면역계 강화 바이러스 학자가 개발 과학적 검증 완료 엘더베리의 영양을 함유한 자연스러운 맛과 향,계절성 알레르기
소화 건강 증진 음식의 영양학적 가치를 최적화 풀 스펙트럼 효소 포뮬라 보충제 채식주의자 비건에게 적합 프로바이오틱스 효소 소화 1968년 설립된 가족 기업 GMP 품질 보증,계절성 알레르기
