effect,category
면역 건강 EpiCor  및 Wellmune  함유 보충제 전반적인 건강을 위한 신체의 방어 기능 강화 강력한 면역력 지원을 위해 임상적으로 검증된 2가지 성분 제공 1969년부터 과학에 기반한 고품질 상품 제공 Epicor  Wellmune,계절성 알레르기
Assists with a Properly Working Digestive Process Herbal Supplement A 16 Day Supply Vegan,계절성 알레르기
Breathe Better Now  Nature s Decongestant   유칼립투스가 선사하는 상쾌하고 향기로운 느낌과 함께 부비강이 상쾌하고 촉촉해집니다  중독성 약물 성분 무함유 시원하고 상쾌한 느낌 Clean Nose  Healthy Life 건강한 비강 위생 관리의 새로운 기준을 만들어 드립니다 ,계절성 알레르기
Dinosaurs  1932년 설립 이래 신뢰할 수 있는 품질 유지 면역계 강화 보충제 대두 무함유 땅콩 무함유면역계 건강 지원 튼튼한 조직 전반적인 면역 건강 및 웰빙,계절성 알레르기
황기 면역력 강화 시스템 빌더 USDA 유기농 인증 허브 보충제 황기 추출액 면역계 기능 건강 증진 글루텐 무함유 건조 허브 용제 비율  1 5 Organic Certifiers 유기농 인증,계절성 알레르기
Himalayan Chandra  건조한 비강 진정 과도한 점액을 자연스럽게 제거 먼지  꽃가루 및 여러 자극 물질을 부드럽게 씻어냄 Neti Wash Plus  데일리 Neti Pot 부스트로 부비강 강화 및 면역 지원 의사 추천 제품 건강에 좋은 제품 1972년에 최초 생산One Porcelain Neti Pot  Neti Wash Plus  USP 등급 Neti Salt비강 및 부비강 건강 증진 콧물 및 코막힘 개선 감기  알레르기  콧물이 뒤로 넘어가는 증상 완화에 도움 건조한 비강에 수분 공급 등,계절성 알레르기
임상 검증된 남아프리카 제라늄 함유 엘더베리   남아프리카 제라늄 신속한 통증 완화   보충제글루텐 무함유 비건 제품효모 유래 성분  밀  유제품  땅콩  인공색소,계절성 알레르기
진짜 과일로 제조 색소 무함유 정제당 무함유 시럽 무함유 구미젤리 2개   신선한 엘더베리 6g USDA 유기농 인증 식물 유래 성분 웰니스 462mg 허브 보충제 Oregon Tilth 유기농 인증,계절성 알레르기
USDA 유기농 인증 2티스푼당 프레시 엘더베리 10g  면역 건강을 강화하는 맛있는 강장제 유기농 꿀 인공 보존제 무함유 첨가된 향료 무함유 허브 보충제 Oregon Tilth 유기농 인증 글루텐 무함유 B  corp  인증 1987년부터 이어진 무결점   순도   효능뛰어난 맛 천연 식품 성분으로 제조 인공 무함유 향료 또는 색소 무함유,계절성 알레르기
구미젤리 1개당 엘더베리 75mg 함유 블랙 엘더베리  비타민C  아연으로 강력한 면역력 증진 효과 USDA 유기농 인증 보충제 글루텐 무함유 유전자 변형 성분 무함유 젤라틴 무함유 액상과당 무함유 크루얼티프리 QAI 유기농 인증,계절성 알레르기
자연적인 소화기 건강 및 웰니스 NSF 유전자 변형 성분 무함유 인증 프로바이오틱을 함유한 완벽한 효소 소화 기능 지원 강화 하루 복용량당 12억 마리 활성 배양균  보충제 채식주의자에게 적합 증량제 무함유,계절성 알레르기
1971년 설립 글루텐 무함유 인증 졸음을 유발하지 않는 포뮬라 퀘르세틴  브로멜라인 및 비타민C 결합 보충제 B  corp  인증진정성 청결도 신선도 일관성 정확성,계절성 알레르기
Ron Teeguarden s 인생은 더 좋아져야 할 가치가 있다 식이 보조제,계절성 알레르기
면역 강화 웰빙 유지를 돕는 면역 시즌 에센셜 허브 보조제 순도   효능   무결점 1987년 설립 비건 글루텐 무함유 대두 성분 무함유 B corp  인증 1987년부터 시작된 식물과 사람의 연결,계절성 알레르기
자연의 면역 1차 방어선 어린이에게도 좋습니다  면역글로불린 IgG  항체 25  건강한 면역 반응 지원 정상적인 위장 건강 지원 글루텐 무함유 보충제 면역 인자 품질  순도 보증,계절성 알레르기
저자극성 글루텐 무함유 보충제 Ultra Tested cGMP 인증   우수 제조 및 품질 관리 기준에 따른 일관된 품질,계절성 알레르기
Amazing Formulas  보충제 단백질 분해 효소   단백질 소화 촉진 항염증 성분으로 관절 건강 증진 영양소 흡수 촉진 우수 제조 및 품질 관리 기준 GMP 을 준수하는 고품질 상품,계절성 알레르기
Sensitive to Your Sensitivities  풀 스펙트럼 소화 증진 효과의 드링크 믹스 비타민C 2 000mg 유전자 변형 성분 무함유 인증 보충제 코셔 인증 우수 제조 및 품질 관리 기준 GMP  스위트 만족스러운 맛 글루텐 및 설탕 무함유 비건 제품,계절성 알레르기
1969년 설립 프리미엄 추출물 건강한 면역계 지원 TRU ID  진품 인증 유전자 변형 성분 무함유 프로젝트 인증 아스트라갈로시데스 0 5  보충제 비건,계절성 알레르기
자연에서 영감을 받은 상품 천연 엘더베리 함유 비타민C와 D3의 우수한 공급원  천연 베리 향료 및 기타 천연 향료 보충제 액상과당 무함유 인공 감미료 무함유 인공 향료 무함유 젤라틴 무함유 글루텐 무함유 알레르기 유발 성분 무함유건강한 면역계를 강화하는 천연 엘더베리  비타민C  비타민D3  아연 함유 어린이에게 영양소 보충이 가장 필요한 순간에 풍부한 엘더베리 추출물 제공 천연 색소,계절성 알레르기
흡수 검사 완료 개선된 면역 복합체 보충제 유전자 변형 성분 무함유 우수 제조 및 품질 관리 기준 GMP  준수 품질 검사 완료 유제품  글루텐  계란 및 견과류 무함유 채식주의자에게 적합,계절성 알레르기
옥시메타졸린 HCI 비강 솔루션 비강 충혈 완화제 코나 목 아래에서 흐르지 않음 빠르고 강력한 코막힘 완화 감기  알레르기 최대 12시간의 완화 효과 맥시멈 스트렝스   멘톨 의사 및 약사 추천 1위 비강 스프레이 브랜드 하루 종일 또는 밤새도록 지속되는 완화 효과일반 감기  건초열  상부 호흡기 알레르기로 인한 코막힘 증상을 일시적으로 완화 코막힘 및 압박감의 일시적인 완화 부은 비강막을 수축시켜 더 자유롭게 호흡할 수 있음,계절성 알레르기
흡수 검사 완료 개선된 면역 복합체 보충제 유전자 변형 성분 무함유 우수 제조 및 품질 관리 기준 GMP  준수 품질 검사 완료 유제품  글루텐  계란 및 견과류 무함유 채식주의자에게 적합,계절성 알레르기
보충제,계절성 알레르기
자연의 면역 1차 방어선 면역글로불린 lgG  항체 25  보증 건강한 면역 반응 지원 정상적인 위장 건강 지원 글루텐 무함유 보충제 순도 품질 보장,계절성 알레르기
1973년 설립  소화 기능 증진 보충제 품질 검사 완료,계절성 알레르기
우수 제조 및 품질 관리 기준 인증 보충제 유전자 변형 성분 무함유,계절성 알레르기
Natural Digestive Health   Wellness  Dietary Supplement 100  Whole Food Nutrition  Powered by Enzymes  With Guaranteed Potency Probiotics and Superfoods Gluten Free Preservative Free Filler Free Dairy Free Soy Free ,계절성 알레르기
1932년 설립 이래 신뢰할 수 있는 품질 유지 전반적인 웰빙 증진 유전자 변형 성분 무함유 대두 무함유 보충제 하루 2정,계절성 알레르기
소화관 기능 및 영양소 흡수를 지원하는 소화 효소 보충제 글루텐 무함유,계절성 알레르기
전 세계에서 가장 편안한 비강 세척기  써 보면 알게 됩니다  BPA 무함유 플라스틱 FDA 등록 제품자연스러운 머리 및 목 위치 위 방향이 아닌 코의 기저부를 따라 세척 자연스럽게 비강 세척 가능 편안한 진정효과에 적합한 완충염 만 2세 이상 이용 가능 고장액은 며칠간 사용 가능 압력 및 흐름에 따른 완벽한 제어 여행용으로 적합한 밀폐형 캡 인체공학적 디자인 완벽한 포지셔닝을 위한 높이선타는 듯한 느낌을 완화하거나 제거해줍니다 점막 부기 완화 분비물을 묽게 함 Nasopure 완충염의 차별화된 편안함인체의 필터인 코를 부드럽게 씻어내고 세척하며 코에 수분을 공급 알레르기 유발 성분  먼지  과도한 콧물  그 외 오염물질을 제거 pH 균형을 맞춘 알칼리 용액 간편  진정  안전  시원한 느낌 ,계절성 알레르기
동종 요법 의약품,계절성 알레르기
자연스러운 소화기 건강 및 웰니스 유전자 변형 성분 무함유 보충제 효소로 전달하는 100  천연 식품 영양소 효능이 보장되는 프로바이오틱 및 유기농 인증 슈퍼푸드 함유 유기농 인증 글루텐 무함유 보존제 무함유 충전제 무함유 유제품 무함유 대두 무함유,계절성 알레르기
면역력 강화 순수 꿀 사탕 정제 1정당 설탕 1g 제3 기관 품질 검사 완료 1회 제공량당 고농축 프로폴리스 추출물 25mg 꿀  비타민 D   아연으로 제조 보충제 프로폴리스로 보강 과학의 뒷받침 자연에서 받은 영감 목 진정 효과 마름모꼴 당 설탕 여성 설립 B  corp  인증,계절성 알레르기
Epicor  함유 면역 건강 고대사성 면역 물질 보충제 면역계에 영양을 공급하기 위한 고대사성 면역 물질 제공 소화 건강을 위한 프리바이오틱 효능 제공 간헐적인 위장 불편감 완화,계절성 알레르기
코막힘 완화 B  corp  인증 여성 기업 프로폴리스로 보강 제3 기관 품질 검사 완료 코막힘 해결,계절성 알레르기
건강한 면역 체계 기능 지원 엘더베리 뛰어난 맛 채식주의자에게 적합 보충제 IGEN 유전자 변형 성분 무함유 검사 완료,계절성 알레르기
1967년 설립 브로멜라인  락타아제  파파인  프로테아제 함유 보충제 Mason 보증   품질 검사 완료 cGMP 인증 대두 무함유,계절성 알레르기
1973년 설립 면역력 강화 보충제 품질 검사 완료 비건 건강한 삶 지원,계절성 알레르기
Oxymetazoline HCl 0 05  Nasal Decongestant 12 Hour Relief  Colds Allergies Maximum Strength  Relief of Sinus Pressure the common cold  hay fever upper respiratory allergies temporarily relieves sinus congestion and pressure helps clear nasal passages shrinks swollen membranes,계절성 알레르기
면역 강화 웰빙 유지를 돕는 면역 시즌 에센셜 허브 보조 식품 순도   효능   무결점 1987년 설립 비건 글루텐 무함유 대두 성분 무함유 B corp  인증 1987년부터 시작된 식물   사람의 연결,계절성 알레르기
음료 1개당 베리 300개  스틱 팩 휴대용 파우더 믹스 비타민C 비타민D 아연 무가당 뜨겁게 또는 차갑게 섭취 가능 보충제 글루텐 무함유 인공 색소  향료  보존제 무함유 휴대용   물병에 넣고 믹스 산뜻한 제형   찬물에 혼합 진정   뜨거운 물에 혼합 가능,계절성 알레르기
상쾌함   안전성,계절성 알레르기
1위 동종 요법 알레르기 브랜드  알려진 알레르기 알레르기 및 약물 상호 작용 없음콧물 코 가려움 눈물 재채기,계절성 알레르기
버전 3 보충제 비건 인증 코셔 파르브 인증,계절성 알레르기
1969년 설립 USDA 유기농 인증 뛰어난 맛 보충제 QAI 유기능 인증 복용컵 포함글루텐 무함유 코셔 인증 비건,계절성 알레르기
1994년 설립 허브 보조제 장기 면역 지원 유기농 황기 함유 유전자 변형 성분 없음 인증  글루텐 없음 Oregon Tilth 유기농 인증,계절성 알레르기
자연적인 소화기 건강 및 웰니스 판매 1위 효소 브랜드 효소 최적화 및 pH 균형 최적의 소화 촉진 자연적인 신진대사 지원 NSF 유전자 변형 성분 무함유 인증 비건 보충제 증량제 무함유,계절성 알레르기
건강한 소화 기능 증진 유익균 보충 체중 감량 지원 보충제,계절성 알레르기
1회 제공량당 엘더베리 150mg 블랙 엘더베리  비타민C 및 아연의 강력한 면역력 지원 USDA 유기농 인증 천연 베리 맛 보충제 글루텐 무함유 유전자 변형 성분 무함유 젤라틴 무함유 액상과당 무함유 QAI 유기농 인증 크루얼티 프리,계절성 알레르기
진짜 과일로 제조 색소 무함유 정제당 무함유 색소 무함유 구미젤리 2개   생 엘더베리 10g USDA 유기농 인증 식물 유래 성분 웰니스 770mg 엑스트라 스트렝스  허브 보충제 Oregon Tilth 유기농 인증,계절성 알레르기
용기 또는 NasaFlo 를 건조하고 위생적으로 보관하는 방법 복용이 편리함기본 2개입 수직 마운팅 접시 1개 소형 홀링 접시 1개  대형 둥근 홀링 접시 2개,계절성 알레르기
글루텐 무함유 유전자 변형 성분 무함유 LE 인증 블랙 엘더베리  아연 및 비타민C 보충제,계절성 알레르기
소화 기능 강화 식물성 포뮬라 보충제 정신  신체  가정을 위한 전반적인 웰니스 증진 최고의 순도 및 효능 1969년부터 과학에 기반한 고품질 상품 제공 식물성,계절성 알레르기
5 in 1 면역력 강화 포뮬라 엘더베리 10 000mg 상당량 보충제 항산화의 계절 면역계 강화 엑스트라 스트렝스 GMP 인증 품질 품질 검사 및 인증 완료 유전자 변형 성분 무함유 전문가 등급 정성을 담은 상품 글루텐  대두  계란  유제품  생선  보존제 무함유,계절성 알레르기
면역 건강 증진 구미젤리 1개당 생 블랙 엘더베리 3 200mg 글루텐 무함유 젤라틴 무함유 비건 보충제 유전자 변형 성분 무함유 프로젝트 인증 검사 및 인증 완료 100  정품Nature s Answer Daily Gummies 1개는 경쟁 상품 대비 2배 농도의 엘더베리를 제공 1회 제공량 당 생 엘더베리 3 200mg 함유 엘더베리는 면역력을 강화하고 활성산소와 싸우는 항산화제를 석류  블루베리보다 더 많이 함유하고 있으며  구기자보다는 3배나 더 많습니다 ,계절성 알레르기
알레르기 완화 가려운 눈 및 눈물  재채기  목 및 코 가려움 녹는 펠릿 동종 요법 약품 휴대하기 편리한 완화제 어린이에게 좋은 맛 졸리지 않음 자연적인 방식으로 건강 증진 동종 요법 의학의 세계적인 리더 튜브당 16회 제공량눈이 가렵고 눈물이 나는 경우 재채기 가려운 목 및 콧구멍 콧물 건초열과 관련된 경련성 기침,계절성 알레르기
면역계 강화 보충제,계절성 알레르기
Moms Make It Better    1 Selling Gripe Water  Women Owned and LedGripe Water Original  Age 2 Weeks   2 fl oz  60 ml  Baby Vitamin D Drops  Newborn   0 11 fl oz  3 24 ml  Baby Gas Relief Drops  Newborn   1 fl oz  30 ml  Saline Drops Spray  All Ages  1 fl oz  30 ml  1 Selling Brand Relieves Stomach Discomfort From Gas  Colic  Fussiness  Hiccups Free of Dyes  Alcohol   Parabens No Spill Syringe Adapter Liquid Dietary Supplement1 Drop   400 IU as Recommended by American Academy of Pediatrics USDA Organic Supports Healthy Growth and Bone Development Liquid Dietary SupplementNasal Relief Cleans  Moisturizes and Soothes Your Little One s Delicate Nasal Passages Non Medicated Free of Drugs  Alcohol   Parabens Dropper Spray Bottle IncludedSimethicone Drops Relieves Stomach Discomfort from Gas Safe   Gentle Works Quickly Free of Dyes   Parabens New Easy Dose Syringe,계절성 알레르기
면역 강화 웰빙 유지를 돕는 면역 시즌 에센셜 허브 보조 식품 비건 글루텐 무함유 대두 성분 무함유 글로벌 사회적 기업 인증,계절성 알레르기
1973년 설립 다당류 70  면역력 강화 스트레스 완화 보충제 품질 검사 완료 비건 건강한 삶 지원,계절성 알레르기
에클렉틱 허브 허브 추출물 보충제 USDA 유기농 인증 100  코셔 대두 성분 무함유 유전자 변형 성분 무함유 미국에서 재배 글루텐 무함유 Oregon Tilth 유기농 인증,계절성 알레르기
USDA 유기농 코셔 비타민 C 함유 글루텐 없음 맛이 좋습니다 건강 보조 식품 QAI 유기농 인증,계절성 알레르기
면역 건강 캡슐당 575mg 허브 보충제 몸의 방어력을 강화하는 허브 면역계 강장제 항산화 작용 강화 면역계 건강 유지 1969년부터 과학에 기반한 고품질 상품 제공,계절성 알레르기
면역력 강화 30회 제공량 액상 드롭형 액상 보충제 맛있는 드롭형 상품 천연 베리 맛   설탕 무함유 무함유 성분  글루텐 대두 무함유 에그 무함유 제로 유제품 제로 견과류 젤라틴 또는 동물성 성분 무함유 유전자 변형 성분 무함유 비건 상품 품질 검사 및 인증 완료 우수 제조 및 품질 관리 기준 GMP 를 준수하는 일관된 품질,계절성 알레르기
옥시메타졸린HCI 함유 99 9  천연 상품 12시간 지속되는 효과 보습 효과가 있는 자일리톨 함유 감기  건초열  알레르기 완화 효능 즉각적인 완화 효과 BPA 무함유 코셔 의사 추천 상품즉시 작용 부비강 압박감 완화 졸음이나 건조함 없이 12시간 지속되는 완화 효과 부비강 및 비강 세척  수분 공급  진정  보호 수분 공급으로 건조함 완화,계절성 알레르기
자연스러운 소화기 건강 및 웰니스 유전자 변형 성분 무함유 보충제 효소로 전달하는 100  천연 식품 영양소 효능이 보장되는 프로바이오틱 및 유기농 인증 슈퍼푸드 함유 유기농 인증 글루텐 무함유 보존제 무함유 충전제 무함유 유제품 무함유 대두 무함유,계절성 알레르기
Pure Vegan 소화 보충제 글루텐 무함유 유전자 변형 성분 무함유 크루얼티프리영양소 흡수율 향상 소화 불량 및 복부 팽만감 완화 소화가 어려운 음식물 분해,계절성 알레르기
효소 전문 브랜드 유전자 변형 성분 무함유 소화 촉진 판매 1위 효소 브랜드 채식주의자  비건  생식에 적합 영양소 흡수 촉진 간헐적 소화 불량 완화 보충제 비건 코셔 파르브 인증 증량제 무함유,계절성 알레르기
허브 보충제 스프레이 1위 브랜드  1회 제공량당 엘더베리 100mg 비타민C  D  아연 함유 면역 건강 과일에서 추출한 펙틴 함유 보충제 엘더베리 맛 구미젤리 천연 색소 및 향료 젤라틴 무함유  품질 보장 품질 검사 완료,계절성 알레르기
식물 영양소 최대 보존 보충제 증량제 무함유 천연 허브 무가공 천연 농축 미국에서 재배 글루텐 무함유 비건 제품 유전자 변형 성분 무함유 100  코셔,계절성 알레르기
황기 Astragalus membranaceus  원산지  중국 미국 캘리포니아에서 가공  포장  품질 검사 완료 KCS 코셔 인증,계절성 알레르기
알레르기  감기  독감  축농증  비염과 관련된 증상을 관리하고 완화하십시오  The Most Comfortable Nose Wash in the World   성인 장애인이 조립 BPA 무함유 플라스틱 자연스럽게 비강 및 부비강을 통한 공기 흡입력 개선 코점막 부기 완화에 도움 감염 입자  알레르기 유발 성분 및 오염 물질 제거 지원 한 번만 사용해도 뻥 뚫리는 코코막힘 부비강 압박감 비강 건조증 후비루 증후군 콧물 완화 재채기 기침구부릴 필요가 없고 비틀 필요도 없으며 용액을 들이마실 염려도 없습니다 ,계절성 알레르기
소화 효소 보충제 최고의 소화 보조 글루텐 무함유,계절성 알레르기
소화 보조제  34 프로테아제  아밀라아제 및 리파아제 함유 보충제 소화 기능 강화 영양소 흡수율 최적의 웰니스 글루텐 무함유 인공 보존제 무함유 효능 및 품질 보증 미국 식품의약국 등록 시설에서 제조,계절성 알레르기
1973년 설립 락타아제 40mg 칼슘 100mg 소화 기능 강화 보충제 품질 검사 완료 건강한 삶 지원,계절성 알레르기
면역력 강화 전통적으로 전반적인 건강 관리 허브 보충제 B  corp  인증 비건 글루텐 무함유 대두 무함유,계절성 알레르기
100  식물성 효소 보충제 글루텐 무함유 가스 및 복부 팽만 완화에 도움 소화 및 영양소 흡수 촉진,계절성 알레르기
Natural Digestive Health   Wellness Non GMO Dietary Supplement With Guaranteed Potency Probiotics and Superfoods Gluten Free Preservative Free Filler Free Dairy Free Soy Free,계절성 알레르기
위산에서 생존율이 100배 더 높은 프로바이오틱  고유하게 혼합된 프로바이오틱과 락타아제 효소 유당 분해 및 가벼운 소화 불량 완화  보충제 500억 개 이상 생존  유제품 무함유 식물성 Schiff 품질 보증 순도 신선도 유통기한 내 Take The Inside Advantage ,계절성 알레르기
호흡을 편안하게 무중독성 상품 인공 보존제  염료 및 향료 무함유 알코올 무함유 유전자 변형 성분 무함유 270회분 스프레이 뉴질랜드 의료용 등급 인증 약물 성분 무함유,계절성 알레르기
삼부커스 원산지  크로아티아 KCS 코셔 인증 USDA 유기농 인증 QAI 유기농 인증,계절성 알레르기
Immune Support within 2 Hours   Natural Flavor Nature s Superior Immune Formula Dietary Supplement Gluten Free GMO Free No Artificial Flavors Epicor  Vitamin C Zinc Elderberry,계절성 알레르기
에클렉틱 허브 허브 글리세라이트 보충제 100  코셔 대두 성분 무함유 유전자 변형 성분 무함유 미국에서 재배 글루텐 무함유,계절성 알레르기
DigeZyme  종합효소 복합체 GutGard  함유 속부터 탄탄하게 보충제 Gingever  Gutgard  Actazin ,계절성 알레르기
허브 보충제 NSF 유전자 변형 성분 무함유 인증 여성 기업 글루텐 무함유 진정 작용 및 각성제 무함유,계절성 알레르기
임상적으로 지원되는 성분 엘더베리 시럽 고농축물 천연 엘더베리와 비타민C  아연 함유 보충제 중독성 약물 또는 알코올 무함유 인공 감미료 무함유 염료 무함유 인공 향료 무함유 글루텐 무함유과학적인 검사를 완료하고 임상적으로 지원되는 성분 천연 엘더베리와 비타민C  아연으로 면역 강화 엘더베리는 항산화제 역할을 하는 플라보노이드를 함유하여 면역 증진과 세포 건강 유지에 효과적입니다 ,계절성 알레르기
Di Tao 정식 공급원 인증 보충제,계절성 알레르기
For Life Balance  단백질 소화 효소 채식주의자 비건에게 적합 보충제,계절성 알레르기
1971년 설립 글루텐 불포함 인증 소화 효소 1그램당 2 000 GDU 타블렛당 1 000 GDU 영양 보충제 코셔 파레브정통 깨끗함 신선함 일관성 정확성,계절성 알레르기
파인애플 효소 표준화된 600GDU g 보충제 소화 기능 강화 식물성 글루텐 무함유식사와 함께 복용하면 소화 건강 증진 관절 및 근육 기능 증진 건강한 혈액 순환 촉진,계절성 알레르기
면역력 강화 보충제 품질 검사 완료 글루텐 무함유 대두 무함유 천연 엘더베리 맛 1973년부터 건강한 삶 지원,계절성 알레르기
Clinically Studied For Your Good Health Bowel Regularity Gut Microflora Nutrient Absorption Overall Digestive Comfort Vegan Dietary Supplement NON GMO Lab Tested For Purity   QualityPromotes regularity and healthy digestion  Supports gut microflora  Reduces occasional bloating and constipation  Supports healthy nutrient absorption  Not a stimulant laxative  Safe  gentle  and effective  Eliminates toxins,계절성 알레르기
150 mg Juice   Per Serving Vitamins C   D for Immune Support America s  1 Gummy Vitamin Brand Dietary Supplement No Artificial Flavors or Sweeteners No Gluten No High Fructose Corn Syrup No Dairy No Synthetic FD C Dyes Award Winning Taste   Chefsbest 2021 Excellence,계절성 알레르기
최초 천연 면역 방어제 면역글로불린 10 와 프로바이오틱스 함유 건강한 면역 반응 증진 건강한 장내세균총 유지에 도움 글루텐 없음 건강 보조 식품 품질 순도 보증,계절성 알레르기
LevmetamfetamineThe common cold Hay fever or upper respiratory allergies ,계절성 알레르기
