effect,category
운동 능력 기술 강력한 활력을 불어넣는 포뮬라 지방 연소 분리 소고기 단백질 지방 연소  근육 생성  에너지 증가 매일 최대 100칼로리 추가 공복감 완화 및 식욕 억제 강력한 발열 성분으로 강화 첨단 향미 기술 천연 및 인공 향료 지방  유당  콜레스테롤  설탕 무함유 보충제 100  소고기 단백질로 제조 젤라틴 무함유임상 시험을 마친 성분인 SUPER 6 PARADOL 이 열을 발생시키고 저장된 지방에서 지방산을 방출하여 갈색 지방 조직 BA 의 열 생성을 촉진합니다  신진대사를 높여 매일 최대 100칼로리를 추가로 소모할 수 있습니다  이 칼로리는 1 6마일을 달리며 연소되는 칼로리와 같습니다  강력한 천연 식물 추출물과 허브가 풍부하게 들어 있으며 폴리페놀  메틸잔틴  카페인이 풍부하게 들어 있어 시너지 효과를 발휘하여 지방 연소를 강화합니다  공복감 및 포만감 감소에 도움을 줍니다  강력한 에너지 충전 및 기분 전환 효과로 다이어트를 성공적으로 마무리하고 최상의 컨디션을 유지할 수 있습니다 1회 제공량당 순수 소고기 단백질 23g  지방 무함유  콜레스테롤 무함유  설탕  유당  글루텐 무함유   새로운 임상 연구에 따르면 CARNIVOR BPI 보충제를 복용하면 8주 만에 근육량을 늘리는 데 도움이 되는 것으로 나타났습니다   Anabolic Nitrogen Retention Technology 는 근육 형성을 위해 아미노산을 재활용하고 암모니아와 독소 축적을 최소화하여 동화 작용을 강화합니다 긍정적인 질소 균형을 촉진하고 단백질 합성을 증진하고 이화 근육 분해를 줄이며 운동 능력을 개선하고 근육 피로를 줄여주는 분지사슬아미노산 BCAA 이 첨가되어 있습니다 ,체중 조절
BCAA   EAA 5g 수분을 공급해 주는 전해질 운동 후 회복 면역력 지원 천연 향료 비건 제품 당류 무함유 인공색소  향료 무함유 카페인 무함유 보충제 Aquamin 천연 감미료 사용,체중 조절
휴대 가능 개별포장 스틱팩 14개 기타 천연 향료 첨가 천연 성분으로 에너지 제공  대사 증진 지방 분해 촉진  집중력 강화 웰빙 촉진 인공 색소 무함유 설탕 무함유 인공 향료 무함유 천연 카페인 200mg,체중 조절
체중 관리 소프트젤 1정당 1 000mg 잇꽃 오일 혼합물 보충제 건강한 체중 관리 잇꽃 오일 혼합물이 체내에서 작용하여 순근육 발달 촉진 체중 관리 및 감량 목표 지원 1969년부터 과학에 기반한 고품질 상품 제공 Tonalin ,체중 조절
USDA Organic 미국 농무부 유기농 인증  건강 보조 식품 Certified Organic by  QCS QCS 유기농 인증 ,체중 조절
식물성 원료 유전자 변형 성분 무함유 홍화유에서 추출한 표준형 80  CLA 보충제 비건 인증 글루텐 무함유 우수 제조 및 품질 관리 기준   GMP 인증 제3 기관 검사 완료 인증 Igen  유전자 변형 성분 무함유 검사 완료표준화 공액리놀레산 80  각성제 무함유 포뮬라 Igen  유전자 변형 성분 무함유 검사 완료,체중 조절
1회 제공량으로 만족스런 식사 The Energy Supplements  고단백 에너지 식사  글루텐 무함유 뛰어난 맛 완전한 광범위 스펙트럼 스피룰리나를 함유한 단백질 복합체 Tri Part Protein  심장에 좋은 음식 코셔 파르브 Meal In A Minute  즉시 혼합되는 바닐라 Spiru Tein 블렌더 불필요 채식주의자에게 적합 효모 무함유 유전자 변형 성분 무함유 천연 대두,체중 조절
Meal Lose Weight   Keep It Off   with the SlimFast Plan  Ideal for Low Carb Lifestyle Artificially Flavored 5 g Fiber Contains 36 Total Fat Per Serving 23 Vitamins   Minerals with A  C  D  E   Zinc 4 Hr Hunger Control   Satiety was Measured in a Laboratory Controlled Setting Gluten Free,체중 조절
맛있는 베이커리 맛  Sweet Treats   베이커리 맛 안심하고 먹을 수 있는 훌륭한 맛  단백질 20g 과일 채소 30종 식이섬유 10g 글루텐 무함유 천연 향료,체중 조절
항산화 효과 허브 보충제 식물성,체중 조절
각성제 무함유 체성분 지방 감량 설탕 무함유 천연 향료 보충제,체중 조절
천연 감미료 사용 BCAA   EAA 5g 수분을 공급해 주는 전해질 운동 후 회복 면역력 지원 천연 향료 비건 제품 당류 무함유 인공색소  향료 무함유 카페인 무함유 보충제 Aquamin 천연 감미료 사용,체중 조절
휴대 가능 개별포장 스틱팩 14개 기타 천연 향료 첨가 천연 성분으로 에너지 제공  대사 증진 지방 분해 촉진  집중력 강화 웰빙 촉진 인공 색소 무함유 설탕 무함유 인공 향료 무함유 천연 카페인 200mg,체중 조절
보충제 계피 추출물 20 1 포도당 관리 시스템 순도 및 효능 보장,체중 조절
최적의 소화와 건강을 위한 완벽하고 균형잡힌 비건 식사 대용품 영양소가 풍부한 슈퍼푸드 1979년 설립 천연  활력 보충  영양 공급 식물성 슈퍼 단백질 블렌드   스피룰리나  클로렐라  보리싹 Life s DHA 식물성 Omega3 1 000mg Life s DHA   건강한 두뇌  눈  심장 프로바이오틱스 80억 최대 생체이용률   소화력 향상   장 건강 유제품 무함유 글루텐 무함유 비건 인증 유전자 변형 성분 무함유 대두 무함유완벽한 천연 식물성 단백질 식사 대용품  필수 비타민 일일 영양권장량 100   특수 효소 혼합물이 단백질 소화를 돕습니다  근육 회복 및 재건을 위한 영양소 가용성을 극대화합니다  프리바이오틱스와 80억 개의 활성 프로바이오틱스 세포를 혼합하여 건강한 소화를 돕는 장내 세균총을 촉진합니다  필수 오메가3 지방산 DHA는 두뇌  눈  심장  신경계 기능을 지원합니다  완두콩  쌀  햄프  스피룰리나  클로렐라  보리 싹 주스에서 추출한 모든 식물성 단백질 ,체중 조절
유기농 프리바이오틱 섬유소 및 실론 계피 함유 보충제 천연향료 분말 Greatness by Nature  콜라겐 1형 및 3형 말토덱스트린 무함유 품질 검사 완료 목초 사육  방목 사육 글루텐 무함유 유전자 변형 없는 성분으로 제조 깨끗한 에너지   최적의 단백질 호르몬 무함유 콜라겐맑은 정신 장 건강 증진 빠르고 지속적인 에너지 제공 최상의 효능 관절 운동성 모발 및 손발톱 강화 피부 세포 건강 건강한 수준의 식욕,체중 조절
체중 관리 Chromas  함유 보충제 정신  신체  가정을 위한 전반적인 웰니스 증진 최고의 순도 및 효능 1969년부터 과학에 기반한 고품질 상품 제공,체중 조절
Accelerate Your Weight Loss Achieve Your Goals Stimulant Free Fat Burn Energy   Metabolism Natural   Artificial Flavors Boost Endurance Healthy Energy Support Fat Burning Non GMO Gluten Free Dye Free BPA Free Paraben Free 31 Servings Dietary Supplement 2x Boost Energy and Fat Burning Health For Every LifestyleEnergy Stored As Fat Carnitine Shuttles Fat Cells To Mitochondria Mitochondria Converts Fat Into Energy Increased Fat Burning   Energy,체중 조절
Since 1930 A Step Towards Optimal Weight Supports Appetite   Metabolism Non GMO Project Verified USDA Organic Herbal Supplement Gluten Free Vegan Friendly cGMP No Wheat No Corn No Soy No Dairy No Ingredients of Animal Origin 2 Month Supply Certified Organic By Control Union Certifications Family Owned for Over 90 Years,체중 조절
IGEN 유전자 변형 성분 무함유 검사 완료 신선도 및 효능  순도 보장 보충제 케토 건강 지원 에너지 생산 지방 대사 인공 보존제 무함유 글루텐 무함유 순도 보장 Friend of the Sea 인증 국제 어유 표준 IFOS  인증,체중 조절
대두 성분 무함유 글루텐 무함유 유기농 섬유소 7g 단백질 20g 유기농 과일   채소 10종 USDA 유기농 인증 코셔 비건 인증 QAI 유기농 인증 유전자 변형 성분이 함유되지 않은 유기농 제품,체중 조절
미국에서 가장 빠르게 성장하는 보충제 브랜드 1위 콜레우스 뿌리 250mg으로 포스콜린 제공 녹색커피 200mg 흑후추 추출물 녹색커피로 체중 감량  흑후추 추출물 함유 각성제 무함유 유전자 변형 성분 무함유 보충제 효과적인 체중 감량  글루텐 무함유   비건 친화적 100  품질 약속항상 저칼로리 식단과 규칙적인 운동을 포함하는 건강한 체중 감량 계획을 지원합니다  각성제를 사용하지 않는 체중 감량 촉진을 위해 매일 2회 복용하십시오 포스콜린 Coleus forskohlii  추출물 250mg 주요 체중 감량 성분인 녹색커피 추출물 200mg 흑후추 추출물 5 3mg,체중 조절
탄탄한 근육질 몸매 만들기 및 유지 락토오스 무함유 단백질 20g 식이섬유 11g 18가지 과일과 채소 글루텐 무함유 유전자 변형 성분 무함유 단백질 보충제 N53 ,체중 조절
목초 사육 유청 25g 12 과일 및 야채 프로바이오틱 식이섬유 8g 고품질 지방 3 5g 프로바이오틱스 10억CFU 천연향료 목초 사육 장 건강 강화 항생제 무함유 추가 호르몬 무함유 대두 무함유 단백질 분말 드링크 믹스,체중 조절
100  코코넛으로 제조 커피 및 셰이크 혼합에 적합 유익한 지방 함유 지속 가능   천연 에너지 무색  무맛 건강 보조 식품 30회 제공량 유제품 무함유 글루텐 무함유 100  Vegan 100  비건  설탕 무함유,체중 조절
허브 보충제 보충제 비건 상품 Greatness by Nature  허브 보충제 품질 검사 완료 글루텐 무함유 일상의 양념같은 활력 영양소 공급 몸을 따뜻하게 하는 웰빙 효과,체중 조절
영양 보조 식품 가르시니아 캄보지아 추출물 크롬 메이트,체중 조절
보충제 Tonalin   체지방 감소용 체지방 감소 및 근육 긴장도 향상 순도 및 효능 보장,체중 조절
유전자 변형 무함유 성분으로 제조 보충제 각성제 무함유 대두 성분 무함유 비건 제품 코셔 파르브 글루텐 무함유지방산 합성을 낮추는 동시에 지방을 연소하여 에너지로 전환  인슐린이 포도당을 에너지원으로 사용할 수 있는 세포로 운반하는 데 도움  식욕 억제에 도움이 되는 뇌 내 세로토닌이 건강한 수치를 유지하도록 지원 ,체중 조절
자연산 50   HCA을 제공합니다 식욕을 제한할 수 있습니다 탄수화물   지방 신진대사를 촉진합니다 건강보조식품 메이슨 담보   실험실에서 검사된 크로막스,체중 조절
무가당 고단백 에너지 대용식  Simply Natural 오리지널 바닐라 글루텐 무함유 자신만의 감미료를 추가 Tri Part Protein  심장에 좋은 음식 당뇨 환자의 라이프스타일에 적합 채식주의자에게 적합 효모 무함유 유전자 변형 성분 무함유 천연 대두,체중 조절
건강한 체중 관리 MCT 천연 에너지원 100  코코넛 성분 보충제트랜스 지방 무함유 케토 친화 상품 Paleo 인증 유제품 무함유 글루텐 무함유 설탕 무함유,체중 조절
펀더멘탈 포뮬라 일상적인 웰니스 증진 강력한 항산화제 유전자 변형 성분 및 글루텐 무함유  비건 상품 천연 슈퍼 푸드 식물성 성분 보충제 기타 천연 향료 첨가 Unleash Your Potential 코셔 유제품인공 향료 무함유 젤라틴 무함유 보존제 무함유 인공 감미료 무함유,체중 조절
수분 공급 및 체중 증가 완화 근육을 정의하는 포뮬라 각성제 무함유 천연 허브 활성 성분 보충제 활성 성분 2 400mg 이상 GAT 정품   만족도 보장민들레  회향  파슬리  비트 등 9가지 식물 추출물이 수분 배출에 도움이 됩니다  수분 손실로 인해 손실된 칼슘 및 칼륨 전해질 을 대체합니다  코코넛오일을 증류한 MCT로 유효 성분의 효율적인 전달 다른 Jetfuel 써모제닉 상품과 함께 사용하기에 완벽한 선택,체중 조절
휴대 가능 개별포장 스틱팩 14개 기타 천연 향료 첨가 천연 성분으로 에너지 제공  대사 증진 지방 분해 촉진  집중력 강화 웰빙 촉진 인공 색소 무함유 설탕 무함유 인공 향료 무함유 천연 카페인 200mg,체중 조절
활력 주의력 주의력 향상 식품 보충제,체중 조절
무설탕   저칼로리 식품 아님 비타민 맛있는 제품  천연 시나몬 라떼 맛 글루텐 무함유 유전자 변형 성분 무함유 보충제 비건 포뮬라,체중 조절
Burn Fat   Support Metabolism 500 mg Green Tea Extract Vegan No Gelatin Non GMO Dietary Supplement,체중 조절
최고의 스포츠 영양제 천연 이뇨제 빠른 수분 손실 및 근육 정의에 도움 보충제 GMP 인증 탄력   피부톤   정돈 임팩트 있는 상품으로 5일 주기로 유지 빠른 수분 손실 및 근육 정의에 도움,체중 조절
레몬 드롭 보충제 우수 제조 및 품질 관리 기준 GMP 을 준수하는 고품질 상품,체중 조절
체중 관리 1정당 500mg 보충제 지방 흡수 방지에 도움 건강한 식단 및 운동과 병행할 경우 건강한 체중 관리 지원 정상 범위 내 콜레스테롤 수준 유지에 도움 1969년부터 과학에 기반한 고품질 상품 제공,체중 조절
폴리페놀 95    카테킨 75    EGCG 45  HPLC 품질 검사 완료 효능 유해 불순물 무함유 식물성 보충제 코셔 채식주의자에게 적합 글루텐 무함유 유전자 변형 성분 무함유 유당 무함유 1996년 설립 자체 우수 제조 및 품질 관리 기준 GMP  및 미국 식품의약국 검사 시설에서 제조,체중 조절
체중 관리 대사 작용 지원 GMO 없음 건강 보조 식품 채식주의 비건 제품,체중 조절
보충제 Camellia sinensis 캡슐당 300mg 통잎 함유 품질 검사 완료,체중 조절
Vegan Formula Dietary Supplement Keto Friendly Non GMO cGMP Certified,체중 조절
목초 사육 유청 25g 12가지 과일 및 채소 프로바이오틱 섬유소 8g 지방 3 5g 프로바이오틱 10억 CFU 천연 향미료 유전자 변형 성분 없음 글루텐 무함유 인공 성분 없음 방목 사육 20회 제공량 건강 보조 식품,체중 조절
보충제 500억 마리 활성 배양균 생존률을 최대화한 균주 18종 Enteric Shield 식욕 증진 혈당 균형 유지 지속적인 에너지 제공 스트레스 완화 및 정서에 도움 소화 기능 지원,체중 조절
산화질소 지방 연소 인페르노 VasoThermic 신진대사 촉진제 산화질소 펌프 유도제 에너지   펌핑   지방 감량 보충제,체중 조절
100  천연 성분 100  천연 향료 보충제 GMP 인증 인공 향료 무함유 인공 식품 염료 색소 무함유 아스파탐 아세설팜칼륨 무함유 신체의 잠재력 강화 2012년부터 업계 최고의 자리를 지켜온 상품 전 세계 300만 명이 넘는 사람들이 신뢰하는 상품 신뢰할 수 있는 확실한 효과와 더불어 강력한 에너지 충전,체중 조절
Natural and Artifical Flavors Stimulant Free Supports Healthy Weight Management Dietary Supplement Boosts Metabolism Converts Fat To Energy Improves Endurance Performance Supports Weight Management No Animal Testing,체중 조절
Chromium Green Tea  Green Coffee Bean  Cocoa  Theobromine Contains Caffeine  Dietary Supplement Nature Works  Science Proves It   Vegetarian FormulaChromium   Helps the body process carbohydrates and fats  Green Tea   Rich in antioxidants shown to increase fat burning and alertness Green Coffee Bean   A natural source of chlorogenic acid and caffeine  equivalent to about 1 oz  of regular brewed coffee  Cocoa   Supports the nervous system  promotes fat burning  improves energy levels and mood   Theobromine    Shown to support weight loss and help curb appetite ,체중 조절
L Carnitine Energy   Fat Burning Catalyst  Cellular Energy  Fat Metabolism  Powerful Thermogenic  Naturally   Artificially Flavored  Dietary Supplement  Premium Ingredients  Premium Results  ,체중 조절
진정한 시나몬 Igen  유전자 변형 성분 무함유 검사 완료 보충제 정상 혈당 유지 항산화제 인공 보존제 무함유 천연 원료 효능 및 품질 보증 미국 식품의약국 등록 시설에서 제조,체중 조절
Formulated to Help Support Fat Loss  MitoBurn  Dietary Supplement ,체중 조절
Stim Free Liquid Super Thermogenic 2 000 mg L Carnitine 500 mg MitoBurn  Increase Thermogenesis Burn More Calories Ignite Metabolism Natural and Artificial Flavors Dietary Supplement CaloriBurn GP ,체중 조절
The Additive Free Company  Doctor Formulated Clinically Proven Irvingia Gabonensis IGOB131  Dietary Supplement Clinical Potency  Made with Non GMO Ingredients  No Magnesium Stearate  Gluten Free  Vegan Formula,체중 조절
단백질 분말 식사  기타 천연 향료 함유 식물성 단백질 글루텐 무함유 코셔 파르브 초콜릿 Spiru Tein 믹스   믹서기 필요 없음 식물성 효모 무함유 제품 유전자 변형 성분 무함유 천연 대두 심장에 좋은 음식우수한 식물성 단백질 혼합물  대두  완두콩  쌀 대부분의 비타민 하루 영양소 기준치 100  다양한 필수 미네랄 에너지 영양소  고품질 식물성 단백질 다이어트 보조  레시틴  스피룰리나  콜린  이노시톨 효소  브로멜라인 및 파파야 클렌징  클로로필린,체중 조절
대두 성분 무함유 글루텐 무함유 유기농 식이섬유 6g 단백질 20g 유기농 과일 및 채소 10종 USDA 유기농 인증 코셔 비건 인증 QAI 유기농 인증 유전자 변형 성분이 함유되지 않은 유기농 상품,체중 조절
Functional Fuel Low Glycemic Meal Replacement Natural Flavor Protein Powder and Medium Chain Triglyceride Drink Mix Zero Sugars   Not a Low Calorie Food Zero Dyes or Fillers Low Glycemic Index  10 g of Healthy Fats Weight Management Supports Brain Health MCTs For Fuel 20 g of Whey Isolate ClearFacts   Full Label Disclosure with Lab Verification,체중 조절
건강 증진 및 영양소 보충 개선된 포뮬라 비타민B 함유 비건 상품 유전자 변형 성분 무함유 보충제 글루텐 무함유 인공 색소 무함유,체중 조절
Helps Curb Hunger Lose Weight   Keep It Off   with the SlimFast Plan  Artificially Flavored 15 g Slow Digest Protein  5 g Fiber 25 Vitamins   Minerals Including A  C  D  E   Zinc,체중 조절
1973년 설립 폴리페놀 8  및 EGCG 50  허브 보충제 유전자 변형 성분 무함유 프로젝트 인증 품질 검사 완료 비건 보충제 건강한 삶 지원,체중 조절
향상된 바이오퍼린  Bioperine  흡수력  지방을 줄여주는 다이어트 건강보조식품,체중 조절
1969년 설립 USDA 유기농 인증 구미젤리 2개 제공량당 5 000mg 비건 상품 효모 유래 성분  밀  유제품  달걀  땅콩 무함유,체중 조절
성형 식물성 성분 첨가당 0g 대두 무함유 글루텐 무함유 유제품 무함유 100  비건 상품 코셔 CCOF 유기농 인증 유기농은 유전자 변형 성분 무함유 그 이상영지버섯  동충하초  표고버섯 등 계피 가루 순 탄수화물 0g 비타민 해조류  과일  채소  미네랄 해조류  파이토뉴트리언트 과일 및 채소 1인분 제공  B 12 메틸코발라민 MCT 오일프로바이오틱 1회 제공량당 토양 유래 유기물 20억 CFU  우수한 섬유소 공급원,체중 조절
건강 증진 자극제 무함유 체중 감량 지원 탄탄한 근육 강화 보충제,체중 조절
체중 감량  및 소화 보조제 체중 감량의 주요 영역 지원 신진대사 촉진 소화 보충제 카페인 무함유 글루텐 무함유 대두 무함유 인공 색소 무함유 종합적인 소화 지원,체중 조절
식물성 성분 뷰티 및 슬리밍 포뮬라 보충제 첨가당 0g 대두 무함유 글루텐 무함유 유제품 무함유 합성 성분 무함유 코셔 100  비건황기 Astragalus membranaceus  인삼 Panax notoginseng  90칼로리 순 탄수화물 5g 각성제 무함유 지방 세포 형성 감소 건강한 혈중 포도당 수치에 도움 단백질 12g 사프란 추출물  포만감 증진 프리바이오틱 식이섬유 설탕 식욕 감소히알루론산 비타민C 비오틴 흰목이버섯,체중 조절
유기농 비건 상품 유전자 변형 성분 무함유 대두 무함유 글루텐 무함유 단백질 15g 천연 향료 드링크 믹스 순 탄수화물 2g 식이섬유 5g 110칼로리 깨끗한 유기농 영양소 설탕 0g 비트뿌리 스피룰리나 강황 생강뿌리,체중 조절
활기 충전 발효 애플 사이다 식초 보충제,체중 조절
보충제 Tonalin 체지방 감소 및 근육 긴장도 향상 순도 및 효능 보장,체중 조절
락토스 프리 단백질 20 g 과일 및 채소 28종 11 g 식이 섬유소 글루텐 없음 그린 커피 빈,체중 조절
건강   자연   삶 100  식물성 특허받은 ForsLean  추출물 캡슐당 포스콜린 25mg 보충제 100  만족 보장,체중 조절
최대 효능 보장 400mg 폴리페놀 50  표준 식물성 보충제 글루텐 무함유,체중 조절
Nitraburn  기술 적용 운동 전 발열 발열 효과 폭발적인 에너지 고도의 집중력 강력한 근육 증진 효과 발열 촉매 보충제 천연 및 인공 향료 Nitrosigine  함유   결합된 아르기닌 실리케이트 CaloriBurn  카페인 325mg 강력한 열 발생 인세 펌프스 넘치는 강도 GAT NITRAFLEX  BURN으로 더욱 경쟁력을 높이십시오  혈관 확장   반응성 충혈 근육 펌프    근력   에너지   지방 연소   경도,체중 조절
산화질소 지방 연소 인페르노 VasoThermic 신진대사 촉진제 근육 형성 및 운동 능력 강화 에너지   펌핑   지방 감량 보충제 천연 및 인공 향료VasoThermic 신진대사 촉진제 산화질소 펌프 유도제 에너지 및 운동 능력 강화 전해질 보충,체중 조절
숙면 지방 연소제 야간 지방 연소제 3 in 1 수면 및 체중 감량 각성제 무함유 남성 전용 제품 비건 친화적 상품 보충제 신체의 잠재력 강화 2012년부터 업계를 선도 우수 제조 및 품질 관리 기준 GMP 을 준수하는 고품질 상품,체중 조절
Nitraburn  기술 적용 운동 전 발열 발열 효과 폭발적인 에너지 고도의 집중력 강력한 근육 증진 효과 발열 촉매 보충제 천연 및 인공 향미료 Nitrosigine  함유   결합된 아르기닌 실리케이트 CALORIBURN  카페인 325mg 강력한 열 발생 인세 펌프스 넘치는 강도 GAT NITRAFLEX  BURN으로 더욱 경쟁력을 높이십시오  혈관 확장   반응성 충혈 근육 펌프    근력   에너지   지방 연소   경도,체중 조절
Nitraburn  기술 적용 운동 전 발열 발열 효과 폭발적인 에너지 고도의 집중력 강력한 근육 증진 효과 발열 촉매 보충제 천연 및 인공 향료 Nitrosigine  함유   결합된 아르기닌 실리케이트 CALORIBURN  카페인 325mg 강력한 열 발생 인세 펌프스 넘치는 강도 GAT NITRAFLEX  BURN으로 더욱 경쟁력을 높이십시오  혈관 확장   반응성 충혈 근육 펌프    근력   에너지   지방 연소   경도,체중 조절
Conjugated Linoleic Acid Lean Muscle Dietary Supplement Gluten Free Non GMO 1 250 mg Contains 1 000 mg of Active CLA Isomers per Softgel Healthy Fat to Support Metabolism,체중 조절
Formulated To Help Support Fat Loss Powered By CaloriBurn  Dietary Supplement,체중 조절
1973년 설립 혈당 건강 증진 보충제 품질 검사 완료 건강한 삶 지원,체중 조절
체중 관리 캡슐당 500mg Phase 2 Carb Controller  보충제 건강한 체중 관리 증진 식이 전분의 효소 소화를 감소 전반적인 건강 증진 1969년부터 과학에 기반한 고품질 상품 제공,체중 조절
각성제 무첨가 체중 관리제 InnoBio CLA 750 mg | 아세틸 L 카르니틴 500 mg | 녹차 추출물 250 mg | 파라독신 25 mg 50회 제공량 건강 보조 식품유제품과 동물성 지방에서 발견됨 건강한 신진대사 지원에 도움정신 기능과 운동 능력 지원 지방산 CLA 이 에너지로 전환되는 미토콘드리아 세포로 이동하는데 도움을 줌에너지 소비를 늘려 체중 관리를 지원 신체가 산화 스트레스 및 유리기에 대항하는 것을 지원더 많은 에너지 소비를 위해 갈색지방조직을 활성화 시키는데 도움을 줄 수 있음 음식물 당류로부터 지방 저장을 방지하는 능력 향상에 도움,체중 조절
신진대사 증진 강화 천연 유래 성분 97  함유 GMP 인증 글루텐 무함유 화학 성분 무함유,체중 조절
체중 관리 캡슐당 400mg 보충제 건강한 체중 지원을 위해 전통적으로 사용되는 제품 순수한 프리미엄 그린 커피콩 가루 Full Spectrum  천연 콩 포뮬라 1969년부터 과학에 기반한 고품질 상품 제공,체중 조절
에너지 증진 건강한 체중 및 에너지 유지에 도움 항산화 강화 허브 보충제 1973년 1987년 무결점  순도  효능 B 기업 인증 비건 글루텐 무함유 대두 무함유 1987년부터 다양한 식물을 소비자에게 제공,체중 조절
에너지 보조제 가르시니아 캄보지아 Garcinia Cambogia  건강보조식품 채식주의 저자극성 글루텐 프리 고품질 천연 보조식품,체중 조절
